Date,tweet,sentiment_score,sentiment_label
2020-01-01,205 roi last month 800 400 right another amazing screenshot progress becoming member shoutout chris happens join leading league trader marsquad jpm pin zm wmt hd ulta khc tsla ,0.8316,Positive
2020-01-01,brokerage set zoom video communication inc zm target price 80 77 URL ,0.0,Neutral
2020-01-01,60k buy newyearseve newyears newyearseve2020 tier1 500 twlo team 10k crwd tier2 500 pgny rng zm tier3 00 coup shop zen plan z stockmarket stock wallst wallstreet spx qq qq economics finance intraday chart overlayed spy ,-0.7506,Negative
2020-01-01,zm zoom nasdaq zm cfo see much bigger opportunity beyond ucaas URL via USER ,0.4215,Positive
2020-01-02,view stock trading higher expectation entry exit signal based technical analysis chart plus highlight today position pton pags nugt chng gh zm lk chwy discover URL ,0.34,Positive
2020-01-02,pii bynd zm identified stock screener weinstein stage setup phase ,0.0,Neutral
2020-01-02,verb disruptive tech trading year low business booming patent pending tech rival zm huge big tech integration 800k member recurring revenue backlog auph kodk sava fcel siri obln fb mirm mcd clsd ontx cycn thmo clsd rad sunw ,-0.2732,Negative
2020-01-02,verb real money made buying bottom buying year low patent pending disruptive tech rival zm huge big tech integration 800k member auph acad pti dffn dlth crm seac aapl gene eyeg jnce ge baba sfet veru eca acb ,-0.2732,Negative
2020-01-03,rt USER rt USER verb cup handle formation effect handle formed 20day 1hr chart exponential gain coming partnership crm msft adbe orcl shop odoo new tech make zm obsolete pacd ,0.296,Positive
2020-01-03,plan team spy twlo crwd zen rng pgny shop coup zm z month return today return overlapped chart stockchart saas wallstreet econ economics stockmarket money business ,0.0,Neutral
2020-01-03,stock watch 2020 performance week jan 3rd stne okta roku zm lvgo work sq cgc crwd tcehy pypl mdb snap shop se ,0.0,Neutral
2020-01-03,verb disruptive tech trading year low business booming patent pending tech rival zm huge big tech integration 800k member recurring revenue backlog auph kodk sava fcel siri obln fb mirm mcd clsd ontx cycn thmo clsd rad sunw ,-0.2732,Negative
2020-01-04,USER zm growth sustainable ,0.3818,Positive
2020-01-04,USER microsoft office 365 zm people adopting office 365 bode well zoom ,0.2732,Positive
2020-01-04,10 largest unicorn ipo 2019 three zoom peloton luckin coffee positive return end year one zoom profitable uber lyft work pin zm sdc pton crwd lk net ,0.7579,Positive
2020-01-04,speculative list tier ual lk baba sq paas tier dal roku jd rig cde tier aal fcx twtr amrn wpm tier jblu teck ea zm ag tier save scco atvi spce hl outlook 2020 URL ,0.4767,Positive
2020-01-05,stock week 2020 longs goog fb mpw lite hub gluu sono mho fn hhr vip aciw docu fcn safe nsit splk angi epam short cost wmt zm rev ha trup hri door stmp plxs appn hog sjm dd kkr go pep goo midd olli dm perf no ,0.7506,Positive
2020-01-05,invested 10 00 zoom ipo much money USER stock zm csco ,0.0,Neutral
2020-01-05,verb daily weekly chart show exponential run progress USER live interactive webcasts making USER zm obsolete patentpending partnership USER msft USER adbe USER crm USER crm USER shop USER techfest2020 ,0.1531,Positive
2020-01-06,list alerted price date position crwd zm spot pton ntnx much ,0.0,Neutral
2020-01-06,splk 20d tap go zm similar regard 20d tap ,0.0,Neutral
2020-01-06,scan result crossed 50 dma today habt sdc crwd ww tenb pch gd zm gi qlys ipgp sf psa gild lh iipr pep hcsg tpx p ,0.0,Neutral
2020-01-07,tues 20 option highest orb avg gain today thirteen 30 min bar final 30 min min 10 vol 1m opt price 76 00 vol 500 100 strike bynd wdc tcom cag amat pton avlr mu nvcr anf zm lrcx amrn stz ,0.4404,Positive
2020-01-07,tues 20 option highest orb avg gain today thirteen 30 min bar final 30 min min 10 vol 1m opt price 51 75 vol 500 100 strike exel bynd amrn amat zm crm tsla wdc hal rubi pep lyft tsm lx ,0.4404,Positive
2020-01-08,roy benhorin chief accounting officer zoom video communication inc zm decreased shareholding total 348694 share URL ,0.3566,Positive
2020-01-08,janine pelosi chief marketing officer zoom video communication inc zm decreased shareholding total 275654 share URL ,0.3566,Positive
2020-01-08,insider benhorin roy report selling 32 00 share zm total cost 240 086 40 ,0.296,Positive
2020-01-08,zm ghosn v japan inc say invest usa presser confirmed zoom video buy ,0.0,Neutral
2020-01-08,daily wrap traded alert ayx jan swing 110 117 feb 20 120c 65 docu swing 76 50 76 20 feb 20 80c active jan 17 77 5c active idea wba level 56 breakdown idea failed pm break sideways action zm swing 71 73 timestamped ,0.5106,Positive
2020-01-08,zm closed option swing trade monday today 60 profit small position great gain ,0.886,Positive
2020-01-08,great layout bullish candlestick pattern provided trendspider zm white soldier today learn trendspider URL please go website URL information discount ,0.7506,Positive
2020-01-08,zm filed sec form 10 owner emergence capital partner ii disposed 625 00 class common stock average price acquired 625 00 class common stock average price 2020 01 06 holding share URL ,0.296,Positive
2020-01-08,josh come push zm want scalp bad boy ,-0.4939,Negative
2020-01-08,12 result buy crm 11 z cldr 12 zm blk buy hold wday 220 since 19 five work 14 since 12 11 19 ulta flat docu dg okta overvalued crwd broke dec 9th 12 since hold ,-0.4215,Negative
2020-01-09,today zm opened midline cent held high often framework geometry perfectly contains price ,0.6369,Positive
2020-01-09,verb huge wealth building opportunity 52 wk range 76 18 71 massive upside 25m patent pending tech rival zm huge big tech integration 900k member recurring revenue backlog fcel sava inpx cemi pulm dpw s tsla nio achv glbs ,0.8625,Positive
2020-01-09,zm 00 turned negative 21 green red move URL ,-0.5719,Negative
2020-01-09,sold aa loss get china trade deal bump wanted adding zm uber lyft ,-0.3182,Negative
2020-01-09,zm today named best buy tom gardner motley fool stock advisor bought today recommendation ,0.3182,Positive
2020-01-10,stock watch 2020 weekly performance crwd mdb okta zm sq lvgo big winner tcehy new 52 week high URL ,0.5859,Positive
2020-01-10,growth stock newyear2020 back time high run since november inmd kick crwd pgny twlo z coup 10 gain since buying jan2 worst performer zen 81 zm 58 got rest spy spx portfolio unwound time ,0.2263,Positive
2020-01-10,verb zack strong buy rising year low 937k member series new feature coming look execution partnership microsoft salesforce others interactive zoom zm killer coming new revenue stream cpah srne acrs hsdt aqst ,-0.4767,Negative
2020-01-10,verb zack strong buy rising year low patented zoom zm killer coming live streaming video interactivity zm mc 20b logm mc 75b fb mc 567b verb mc 40m crm adbe msft sava jan svra trmd pixy clvs amtd orcl cvsi pti sfet xcur siri ,-0.4767,Negative
2020-01-10,ajust example zm fine 12 00 pm machine listen ,0.2023,Positive
2020-01-11,chart setup setting long adbe adsk axp payc plan pypl rost sbux splk team twlo tmo uber wday yy zm z short aap azo avgo pep wmt cmi ,0.0,Neutral
2020-01-11,zm open interest increase 23 week percentile rank 83 put oi increased 20 v call oi 25 ratio URL ,0.7506,Positive
2020-01-11,uc trend 2020 industry analysis zoom ceo URL via USER zm ,0.0,Neutral
2020-01-11,needham 22nd annual growth conference 2020 jan 14 15 scheduled appear okta ddog docu coup oled zm z avlr ayx ntnx smar mdb keep eye company present get investor personally looking docu zm z ddog interesting ,0.6486,Positive
2020-01-11,zoom video communication inc zm director sell 218 750 00 stock URL ,0.0,Neutral
2020-01-12,verb zack strong buy rising year low 937k member series new feature coming look execution partnership microsoft salesforce others interactive zoom zm killer coming new revenue stream cpah srne acrs hsdt aqst sava cycn ,-0.4767,Negative
2020-01-13,view stock trading higher expectation entry exit signal based technical analysis chart plus highlight today position cgc inmd lk sq okta ntnx pags crwd zm discover URL ,0.34,Positive
2020-01-13,scan result shooting star candlestick today tsla ddog cree alex lvgo zm cbrl hiiq trex mxl pstg exc qcom nu mm qiwi desp pags ,0.0,Neutral
2020-01-13,zm inverted hammer daily appearance since 2020 01 02 next day close avg 95 worst 14 62 best 98 day later avg 33 worst 15 31 best 92 day later avg 08 worst 14 32 best 90 ,0.0772,Positive
2020-01-13,fall dip enterprise saas followed major bounce shop 295 11 440 current 49 twlo 91 11 120 31 splk 110 10 22 156 41 zm 62 10 22 74 19 okta 98 10 18 131 33 ddog 28 10 22 41 46 ,0.0,Neutral
2020-01-13,verb real money made buying bottom buying year low patent pending disruptive tech rival zm huge big tech integration 800k member inpx acad pti dffn dlth crm sava aapl gene eyeg dpw ge baba sfet veru eca acb jd ,-0.2732,Negative
2020-01-14,view stock trading higher expectation entry exit signal based technical analysis chart plus highlight today position shak labu cgc inmd lk okta ntnx pags chng crwd zm discover URL ,0.34,Positive
2020-01-14,scan result bearish engulfing today crto dt ivr cg payc ice inmd hta safm pgre gwre trex mdlz eqix ddog gpn zm ec okta ,0.0,Neutral
2020-01-14,verb wealth builder ultimate buy low opportunity oversold year low 25m patent pending tech rival zm huge big tech integration 900 00 member recurring revenue backlog fcel ge orcl crm qcom aapl cvsi sava plug arav pixy bold ,0.7717,Positive
2020-01-14,verb ceo provides 2019 business recap outline plan 2020 nasdaq 937k member series new feature coming look execution partnership microsoft salesforce others interactive zoom zm killer coming new revenue stream ,-0.6486,Negative
2020-01-14,verb zack strong buy rising year low 937k member series new feature coming look execution partnership microsoft salesforce others interactive zoom zm killer coming new revenue stream cpah srne acrs hsdt aqst sava cycn ,-0.4767,Negative
2020-01-15,view stock trading higher expectation entry exit signal based technical analysis chart plus highlight today position nvta nugt shak labu cgc lk okta ntnx pags chng crwd zm discover URL ,0.34,Positive
2020-01-15,healthcare 53 27 49 xair sgry flgt avtr software 52 37 53 ocft zm electronics 44 11 20 china 16 11 25 nio zlab finan insur 02 10 20 telecom 21 10 19 insg ,0.0,Neutral
2020-01-15,zm rebound turned potential breakout stock patience starting pay nicely u one ,0.3612,Positive
2020-01-15,16 recap weird day considering trade deal signed figured would sell news event news like impeachment ppi weighed think unh 302 5c 180 mcd 212 5c swing 200 fails 40 50 stop bidu 145c nflx 350c ulta 290c swing zm sq algn g ,-0.4939,Negative
2020-01-16,view stock trading higher expectation entry exit signal based technical analysis chart plus highlight today position nvta inmd shak labu cgc lk ntnx chng crwd zm discover URL ,0.34,Positive
2020-01-16,mkt ripped thing got extended switch back stock stock oppty basis select leader let come plan tsla zm today example approach interested ,0.4019,Positive
2020-01-16,16 recap slow melt today active besides closing lotto prgo 60c 300 algn 290c 500 fails shak zm bidu follow though probably stay cash till next week tuesday unless something set nicely feeling buyer ,0.5106,Positive
2020-01-16,whatsapp fb USER owned messaging service focus helping business connect customer URL via USER buy USER zm facebookportal plus zoom nice combo ,0.6124,Positive
2020-01-17,zm 04 turned negative 59 green red move URL ,-0.5719,Negative
2020-01-17,could also bearish weekly set long term positive set like zm today stock took 10x short position 72 exp 24th 25 chart look ready pull back zigzag reversal avg move sell put put total ,0.8225,Positive
2020-01-17,verb wealth builder ultimate buy low opportunity oversold year low 25m patent pending tech rival zm huge big tech integration 900 00 member recurring revenue backlog fcel ge orcl crm qcom aapl cvsi sava plug arav pixy bold ,0.7717,Positive
2020-01-17,verb 2020 expansion business sector world 1st live interactive video webinar platform microsoft salesforce integration upgrade 937 00 user base growing globally sava cei cycn crm adbe msft aapl gene dpw orcl zm rad siri opgn ,0.1779,Positive
2020-01-17,verb time wake verb 2020 whole new world global expansion world 1st live interactive video webinar platform zoom killer zm microsoft salesforce integration upgrade 937 00 user base growing sava cei cycn crm adbe msft aapl ,-0.5574,Negative
2020-01-18,5yr big bet lithium lk zm lac cgc wmd sq spce ,0.0,Neutral
2020-01-18,USER monday one would suggest buy zm work invh dis ,0.0,Neutral
2020-01-18,zoom video communication inc zm given consensus recommendation hold brokerage URL ,0.0,Neutral
2020-01-19,mine cash 59 12 mkl voo yext vgt pypl msft sq etsy sbux mtch ddog zm bam gdot pin frequently selling sq put ,0.0,Neutral
2020-01-19,zm weekly ,0.0,Neutral
2020-01-20,zm crwd sand ayx coup tndm udr plan estc inmd pgny shop z aaxn cybr rng ttd team zen gddy twlo scoring model sorted 74 weight 180 90 day next current fiscal year analyst revenue estimate revision spy qq tech spx ndx djia qq ,-0.7506,Negative
2020-01-20,zm crws sand ayx coup tndm udr plan estc inmd pgny shop z aaxn cybr rng ttd team zen gddy twlo scoring model sorted 74 weight 180 90 day next current fiscal year analyst revenue estimate revision spy qq tech spx ndx djia qq ,-0.7506,Negative
2020-01-20,early stage b2b founder direct sale important unlock two viral bottom product history enterprise software benefit immensely direct sale slack work zoom zm ,0.5859,Positive
2020-01-20,zoom video communication inc zm ceo eric yuan sell 70 143 share URL ,0.7506,Positive
2020-01-21,keep hearing msft going kill work USER great video yesterday way hope skype going kill zm bullish slack zoom ,-0.5267,Negative
2020-01-21,zm aparna bawa dump 5k share zoom video communication inc URL ,-0.1027,Negative
2020-01-21,insider bawa aparna report selling 500 share zm total cost 585 00 00 ,0.296,Positive
2020-01-21,zm filed sec form chief legal officer bawa aparna disposed 500 class common stock price 78 2020 01 16 decreased holding 293 194 share URL ,0.4019,Positive
2020-01-21,perspective change zm assumed offering video conferencing something seen actually potential platform new company build top ,0.2023,Positive
2020-01-22,zm dark cloud cover daily appearance since 2020 01 02 18 next day close avg 69 worst 39 best 76 day later avg 78 worst 70 best 14 88 day later avg 76 worst 17 best 13 73 ,0.0772,Positive
2020-01-22,verb breakout industry disruptor moving oversold year low 25m patent pending tech rival zm huge big tech integration 937 00 member recurring revenue backlog fcel ge orcl crm dare aapl adap sava plug aemd pixy bold ,0.4215,Positive
2020-01-22,actually think non trivial number people buying spce thinking buying spacex stupider thing happened folk buying zoom instead zm ,-0.5106,Negative
2020-01-22,verb wealth builder ultimate buy low opportunity oversold year low 25m patent pending tech rival zm huge big tech integration 900 00 member recurring revenue backlog fcel ge orcl crm qcom aapl cvsi sava plug arav pixy bold ,0.7717,Positive
2020-01-22,pypl zm new article reason paypal stock could zoom 150 2020 URL get latest pypl related news URL ,0.0,Neutral
2020-01-23,janine pelosi sell 13 046 share zoom video communication inc zm stock URL market ,0.296,Positive
2020-01-23,kelly steckelberg sell 11 067 share zoom video communication inc zm stock URL stock ,0.296,Positive
2020-01-23,zoom video communication inc zm cmo janine pelosi sell 13 046 share URL stock ,0.296,Positive
2020-01-23,zoom video communication inc zm cmo janine pelosi sell 13 046 share URL ,0.296,Positive
2020-01-23,insider steckelberg kelly report selling 11 067 share zm total cost 841 609 40 ,0.296,Positive
2020-01-23,tomorrow lotto day trying live u 500likes 12am tonight everyone join stream USER zm ,0.296,Positive
2020-01-23,zm pd mdb crwd coup happened guy today ,0.0,Neutral
2020-01-23,zm filed sec form 10 owner emergence capital partner ii disposed 562 500 class common stock average price acquired 562 500 class common stock average price 2020 01 21 holding share URL ,0.296,Positive
2020-01-23,verb real money made buying bottom buying year low patent pending disruptive tech rival zm huge big tech integration 800k member inpx acad apt dffn dlth crm sava aapl gene gnpx dpw ge baba sfet veru eca acb jd ,-0.2732,Negative
2020-01-23,invest cloud stock USER stock crm ibm msft googl amzn nvda fb nflx csco wday vmw ctl adbe splk mu tcehy goog veev baba anet hub shop sq twlo iqv okta ttd spot skyy docu zm plan ,0.0,Neutral
2020-01-23,verb 2020 expansion business sector world 1st live interactive video webinar platform microsoft salesforce integration upgrade 937 00 user base growing globally sava cei cycn crm adbe msft aapl gene dpw orcl zm rad siri opgn ,0.1779,Positive
2020-01-23,verb wealth builder ultimate buy low opportunity oversold year low 25m patent pending tech rival zm huge big tech integration 900 00 member recurring revenue backlog fcel ge orcl crm qcom aapl cvsi sava plug arav pixy bold ,0.7717,Positive
2020-01-23,shelter place talk would think company like USER zm would spiking roof market looking reason sell ,0.3612,Positive
2020-01-23,USER USER USER shelter place talk would think company like USER zm would spiking roof market looking reason sell ,0.3612,Positive
2020-01-23,clro zm clearone unite video conferencing camera zoom certified ,0.0,Neutral
2020-01-23,thursday qq spy uvxy tvix tsla roku nvda snap pypl sq twlo twtr xlnx spce stld ter txn zm nke ntnx pg swks team teck ttd unp vfc wmt wwe ,-0.4939,Negative
2020-01-24,zm option order flow sentiment 55 bullish URL ,0.0,Neutral
2020-01-24,verb wealth builder ultimate buy low opportunity oversold year low 25m patent pending tech rival zm huge big tech integration 900 00 member recurring revenue backlog fcel ge orcl crm qcom aapl cvsi sava plug arav pixy bold ,0.7717,Positive
2020-01-24,zm added bit hoping come bit id like add quite bit get better discount ,0.8158,Positive
2020-01-24,outside day today matw zm sif ,0.0,Neutral
2020-01-24,verb real money made buying bottom buying year low patent pending disruptive tech rival zm huge big tech integration 800k member inpx acad apt dffn dlth crm sava aapl gene gnpx dpw ge baba sfet veru eca acb jd ,-0.2732,Negative
2020-01-24,zm URL zoom video communication inc mathematical model detected company stock price undetermined short term setup neutral long term outlook finance stockmarket money ,0.0,Neutral
2020-01-24,zm new insider selling 11067 share URL ,0.296,Positive
2020-01-24,zoom video communication inc zm receives consensus recommendation hold analyst URL ,0.0,Neutral
2020-01-25,new product release USER zm virtual video background expanded app integration added zoom phone feature highlight URL ,0.34,Positive
2020-01-25,vuzix zoom great app zm video conferencecall handsfree tech technology smartglasses business communication verizon augmentedreality virtualreality vuzixblade ar digital 5g innovation wireless mobile mifi goog aapl vz URL ,0.7717,Positive
2020-01-25,crazy idea overvalued cloud software stock actually value investment investor understand exponential like growth come sustained yoy revenue growth 45 85 gross margin ayx ddog crwd zm etc ,0.5574,Positive
2020-01-25,zm new alert URL stock daytrading nyse nasdaq market 275 ,0.296,Positive
2020-01-25,aparna bawa sell 500 share zoom video communication inc zm stock URL ,0.296,Positive
2020-01-25,kelly steckelberg sell 11 067 share zoom video communication inc zm stock URL ,0.296,Positive
2020-01-25,insider selling zoom video communication inc zm insider sell 585 00 00 stock URL ,0.0,Neutral
2020-01-25,janine pelosi sell 13 046 share zoom video communication inc zm stock URL ,0.296,Positive
2020-01-25,exactly expensive best breed saas stay expensive long period time team shop example growth unit econ capital effec drive outperformance 2020 zm ddog tech company wework techcrunch URL ,0.7783,Positive
2020-01-25,zm three black crow daily appearance since 2020 01 02 next day close avg 57 worst 57 best 57 day later avg 47 worst 47 best 47 day later avg 85 worst 85 best 85 ,0.0772,Positive
2020-01-25,zm 31 jan 20 atm implied vol climb straddle implies move URL ,0.0,Neutral
2020-01-26,stock week 27 20 longs sdc sq gsky luv ally anet grub ctsh hmi gdot inmd petq tpic wgo safe axp sedg rdfn kbh short iq chwy zm wmt tcmd boot chef fdp epac ktos tivo th spb casy dd cnhi box goo work mtrn perf last week 04 ,0.4404,Positive
2020-01-26,USER think debit put spread zm trend continues could see 65 especially insider selling overall market concern china virus think reaction ,0.0,Neutral
2020-01-26,looking debit put spread zm think see retrace back 65ish macd crossing momentum jc squeeze downward rsi going think bounce back rsi hit 30ish let see happens oh lot insider selling lately ,0.0,Neutral
2020-01-26,zm eric yuan founder san jose california based zoom video communication provides remote conferencing service using cloud computing announced offer free video conference service user china URL jd sending medical supply ,0.5106,Positive
2020-01-26,janine pelosi sell 13 046 share zoom video communication inc zm stock URL ,0.296,Positive
2020-01-26,zoom video communication inc zm cfo sell 841 645 35 stock URL ,0.0,Neutral
2020-01-27,let recap damage today jmia even disappointing since looked like big potential waay volatile condition put team position change pleased crwd docu bounce zm need tomorrow cut ,-0.4767,Negative
2020-01-27,zm expiration 01 31 2020 maxpain 73 high put open interest 70 438 high call open interest 85 1269 ,0.7184,Positive
2020-01-27,verb wealth builder ultimate buy low opportunity oversold year low 25m patent pending tech rival zm huge big tech integration 900 00 member recurring revenue backlog fcel ge orcl crm qcom aapl cvsi sava plug arav pixy bold ,0.7717,Positive
2020-01-27,USER assume jason moser know skype end life microsoft investing better compare zm team ,0.4404,Positive
2020-01-27,USER thought stock like ttd coup zm looking good 20 day assuming insurance gain place hold waking market morning guess trying gauge vulnerability ,0.7845,Positive
2020-01-27,verb real money made buying bottom buying year low patent pending disruptive tech rival zm huge big tech integration 937k member inpx acad apt dffn dlth crm sava aapl gene gnpx dpw ge baba sfet veru eca acb jd ,-0.2732,Negative
2020-01-27,USER buyer zm work pullback USER USER ,0.0,Neutral
2020-01-27,zm add long nice pullback ,0.4215,Positive
2020-01-27,bili bzun bidu jd iq going hurt coronavirus business online business zm pdd price last ,-0.5267,Negative
2020-01-27,high bar stock 30x 20 year idea meli latin america stabilizes sfix break mainstream zm ubiquitous across enterprise consumer trup u insures pet rate eu australia vmd promising underfollowed ,0.4019,Positive
2020-01-28,watch lyft sq teva momo ddog roku nio cgc tlry hiiq inmd stne okta zm lvgo work crwd tcehy pypl mdb snap shop se bynd twlo shak nvta z ntnx ttd twtr enph spwr abbv ayx clvs nvcr spce miss anything ,-0.1531,Negative
2020-01-28,zm substantial price change stock 41 URL ,0.2023,Positive
2020-01-28,meet USER developerrelations team featuring USER USER USER USER USER truly zoom zm ,0.4404,Positive
2020-01-28,seeing post zm see ,0.0,Neutral
2020-01-28,verb wealth builder ultimate buy low opportunity oversold year low 25m patent pending tech rival zm huge big tech integration 937 00 member recurring revenue backlog fcel ge orcl crm qcom aapl cvsi sava plug arav pixy bold ,0.7717,Positive
2020-01-28,outside day today irtc dswl stwd zm osis ,0.0,Neutral
2020-01-28,zm appears breaking ,0.0,Neutral
2020-01-28,literally roflmao squeeze ensuing immediately purchased zm ,0.5423,Positive
2020-01-28,verb rise phoenix baby coming year low 25m patent pending tech rival zm huge big tech integration 937 00 member recurring revenue backlog fcel ge orcl crm qcom aapl cvsi sava plug arav pixy bold nnvc codx ,0.4215,Positive
2020-01-28,zm outrage crap portrayed current issue happened fixed mid last year zoom told hill tuesday privacy security zoom user top priority check point chkp vulnerability addressed august 2019 ,-0.5574,Negative
2020-01-28,USER zm outrage crap portrayed current issue happened fixed URL ,-0.7096,Negative
2020-01-28,zm pre zoom patched vulnerability allowed eavesdropping video meeting hill URL ,-0.2263,Negative
2020-01-28,zm flaw zoom allowed intruder illegally eavesdrop meeting URL ,0.0,Neutral
2020-01-28,fastest growing business apps crm wday msft zm URL ,0.1779,Positive
2020-01-28,sabre sabr versus zoom video communication zm head head analysis URL ,0.0,Neutral
2020-01-28,zm lower low daily appearance since 2020 01 02 11 next day close avg 58 worst 30 best 76 day later avg 68 worst 47 best 14 88 day later avg 56 worst 47 best 13 02 ,-0.4588,Negative
2020-01-28,staying long year swir akts insg yext twlo zbra newr zm estc bzun tdoc gh edit mbot iivi tsla sq fb amzn irbt maxr sedg cgnx ayx nvta ,0.0,Neutral
2020-01-28,zm higher high higher low well ,0.0,Neutral
2020-01-29,setup zm one stock picking session parameter watching URL trading fibonacciqueen option stockmarket stockstowatch optionstrading spx e ,0.0,Neutral
2020-01-29,using google hangout week never bullish USER zm proudshareholder ,0.0,Neutral
2020-01-29,tues 29 20 trading range 80 min vol 750k opt min vol 500 strike inst au feye ego gfi kgc sdc paas aobc agnc gold mrcy tndm llnw apt yy vst nrg ge lulu dri avy sbgl amx kl nem pgr aqua nvta ag fb cde nclh zm five ,-0.128,Negative
2020-01-29,USER coronavirus shld benefit zm miss ur china list big upside company stop travel another thought amzn buy ups cheaper building delivery network ,0.0516,Positive
