Date,tweet,sentiment_score,sentiment_label
2021-05-06,forget zoom continuing guide rapid growth even pandemic also zoom much cash use acquire competitor pursue opportunity within workplace management space buying dip zm ,0.5423,Positive
2021-05-06,adding thousand client pandemic zoom efficient profitable software company zm ,0.6908,Positive
2021-05-06,largest stock hit new month low point today microsoft msft amazon amzn tesla tsla paypal pypl adobe adbe netflix nflx salesforce crm shopify shop square sq airbnb abnb uber amd zoom zm snap snowflake snow coinbase coin spot twtr ,-0.1027,Negative
2021-05-06,big going highly selective growth name buying prerequisite strong balance sheet ubiquitous adoption pypl fuse moneylion better yet brand become verb zm example ,0.8434,Positive
2021-05-06,interesting getting overbought signal ceix lot oversold signal payc zm docu okta et al brave ,0.7269,Positive
2021-05-06,wfh work home momo play fantastic run seeing lot exists zm pton shop shop next live quote 073s nyse ,0.7184,Positive
2021-05-06,cathy wood buy keep buying coin zm pton way ,0.0,Neutral
2021-05-06,strat inside month setup going force sold following spot 28 230p 45 30 zm 28 265p 50 10 snow 28 200p 90 50 50 45 30 appn 21 75p 92 25 65 etsy 28 185p 120 ,0.0,Neutral
2021-05-06,top large cap stock buy may USER stock aapl tdoc zm USER ,0.2023,Positive
2021-05-06,new free option crypto discord link bio join btc eth ech bch ltc ampl xtz xlm xom appl zm fb spy amd qcom msft twtr spaq nio nkla att ba dji intc atvi pfe mrna gild ,0.4215,Positive
2021-05-06,interestingly zm went almost 200 since covid came life yet growth biz past year north 300 shop expensive pre covid well wonder covid winner trading lower multiple pre covid ,0.8402,Positive
2021-05-06,ark slammed tech riskiest bet blow past lifeline gme plug g roku zm URL ,-0.3612,Negative
2021-05-06,member check email swing trade mid day video cmls galt sigg gnln lac uber sdc zm kala hdsn expi mito fsly q tlry cara spy oil cl uso btc ,0.0,Neutral
2021-05-06,zm follow crazy ,-0.34,Negative
2021-05-06,arkk watch name tsla tdoc roku sq shop zm spot twlo exas ,0.0,Neutral
2021-05-06,yellen walk back momo investor trust read URL qq tsla amd mrna bntx fb lyft uber etsy rkt pton zm spy investing invest investment investment investor markts stock stockstowatch stockmarket vaccine biden ,0.0258,Neutral
2021-05-06,arkk ark tech big growth getting absolutely trashed week fsly pton zm rdfn twlo ddog twlo etc ,0.3818,Positive
2021-05-06,ark dead money far year tsla roku sq zm arkk arkg credit USER ,-0.4019,Negative
2021-05-06,dear USER please consider integration USER zm video conferencing platform would create strong contender take msft team slack platform security built default sophisticated functionality collaboration ,0.9413,Positive
2021-05-06,seeing several name entering stage iv docu zm pton weekly chart 30 useful tool evaluating cycle depth discussion stage analysis recommend reading stan weinstein secret profiting bull bear market ,0.7906,Positive
2021-05-06,21 company totaling nearly 30 qq 10 52 week high still 50 52 week low zm pton bidu 40 52 week high still 80 52 week low market come fast ,-0.7506,Negative
2021-05-06,gdmk discover world class snack brand URL USER pltr rkt amc disca snow dash clov pton zm tdoc bynd stockmarkets ihub stockposts trader intraday tradingview ,0.0,Neutral
2021-05-06,shop nobody paying attention think gon na break lower competitor squarespace direct listing soon additionally world normalizing shop still able maintain growth last year use zm proxy ,0.1027,Positive
2021-05-06,zm pullback card death cross daily chart ,-0.5994,Negative
2021-05-06,yellen walk back momo investor trust read URL qq tsla amd mrna bntx lyft uber etsy rkt pton zm investing invest investment investment investor markts stock stockstowatch stockmarket vaccine biden ,0.0258,Neutral
2021-05-06,zm put credit spread opened sold 280p bought 270p may 7th entry 40 40 contract USER ,0.3818,Positive
2021-05-06,better feeling diamond handing paying spy qq tsla amzn zm aapl docu nvda ,0.3818,Positive
2021-05-06,added zm fsly rdfn path rblx mgni reduce net sold open small loss position ,-0.3182,Negative
2021-05-06,wallstreet option increasing iv clvs amc bynd cvna ddog zm docu mrna pton sq ,0.0,Neutral
2021-05-06,cathy wood arkf wtf fell seventh straight day wednesday longest slide nearly two half year taken selloff tearing high valuation technology share zm roku tdoc top 10 holding arkk ,0.0258,Neutral
2021-05-06,cicada older multi billion dollar business like airbnb abnb etsy etsy pinterest pin skillz sklz peloton pton doordash dash zoom zm innovation happen faster bug life ,0.6249,Positive
2021-05-06,little shopping today rdfn zm roku buythedip ,0.0,Neutral
2021-05-06,stock top buy list recent sell list 52 week high sklz 69 52 dmtk 55 63 lmnd 55 30 zm 44 92 44 01 USER USER USER USER USER USER ,0.2023,Positive
2021-05-06,option increasing iv clvs amc bynd cvna ddog zm docu mrna pton sq option decreasing iv uber lyft znga pypl ,0.0,Neutral
2021-05-06,warren buffett worst nightmare live today snowflake downgraded junk charlie munger win nobel prize fraud warrenbuffett snow wallstreet qq spy zm tsla xl investing ,-0.6124,Negative
2021-05-06,huge win today zm fsly put holding week two good set ups around though mito faked longside breakeven lexx wanted quite patient enough bcrx good itm stop ,0.8658,Positive
2021-05-06,aunt USER need competent ta consultant pltr 19 90 roku 283 coin 254 zm 289 tdoc 150 rooting damn early buy ,-0.1027,Negative
2021-05-06,market note compiled listening expert news follow aapl amzn spce meli googl twtr fb nio docu rkt fubo shop wmt mcd dis msft amd tsla zm sbux snap ba ccl mm q bkng rkt lrcx nnox vldr spy jnj se g bac baba dkng ,0.0,Neutral
2021-05-06,sen hit max target 14 little 100 trade still love opportunity company long term look scale back sort retracement spx spy qq amzn aapl fb goog amd nvda zm tsla nio sq baba shop dis ba spot ,0.5859,Positive
2021-05-06,work home stock struggling zm docu pton tdoc ,-0.4215,Negative
2021-05-06,careful self reinforcing cycle pain see growth zm fsly pin spot ddog docu tdoc etc arkk suffers arkk suffers money flee money flees arkk see relentless selling growth ,-0.6369,Negative
2021-05-06,zm break paid ty ,0.3818,Positive
2021-05-06,1k 25k account update called 100 zm put stream today 23k balance end day ,0.0,Neutral
2021-05-06,saying using protection strategy stop cc put smoked crushed head sand theory added put docu upst pltr tigr futu lmnd zm watching snow may initiate large put missed put rdfn another dive ,-0.7351,Negative
2021-05-06,want buy dip keep dipping maybe nibble share need rush zm roku fubo sklz qq nvda shop ,-0.1779,Negative
2021-05-06,zm another today forget trimming trailing short ,-0.2263,Negative
2021-05-06,gon na talk roku zm 300 ,0.0,Neutral
2021-05-06,called zm put stream today shoutout URL ,0.0,Neutral
2021-05-06,loving zm 23 one put contract 10 ,0.5994,Positive
2021-05-06,shortable bounce opinion hit zm 3k 10min mean done today trying disciplined ,0.0,Neutral
2021-05-06,alex vieira downgrade zoom video junk increasing short stake 11 00 american pig slaughtered today cuomo subscribes zm arkk tsla pton nio qq biden cuomo spy wallstreet finance ,-0.4939,Negative
2021-05-06,zm another poopy day dip see ,0.0,Neutral
2021-05-06,even trade anymore today snow put 400 zm put 75 thing lagging pton put ,-0.2732,Negative
2021-05-06,URL zm another interesting move ,0.4019,Positive
2021-05-06,zm juice weekly bar nice box flag setup right psych following thru bidu slower double topping 21d reject following thru 195 185 big spot ,0.0258,Neutral
2021-05-06,entry signal time 15 55 bat zm asset zoom video communication inc direction short timeframe minute tp price 310 27 pip point gained move 88 subscribe trading signal URL zm nasdaq stock zm ,0.6249,Positive
2021-05-06,hubspot hub four target raise stock currently around 503 needham co 520 600 piper sandler 600 615 morgan stanley 567 605 bmo capital market 565 585 spy qq tsla aapl amzn msft mvis goog nvda nio fb sq zm ,-0.4939,Negative
2021-05-06,zm look ugly macd curling daily see short opportunity 284 ,-0.128,Negative
2021-05-06,cathie wood calling autonomous trading subscribing today american left holding bag tsla arkk zm stock spce spce aapl msft roku pton twlo qq spy xl ,-0.4939,Negative
2021-05-06,zm put ,0.0,Neutral
2021-05-06,watch market legend crash stock minute speaking youtube member make million bi weekly trading stock crypto cryptonews stock earnings nls pton zm qq spy tsla amzn aapl nio blnk arkk coin ai amd ,-0.7096,Negative
2021-05-07,trader would rather allow market punish make financially miserable reaching someone would help reasonable monthly fee hope spy money disappears faster anything market USER jd nflx zm ,-0.1779,Negative
2021-05-07,invest tomorrow big tech trend zm rxrx zy twst URL ,0.0,Neutral
2021-05-07,today candle chart 10y u yield ultra bullish hammer candle doubt cause worry many tech investor fb aapl amzn se zm sklz cciv amc doge btc gme ,-0.6597,Negative
2021-05-07,insider yuan eric report selling 96 154 share zm total cost 27 926 538 22 ,0.296,Positive
2021-05-07,zm sec form yuan eric converted 96 154 unit class common stock sold 27 926 538 worth class common stock 96 154 unit 290 44 URL technology ,0.2263,Positive
2021-05-07,insider yuan eric report selling 80 529 share zm total cost 24 364 963 56 ,0.296,Positive
2021-05-07,zm macd looking bearish ttm squeeze also looking like downside think get around 260 261 area lot open interest volume may 21 260p interesting ,0.7351,Positive
2021-05-07,108 average max roi 76 win rate excellent week kick may let keep rolling free day trial bio aapl msft amzn fb nflx nvda tsla googl qq spy dia amd zm bynd ba baba gme amc hd g cost pltr shop bmy xlf dkng ,0.8225,Positive
2021-05-07,wkly port snapshot top 10 spg mrk pin rdfn docu roku gdrx pd tdoc 70 conc let go pton zm crwd short term headwind smaller position picked liked recent cash flow mrk business requires doc keytruda growth cash flow ,0.7351,Positive
2021-05-07,zm 330c exp 18 jun 21 total day 681 690 smartmoneyflow ,0.0,Neutral
2021-05-07,back cathie wood cnbc interview reveal today archegos bill hwang seed investor first etf think relative spot share video made week danger concentrated position tsla zm ,-0.296,Negative
2021-05-07,zm pton tdoc platform company new world better cheaper faster productive innovative going old world always love cathie thought focusing quarter quarter earnings focus future ,0.875,Positive
2021-05-07,zm going homerun cathy arkw arkk virtually zero barrier competition people physically going back work lockdown end valuation insane growth slow fwd 75x least 50 overvalued 18 mo price target 150 ,-0.1531,Negative
2021-05-07,learn take money market load pton 80 89 watching like loser USER taking every day week jd room zm loaded yesterday 290 302 1k member spy room trade 50 ,-0.2263,Negative
2021-05-07,position 05 07 2021 high low amzn aapl isrg tsla fb uri pltr ba nvax zm nvda tsm amat shak path ge pll arkk agc cash 11 09 increased amat fb dip added shak today drop watch list apps mrna mvis holding position maintain cash 15 ,-0.2732,Negative
2021-05-07,zm avg volume daily appearance since 2020 194 close day later avg 55 sd 10 90 worst 53 18 best 42 79 10 day later avg 04 sd 13 98 worst 79 83 best 36 19 30 day later avg 50 sd 28 16 worst 124 72 best 140 83 ,0.0772,Positive
2021-05-07,many company know financial space using msft team zm video conducting interview client meeting USER USER USER ,0.0,Neutral
2021-05-07,arkk got seed capital bill hwang fn serious bird feather tsla zm arkg ,-0.0772,Negative
2021-05-07,ark cathie wood think twitter tipping could bigger deal anticipated zoom zm essential technology take traditional communication stack twitter twtr love space think well ,0.743,Positive
2021-05-07,good grief someone sold pbx year previous life zm doesnt advantage ericsson fujitsu alcatel later asterisk open source pushing rope claim livetvchat USER USER USER ,-0.2593,Negative
2021-05-07,interesting cathie wood think zm take conference call going forward may even kill pbx system ,-0.4588,Negative
2021-05-07,cathie wood indicates zoom video continue take bigger stack remote connection communication space zm ,0.0,Neutral
2021-05-07,breaking cathie wood think zoom going take traditional communication stack zm ,0.0,Neutral
2021-05-07,commercial cathie wood try pump flailing name tdoc zm coin ,0.0,Neutral
2021-05-07,ttd tsla zm alerted play yesterday today profited went 100 option play today reaching 100 profit ,0.8689,Positive
2021-05-07,wyy ticker massively oversold point sickness sight current price wyy within day could 13 00 investment idea gme amc kos bb eh fsr kndi nkla wkhs aapl pypl coin snow spy spce zm xray stock tip wyy ,0.0,Neutral
2021-05-07,zm testing lower support line falling wedge hold next pivot point 350 ,-0.0258,Neutral
2021-05-07,lottofriday day away result hagw zm 297 5c 168 cost 385c 60 65 175 chwy 74c 48 71 50 hd 335p 71 05 48 breakeven hd 340c 35 42 20 breakeven bidu 197 5c 55 227 ,0.0,Neutral
2021-05-07,zm short target 270 ,0.0,Neutral
2021-05-07,top 10 end april 2021 crwd portfolio zm pin meli fvrr se mgni dis hca cfg ,0.2023,Positive
2021-05-07,zm zm210514c295 stop alert posted discord ,-0.4019,Negative
2021-05-07,closed amzn short put position win gon na lie thats nervous qq bounce saved as rest short call baba fb gme nio nvda qcom snap tsla zm got decimated closing best week ever ,0.7579,Positive
2021-05-07,zm 230 00 may 21 2021 put underlying 296 95 difference 29 11 daily volume 71 300 volume 852 oi 33 iv 62 54 bid ask 20 30 ,0.0,Neutral
2021-05-07,zm tell try close shit gain ,-0.0516,Negative
2021-05-07,wyy ticker massively oversold point sickness sight current price wyy within day could 13 00 investment idea rkt kmph zm gnog amtx clf so asti atnx pltr riot mara coin snow eh stock tip wyy ,-0.5574,Negative
2021-05-07,um love zm ,0.6369,Positive
2021-05-07,zm seen covid stock multiple year gain pulled forward yet trading significantly cheaper pre covid ,0.5267,Positive
2021-05-07,started credit spread challenge last monday 32 500 currently 39 370 full week trading total profit 870 10 trading day 21 account gain time gld dia pton zm join u URL ,0.8932,Positive
2021-05-07,zm possible run 306 307 treat lotto ,0.4019,Positive
2021-05-07,zm 100 profit credit spread ,0.6705,Positive
2021-05-07,ttd tsla awx zm day vip make sure join u URL check new membership feature ,0.7783,Positive
2021-05-07,zm weekly ,0.0,Neutral
2021-05-07,zm looking good test 324 ,0.4404,Positive
2021-05-07,zm escalated quickly ,0.0,Neutral
2021-05-07,pton earnings outlook pton zm ccl nclh amzn follow turn notification amazing trade idea unitedtraders daytrade teamwork wsb stock ,0.5859,Positive
2021-05-07,ready 10 day free trial credit card required begin growing portfolio optionalarm option swing trade today URL aapl tsla zm shop gild ,0.8442,Positive
2021-05-07,zm credit spread closed 05 95 profit USER amazing trade ,0.8519,Positive
2021-05-07,zm update rallying reasonable level prior support trendline past retests highlighted previously pivotal support range grey let see gain momentum earnings descending wedge produce wild swing ,0.8402,Positive
2021-05-08,rxrx zy twst zm invest tomorrow tech trend today URL via USER ,0.0,Neutral
2021-05-08,value 00 invested little 12mo ago doge 274 521 dog eth 17 186 dna btc 872 penn 700 gps 375 tsla 103 mrna 754 zm 900 twtr 797 pypl 748 googl 728 aapl 679 amzn 383 ,0.34,Positive
2021-05-08,ark invest USER call called stay home play platform play say go back old world indicates technology going away shop tdoc zm ,0.5859,Positive
2021-05-08,USER long position tsla aapl msft amzn pool fb dhr nvda sq hero zm crwd pltr pypl msci mar mara qq smh eh mo spxl thinking trex dis se jp7974 googl rblx coin ba el tecl webl rh ndaq ,-0.2263,Negative
2021-05-08,momo crowd gorge bad news prudent investor need know read URL qq arkk arkg ark tdoc docu twlo pton bynd zm flsy fvrr upwk investing invest investment investment investor markts stock stockstowatch ,-0.7717,Negative
2021-05-08,arkk flagship top 10 making almost half fund price sale tsla 18 tdoc 17 roku 22 sq 11 shop 40 spot zm 32 twlo 25 coin 41 USER paved whole lot runway narrative manana famous word 200 tech bubble ,0.296,Positive
2021-05-08,continue look zm pton lmnd gdrx bull bear case ,0.0,Neutral
2021-05-08,corrected 72 se roku crwd sq tdoc rdfn twlo fsly adyey net 28 etsy zm docu ddog meli pton snow fvrr blfs ,0.0,Neutral
2021-05-08,cross crosspad finance coin climbing fast big buy coming retest recent high soon crypto coin btc pltr arec nndm ebon so dot mara riot sava gthx tsla tsla penn plug nclh ccl nio tsla riot ebon mara zm chwy wynn gme ,-0.8158,Negative
2021-05-08,27 926 472 27 share sold yuan eric chief executive officer reported new form filed sec zm URL ,0.296,Positive
2021-05-08,24 364 972 29 share sold yuan eric chief executive officer reported new form filed sec zm URL ,0.296,Positive
2021-05-08,long shop go long zm ,0.0,Neutral
2021-05-08,zm earnings beat earnings beat earnings beat yet price last august go long zm betting reopening economy gon na happen like people plan new future online everything ,0.3612,Positive
2021-05-08,look like cross crosspad finance coin taking crypto coin btc pltr arec nndm ebon so dot mara riot sava gthx tsla tsla penn plug nclh ccl nio tsla riot ebon mara zm chwy wynn btc gme aal amc fb googl ,-0.7152,Negative
2021-05-08,new free option crypto discord link bio join btc eth ech bch ltc ampl xtz xlm xom appl zm fb spy amd qcom msft twtr spaq nio nkla att ba dji intc atvi pfe mrna gild pypl ,0.4215,Positive
2021-05-08,13 thursday abnb dis ftch newr pre mkt baba 18 pre mkt bidu se 19 snp 20 panw pre mkt lspd tcehy 25 intu z 26 ntnx okta pstg snow wday 27 adsk box crm domo veev pre mkt plan stne zm smar splk asan 17 adbe ,0.0,Neutral
2021-05-08,absolutely hating last round still walking zm casino like yay ,0.3197,Positive
2021-05-08,really interesting going happen tonight already happening crazy time live doge se roku zm URL ,0.1513,Positive
2021-05-08,portfolio weekly update top ten cciv roku meli shop open afrm chwy twlo tdoc ride weekly move liquidation ipod ipof accumulation afrm chwy ride nvta pacb plug roku new initiation tsp zm ,0.2023,Positive
2021-05-08,option maxpain chart zm free option app URL ,0.5106,Positive
2021-05-08,zm option oi chart free stock apps URL ,0.5106,Positive
2021-05-09,zm clean triangle breakdown seeing maybe retest triangle atleast 618 bearish retrace next leg ,0.4019,Positive
2021-05-09,arkk size darkpool activity friday 05 07 amc million share 109 71 historical transaction displayed right usually see many dp share top holding tsla tdoc roku sq shop spot zm twlo coin ,0.6369,Positive
2021-05-09,two day risk free trial sign visit URL login subscribe pay satisfied fully refunded ready trade insight aapl amd amzn gme cciv nflx nio tlry pltr roku spce spx spy tsla zm ,0.749,Positive
2021-05-11,chwy 30 35 tdoc 80 40 zm 50 83 zm 10 50 14 10 perfect way continue week free day trial bio aapl msft amzn fb nflx nvda tsla googl qq spy dia amd zm bynd ba baba gme amc hd g cost pltr shop bmy ,0.5859,Positive
2021-05-11,chwy tdoc zm play today waited setup arrive executed perfectly went play today check quote tweet result free day trial bio aapl msft amzn fb nflx nvda tsla googl qq spy dia gme zm bynd ,0.8442,Positive
2021-05-11,zm 169 time zm trading day 56 time traded higher next day market close URL ,0.0,Neutral
2021-05-12,qq key level watching 316 support 321 324 resistance tech led way may lead bounce happens close eye level spy amzn aapl ba nflx tsla amd roku nvda fb sq msft baba zm USER ,-0.128,Negative
2021-05-12,social medium stock zm fb twtr pin snap etsy bmbl mtch ,0.0,Neutral
2021-05-12,fb tested big support area 297 50 298 move back 305 get u bounce higher 309 315 297 50 fails possible see 293 support next spy amzn aapl ba nflx tsla amd roku nvda crwd etsy sq msft baba zm USER ,0.3818,Positive
2021-05-12,qq 52 week high set 10 day ago 34 nasdaq 100 stock 20 52 week high zm lead way 50 80 splk 48 78 bidu 48 34 pton 47 78 pdd 41 65 meli 35 52 docu 35 30 tsla 34 49 ,-0.4939,Negative
2021-05-12,cramer list woodstocks stock season prepare pain cut loss next move tsla coin tdoc sq roku spot twlo shop zm wallstreet stockmarket stock investor cathiedwood jimcramer madmoney investing wallstreetbets ,-0.7717,Negative
2021-05-12,insider kelly steckelberg report selling 700 share zm total cost 928 890 51 ,0.296,Positive
2021-05-12,docu 2017 using sign first home logi 2016 affordable option wireless keyboard intu 2017 used turbotax splk zm 2018 used work aftpy seeing website replace affirm puma tsla cost 2016 bay area mcd dpz 2016 synonym usa ,0.0,Neutral
2021-05-12,jim cramer list woodstocks sell strength teledoc tdoc square sq roku roku shopify shop zillow twilio twlo spotify spot coinbase coin zoom zm USER USER ,0.4939,Positive
2021-05-12,buy dip spx qq spy aapl baba nflx ba cost tsla sq fb gld bac mrna zm pton nvax nvda pypl nkla amd amzn msft stockstowatch daytrading snap ccl dal baba twtr nok csco penn intc acb cron luv ino ,-0.4939,Negative
2021-05-12,30 growth stock said watch jan 1st growth corrects coming back list potential future buy pullback eventually base currently se pin sq fsly net ddog pltr tdoc roku zm ,0.6369,Positive
2021-05-12,zm 20 5m buyer rolled position may ,0.0,Neutral
2021-05-12,ignored valuation bought 55 60 euphoria spac world bottom nasdaq still near top enlighten spacs destroyed growth stock dip position either zm cciv ,0.7579,Positive
2021-05-12,zm trading 289 bought zm april 20 150 almost 100 even bought oct 20 600 guarantee zm dip 200 mark bought cciv nav 80 case ,0.25,Positive
2021-05-12,zm 455k share darkpool print 289 50 URL ,0.296,Positive
2021-05-12,nice print zm amount 131 721 362 50 learn signup URL get training URL ,0.4215,Positive
2021-05-12,zm weirdly holding well ,-0.0258,Neutral
2021-05-12,daamn zm 17 290c 3k vol 23m premium ,0.0,Neutral
2021-05-12,zm currently lead unusual option activity barchart visit URL view unusual option URL option optionstrading unusualoptions optionstrading option ,0.0,Neutral
2021-05-12,big boy stuff heading final 15 trading spy tsla dkng riot mara goog aapl uvxy dia arkk pton zm daytrading stockmarket stonks gme amc wallstreetbets investing ddtg ,-0.5574,Negative
2021-05-12,pacv pacific venture group first quarter ended march 31 2021 earnings result expected released mid may URL USER tsla nkla roku aapl jpm amzn msft zm fb nvda dal amd rmti ,0.0,Neutral
2021-05-12,qq aapl msft googl nvda amzn nflx tsla roku zm shop pton rkt wkhs spy etc deep red rescue catalyst upcoming last hour today trading ,0.0258,Neutral
2021-05-12,used think video conf apps unloaded zm stock really level polish zoom seen competitor ,0.0,Neutral
2021-05-12,make sure tune monday may 17 2021 pacific 11 eastern navigating market help retail trader consistently bank taken advantage dd ba aapl zm aal tsla nio penn buzz pltr sbux coin sndl fubo amc gme ,0.7184,Positive
2021-05-12,option flow stream update aapl amzn tsla zm soxs ndx spy spx optionstrading optionsflow optionstrade optiontrading stock stock stockmarket investment investing invest investor investor uoa URL ,0.0,Neutral
2021-05-12,redemption surge arkk trouble exiting 10 plus stake handful company whose share relatively illiquid potentially hard exit tsla tdoc roku sq shop zm spot coin twlo viac disca arkk arkw arkw arkg billhwang archegos ,-0.2263,Negative
2021-05-12,zm weekly monthly visual testing half year 18 mo also previous pivot zone 270 280s lot like tightly defined trade sentiment interest name low surprise runner watch summer fall ,0.6705,Positive
2021-05-12,tweet bought zm 300c lotto earlier ,0.0,Neutral
2021-05-12,portfolio risk level arkinnovation etf arkk rank well average 10 11 factor morningstar global riskmodel tsla tdoc roku sq shop zm spot coin twlo ,0.0,Neutral
2021-05-12,arkk liquidity concern arkk hit redemption could spark selloff cathiewood smaller position tsla tdoc roku sq shop zm spot coin twlo ,0.2263,Positive
2021-05-12,option flow stream update aapl amzn tsla zm xle vix ndx spy spx optionstrading optionsflow optionstrade optiontrading stock stock stockmarket investment investing invest investor investor uoa URL ,0.0,Neutral
2021-05-12,crwd sq zm new article bottoming growth stock buy tuesday reversal URL get latest crwd related news URL ,0.3818,Positive
2021-05-12,zm continues struggle giant volume node looming matter measure ,-0.4019,Negative
2021-05-12,rggi target government sector looking forward URL gmev geo nio zm tsla ,0.0,Neutral
2021-05-12,today play roku 21 325c hit 29 30 12 spy 14 409p hit 63 90 play today slower movement market keep simple small amzn aapl ba nflx tdoc shop tsla dis amd nvda fb docu crwd etsy sq msft baba zm ,0.5859,Positive
2021-05-12,USER right b rhetoric blew 200 pt djia pump like zm docu problem market create fear none exists gdp explodes hedge fund pal happy USER pe USER ,0.34,Positive
2021-05-12,zm spot last night inside candle day massive run bearish time always something watch sometimes power hour lotto brings right risk reward situation 11 60 put ,0.3818,Positive
2021-05-13,tsla 15 80 41 34 tsla 16 50 21 48 gme 40 20 20 play yesterday hit huge hard time volatility come check u aapl msft amzn fb nflx nvda tsla googl qq spy dia amd zm bynd ba baba gme amc ,0.0258,Neutral
2021-05-13,docu 17 10 45 bidu 35 18 se 65 10 16 zm 45 50 zm 65 12 00 day near end week come join u 30 free trial aapl msft amzn fb nflx nvda tsla googl qq spy dia amc zm bynd ba baba gme ,0.3182,Positive
