Date,tweet,sentiment_score,sentiment_label
2020-09-17,nuro bouncing afterhours huge news seen eye tiny float bio soon 50 break open zm fb spy amd qcom twtr spaq nio nkla att ba nvda pypl amzn sq snow csco bp tsla dji tsla wmt msft spaq shll tsla nkla wkhs nio ,0.3182,Positive
2020-09-17,zm setting tactical intraday swing type trade get resistance gap closed high putting wide range bar 8ema holding really well ,0.3384,Positive
2020-09-17,market recap september 17th 2020 stock slide URL amzn tsla nvda aapl shop dkng sbux wynn aal nclh fb qq ibb crm splk ntap wsm stockstowatch stock abt wmt aimt ulta wday hpq zm nasdaq nkla pton spce penn rh ,-0.4939,Negative
2020-09-18,ticker boob zm fb spy amd qcom msft twtr spaq nio nkla wmt ba atvi pypl amzn sq fsly etsy shop lyft uber csco bp tsla crm bigc shop appl roku orcl dia qq snow frog ,-0.4939,Negative
2020-09-18,scan friday september 18 2020 URL URL abt met pton mrk amgn twtr schw gm zm ibm hd low swingtrading technicalanalysis trading stock stocktrading option optionstrading ,-0.2732,Negative
2020-09-18,thanks USER cashed long position beginning week aj advice made close 2k today option zm could 27k end day shoulda woulda coulda bottom line banked big thanks aj ,0.7003,Positive
2020-09-18,spy tsla aapl wmt jpm nvda amd shop amzn bigc crwd hd msft orcl nee qq nflx pton vxx zm docu penn tgt ba fb chgg bac googl goog lyft fdx crm sbux pdd ttwo nkla bynd dis nio qcom atvi sne ,-0.4939,Negative
2020-09-19,reason stop zm tsla chart lol ,0.1531,Positive
2020-09-19,nuro 70 million beyond oversold undervalued huge news big board trader know nothing significance low float much ask nuro squeezed volume easily srne tgi uco uso xspa zm gild ktov ,0.5719,Positive
2020-09-19,smartoptions unusual activity alert delayed zm 412 put oct exp trade volume 025 contract 865 500 traded follow money trade option smartoptions artificial intelligence URL ,0.5267,Positive
2020-09-19,stock market outlook sideways choppy 19 2020 rmsmo ibd uptrend pressure gmi red qq rwb market leader action forming base clearly showing r tsla apps zm pin wkhs like retweet ,-0.0516,Negative
2020-09-20,disclaimer sell next friday tsla zm put ,0.0,Neutral
2020-09-20,call tsla sell tuesday 3pm put tsla zm sell friday 3pm put spy 300 sept 30 let go ,0.0,Neutral
2020-09-20,stock market ready bounce crash continue watch stock market analysis video find URL amzn aapl ba baba fb tsla msft roku spx spy tdoc cost zm nvda bynd snap mrna orcl sq crm e qq vix nq ,-0.5267,Negative
2020-09-20,zm built infrastructure moat company difficulty crossing got ta start beginning ,-0.34,Negative
2020-09-20,zm 445 454 459 455 500 510 vol huge last friday open 446 open great ,0.7506,Positive
2020-09-21,list stock currently known fundamental priced least tomorrow morning premarket amzn zm docu tsla roku nflx nvda sq e nq spx spy qq ndx ,-0.4939,Negative
2020-09-22,zm new insider filing zoom video communication inc chief financial officer kelly steckelberg URL ,0.0,Neutral
2020-09-22,roku tsla aapl msft nnox bynd aal dal nkla uber amd kodk kndi fb amzn zm twtr snap nflx baba jd goog crox htz spy spot nio wkhs lfl f4f ivr ba mrna nvda wmt jnj pypl fdx googl ifb shop dell zm 50 URL ,0.0,Neutral
2020-09-22,acca 032 bullish pennant break 9m float pivot 07 potential 48 remark pink current tie zm zoom speculative fintech ,0.1027,Positive
2020-09-22,zoom cfo kelly steckelberg sold 11 066 share total 654 907 18 20 leaving 388 share left zm 420 65 18 492 today zoom zm ,0.5267,Positive
2020-09-23,tricky market pulling everything like march name like zm dkng roku making new high showing impeccable strength giving false impression downside limited ,0.7906,Positive
2020-09-23,spot 100 roi qq 100 roi sq 150 roi dgly 150 roi tqq 25 roi play strike big rest september 10 message join aapl msft amzn fb nflx nvda googl spy dia amd zm bynd ba baba dal wmt hd g cost work ,-0.0258,Neutral
2020-09-24,24 2020 day trading result 377 900 100k 500k income potential stock day acn tsla spi zm nvda aapl exas gdrx 32 trade 25 win loss break even result 377 900 call 949 218 4114 ,0.3612,Positive
2020-09-24,zm pulled back point great add 472 00 02 51 hour 42pm edt ,0.6249,Positive
2020-09-25,zm zoom video communication top stock 707 low close 496 50 volvsavg 87 liq 6218m URL ,-0.0772,Negative
2020-09-25,zm new insider filing zoom video communication inc chief executive officer eric yuan URL ,0.0,Neutral
2020-09-25,60 40 portfolio work anymore amzn tsla zm URL ,0.0,Neutral
2020-09-25,zm new alert URL stock daytrading nyse nasdaq market 2021 ,0.296,Positive
2020-09-26,URL 680 profit zm croock alert fred big big extension technical breakout bounce coming ,0.6249,Positive
2020-09-26,detailed look zm broken wing butterfly trade week including entry adjustment biggest loss ever 99 book lesson learned URL optionstrading stockmarket tastytrade ,-0.6597,Negative
2020-09-26,itox unknown startup created former vp medtronic aapl amd amrn aal bac amzn msft ba abt tsla nvda ge dis ccl uber dal nflx fb mu sq zm xom gild roku ual jpm abbv fcx snap baba wfc rcl ba ibio ino aytu gnc visl ,0.25,Positive
2020-09-26,itox startup extremely oversold undervalued could run 00 coronavirus mu twtr fb bcrx spy cldr gemp mvis rvlt isr tsla aapl wmt uvxy tza mnkd zm auph acad apdn fcel siri mrna fb opgn sif clsd apt cycn codx clsd ino aytu ttoo idex ,0.0,Neutral
2020-09-27,eght zm tam eght zm 48 billion right assume capture ,0.0,Neutral
2020-09-27,zm good call still think test 560 range dont try short name like overvalued market punish like punished tslaq holder reversal candle opp take ,0.128,Positive
2020-09-27,great performance weekly trade idea last week research week underway investing stock trading ddtg daytrading market money aapl spce zm spy ,0.6249,Positive
2020-09-27,eght better value compared zm ,0.6486,Positive
2020-09-28,fb love work aal amd mnta gld twr slv xom wmt ccl hd tsla xle spy iwm e wpx ba spg mcd mfa htz aapl chwy qq e amc dis znga zm plnt mgm amd amzn dis alert update watchlist chart chatroom URL welcome ,0.7351,Positive
2020-09-28,zm dumping continues URL ,-0.3182,Negative
2020-09-28,spot multiple test 242 25 level big level get one see move 255 268 30 break support 230 watching closely amzn aapl ba nflx tsla amd roku nvda etsy sq msft baba zm USER ,0.4019,Positive
2020-09-28,jd watching move 76 57 bounce see 79 81 45 83 use 72 56 near term support fails spy amzn aapl ba nflx tdoc shop tsla dis amd roku nvda fb pypl docu crwd etsy sq msft baba zm USER ,-0.0258,Neutral
2020-09-28,avgo peaking pennant today 362 see 372 53 next looking ath test 379 fib target 396 support 350 spy amzn aapl ba nflx tsla amd roku nvda fb etsy sq msft baba zm USER ,0.4019,Positive
2020-09-29,tdoc similar setup lvgo target 237 253 strong breakout pypl spy snow pin crm docu amzn tsla roku amd e qq fdx ups ttwo twlo aapl fb zm nvda ddog atvi docu crm lulu amd ,0.0258,Neutral
2020-09-29,thanks alert update URL best analysis far fb love work aal amd mnta gld twr slv xom wmt ccl hd tsla xle spy iwm e wpx ba spg mcd mfa htz aapl chwy qq e amc dis znga zm plnt mgm spy amd amzn dis uone ,0.8834,Positive
2020-09-29,crm watching closely move 249 47 level see move 256 51 266 278 near term support sitting 240 spy amzn aapl ba nflx tdoc shop tsla dis amd roku nvda fb crwd etsy sq msft baba zm USER ,0.4019,Positive
2020-09-29,lvgo wedge consolidation targeting 160 51 166 173 89 breakout pypl spy snow pin crm docu amzn tsla roku amd e qq fdx ups ttwo twlo aapl fb zm nvda sq pltr baba docu crm ,-0.4939,Negative
2020-09-30,microsoft team issue strike zoom tidal wave brilliant new feature via USER zm msft ,0.5106,Positive
2020-09-30,10 term existing holding last month great one adyey ddog roku sq zm etc far broad market concerned october might turn another choppy month election uncertainty pretty convinced early stage ,0.8225,Positive
2020-09-30,form initial statement beneficial ownership security filed sec zm URL ,0.6486,Positive
2020-10-01,holding portfolio zm 28 05 crwd 15 85 fsly 14 13 ddog 11 50 okta 11 24 net 10 41 ,0.0,Neutral
2020-10-01,sold call zm net even docu 85 90 25 gain ilmn 20 50 49 gain well intraday scalp dkng 25 50 30 gain grabbed call docu 10 16 240c 10 penn 10 16 73c 80 tsla 10 480c 85 10 16 510c 10 70 ,0.9062,Positive
2020-10-01,USER continues actively manage flagship p500 index well afternoon passed tsla zm favor p400 constituent pool replace etfc acquired m URL ,0.7579,Positive
2020-10-01,zm took questionable oct 16 put today 485 zm chart ,-0.296,Negative
2020-10-02,proposal next debate use zm wallace mute participant ,0.0,Neutral
2020-10-02,stock watch best mutual fund buy tech retail stock URL amzn fb msft pypl nvda dpz zm docu dt chgg ,0.6369,Positive
2020-10-02,10 2020 day trading result 362 220 100k 500k income potential stock day twlo tsla snow nvda nflx lad asml zm 44 trade 36 win loss break even result 362 220 call question 949 218 4114 ,0.3612,Positive
2020-10-02,future already across board monday nut red bad news people go buying like crazy time lose house dia qq spy wmt aapl dkng penn tsla zm shop pton ,-0.8519,Negative
2020-10-03,longer term indefinite holding period though assume sell become mature growth slows zm always small position made lot mistake trading loaded last er sold 40 day post er leave ,0.4215,Positive
2020-10-03,really nice friend thanked stock tip today one ppl never experienced sexism happy worked zm bet turned quite well since go ipo ,0.8454,Positive
2020-10-03,zm oct 02 400 call 525 00 alerted 20 80 sep 17 2020 10 29am peak alert 130 00 2020 09 23 daily progress URL ,0.6124,Positive
2020-10-03,10 05 20 watchlist peck sbe chargepoint tsla 410 entry ride nio top china ev dpw ev charger tech zhud patience tester rkt long spaq pic xl fleet verb baby zm vxrt USER pill partner rafa huge ride wave ,0.4767,Positive
2020-10-04,covid wave like covid stock like zm docu pfe see new high coming week matter ,0.6249,Positive
2020-10-04,stock hit 52 week high wednesday nke spi nvo zm dg URL ,0.0,Neutral
2020-10-04,late buying zm tomorrow open ,0.0,Neutral
2020-10-05,nvda showed lot strength today moving back 532 level watching 55 next 55 see 565 579 589 use 532 support spy amzn aapl ba nflx tsla amd roku fb docu crwd etsy sq msft baba zm USER ,0.7096,Positive
2020-10-05,four bigc spot xbi lob work shop lvgo carr zm trading looking trade stock may want see latest chart update also find actual price alerted subscriber technical reasoning alert ,0.3612,Positive
2020-10-05,today cap 10 05 2020 pre market note zm great play u act note written perfection told everyone care stock pop rest assured sell today way 475 go long hit 475 26 URL ,0.9423,Positive
2020-10-06,investor wondering zm may running steam current support ,0.4019,Positive
2020-10-06,daily watchlist recap 16 4k per 100 share potential ddog sq zm tsla snow follow turn notification amazing trade idea learn trade following link live trading stream URL ,0.7184,Positive
2020-10-06,trade log oct 2020 buy trade sell trade hold zm 47 crwd 17 zi 66 rprx 92 bntx 06 total 05 ,0.0,Neutral
2020-10-06,zm zoom meeting ,0.0,Neutral
2020-10-06,ut profit zm fb spy amd qcom msft twtr spaq nio nkla wmt ba atvi pypl amzn sq fsly etsy shop lyft uber csco bp dji tsla crm bigc shop appl roku wmt docu tdoc ,0.4404,Positive
2020-10-07,picked zm debit spread today group 10 16 expiration look great move triangle back 500 nearly perfect formation got ta execute ,0.8316,Positive
2020-10-07,today highlight pre market note 10 07 2020 sunw short 50 peck short 14 50 pll long 46 49 dkng long 52 55 nflx long 517 535 pll long 40 49 gh long 101 109 zm short 487 477 levi short 17 15 shop short 1065 1050 1075 URL ,0.34,Positive
2020-10-07,zm bull pennant getting tight alert set 500 ,0.296,Positive
2020-10-07,fsly breaking get top 100 chartbook stock take advantage current bull trend today hottest stock contained chartbook dm free copy zm lvgo pton pin ,0.7269,Positive
2020-10-08,ut killing zm fb spy amd qcom msft twtr spaq nio nkla wmt ba atvi pypl amzn sq fsly etsy shop lyft uber csco bp dji tsla crm bigc shop appl roku wmt docu tdoc ,-0.6597,Negative
2020-10-08,baba closed 300 making new aths today hold 300 see fibonacci level 314 329 345 next 300 295 support spy amzn aapl ba nflx shop tsla amd roku nvda fb pypl docu crwd etsy sq msft zm USER ,0.4019,Positive
2020-10-08,zm another consolidation day still direction see way want break ,0.0772,Positive
2020-10-09,life zm ,0.0,Neutral
2020-10-09,working weekend next weekly stock trade next week specific setup change love fang tsla aapl nflx zm nvda dis baba googl amzn fb room stock oversold level 1k room USER ,0.6369,Positive
2020-10-09,inside week scan master watchlist courtesy USER beke mgm bidu plan snow mrna run nova rh wkhs nio cvna srne mrsn ttwo zm aapl want access scan sign newsletter URL pupcharts insideweek ,0.4215,Positive
2020-10-10,current watchlist abt amd aapl cern crwd docu fvac immr ipoc nio pbi pin pypl tsla ttwo vuzi wmt xone zm refine post chart tomorrow ,0.0,Neutral
2020-10-10,zm broke bull close crazy thing leg day see happens throw fundies window enjoy hype ,-0.25,Negative
2020-10-10,zm snow given superior revenue growth profitability better valuation zoom clearly better buy snowflake ,0.9403,Positive
2020-10-10,snow forget snowflake tech stock better buy right URL ayx zm amzn excitement around snowflake ipo caused valuation reach stratospheric height ,0.6486,Positive
2020-10-10,entering zm stoploss around 460 ,0.0,Neutral
2020-10-11,zm setting inside week ,0.0,Neutral
2020-10-11,zm may broken tight flag consolidation fri upgraded mizuho 550 pt zoom analyst day 10 14 potential run event senseisundays spy msft qq tsla amzn work ,-0.743,Negative
2020-10-11,biggest miss 2020 stock market zm held missed gain year without doubt stock 2020 ,0.4039,Positive
2020-10-11,notable chart today adbe docu low mdb ntes zm potential week alert set everything else ,0.0258,Neutral
2020-10-12,cery careful bear good company tsla aapl spy qq nio srne zm pton nvda amd msft ,0.0772,Positive
2020-10-12,aapl 43 swks 81 amd 19 beginning aapl msft amzn fb nflx nvda tsla googl qq spy dia amd zm bynd ba baba dal wmt hd g cost work shop bmy xlf xlk pg dkng tlry ,-0.4939,Negative
2020-10-12,ko 24 38 wkhs 00 60 msft 30 14 07 mrna 28 70 play hit thursday killing multiple winning per day aapl msft amzn fb nflx nvda tsla googl qq spy dia amd zm bynd ba baba dal wmt hd g cost work tgt ,-0.4215,Negative
2020-10-12,zm played weekly 250 260 call spread open got 15 ,0.34,Positive
2020-10-13,zm next buy point 530 volume ,0.0,Neutral
2020-10-13,bought zm lvgo today ,0.0,Neutral
2020-10-13,uber zm call tomorrow possible continuation lvgo new 52wkh ,0.0,Neutral
2020-10-14,cool announcement wanted see around zoom phone potential application ex something around call center might see tomorrow zm ,0.3182,Positive
2020-10-14,spy qq iwm summary 10 14 bidu zm dis nflx roku holding trying restrict play top setup result started show still early though let see long disciplined ,-0.3818,Negative
2020-10-14,latest client note hallmark bubble long term consequence massive government stimulus bank earnings available website URL USER USER spy qq dia zm jpm bac wfc g ,-0.4939,Negative
2020-10-15,pat self back USER bought fsly today pretty large initial buy zm nice job selling austin great timing ,0.8779,Positive
2020-10-15,twitter suffers widespread service disruption twtr msft zm URL ,-0.6808,Negative
2020-10-15,top stock iipr dkng ng bynd zm technical analysis oct 15th 2020 ,0.2023,Positive
2020-10-15,zm lot love today outstanding relative strength rightly benefited month long rsi macd negative daily divergence attention along mature ew count divergence get wiped away strength think caution warranted ,0.9287,Positive
2020-10-15,market pause bullish tech titan ultimate coronavirus stock buy URL aapl amzn msft adbe zm tsla ,0.0,Neutral
2020-10-16,smart product strategy trying build platform marketplace top brand visibility gain pandemic directly addressing doubt moat people like think zm overpriced ,0.7845,Positive
2020-10-16,smartoptions unusual activity alert delayed zm 530 call oct 30 exp trade volume 290 contract 334 00 traded follow money trade option smartoptions artificial intelligence URL ,0.5267,Positive
2020-10-16,first bagger zm ,0.0,Neutral
2020-10-16,trader please stop messing around give sniper follow ta one best seen ever hand see make type call almost weekly honored trade week zm amzn ,0.9005,Positive
2020-10-17,professional stock picker blaming small time investor phenomenal rise stock like zoom moderna maybe look mirror instead mrna zm ,-0.1779,Negative
2020-10-17,twitter suffered widespread service disruption twtr msft zm URL ,-0.6908,Negative
2020-10-18,amzn huge sell last hour friday 3229 see move towards 332 break 3178 see test buyer zone 3148 amd aapl baba fb msft roku spx spy nflx zm nvda bynd qq ,-0.2263,Negative
2020-10-18,USER really read celebration stating fact higher cv equates higher zm price investment site karen toowoke ,0.0,Neutral
2020-10-18,fb hold 265 key level could see test seller zone 272 38 amd aapl baba fb msft roku spx spy nflx zm nvda bynd qq ,-0.4939,Negative
2020-10-19,baat room stock trader URL gold dxy gdx gld slv cgc aapl msft tsla amzn spx spy ba spce zm fb gbpusd usdjpy eurusd iwm eem qq g jpm bac m xlf tlt penn dkng msg cv jnj ge wmt vix intc ba xom ,-0.4939,Negative
2020-10-19,fb love work aal amd mnta gld twr slv xom wmt ccl hd tsla xle spy iwm e wpx ba spg mcd mfa htz aapl chwy qq e amc dis znga zm plnt mgm amd amzn dis alert update watchlist chart chatroom URL welcome ,0.7351,Positive
2020-10-19,fvrr blue jks yellow nls green perfect yes gained huge zm pink like angel gem ,0.9153,Positive
2020-10-19,breaking zoom plan develop cockblocker app zm ,0.0,Neutral
2020-10-20,dkng de spy play today market chop city want overextend direction currently holding amat spy put chgg de dkng intc call good luck aapl msft amzn fb nflx nvda tsla googl qq spy dia amd zm bynd ba ,0.6597,Positive
2020-10-20,tomorrow watching much especially nio twtr bynd zm twlo nvda uber roku ,0.0,Neutral
2020-10-20,today much better monday made money dkng short bynd short zm short spce got thanos ed arwr nio gogo short ended day holding twtr selling hour plenty loss throughout day also ,0.1531,Positive
2020-10-21,peloton stock slump despite bullish analyst call pton zm URL ,0.0,Neutral
2020-10-21,overbought indicator hate term upper bb know stock acting ok pull back high get upper band remember always say selling provides information buying mean zm pin ,-0.3612,Negative
2020-10-22,URL finally realize zm longer able sustain growth ,0.3818,Positive
2020-10-22,zm zm quite volume shelf forming ,0.0,Neutral
2020-10-22,today cap 10 20 2020 pre market note zm nice trade today act chat 1st overnighted 514 wed waited pop open 530 per note sold overnight share shorted stock 505 long URL ,0.6124,Positive
2020-10-22,big short zm URL ,0.0,Neutral
2020-10-23,1100 zm open took snap short first top per USER get 400 net listened saying scalp ended day 450 got greedy stubborn trying vwap ignoring major support line 42 07 lesson learned ,-0.4417,Negative
2020-10-23,zm imo change tsla level comfortable wan na see open higher monday reclaim back emas could definitely see retrace 55 ema even 618 tsla see ,0.7184,Positive
2020-10-23,weekend analysis thirteen ticker analysis URL 00 01 intro 05 00 index spy 18 35 volatility vix 22 24 equity googl luv fdx baba 37 51 equity tsla zm docu roku msft 48 44 gold gld 49 33 bitcoin gbtc themarketupdate ,0.0,Neutral
2020-10-24,zm reversal candle earlier week day move 565 21 day price looked shaky last week negative rsi divergence need resolved ,-0.5994,Negative
2020-10-24,comprehensive market analysis coming week spy googl tsla fdx baba zm docu roku msft gld gbtc ,0.25,Positive
2020-10-25,two day risk free trial sign visit URL login subscribe pay satisfied fully refunded ready trade insight amzn amd ba baba snap fb aapl googl nflx roku tsla spx spy dkng zm ,0.749,Positive
2020-10-25,continue let work talk spy amzn baba zm googl tsla e msft fsly crm aapl ba nflx follow along see ,0.0,Neutral
2020-10-26,coronavirus case hit time high must buy stock URL olli go zm spb lcut ,0.0,Neutral
2020-10-26,today cap 10 26 2020 pre market note nvda nice trade today act slower version zm pop 6pts zm pop candle nvda pop 10mins nvda today simple go long 539 open look push 545 URL ,0.4215,Positive
2020-10-26,today cap 10 26 2020 pre market note zm nice trade today act easy execute follow pre market note told everyone soon hit 524 go long 10 pt got 17 made 514 89 3mins URL ,0.6908,Positive
2020-10-27,nice quarter beat think make 11 row msft amzn work zm azure xbox d365 ,0.4215,Positive
2020-10-27,htsc go parabolic today news huge ultimate ev play rumor talking biggest amzn tsla roku zm amd irrzf elygf intc xlnx cgc vff googl spy qq pbio ba boa nikl nke wmt tgt chi tgodf tgod miti pctl pbhi ge gm ,0.128,Positive
2020-10-27,prediction 10 year zm acquired 10 present value taken private fire sale scrap ,0.0,Neutral
2020-10-27,daily set ups interest wed 2x inside sam 2x outside hae outside inside roku pton pin beam lot 1x inside fb zm 50 1x outside mktx kura ung 1x rev strat apls ok enough hagn ,0.8126,Positive
2020-10-28,highlight day vix 70 40 100 twlo 70 13 80 40 diamondclub week pin tdoc ostk etsy spy qq nflx zm aapl ,-0.2023,Negative
2020-10-28,10 28 2020 result day trading 269 190 income potential 100k 500k year proof URL stock day zm srrk baba dxcm tif nvda 26 trade 20 win loss break even result 226 390 stock earnings pin ,0.3612,Positive
2020-10-28,10 27 2020 result day trading 248 620 yourincomepotential 100k 500k year proof URL stock day zm xlnx ffiv srrk nvda baba dxcm exas twlo snowresults 232 060 stock earnings twou fslr trade winsresults 16 560 ,0.0,Neutral
2020-10-28,small account challenge phenomenal especially today result dia put taken 93 went way 10 05 today overnight result aapl msft amzn fb nflx nvda tsla googl qq spy dia amd zm bynd ba baba dal wmt hd g cost work ,-0.4404,Negative
2020-10-28,zm stock option made simple entry exit signal zm 28 profit join platinum trading room link bio dm u join stockoptions stockoptionstrading stockoption stockmarket startinvesting stockmarkettips optionstrader optionstrading ,0.743,Positive
2020-10-29,nflx big move today 500 hitting high 513 90 currently trading 500 hour move back 510 bring gap fill back 522 hold 500 see 491 spy amzn aapl ba tsla amd nvda fb sq zm USER ,0.0,Neutral
2020-10-29,essential need relationship based zodiac sign fb twtr zm aries taurus gemini cancer leo libra scorpio sagittarius capricorn aquarius pisces zodiacsigns relationship relationshipneeds partner astrologyreading astrology ,-0.6597,Negative
2020-10-29,replay thursday night stock chart live another great night chart URL pbr zm optt ibm ride jks zdge ,0.6249,Positive
2020-10-30,monster day box tsla goog ccl aapl pin fb zm ,0.0,Neutral
2020-10-30,know fb thing got real people real convos URL brtxq snvp inno wkhs brgo czni bynd abce snap rvdo ds net enzc nke gps mro crm amzn aapl zm tsla nkla nflx twlo ba nio slb ge amd msft fb idex amd ,0.0,Neutral
2020-10-30,zm really start zoom 446 ,0.0,Neutral
2020-10-30,34 407 796 97 share sold yuan eric chief executive officer reported new form filed sec zm URL ,0.296,Positive
2020-10-31,zm valuable ,0.4767,Positive
2020-10-31,zm oct 30 497 call 170 87 alerted 33 40 oct 2020 53am peak alert 90 47 2020 10 19 daily progress URL ,0.6124,Positive
2020-10-31,zm oct 30 525 call 150 40 alerted 12 50 oct 27 2020 30pm peak alert 31 30 2020 10 28 daily progress URL ,0.6124,Positive
2020-10-31,peak profit last expired option alert zm 170 87 11 205 76 14 99 17 99 217 88 URL ,0.6249,Positive
2020-10-31,zm nov 13 530 00 call option volume 130 00 volume 299 v 130 ,0.0,Neutral
2020-11-01,killer month gang aapl jmia zm nflx spy atvi wei visl twtr nio baba pfe xlnx bidu jks spy fsly like trade learn email st bio could dm let keep ball rolling november ,-0.4215,Negative
2020-11-01,medium sized net long exposure current intention near term net short short december early 2021 proposition covered half aggressive short zm aapl sq cvna still short small late day friday ,-0.1531,Negative
2020-11-01,batter experience trading community join alert option discord URL uxin gme fsly msft nkla penn opti xspa zm fb lca spaq srne dkng aapl nio wkhs ino aal wwr vxrt avgr ibio htz tsla spy sunw pfe boxl zm ,0.1779,Positive
2020-11-01,lost look week 13 potential trade setup green red day chart level watch either potential support resistance hd mcd cat de pypl ebay axp amd zm pg unh ups fdx ,0.1027,Positive
2020-11-01,general market became tail wind zm zoomed ahead another 269 ,0.0,Neutral
2020-11-02,jim cramer break monday rotation value lagged aapl msft amzn fb zm URL ,0.0516,Positive
2020-11-02,zm hello eric need much cash zoom ceo jumped boat ,0.0,Neutral
2020-11-02,URL instead posting written watchlists recording watchlist review ill recording one daily USER community please feel free check cover spy nvda nflx amzn zm tsla timestamps listed ,0.4215,Positive
2020-11-02,zm 453 long earnings november 30 ,0.0,Neutral
2020-11-02,stock investor care win presidential election 75 nasdaq nyse tsx stock rose top stock amzn aapl tsla fb msft goog nvda zm googl amd ,0.8316,Positive
2020-11-03,biden trump long nio zm tesla docu affected fine ,0.0516,Positive
2020-11-03,powered major social hit pokemon go among u lego time know many thing powering future like thing trending theme wise strong theme common factor zm lvgo sq win ,0.9136,Positive
2020-11-03,know swear picture taken last night zm call USER held USER background toobin fellow speaking toobin fellow bet wish election night coverage v chubby jail ,0.3612,Positive
2020-11-03,nice quick flip zm call today 75 contract first time touching thing since shorting august 267 hahahahah market nut ,0.4215,Positive
