Date,tweet,sentiment_score,sentiment_label
2022-01-06,bought stock bought call make sense save crash deploy wait entire armageddon collapse still got buying power bought favourite rblx afrm sq zm pltr lot bargain deployed cash ,-0.2263,Negative
2022-01-07,ask anything unlocked team using zm always able find pretentious top techie make argument product average american running non profit kansa team need zm ,0.296,Positive
2022-01-07,zm valuable alternative meeting person know also valuable email conference call employee luncheon video mean basic communication powerful work better medium overkill ,0.8979,Positive
2022-01-07,monday short watchlist trading nyse nasdaq 150 200 aapl adi amat cvna etsy mmc nke pld roku txn xlk xlnx xly zm ,0.0,Neutral
2022-01-07,hearing zm usage office plummeted recent month ever employee using slack text person lunch communicate whole need keep touch together long time approach losing steam ,-0.3818,Negative
2022-01-08,top 10 stock market moving headline last week tesla ark innovation etf bitcoin tesla motor tsla arkk qq amzn btc msft coin zm ,0.0516,Positive
2022-01-08,USER say market dismissive zm tdoc trade 14 time time sale respectively even dismissive market way around ,0.34,Positive
2022-01-08,top 10 holding cathie wood ark invest arkk ark innovation etf tesla tsla zoom zm roku teladoc tdoc coinbase coin spotify spot unity twilio twlo exact science exas 10 block square sq source URL ,0.128,Positive
2022-01-08,pretty soon time go long mrna rivn docu zm ,0.4939,Positive
2022-01-09,stock chart review snapshot disappointing start new year URL aapl arkk bhp bset cat crm etd etsy goog igv intc isrg itb kfy lulu mndy net rpd shop smh snow sq tsla twlo xlf zm ,-0.296,Negative
2022-01-09,shop 1144 trade idea jan 14 1220c shop 1126 trade idea jan 14 1050p closed 1144 48 let see shop start form bottom 1126 aapl amd amzn ba fb lcid msft nflx nio nvda mrna roku spx spy sq tsla upst zm ,0.0,Neutral
2022-01-09,u market week 10 2022 spy dia xly xlu xlp xlv xlb xli xlf xlk smh gld ief fxi bac g pfe jnj aapl mrna twtr nflx zm hd ba cat unh mrk dis pypl ebay xom cvx tsla amzn bby tgt fslr apd mtch mat xle amt vz ,-0.3182,Negative
2022-01-09,zm 72 600 time high sitting level march 2020 point turn back towards 225 250 think anything 72 due bounce likely never see 600 foreseeable future though ,0.0,Neutral
2022-01-09,invest use USER URL make 30 29 annualized start lose zm drop 22 01 20 2023 buy 170 call sell 210 call sell 135 put 20 23 exp optionsstrategy videoconference investing ,-0.5859,Negative
2022-01-10,zm waiting buy signal zm URL ,0.0,Neutral
2022-01-10,zm new article wayfair normalization pain 2022 URL get latest zm related news URL ,-0.5106,Negative
2022-01-10,looking fvrr zm among others ,0.0,Neutral
2022-01-11,caused zm drop 49 value 176 share change fundamental excellent business offer better purchasing price ,0.8442,Positive
2022-01-11,URL thought zm zoom great stock share year ago 357 share like even today growth stock currently getting punished due potential interest rate hike later year ,0.9118,Positive
2022-01-11,scan result 1h exchange ftx top bullish trend perp future cream perp xaut near tryb top bullish trend usd stock tsm acb aapl pfe zm buy signal dyor result URL website ,0.3818,Positive
2022-01-12,zm bearish engulfing daily appearance since 2020 32 close day later avg 51 sd 16 31 worst 32 31 best 50 53 10 day later avg 93 sd 24 99 worst 102 67 best 37 44 30 day later avg 44 sd 38 37 worst 118 05 best 88 82 ,0.0772,Positive
2022-01-12,highest conviction play ideal entry price index correct shop sq amd enph se nvda zm okta pypl etsy nvta beam tdoc crwd already position meli pltr pacb add go lower ,0.5574,Positive
2022-01-13,could literally put hundred name watchlist setting side tonight discus waiting confirmation problem trading name like zm like msft avgo z tomorrow new video live URL ,0.3182,Positive
2022-01-13,top bullish flow today expe tsla spy zm ,0.2023,Positive
2022-01-13,zm 14 jan 22 atm implied vol climb 27 straddle implies move URL ,0.0,Neutral
2022-01-13,zoom video communication inc zm trending twitter reddit URL ,0.0,Neutral
2022-01-14,perfect mastery someone thinking buying zm ,0.5719,Positive
2022-01-14,zm already closed short zoom still bleeding imagine much downside left valid lcid lucid cash flow negative without earnings expected late year poor market judgement point dust eventually settle ,-0.8316,Negative
2022-01-14,good question paying trading room free trading room via URL tradingroom buythedip nasdaq sharemarket stock investing stockstowatch stockstobuy zm dkng idex baba clov lcid chpt hban cop key schw mpc ,0.7351,Positive
2022-01-15,think zm keep sliding would crazy see hit 100 ,-0.34,Negative
2022-01-16,scan result 15m exchange ftx top bullish trend perp future mkr okb theta ada exch top bullish trend usd stock bito coin gbtc ethe zm buy signal dyor follow USER content ,0.3818,Positive
2022-01-16,zm 156 78 seeing 149 16 weekly 30min timeframe ,0.0,Neutral
2022-01-16,scan result 15m exchange ftx top bullish trend perp future mkr ax bch zrx look top bullish trend usd stock zm gbtc coin twtr bitw buy signal dyor follow USER content ,0.3818,Positive
2022-01-17,truth priority caring uyghurs china spy dia xly xlu xlp xlv xlb xli xlf xlk smh gld ief fxi bac g pfe jnj aapl mrna twtr disca zm hd ba cat unh mrk dis pypl ebay xom cvx tsla amzn bby tgt fslr apd mtch mat xle amt ,0.4939,Positive
2022-01-17,arkk top 10 current hold daily tf tsla strongest roku positive rsi div tdoc positive rsi div sq remains weak zm positive rsi div shop extended downside spot positive rsi div twlo remains weak coin positive rsi div sup 114 ,0.9423,Positive
2022-01-17,zm sold well URL ,0.2732,Positive
2022-01-17,profitable company portfolio metric last gross margin asan 90 adbe 88 abnb kind 86 ebitda margin nvda 42 adbe 41 abnb 40 asml 39 net income margin abnb 37 nvda 35 zm 32 adbe asml 31 ,0.1531,Positive
2022-01-18,zm stock hidden value stock ,0.34,Positive
2022-01-18,zm waiting buy signal zm URL ,0.0,Neutral
2022-01-18,lowest since pltr nov 20 ftch sep 20 pypl sep 20 roku sep 20 sq aug 20 twtr aug 20 penn aug 20 twlo jun 20 crsp jun 20 chwy may 20 docu may 20 dkng may 20 zm may 20 pton apr 20 tdoc dec 19 spce dec 19 clov time hood time ,-0.3818,Negative
2022-01-18,point mkt selloff investor start throwing baby bath water decline v 2021 high vroom vrm 86 virgingalactic spce 85 robinhood hood 83 peloton pton 82 zoom zm 65 honest co hnst 73 draftkings dkng 70 pennatl penn 70 ,0.1779,Positive
2022-01-19,stonksteam wednesday ewave spy qq iwm iwc iwb aapl tsla nya dia fb amzn amc msft pltr afrm zm USER tlt tnx sponsored tradinglounge ndx primary count though ,-0.2732,Negative
2022-01-19,issue online learning many student deal bad internet attending online class zoom zm requires ton bandwidth need increase bandwidth capacity ,-0.296,Negative
2022-01-19,cfius extends reach non notified deal biden administration seek deepen national security scrutiny 2022 zm fivn ,0.4588,Positive
2022-01-20,meta really want metaverse acquire adobe unity zoom adbe zm ,0.1513,Positive
2022-01-20,seriously though pton nflx surprised seen people taking shot zm docu etc afterhours really knee jerk thing ,-0.3566,Negative
2022-01-20,zm zoom received rate buy based security added platform believe company way back recovery insider unloads good ,0.6486,Positive
2022-01-20,anyone checked zm ok bro ,0.296,Positive
2022-01-21,zm one trap 2021 despite 10 year experience felt easy fcf fantastic thought maybe market understand potential thinking hard figured actually knew nothing future zm ,0.5859,Positive
2022-01-21,fivn deal fell 15 billion buyout offer zm right fivn trading billion still 13x sale run rate burning top line cxdo trade 5x run rate doubling business acquisition well organic growth ,0.6705,Positive
2022-01-21,put eye name holding despite correction likely chance finding future leader think upst docu zm asan afrm hundred name killed past 10months going back ath anytime soon already lost ,-0.8196,Negative
2022-01-21,zm mark spot almost directly pivot time fails get crushed regardless 147 live die ,-0.8591,Negative
2022-01-22,shop spot starting look attractive outside probably going diving big tech name soon look zm stne definitely interesting price definitely riskier ,0.836,Positive
2022-01-22,scan result 15m exchange ftx top bullish trend perp future ampl knc slp mta leo top bullish trend usd stock gld bntx coin tsla zm buy signal dyor follow USER content ,0.3818,Positive
2022-01-23,zm price april 2020 ,0.0,Neutral
2022-01-23,amzn 2827 trade idea jan 28 2700p closed 2852 86 amzn hold 2827 drop 2800 quickly 2800 test 2720 2700 aapl amd ba bynd fb lcid msft nflx nio nvda mrna roku snap spce spx spy sq tsla zm ,-0.5719,Negative
2022-01-23,thing see nvda zm set ups could fly truth told one know going happen tomorrow could ugly trade see volatility going one way another catch ready go heavy size day make ur life ,0.128,Positive
2022-01-23,scan result 15m exchange ftx top bullish trend perp future fida ht cro bao dawn top bullish trend usd stock tlry cron apha zm nok buy signal dyor follow USER content ,0.3818,Positive
2022-01-24,stopped research gut level trimmed position kept tab growth driver streaming share sub pricing lot keep top story classic pandemic stock like zm pton dash ,0.7351,Positive
2022-01-24,zm zoom video communication option alert aug 19 135 put sweep near ask 95 v oi earnings 28 close est learn get detail ,0.296,Positive
2022-01-24,fwdailyinsights top 10 insider sold ticker last day bv gmii crc pg sumo new gpft psnl zm cuk dash click detail URL ,0.2023,Positive
2022-01-24,stock market crash correction technically biggest position also growth tech like hood open sofi spy qq sq afrm tsla shop tdoc roku coin zm twlo let discus ,-0.2023,Negative
2022-01-26,probably swinging heavy zm tomorrow ,0.0,Neutral
2022-01-27,finally got rid zm holding putting profit use elsewhere started trim long time ago lesson learned ,0.4404,Positive
2022-01-27,free alert recap mrna put paid 87 zm put paid 30 wday low volume call paid 30 let get 80 80 like tomorrow lotto pick spy tsla shop amzn roku nflx bynd lcid pltr coin hood mara amd nvda aapl ba qcom mrna pfe ,0.7096,Positive
2022-01-27,market rebellion co founder USER highlighted unusualactivity zm gm lazr today 3USER livestream ,-0.128,Negative
2022-01-28,saying long noo corporate standard short zm ground next pton ,0.0,Neutral
2022-01-28,crash buy tech stock rate begin rise zm shop etsy docu msft URL ,-0.4019,Negative
2022-01-28,top 01 26 22 extreme bullish unusual option activity massive superbull 800 p sold c bot itb pltr expensive bullish putselling mil kdp sbux quadrupledouble prch tripledouble sabr itb expensive callbuyng mil intc mrvl zm ,0.2023,Positive
2022-01-29,scan result 15m exchange ftx top bullish trend perp future xaut trx people spell kin top bullish trend usd stock abnb fb hood wndr zm buy signal dyor follow USER content ,0.3818,Positive
2022-01-29,scan result 1h exchange ftx top bullish trend perp future so ksos people stmx cvc top bullish trend usd stock bito nok pfe zm spy buy signal dyor result URL website ,0.3818,Positive
2022-01-29,zm waiting buy signal zm URL ,0.0,Neutral
2022-01-30,scan result 15m exchange ftx top bullish trend perp future leo perp crv hnt mkr top bullish trend usd stock zm cron bili bito bynd buy signal dyor follow USER content ,0.3818,Positive
2022-01-30,scan result 15m exchange ftx top bullish trend perp future ht mkr hnt crv leo top bullish trend usd stock zm bito cron bili abnb buy signal dyor follow USER content ,0.3818,Positive
2022-01-31,new article outlook remote worker remains strong URL USER qq zm msft aapl fb ,0.0258,Neutral
2022-01-31,zoom zm stock price last month buy dip stock dipped news society opening back reliance upon zoom mtgs would wither never bet pandemic ,0.0,Neutral
2022-01-31,zm 240c exp 19 jan 24 total day 241 260 zm 250c exp 19 jan 24 total day 110 700 unusualactivity sign free beta ver URL chart courtesy finviz ,0.7003,Positive
2022-01-31,zm 185c exp 20 jan 23 total day 71 445 zm 200c exp 20 may 22 total day 33 500 zm 230c exp 19 jan 24 total day 139 496 unusualactivity sign free beta ver URL chart courtesy finviz ,0.7003,Positive
2022-01-31,zm 165c exp 18 mar 22 total day 27 675 zm 165c exp 20 jan 23 total day 93 225 zm 175c exp 20 jan 23 total day 86 450 unusualactivity sign free beta ver URL chart courtesy finviz ,0.4445,Positive
2022-02-01,tdoc hood zm dkng nndm see crooked jim cramer go back video type last week bashing kissing majesty cathie wood yeah crooked wallst buddy back crystal ball saw coming ,0.7096,Positive
2022-02-01,arkk USER would rather bet USER tsla zm tdoc roku larger holding fan ,0.3182,Positive
2022-02-01,people know zm gon na print money nah rlly ,-0.1027,Negative
2022-02-01,value hour s04 e05 value best 50 day misinformation qrate v zm update URL valueinvesting news ,0.7717,Positive
2022-02-02,zm find active market alert best winning trading community URL ,0.91,Positive
2022-02-03,zm find active market alert best winning trading community URL ,0.91,Positive
2022-02-03,zoom aka zm look like remote meeting schedule downward trajectory people using phone maybe USER awesome meeting fyi happened ,0.8126,Positive
2022-02-03,holy shit think fukking moose get men white coat amzn fb zm snap msft ,-0.5574,Negative
2022-02-04,better buy zm docu pton news go ,0.4404,Positive
2022-02-04,zm statement change beneficial ownership ,0.4404,Positive
2022-02-04,wild volatility big tech issue continues money pours amazon others reversing sector thurs loss fri snap 58 amzn 13 roku snow sq uber twtr panw zm ebay tsla crm amd nasdaq ,-0.1531,Negative
2022-02-04,bull forecast february 04 2022 13 16 00 pdt ticker log change intraday 46 et 53 enph 59 cmg 49 spy 59 googl 43 zm 27 52 nflx 49 ups 94 ,0.0,Neutral
2022-02-04,took contract could made 510 31 shib baba googl aapl snap hd nflx nvda bynd ba zm ttd pin small gain add end doge tsla nflx g coin shib join u trade powerful watchlist ,0.8126,Positive
2022-02-04,dailyup5 wkhs 18 65 66 29 18 56 20 38 21 wwe 51 71 16 18 36 16 35 57 05 xpl 50 00 14 92 20 19 57 03 xpof 18 43 31 48 11 14 78 56 01 zm 145 00 12 83 19 38 48 02 38 80 z 259 23 80 60 94 18 66 48 38 ,0.0,Neutral
2022-02-04,zm new article better loses exec ceo vishal garg return following zoom layoff meltdown URL get latest zm related news URL ,0.1531,Positive
2022-02-04,wild week trading USER buy bail investor hint tech stock plus selling stalwart stay home trend USER USER adbe googl msft zm ,0.0,Neutral
2022-02-04,better loses exec ceo vishal garg return following zoom layoff meltdown zm full take ,0.1531,Positive
2022-02-04,zm short swing alert high risk feb 11 160call 94 ,0.0258,Neutral
2022-02-04,zm 160 00 feb 11 2022 call underlying 144 08 difference 95 daily volume 11 699 volume 182 oi 232 iv 64 64 bid ask 90 99 ,-0.5994,Negative
2022-02-04,hellofresh right ingredient growth pton zm URL ,0.3818,Positive
2022-02-04,avory company llc filed form 13f q4 2021 opened new position duol shv sq wix zm try insider form mobile app get realtime notification ,0.0,Neutral
2022-02-04,zoom team feel bit like netscape internet explorer zm msft ,0.3612,Positive
2022-02-04,ready 10 day free trial credit card required begin growing portfolio optionalarm option swing trade today URL aapl tsla zm shop gild ,0.8442,Positive
2022-02-04,finance social medium post back march 2020 catch falling knife time buy finance social medium post buy march 2020 would much spy qq tsla zm gme amc ,-0.5859,Negative
2022-02-04,bull forecast february 04 2022 09 06 00 pdt ticker log change intraday iwm 16 atvi 26 uso 79 g 65 nflx 20 hon 93 adbe 29 mstr 72 zm 00 spg 55 ,0.0,Neutral
2022-02-04,bull forecast february 04 2022 09 03 00 pdt ticker log change intraday iwm 20 xlf 65 atvi 27 uso 75 g 54 12 nflx 21 hon 87 zm 87 adbe 30 ,0.0,Neutral
2022-02-04,roku tdoc zm khc mco vz usb coin exas ntla twlo spot wanted shoot invite discord actually get paid contributing 70k last month check ,-0.5423,Negative
2022-02-04,arkfunds launching new fund could invest private company tsla coin btc arkw arkk tdoc arkg zm arkf arkx gbtc ,0.0,Neutral
2022-02-04,bull forecast february 04 2022 08 48 00 pdt ticker log change intraday luv 30 iwm 20 uso 84 atvi 14 xlf 50 ks 20 zm 83 fsly 67 dks 70 fcx 11 ,0.0,Neutral
2022-02-04,bull forecast february 04 2022 08 45 00 pdt ticker log change intraday luv 37 iwm 35 uso 48 atvi 12 xlf 37 ks 08 spot 44 zm 71 dks 84 fsly 40 ,0.0,Neutral
2022-02-04,stock would want portfolio zm tsla pypl nflx nvda gme dis asml amc baba ,0.0772,Positive
2022-02-04,zm hourly ,0.0,Neutral
2022-02-04,bull forecast february 04 2022 08 27 00 pdt ticker log change intraday luv 23 gme 84 ks 06 uso 29 fcx 61 02 fsly 91 spy 29 zm 48 et 98 ,0.0,Neutral
2022-02-04,bull forecast february 04 2022 08 25 00 pdt ticker log change intraday luv 01 gme 18 ks 99 fcx 38 uso 36 fsly 69 04 spy 50 et 93 zm 90 ,0.0,Neutral
2022-02-04,bull forecast february 04 2022 08 22 00 pdt ticker log change intraday luv 21 gme 06 ks 23 fcx 02 uso 60 fsly 02 14 spy 39 et 68 zm 16 ,0.0,Neutral
2022-02-04,bull forecast february 04 2022 08 16 00 pdt ticker log change intraday luv 19 gme 47 ks 31 fsly 71 fcx 34 uso 74 spy 31 12 et 68 zm 05 ,0.0,Neutral
2022-02-04,bull forecast february 04 2022 08 13 00 pdt ticker log change intraday luv 16 gme 54 ks 41 fsly 10 fcx 03 uso 62 spy 33 20 et 98 zm 65 ,0.0,Neutral
2022-02-04,bull forecast february 04 2022 08 07 00 pdt ticker log change intraday luv 07 himx 15 gme 67 ks 96 fcx 20 fsly 33 spy 31 uso 45 et 58 zm 78 ,0.0,Neutral
2022-02-04,bull forecast february 04 2022 08 05 00 pdt ticker log change intraday luv 23 himx 15 gme 22 ks 92 fsly 02 spy 42 fcx 21 uso 30 et 60 zm 51 ,0.0,Neutral
2022-02-04,bull forecast february 04 2022 07 59 00 pdt ticker log change intraday luv 26 himx 05 gme 12 ks 20 spy 46 fcx 35 fsly 67 uso 31 et 47 zm 45 ,0.0,Neutral
2022-02-04,right folk call boner candle hbar gme amc tsm baba gm aapl fb msft pton lcid ba zm etsy bynd ccl ,0.0,Neutral
2022-02-04,top 10 growth tech stock fri feb 04 2022 08 00 est nvda 239 48 mu 81 97 afrm 57 49 zm 137 94 amat 136 51 sq 101 50 56 21 qcom 179 10 umc 49 10 coin 181 31 ,0.5267,Positive
2022-02-04,nich nitches partner shipbob accurate fast fulfillment shipping service amzn zm amd qq owuv fb lcid cost msft qq spy jnj innd sing silff esrcf mm mtrt crdv bwvi sirc tvccf ilal sysx nufmf gase cntww tlltf dmehf ,-0.7506,Negative
2022-02-04,zm 11 downtrend sliding three consecutive day february 2022 view odds indicator URL zoomvideocommunications ,0.0,Neutral
2022-02-04,zm utilizing stock option alert advisor experience technology market analysis URL ,0.296,Positive
2022-02-04,zm find active market alert best winning trading community URL ,0.91,Positive
2022-02-04,tsla amzn zm nvda tlry baba bidu kern wanted shoot invite discord actually get paid contributing 70k last month check ,-0.5423,Negative
2022-02-04,tsla nvda baba zm tlry avgo sndl fb fsly ostk nnox pltr pton spx wanted shoot invite discord actually get paid contributing 70k last month check ,-0.5423,Negative
2022-02-04,USER supposed pin fvrr cpng lmnd zm sq sklz appn curi heavily recommended stock advisor look ,0.2023,Positive
2022-02-04,reviewing ark top 20 holding show thatis literally underwater almost every significant position except tsla tdoc zm roku path dkng pltr hood dna likely exceeding 50 loss USER USER USER USER ,0.0056,Neutral
2022-02-04,ark investment trade 02 03 2022 arkf arkg arkk arkq arkw arkx sorry spot sq shareholder probably going lower asstill averaging see tdoc roku zm path dkng hood buy bnr mass mkfg psnl se slgc spot sq tsp twlo vld xpev ,-0.3612,Negative
2022-02-04,zm lmao ,0.5994,Positive
2022-02-05,scan result ftx 15m top bullish trend perp pair oxy gala hnt paxg alice top bullish trend usd pair bito gdxj zm tlry cgc ftx result URL buy signal ,0.3818,Positive
2022-02-05,scan result ftx 15m top bullish trend perp pair oxy alice chr so ksos top bullish trend usd pair bili gdxj amc cgc zm ftx result URL buy signal ,0.4364,Positive
2022-02-05,scan result ftx 15m top bullish trend perp pair alice gala sand chr people top bullish trend usd pair bili uso gdxj glxy zm ftx result URL buy signal ,0.3818,Positive
2022-02-05,scan result ftx 15m top bullish trend perp pair medium paxg bch yfi hnt top bullish trend usd pair bili gdxj tlry cron zm ftx result URL buy signal ,0.3818,Positive
2022-02-05,scan result ftx 15m top bullish trend perp pair hnt ramp cro fil step top bullish trend usd pair tlry mstr bili fb zm ftx result URL buy signal ,0.3818,Positive
2022-02-05,zm 25 uptrend advancing three consecutive day february 2022 view odds indicator URL zoomvideocommunications ,0.0,Neutral
2022-02-05,scan result ftx 15m top bullish trend perp pair hnt sol comp sushi seco top bullish trend usd pair zm tlry gdxj ethe amc ftx result URL buy signal ,0.3818,Positive
2022-02-05,scan result ftx 15m top bullish trend perp pair so icp comp stmx one top bullish trend usd pair zm amc cron fb tlry ftx result URL buy signal ,0.3818,Positive
2022-02-05,scan result ftx 15m top bullish trend perp pair zec asd stmx comp lina top bullish trend usd pair cron gdxj zm fb bito ftx result URL buy signal ,0.3818,Positive
2022-02-05,zm pandemic beginning 2020 price level ,0.0,Neutral
2022-02-05,zm find active market alert trading community URL ,0.5994,Positive
2022-02-05,zm find active market alert best winning trading community URL ,0.91,Positive
2022-02-05,cloud saas earnings igv clou 16 csco fsly tyl pre mkt ttd shop wix 17 rdfn roku pre mkt pltr 18 lyft payc 22 cdns panw rng rxt tdoc wk 23 ans msp pre mkt mndy 24 adsk bigc coin intu open ping sq z pre mkt docn 28 sail zm ,0.0,Neutral
2022-02-05,ark fund biggest holding feb 04 2022 tsla tdoc coin path exas roku zm twlo ntla shop spot sq crsp beam pltr dkng pacb fate sq twtr dna trmb gbtc hood twst nvta pd sgfy vcyt vrtx txg irdm ion cdna accd ktos jd ,0.0,Neutral
2022-02-05,stock low rsi 30 oversold nasdaq index weekly timeframe feb 04 2022 pypl zm trow fb xyl docu mm mean buy signal wait trend break ,-0.2732,Negative
2022-02-05,21 recap URL uber 852 38 pin 596 86 pfe 445 45 zm 438 83 cv 242 11 live call twitter alert fdx 209 52 live call twitter alert mara 146 88 cv 14 29 fb 24 39 fb 28 26 twtr 19 15 bac 20 83 ,0.2023,Positive
2022-02-05,arkk nothing want company lol def want pd sq dkng maybe roku coin pltr hood twtr dont want garbage tdoc zm shoulda sold 12 month ago prob better option buy stornkie ,0.1088,Positive
2022-02-06,tsla 945 trade idea feb 11 100c closed 923 32 tsla trading range 862 943 tsla 945 set 988 100 put work 865 aapl afrm amd amzn fb lcid msft nflx nio nvda roku upst spx spy sq zm lrcx ,0.0,Neutral
2022-02-06,shop 900 trade idea feb 11 100c closed 876 00 shop hold 841 tuesday move back 935 962 next put work 800 aapl afrm amd amzn ba fb lcid msft nflx nio googl nvda roku upst spx spy sq tsla zm lrcx ,0.0,Neutral
2022-02-06,ttd 72 trade idea feb 11 75c ttd 72 swing trade idea apr 14 90c closed 73 04 ttd hold 72 support run 76 83 next put work 65 aapl afrm amd amzn fb lcid msft nvda upst spx spy sq tsla zm lrcx ,0.4019,Positive
2022-02-06,zm still much within steady downtrend form oct 2020 high trying base volume shelf need break hold 8ema failed since last tested upper trendzone 134 could fall sub 120 next demand ,-0.5859,Negative
2022-02-06,scan result ftx 15m top bullish trend perp pair slp ht mana cel lina top bullish trend usd pair nflx zm fb gbtc apha ftx result URL buy signal ,0.3818,Positive
2022-02-06,scan result ftx 15m top bullish trend perp pair ht ax cel asd mana top bullish trend usd pair zm nflx fb gbtc baba ftx result URL buy signal ,0.3818,Positive
2022-02-06,folk performed analysis coin zm roku sofi sq tdoc arkk see educational post think analysis URL ,0.0,Neutral
2022-02-06,scan result ftx 15m top bullish trend perp pair ht cel ax ron mana top bullish trend usd pair nflx baba zm fb bito ftx result URL buy signal ,0.3818,Positive
2022-02-06,scan result ftx 15m top bullish trend perp pair alice kava chr tlm asd top bullish trend usd pair gdxj zm pypl tlry bili ftx result URL buy signal ,0.3818,Positive
2022-02-06,scan result ftx 15m top bullish trend perp pair kava chr bch alice gala top bullish trend usd pair zm gdxj pypl amzn gme ftx result URL buy signal ,0.3818,Positive
2022-02-06,pypl hnst zm crsr sq ttcf pltr bynd lmnd wanted shoot invite discord URL actually get paid contributing 70k last month check ,-0.5423,Negative
2022-02-06,arkw confluence wave fib pitchfork median weekly timeframe top 10 holding tsla coin gbtc roku tdoc zm twlo spot twtr sq think company going bankrupt ,-0.4215,Negative
2022-02-06,scan result ftx 15m top bullish trend perp pair gala sand rune dawn xaut top bullish trend usd pair tlry zm gdxj bili gme ftx result URL buy signal ,0.3818,Positive
2022-02-06,scan result ftx 15m top bullish trend perp pair gala step srm tryb omg top bullish trend usd pair tlry zm bili gdxj gme ftx result URL buy signal ,0.3818,Positive
2022-02-06,scan result ftx 15m top bullish trend perp pair gala ksos so ax people top bullish trend usd pair twtr tlry bili gdxj zm ftx result URL buy signal ,0.4336,Positive
2022-02-06,scan result ftx 15m top bullish trend perp pair hum gala people tlm cvc top bullish trend usd pair bili twtr tlry gdxj zm ftx result URL buy signal ,0.3818,Positive
2022-02-07,new nasdaq ark invest ceo cathie wood told USER barron streetwise podcast hear think stock tsla zm spot poised bounce back URL ,0.25,Positive
2022-02-07,zm foam ball coming get ready duck dive 107 ,0.3612,Positive
2022-02-07,zm cathy wood job depends earnings believe make bounce back soon ,0.0,Neutral
2022-02-07,140 114 109 gainer today blackboxstocks get 20 1st month URL fb googl mrk wfc ccl avgo tsla bkkt zm amd aapl cwh hl xpev lvs roku aal et abnb trading learntotrade daytrading optionstrading swingtrading ,0.0,Neutral
