date,news_headline,sentiment_score,sentiment_label
2022-11-11,Zoom Video Communications (ZM) Recently Broke Out Above the 50-Day Moving Average,-0.4215,Negative
2022-11-11,Cathie Wood's ARK Innovation ETF Marks Record Surge On Thursday: Here's What She Offloaded Amid Market Rally,0.3818,Positive
2022-11-10,"Zoom Up Over 13%, On Track for Largest Percent Increase Since September 2020 -- Data Talk",0.3182,Positive
2022-11-10,What Is Going on With Motorsport Games (MSGM) Stock Today?,0.0,Neutral
2022-11-10,"ZM Stock Alert: What to Know About Zoom’s Latest Partnerships With Tesla, AMC",0.296,Positive
2022-11-10,Why Merrimack Pharmaceuticals Shares Jumped Around 213%; Here Are 114 Biggest Movers From Yesterday,0.296,Positive
2022-11-10,"Robinhood, MicroStrategy And Other Big Losers From Wednesday",-0.5267,Negative
2022-11-09,"Tesla Finds Buyer In Cathie Wood As Stock Goes Haywire Amid Elon Musk's Twitter Deal, Share Sale",0.296,Positive
2022-11-09,Verint And Zoom Expand Partnership To Elevate Customer Experience Across The Enterprise With Zoom Contact Center,0.3182,Positive
2022-11-09,Why RumbleON Shares Are Trading Higher By Around 28%? Here Are 84 Stocks Moving In Wednesday's Mid-Day Session,0.296,Positive
2022-11-09,"AMC should avoid ‘distractions’ like credit cards, popcorn and dive deeper into IMAX, says analyst",0.4404,Positive
2022-11-09,Analyst Ratings for Zoom Video Comms,0.0,Neutral
2022-11-09,Verint to Further Integrate Customer Engagement Platform With Zoom's Contact Center Service,0.4588,Positive
2022-11-09,"Mark Zuckerberg Takes Blame As Meta Lays Off 13% Of Workforce, Elon Musk's Tesla Stock Sale May Not Sit Well With Investors, Netflix Eyes Sports Leagues: Top Stories Wednesday, Nov. 09",-0.343,Negative
2022-11-09,"Cvent, Zoom Partner to Support Hybrid Events",0.4019,Positive
2022-11-09,Zoom Expands Into Email And Calendar Software — Pitching Itself As Closer Rival To Microsoft,0.1027,Positive
2022-11-09,Zoom Video Communications Price Target Cut to $84.00/Share From $91.00 by Piper Sandler,-0.2732,Negative
2022-11-09,"Piper Sandler Maintains Neutral on Zoom Video Comms, Lowers Price Target to $84",-0.128,Negative
2022-11-09,"--Morningstar Adjusts Price Target on Zoom Video Communications to $115 From $160, Maintains Buy Rating",0.0,Neutral
2022-11-09,"--Piper Sandler Lowers Price Target on Zoom Video Communications to $84 From $91, Maintains Neutral Rating",-0.128,Negative
2022-11-08,"AMC Q3 Earnings Highlights: Revenue And EPS Beat, Company Sells 14.9 Million APE Shares, Q4 Blockbuster Slate",0.7269,Positive
2022-11-08,Zoom Announces Its Video Conferencing App Is Coming To Tesla Vehicles,0.0,Neutral
2022-11-08,How To Trade AMC Entertainment Stock Before And After Q3 Earnings,0.4215,Positive
2022-11-08,AMC Entertainment Earnings Are Up Next. The Meme Trade Desperately Needs a Boost. -- Barrons.com,0.4404,Positive
2022-11-08,Zoomtopia 2022 Anual Event Unveils New Innovations To Power Modern Work Experiences,0.0,Neutral
2022-11-08,"Zooms Adds Email, Calendar Tools to Keep Business From Video Rivals",0.0,Neutral
2022-11-08,Zoomtopia 2022: New Innovations to Power Modern Work Experiences,0.0,Neutral
2022-11-08,"Zoom Seeks to Expand Beyond Video With Email, Calendar Tools",0.3182,Positive
2022-11-08,Zoom Adds Email and Calendars to Video Software -- Barrons.com,0.0,Neutral
2022-11-08,What's Going On With AMC Entertainment Stock?,0.4215,Positive
2022-11-08,Palo Alto Networks Partners with Zoom To Deliver Exceptional User Experience For Zoom Meetings,0.0,Neutral
2022-11-08,AMC stock lifted by ‘Zoom Rooms’ partnership with Zoom,0.0,Neutral
2022-11-07,AMC teams with Zoom to turn movie theaters into ‘Zoom Rooms’,0.0,Neutral
2022-11-07,AMC Theatres And Zoom Partner To Bring Zoom Rooms To The Comfort And State-of-the-art Sight And Sound Technology Of AMC Movie Theatres,0.3612,Positive
2022-11-07,AMC partners with Zoom to offer meeting rooms at select theatres,0.0,Neutral
2022-11-07,What's Going On With AMC Entertainment Stock After Hours?,0.4215,Positive
2022-11-07,"Benzinga Pro's Top 5 Stocks To Watch For Monday, November 7, 2022: AAPL, PFE, BTU, ZM, GCT",0.2023,Positive
2022-11-04,"Catalyst watch: CPI downtick, election ripples, Disney and Rivian earnings, Roblox conference call",0.0,Neutral
2022-11-04,10 Most Popular Video Calling Software Companies in the World,0.4754,Positive
2022-11-03,Zoom Video Communications (ZM) Stock Moves -0.27%: What You Should Know,0.0,Neutral
2022-11-03,UPDATE 1-Zoom says it has fixed issue preventing access to platform,-0.0258,Neutral
2022-11-03,It's Not Just You: Zoom Went Down For Many Users Thursday,0.0,Neutral
2022-11-03,Zoom down for thousands of users - Downdetector.com,0.0,Neutral
2022-11-03,User Reports Indicate Zoom Is Having Problems - DownDetector,-0.4019,Negative
2022-11-03,"Zoom Video Communications, Inc. (NASDAQ:ZM) Stock Has Shown Weakness Lately But Financials Look Strong: Should Prospective Shareholders Make The Leap?",0.5499,Positive
2022-11-02,U.S. DOJ preparing to probe Adobe's $20 bln Figma deal - Politico,0.0,Neutral
2022-11-02,"Cathie Wood Invested In Musk's Twitter Takeover, How You Can Get A Stake For $500",0.0,Neutral
2022-11-02,3 Things About Zoom Stock That Smart Investors Know,0.4019,Positive
2022-11-02,2 Nasdaq Growth Stocks Down 44% and 85% to Buy Now and Hold Forever,0.3818,Positive
2022-11-01,Zoom to Release Financial Results for the Third Quarter of Fiscal Year 2023,0.0,Neutral
2022-10-27,Why Is Teladoc (TDOC) Stock Up 5% Today?,0.0,Neutral
2022-10-27,"Bear of the Day: Zoom Video Communications, Inc. (ZM)",0.0,Neutral
2022-10-21,Zoom Rode the Pandemic. Now It's Stock Is Back to January 2020. -- Barrons.com,0.0,Neutral
2022-10-21,Zoom Video Communications (ZM) Gains But Lags Market: What You Should Know,-0.3716,Negative
2022-10-21,Cathie Wood Bought TSLA Stock on the Post-Earnings Dip. Should You?,0.0,Neutral
2022-10-20,Cathie Wood Picks Up $13M In Tesla Shares As Investors React Negatively To Q3 Earnings,0.296,Positive
2022-10-19,Zoom To Hold Investor Day During Zoomtopia 2022,0.0,Neutral
2022-10-18,RingCentral Is Down 80%. Why One Former Bull Has Thrown in the Towel. -- Barrons.com,0.0,Neutral
2022-10-18,"RingCentral slips as BTIG downgrades on increased competition from Microsoft, Zoom",0.2732,Positive
2022-10-18,Covid Companies Are Losing Steam. Not This One. -- Barrons.com,-0.3818,Negative
2022-10-17,"Zoom Video Communications, Inc.'s (NASDAQ:ZM) Intrinsic Value Is Potentially 73% Above Its Share Price",0.5574,Positive
2022-10-16,"Couchbase, Duck Creek, SmartSheet viewed as possible takeover targets - analyst",0.0,Neutral
2022-10-14,ARK Innovation ETF Finally Closed Below Its Covid-Era Low. Why It Might Stay There. -- Barrons.com,0.128,Positive
2022-10-14,"--Goldman Sachs Adjusts Price Target for Zoom Video Communications to $104 From $122, Maintains Neutral Rating",0.0,Neutral
2022-10-13,Microsoft (MSFT) to Launch an App to Make Hybrid Work Easier,0.4215,Positive
2022-10-13,ARK Innovation ETF Again Hits Pandemic-Era Lows -- Barrons.com,0.2023,Positive
2022-10-13,"Facebook Parent Takes 'Step Forward' With Metaverse, Quest Pro Plans: Gene Munster",0.0,Neutral
2022-10-13,"Jim Cramer's Take On The Biggest Losers Of Nasdaq 100: 'If You're Living In A House Of Pain, You Should Move'",-0.7717,Negative
2022-10-12,"'The Answer Is Greed': Michael Burry Takes On Cathie Wood, Again",-0.4019,Negative
2022-10-12,Saga of Wall Street's pandemic darlings ends with tears,0.3182,Positive
2022-10-12,"Analysts See Meta Connect Shows Progress With Partnerships, Admire Mark Zuckerberg's Vision",0.7845,Positive
2022-10-12,Cisco partners with Microsoft to add Teams to its meeting devices,0.0,Neutral
2022-10-11,Meta's Facebook Takes Aim at Workers' PCs With New VR Headset -- WSJ,0.0,Neutral
2022-10-11,Zoom Video Communications (ZM) Stock Moves -0.01%: What You Should Know,0.0,Neutral
2022-10-11,Meta's Facebook Says Its New VR Headset Could Replace Workers' PCs -- WSJ,0.0,Neutral
2022-10-11,Cathie Wood Says Fed Is Making a Mistake. She's Not the Only One. -- Barrons.com,-0.34,Negative
2022-10-11,"Zoom Overhang Likely To Remain Till Early 2023, Analyst Downgrades Stock While Slashing Price Target By 31%",-0.2732,Negative
2022-10-11,Zoom Stock Loses Pandemic-Era Gains as Morgan Stanley Cuts Rating -- Barrons.com,-0.2732,Negative
2022-10-11,Stock Market Trims Losses; Meta Nears 4-Year Low; Putin's Black Swan?,-0.5859,Negative
2022-10-11,"Benzinga's Top Ratings Upgrades, Downgrades For October 11, 2022",0.2023,Positive
2022-10-11,Alphabet To $134? Plus This Analyst Slashes Price Target On McDonald's,-0.2023,Negative
2022-10-11,Apple To $155? Plus Morgan Stanley Cuts Price Target On Zoom Video,-0.296,Negative
2022-10-11,Merck To Rally Over 29%? Here Are 5 Other Price Target Changes For Tuesday,0.0,Neutral
2022-10-11,Zoom Video Communications Price Target Cut to $90.00/Share From $130.00 by Morgan Stanley,-0.2732,Negative
2022-10-11,Zoom Video Communications Cut to Equal-Weight From Overweight by Morgan Stanley,-0.5574,Negative
2022-10-11,"Morgan Stanley Downgrades Zoom Video Comms to Equal-Weight, Lowers Price Target to $90",-0.128,Negative
2022-10-11,"Zoom Video Communications Downgraded by Morgan Stanley to Equalweight From Overweight, Price Target Cut to $90 From $130",-0.5574,Negative
2022-10-10,Cheap Stocks To Buy: Should You Watch These 5 Growth Stocks?,0.3818,Positive
2022-10-10,Five9's decline leads losses across cloud call center stocks,-0.4019,Negative
2022-10-07,"Zoom Faces New Risks in Enterprise Contract Renewals, J.P. Morgan Says",-0.2732,Negative
2022-10-06,Ark Invest Stocks To Watch: 5 Stocks That Cathie Wood's ARK ETFs Own; Tesla Falls,0.0,Neutral
2022-10-06,Don't Like Jim Cramer's Stock Calls? This ETF Bets Against 'Mad Money' Host. -- Barrons.com,-0.6497,Negative
2022-10-05,Zoom Video Communications (ZM) Stock Moves -0.03%: What You Should Know,0.0,Neutral
2022-10-05,Where Will Zoom Stock Be in 5 Years?,0.0,Neutral
2022-10-04,"Cathie Wood Says Zoom Video Communications, Microsoft Corporation Will Lead Software Names",0.0,Neutral
2022-10-03,Ark Invest Stocks To Watch: 5 Stocks That Cathie Wood's ARK ETFs Own; Tesla Dives,0.0,Neutral
2022-10-01,"Got $5,000? 3 Bear-Market Stocks to Buy Now and Hold Forever",0.0,Neutral
2022-09-28,Zoom Video Communications (ZM) Launches Wide Range of Updates,0.0,Neutral
2022-09-28,"Jim Chanos Live On CNBC Says Still Short Zoom Video Communications, But Not As Much As Before",0.0,Neutral
2022-09-27,"Cathie Wood's Confidence In Tesla 'Couldn't Be Higher,' Says Elon Musk-Led Automaker Sits In 'Driver's Seat' Of EV Boom",0.5106,Positive
2022-09-24,"Zoom, Datadog among companies in broad new Credit Suisse software view",0.3818,Positive
2022-09-23,It's Painful to Watch Zoom Video's Decline,-0.4404,Negative
2022-09-23,"Benzinga's Top Ratings Upgrades, Downgrades For September 23, 2022",0.2023,Positive
2022-09-23,Zoom Video Communications Price Target Announced at $83.00/Share by Credit Suisse,0.3818,Positive
2022-09-23,Zoom Video Communications Initiated at Neutral by Credit Suisse,0.3818,Positive
2022-09-23,"Credit Suisse Initiates Coverage On Zoom Video Comms with Neutral Rating, Announces Price Target of $83",0.3818,Positive
2022-09-23,"Credit Suisse Initiates Coverage on Zoom Video Communications With Neutral Rating, $83 Price Target",0.3818,Positive
2022-09-22,"Benzinga's Top Ratings Upgrades, Downgrades For September 22, 2022",0.2023,Positive
2022-09-22,Zoom Video Communications Price Target Announced at $86.00/Share by MoffettNathanson,0.0,Neutral
2022-09-22,Zoom Video Communications Initiated at Sell by MoffettNathanson,0.0,Neutral
2022-09-22,"MoffettNathanson Initiates Coverage On Zoom Video Comms with Sell Rating, Announces Price Target of $86",0.0,Neutral
2022-09-22,"More Antitrust Pain For Amazon, Microsoft And Google: UK Regulator Promises Action",-0.0717,Negative
2022-09-22,"MoffettNathanson Initiates Coverage on Zoom Video Communications With Sell Rating, $86 Price Target",0.0,Neutral
2022-09-20,"Zoom Video Communications, Inc. (ZM) Is a Trending Stock: Facts to Know Before Betting on It",0.0,Neutral
2022-09-19,Peering Into Zoom Video Comms's Recent Short Interest,0.4588,Positive
2022-09-17,"Got $2,000? Here Are 2 Beaten-Down Growth Stocks to Buy Right Now",0.3818,Positive
2022-09-16,Time for Investors To Revisit the Pandemic Winners?,0.4767,Positive
2022-09-16,A Top Mid-Cap Manager Is Finding Tech Gems Amid the Downturn -- Barrons.com,0.2023,Positive
2022-09-15,Zoom Says It Has Fixed Service After Widespread Outage,0.0,Neutral
2022-09-15,UPDATE 1-Zoom says issue with joining meetings on its platform resolved,0.1779,Positive
2022-09-15,Zoom says 'investigating issues' after thousands of users report problems,-0.4019,Negative
2022-09-15,Zoom Says Resolved The Issue Causing Users To Be Unable To Start And Join Zoom Meetings,0.4404,Positive
2022-09-15,Zoom Says Aware Of Issues Currently Impacting Zoom; Engineering Team Is Investigating This Matter,0.0323,Neutral
2022-09-14,5 Stocks Cathie Wood Just Bought on the Dip,0.0,Neutral
2022-09-14,Cathie Wood shrugged off the hot CPI print and bought the dip across 18 different stocks,0.0,Neutral
2022-09-13,"Amid Wall Street Bloodbath, Cathie Wood Picks Up Over $16M Each In Roku And This Video Communications Stock",0.0,Neutral
2022-09-13,"Benzinga's Top Ratings Upgrades, Downgrades For September 13, 2022",0.2023,Positive
2022-09-13,Zoom Video Communications Initiated at Sector Weight by Keybanc,0.0,Neutral
2022-09-13,Keybanc Initiates Coverage On Zoom Video Comms with Sector Weight Rating,0.0,Neutral
2022-09-13,KeyBanc Resumes Zoom Video Communications at Sector Weight,0.0,Neutral
2022-09-12,"Zoom renames chat product, adds features in push to compete with Teams, Slack",0.0,Neutral
2022-09-10,Cathie Wood Has 18% of Her Money in These 3 Growth Stocks,0.3818,Positive
2022-09-08,3 Reasons Why You Should Take Another Look Into Buying Zoom Stock,0.0,Neutral
2022-09-08,"1 Growth Stock Set to Soar 1,828% From Its 52-Week Low, According to Cathie Wood",0.128,Positive
2022-09-07,"Zoom Video Communications, Inc. Citi 2022 Global Technology Conference Transcript >ZM",0.0,Neutral
2022-09-07,"Investors Heavily Search Zoom Video Communications, Inc. (ZM): Here is What You Need to Know",0.0,Neutral
2022-09-06,Splunk Appoints Jason Lee as Chief Information Security Officer,0.34,Positive
2022-09-06,Why Zoom Video Plunged by 22.6% in August,0.0,Neutral
2022-09-03,The Fed Chief Speaks; Wall Street Reacts,0.0,Neutral
2022-09-03,Are Zoom's Growth Days Really Over?,0.3818,Positive
2022-09-01,"Cathie Wood watched $803M exit from ARKK in August, marking the largest monthly outflow YTD",0.0,Neutral
2022-08-31,"Zoom Video Communications, Inc. (ZM) Management presents at Deutsche Bank 2022 Technology Conference (Transcript) >ZM",0.0,Neutral
2022-08-31,2 Founder-Led Growth Stocks With Serious Long-Term Potential,0.3182,Positive
2022-08-31,Motley Fool Co-Founder David Gardner on Investing During Tough Markets,-0.5267,Negative
2022-08-31,Shopify and Zoom Video Are Below Their Pre-Pandemic Prices. Does This Make Them a Buy?,0.0,Neutral
2022-08-31,Zoom's Business Has 1 Glaring Issue,0.0,Neutral
2022-08-30,"If You Invested $1,000 In The ARK Innovation ETF At Its COVID-19 Pandemic Low, Here's How Much You'd Have Now",0.128,Positive
2022-08-29,Cathie Wood And Ark Invest Still Bullish On Zoom After Earnings Report — Here's Why,0.0,Neutral
2022-08-28,"I Never Thought I'd Say This, but Zoom Is Starting to Look Like a Bargain",0.6652,Positive
2022-08-26,"Zoom Video 'Has Fallen to Earth,' Says Analyst. It Gets a Downgrade. -- Barrons.com",-0.3612,Negative
2022-08-26,"Zoom Video ‘Has Fallen to Earth,’ Says Analyst. It Gets a Downgrade.",-0.3612,Negative
2022-08-26,Zoom heads south as Argus says 'pandemic star has fallen to Earth',-0.3612,Negative
2022-08-26,"Benzinga's Top Ratings Upgrades, Downgrades For August 26, 2022",0.2023,Positive
2022-08-26,"Here is What to Know Beyond Why Zoom Video Communications, Inc. (ZM) is a Trending Stock",0.0,Neutral
2022-08-26,"Zoom Video Communications Stock Might Be Down, but Here Are 222 Million Reasons It's Not Out",0.0,Neutral
2022-08-26,Zoom Video Communications Cut to Hold From Buy by Argus Research,-0.2732,Negative
2022-08-26,Why Zoom Stock Fell Hard This Week,-0.1027,Negative
2022-08-26,Argus Research Downgrades Zoom Video Comms to Hold,0.0,Neutral
2022-08-26,Argus Downgrades Zoom Video Communications to Hold From Buy,0.0,Neutral
2022-08-25,11 Best Depressed Stocks To Invest In,0.2263,Positive
2022-08-25,Zoom Crashes: Time to buy the Dip With ETFs?,0.0,Neutral
2022-08-25,Is It Time to Sell Zoom Stock and Move On?,0.0,Neutral
2022-08-25,Zoom's Growth Rate Falls Below 10%: Time to Sell the Stock?,0.3818,Positive
2022-08-25,Cathie Wood Bought Zoom Stock on the Dip. Should You?,0.0,Neutral
2022-08-24,5 Best Websites To Research Stocks,0.6369,Positive
2022-08-24,Why Zoom Stock Zoomed Past the Market Today,0.0,Neutral
2022-08-24,Is Cathie Wood Losing Faith in Nvidia (NVDA) Stock?,0.0516,Positive
2022-08-24,"Top 15 Trending Stocks On WallStreetBets As Of Wednesday, August 24, 2022 (Via Swaggy Stocks)",0.2023,Positive
2022-08-24,Cathie Wood's Ark Buys The Dip in Zoom As Shares Crater -- WSJ,0.296,Positive
2022-08-24,Investor Optimism Decreases Further As Dow Tumbles 150 Points,0.5423,Positive
2022-08-24,Is Zoom Video Communications Stock a Buy Now?,0.0,Neutral
2022-08-24,MORNING BID-Hesitation on Fed tone,0.0,Neutral
2022-08-24,Why XPeng Shares Traded Lower By Around 11%; Here Are 77 Biggest Movers From Yesterday,0.0,Neutral
2022-08-24,"Cathie Wood's ARK Buys Zoom After the Stock Plunges, Sells Nvidia Ahead of Earnings -- Barrons.com",0.0,Neutral
2022-08-24,Volatility In Markets Increases Further After US Private-Sector Business Activity Contracts Again,0.0,Neutral
2022-08-24,Confounding Trade? Cathie Wood Dumps $50M In Nvidia Shares Just 2 Weeks After Major Buy And A Day Ahead Of Earnings,-0.128,Negative
2022-08-24,Cathie Wood Buys Zoom’s Dip to Pre-Pandemic Level After Results,0.0,Neutral
2022-08-23,"Zoom Had Disappointing Quarter, Faces Transition Year: Here's Why Some Analysts Are Cutting Price Targets",-0.5719,Negative
2022-08-23,US STOCKS-Wall Street ends down as investors eye slowing economy,0.0,Neutral
2022-08-23,"Why did Zoom stock tank today? Weak Q2, guidance hits software maker",-0.4404,Negative
2022-08-23,Zoom Video Stock Falls Hard. What Wall Street Is Saying. -- Barrons.com,-0.1027,Negative
2022-08-23,US STOCKS-S&P 500 ends down as investors eye slowing economy,0.0,Neutral
2022-08-23,Correction to Zoom Market Talk,0.0,Neutral
2022-08-23,US STOCKS-Wall Street dips as investors eye slowing economy,0.0,Neutral
2022-08-23,Trending: Zoom Video Cuts FY23 View,-0.296,Negative
2022-08-23,11 Information Technology Stocks Moving In Tuesday's Intraday Session,0.0,Neutral
2022-08-23,Jim Chanos Earlier Says He Has Been Short On Zoom,0.0,Neutral
2022-08-23,"Top 15 Trending Stocks On WallStreetBets As Of Tuesday, August 23, 2022 (Via Swaggy Stocks)",0.2023,Positive
2022-08-23,"BRIEF-Short Seller Chanos Says He Is Short On Zoom, AMC Common Shares; Long On AMC Preferred Shares - CNBC",0.5267,Positive
2022-08-23,Zoom's Phone Service Was Standout of Tough 2Q -- Market Talk,-0.128,Negative
2022-08-23,"Twitter, Zoom Video And Some Other Big Stocks Moving Lower On Tuesday",-0.296,Negative
2022-08-23,US STOCKS-Nasdaq ticks up on hopes of less aggressive rate hikes after weak PMI data,-0.1045,Negative
2022-08-23,"Zoom Video Communications Down Nearly 15%, on Track for Lowest Close Since January 2020 -- Data Talk",-0.3818,Negative
2022-08-23,"Why Windtree Therapeutics Is Trading Higher By Over 60%, Here Are 61 Stocks Moving In Tuesday's Mid-Day Session",0.0,Neutral
2022-08-23,Zoom Video Communications Shares Drop 15%; Analysts Respond to Lowered FY Outlook,-0.1027,Negative
2022-08-23,Mizuho Maintains Buy Rating for Zoom Video Comms: Here's What You Need To Know,0.0,Neutral
2022-08-23,MKM Partners Maintains Buy Rating for Zoom Video Comms: Here's What You Need To Know,0.0,Neutral
2022-08-23,Zoom Video Stock Is Plummeting. Citi Says the Lowered Guidance Might Still Be 'Too Optimistic.' -- Barrons.com,0.2023,Positive
2022-08-23,Why Zoom Video Communications Stock Got Crushed Tuesday Morning,-0.4215,Negative
2022-08-23,Zoom Stock Falls 8% on Earnings and Sales Guidance Cuts,-0.296,Negative
2022-08-23,"US STOCKS-S&P 500, Nasdaq rise as growth stocks bounce",0.3818,Positive
2022-08-23,Why Is Aerie Pharmaceuticals (AERI) Stock Up 35% Today?,0.0,Neutral
2022-08-23,Our Earnings Analysis Indicates that Zoom (NASDAQ:ZM) Investors may be Waiting for Some Time for a Recovery,0.0,Neutral
2022-08-23,"Benzinga's Top Ratings Upgrades, Downgrades For August 23, 2022",0.2023,Positive
2022-08-23,"Pfizer and BioNTech say data shows COVID vaccine has more than 70% efficacy in small children, and cases now rising in just 7 states",0.0,Neutral
2022-08-23,Zoom (ZM) Stock Plunges 10% as Q2 Revenue Disappoints,-0.3818,Negative
2022-08-23,Zoom Earnings: Is Cathie Wood's Bet Still on Track,0.0,Neutral
2022-08-23,16 Analysts Have This to Say About Zoom Video Comms,0.0,Neutral
2022-08-23,Zoom Video Communications Is Maintained at Buy by MKM Partners,0.0,Neutral
2022-08-23,Zoom Video Communications Price Target Cut to $125.00/Share From $135.00 by MKM Partners,-0.2732,Negative
2022-08-23,"MKM Partners Maintains Buy on Zoom Video Comms, Lowers Price Target to $125",-0.128,Negative
2022-08-23,"Benzinga Pro's Top 5 Stocks To Watch For Tuesday, Aug. 23, 2022: CRM, RRC, BAM, BLNK, MOB",0.2023,Positive
2022-08-23,US STOCKS-Wall St set for subdued open ahead of business activity data,0.0,Neutral
2022-08-23,Zoom stock sinks after ‘one of the worst quarters’ since IPO,-0.6249,Negative
2022-08-23,Zoom Video Communications Price Target Cut to $90.00/Share From $120.00 by Stifel,-0.2732,Negative
2022-08-23,Zoom Video Communications Is Maintained at Hold by Stifel,0.0,Neutral
2022-08-23,Zoom Video Communications Price Target Cut to $95.00/Share From $105.00 by Deutsche Bank,-0.2732,Negative
2022-08-23,"Stifel Maintains Hold on Zoom Video Comms, Lowers Price Target to $90",-0.128,Negative
2022-08-23,"Deutsche Bank Maintains Hold on Zoom Video Comms, Lowers Price Target to $95",-0.128,Negative
2022-08-23,"Hot Stocks: M and JD jump on earnings, MRIN rises on SNAP integration, while ZM sinks more than 10%",0.0,Neutral
2022-08-23,Zoom Video Communications Is Maintained at Outperform by Baird,0.0,Neutral
2022-08-23,Zoom Video Communications Price Target Cut to $125.00/Share From $140.00 by Baird,-0.2732,Negative
2022-08-23,"Booking Holdings To $2,300? Here Are 5 Other Price Target Changes For Tuesday",0.0,Neutral
2022-08-23,Zoom Video Communications Is Maintained at Overweight by Morgan Stanley,-0.3612,Negative
2022-08-23,Zoom Video Communications Price Target Cut to $130.00/Share From $140.00 by Morgan Stanley,-0.2732,Negative
2022-08-23,Why Zoom Video Stock Is Falling Today,-0.1531,Negative
2022-08-23,"Zoom plunges 11% as analysts fret over slowing growth, BTIG downgrades",0.3818,Positive
2022-08-23,"Baird Maintains Outperform on Zoom Video Comms, Lowers Price Target to $125",-0.128,Negative
2022-08-23,"Morgan Stanley Maintains Overweight on Zoom Video Comms, Lowers Price Target to $130",-0.4588,Negative
2022-08-23,"Zoom Video Faces Price Target Cuts After Downbeat Sales, Shares Tumble",0.0,Neutral
2022-08-23,"Zoom Video, Palo Alto Networks, Macy’s, and More Stock Market Movers Tuesday",0.0,Neutral
2022-08-23,Zoom Video Communications Price Target Cut to $118.00/Share From $128.00 by Benchmark,-0.2732,Negative
2022-08-23,Zoom Video Communications Is Maintained at Buy by Benchmark,0.0,Neutral
2022-08-23,"Benchmark Maintains Buy on Zoom Video Comms, Lowers Price Target to $118",-0.128,Negative
2022-08-23,Zoom Video Communications Price Target Cut to $120.00/Share From $190.00 by Mizuho,-0.2732,Negative
2022-08-23,Why Zoom Video Is Trading Lower By 11%; Here Are 28 Stocks Moving Premarket,-0.296,Negative
2022-08-23,"Mizuho Maintains Buy on Zoom Video Comms, Lowers Price Target to $120",-0.128,Negative
2022-08-23,Zoom Video Communications Price Target Cut to $95.00/Share From $105.00 by Wells Fargo,-0.0258,Neutral
2022-08-23,Zoom Video Communications Price Target Cut to $122.00/Share From $142.00 by Goldman Sachs,-0.2732,Negative
2022-08-23,"Premarket Movers: Axon Enterprise, Zoom Video Comms, Palo Alto Networks",0.0,Neutral
2022-08-23,Zoom Video Communications Is Maintained at Outperform by RBC Capital,0.0,Neutral
2022-08-23,Zoom Video Communications Price Target Cut to $130.00/Share From $150.00 by RBC Capital,-0.2732,Negative
2022-08-23,"Wells Fargo Maintains Equal-Weight on Zoom Video Comms, Lowers Price Target to $95",0.128,Positive
2022-08-23,"Goldman Sachs Maintains Neutral on Zoom Video Comms, Lowers Price Target to $122",-0.128,Negative
2022-08-23,"RBC Capital Maintains Outperform on Zoom Video Comms, Lowers Price Target to $130",-0.128,Negative
2022-08-23,US STOCKS-Futures edge up ahead of business activity data,0.0,Neutral
2022-08-23,Zoom Can’t Escape Its Own Shadow,0.1779,Positive
2022-08-23,Zoom Can't Escape Its Own Shadow -- Heard on the Street -- WSJ,-0.1326,Negative
2022-08-23,Zoom Video Communications Price Target Cut to $91.00/Share From $115.00 by Piper Sandler,-0.2732,Negative
2022-08-23,"Piper Sandler Maintains Neutral on Zoom Video Comms, Lowers Price Target to $91",-0.128,Negative
2022-08-23,Zoom Video Communications Price Target Cut to $76.00/Share From $91.00 by Citigroup,-0.2732,Negative
2022-08-23,Zoom Video Communications Cut to Neutral From Buy by BTIG,-0.2732,Negative
2022-08-23,"Citigroup Maintains Sell on Zoom Video Comms, Lowers Price Target to $76",-0.128,Negative
2022-08-23,BTIG Downgrades Zoom Video Comms to Neutral,0.0,Neutral
