date,news_headline,sentiment_score,sentiment_label
2020-09-03,"A 16-year-old student was arrested Thursday for allegedly bringing down Miami-Dade County Public Schools’ (M-DCPS) virtual learning platform, which had been down for several days. According to the M-DCPS, district detectives traced the IP address responsible for the attacks to the student, who is a junior",-0.5719,Negative
2020-09-03,"You'd think, by now, investors would stop warning about a stock market crash.You'd think, by now, investors would stop talking about valuations.Of course, at some point, the market's going to go down - maybe by a lot and, possibly, for a prolonged period of time.When it does, it won't be because of valuations. This isn't 1999-2000.If you're properly prepared, a stock market crash will do nothing but good for your portfolio.",-0.7513,Negative
2020-09-03,"High p/e ratios, glamour stocks, a new normal: today's market boom echoes the Nifty Fifty phase of the early 1970s.Most Nifty Fifty companies survived and showed some positive return - but less than the broad-based S&P.Key lessons include the correlation between lower p/e ratios and long-term returns for most of the stocks.",0.6757,Positive
2020-09-03,Zoom Video Communications (NASDAQ: ZM) shares are trading lower on Thursday as the stock continues to see some profit-taking after gaining over 40% following the company's earnings repo,0.4215,Positive
2020-09-03,Almost eight months after French luxury goods giant LVMH Moet Hennessy Louis Vuitton SA (OTC: LVMH) and U.S.,0.0,Neutral
2020-09-03,"There's an annoying voice in the back of my head that the fun-loving technology Samaritans can't help me override.Aren't we in a bubble, I sheepishly ask as they patiently listen.Tomorrow they may be down, but that's then. I'm at the party now; long live the tech stock party.",0.6829,Positive
2020-09-03,Zoom Video surged 41% following a strong FQ2 beat.The video conferencing company has already seen a peak in new customer additions.The stock now trades above some 2000 internet bubble valuation multiples.The company guidance for 4% sequential revenue growth doesn't match with a stock trading at nearly 60x a $2.38 billion revenue target.,0.7096,Positive
2020-09-02,"The pandemic has caused a massive rally among anti-office stocks while office REITs are being severely punished.Without a doubt, COVID-19 is an accelerator of the work-from-home trend - however, it is not an exterminator of traditional offices.For now, ZM's share price reflects maximum optimism while BXP's share price reflects maximum pessimism.",-0.0258,Neutral
2020-09-02,"A handful of tech megacaps have been the symbol of the market rally off the March lows. Amazon or Facebook now sport valuations of close to $1T or more, and",-0.0258,Neutral
2020-09-02,"On CNBC's ""Fast Money Halftime Report,"" Joe Terranova said that Lululemon Athletica Inc (NASDAQ: LULU) has plenty of room to the upside. He owns the stock and he is staying with it.",0.0,Neutral
2020-09-02,"ZM soared over 35% following the release of undeniably strong earnings, but the underlying valuation looks unsustainable.Revenue for 2H is only expected to be marginally better than Q2, so ZM is facing decelerating revenue on a QoQ basis.Customer mix shifted more in favor of small customers who are billing monthly instead of annually and likely to contribute to higher churn rates.Net margin forecast at ~31% for FY21 is likely to be unsustainable as ZM scales costs and operations to meet demand.Even with net margin at ~31%, shares are still trading at a high forward P/E premium, but a more reasonable 26% or 17% net margin has a more dire outlook.",0.7838,Positive
2020-09-02,"(Bloomberg) -- The best route to success has been simple in stocks of late. If an analyst raises a price target, you buy.Of 17 so-called equity factors -- traits and qualities by which stocks can be categorized for investment purposes -- the one that groups companies according to the biggest analyst",0.836,Positive
2020-09-02,"Between Monday and Tuesday, Zoom Video Communications (NASDAQ: ZM) went from breaking a $300 closing record to ending above  the$400. This happened after the company significantly raised its fiscal-year guidance as it far exceeded analyst estimates in its latest quarterly earnings report.",0.0,Neutral
2020-09-02,Earnings expectations are big for DocuSign Inc. (NASDAQ: DOCU) and CrowdStrike Holdings Inc. (NASDAQ: CRWD) after Zoom Video Communications (NASDAQ:,0.0,Neutral
2020-09-02,"Investors will try and sustain the momentum from August, and the first trading day of September.",0.0,Neutral
2020-09-02,Add the Direxion Work From Home ETF (NYSE: WFH) to the list of rookie thematic exchange-traded funds that are excelling right out of the gates.,0.5423,Positive
2020-09-02,Tesla looks crazy overvalued judging by this one new metric.,-0.34,Negative
2020-09-02,"Zoom has reported blown-out results for the second quarter, almost redefining the term blow-out.Operating momentum surprised management, and is simply very strong, both on the top and bottom line.These great results (note that sales will come in at roughly 2.5 times the original revenue forecast) have gone hand-in-hand with increased sales multiples.Shorting is very dangerous in this market, especially with unlimited downside, yet this is a very risky proposition here.",0.7931,Positive
2020-09-02,"The major market indexes keep going up, but the notion that the stock market might be too frothy for its own good continues to be downplayed.",0.5927,Positive
2020-09-02,"(Bloomberg Opinion) -- In the early days of 2009 following the Great Financial Crisis, I received an extremely silly email from a booker for a television program who asked: “What single letter would you use to predict the recovery?”My response noted there were 26 letters that humans could use to form",0.101,Positive
2020-09-02,"Zoom Video Communications Inc. (NASDAQ: ZM) CEO Eric Yuan added $6.6 billion to his net worth Tuesday, according to the Bloomberg Billionaires Index.",0.2263,Positive
2020-09-01,Australia First Recession Since 1991; Plasma Doubt: Virus Update,-0.6486,Negative
2020-09-01,One-Third of Li Ka-shing’s Wealth Is an $11 Billion Zoom Stake,0.4939,Positive
2020-09-01,Zoom had numbers not seen in most public companies.I think there's still big upside.Many say it's too expensive but that depends on your earnings number. I'll walk you through why it's probably not expensive.Many people doubted our big Tesla price targets the last couple of years all based on earnings targets. Those price targets came to fruition. Zoom has that same ability.,0.6829,Positive
2020-09-01,FAANGs Make It Difficult to Eat a Balanced Diet,-0.3612,Negative
2020-09-01,"Docusign Inc (NASDAQ: DOCU) shares are trading higher on Tuesday in sympathy with Zoom Video Communications (NASDAQ: ZM), which reported strong quarterly results. Docusign is set to report earnings on Thursday.",0.7906,Positive
2020-09-01,"Zoom Video Communications Inc, the company whose online meeting services have become a regular part of life in the United States during the coronavirus pandemic, has hired longtime Silicon Valley lawyer Jeff True as its general counsel.",0.6808,Positive
2020-09-01,"Toward the end of trading Tuesday, the Dow traded up 0.37% to 28534.69 while the NASDAQ rose 1.13% to 11908.25. The S&amp;P also rose, gaining 0.43% to 3515.27.",0.4215,Positive
2020-09-01,"Wall Street climbed on Tuesday as gains in Apple and Zoom Video shares propelled the tech-heavy Nasdaq to record highs, while better-than-expected U.S. manufacturing sector data fueled optimism around a post-pandemic economic recovery.",0.7964,Positive
2020-09-01,"Gainers: Zoom Video Communications (ZM) +38%, Gogo (GOGO) +26%, At Home Group (HOME) +19%, Kaleyra (KLR) +16%, Build-A-Bear Workshop (BBW) +16%.Losers: XpresSpa Group (XSPA) -14%, CarParts.com (PRTS) -11%, Allied Esports Entertainment (AESE) -9%, G. Willi-Food International (WILC) -9%, AutoWeb",0.4215,Positive
2020-09-01,"Midway through trading Tuesday, the Dow traded up 0.25% to 28500.89 while the NASDAQ rose 0.92% to 11883.39. The S&amp;P also rose, gaining 0.30% to 3510.98.",0.4215,Positive
2020-09-01,Zoom CFO Says Video Communication Is Here to Stay,0.0,Neutral
2020-09-01,"Following the market opening Tuesday, the Dow traded up 0.07% to 28449.38 while the NASDAQ rose 0.90% to 11881.94. The S&amp;P also rose, gaining 0.24% to 3508.68.",0.4215,Positive
2020-09-01,Bank of America analyst Nikolay Beliov reiterates Zoom Video Communications (NASDAQ:ZM) with a Buy and raises the price target from $260 to $475.,0.0,Neutral
2020-09-01,Eastman Kodak (KODK) +44% on D.E.Shaw stake.Priority Technology Holdings (PRTH) +30% as MRI Software to acquire RentPayment business from Priority Technology.Zoom Video Communications (ZM) +31% on Q2 results.Gogo (GOGO) +26% on sale of commercial,0.0,Neutral
2020-09-01,"Fear-mongering articles have led to a lot of investment biases that affect the REIT sector.No, tech is not killing REITs. Balance sheets are stronger than you may think. And rent collection rate are near 100% for most property sectors.Bought at a discounted price, high-quality real estate always has been a great investment. Be greedy when others are fearful.",0.711,Positive
2020-09-01,Morgan Stanley analyst Meta Marshall maintains Zoom Video Communications (NASDAQ:ZM) with a Equal-Weight and raises the price target from $240 to $350.,0.0,Neutral
2020-09-01,"Today&#39;s 5 Stock Ideas:  Tesla (TSLA) - After Tesla shares closed up 12.5% on Monday, shares continued another 5% higher Tuesday morning. Mid-morning news of a $5 billion equity distribution deal caused",0.5267,Positive
2020-09-01,"After yesterday's stellar Q2 report, BofA reiterates a Buy rating on Zoom Video (ZM) and raises the price objective from $260 to $475. Zoom shares are up 30% pre-market to $422.50.The",0.296,Positive
2020-09-01,"Listen on the go! A daily podcast of Wall Street Breakfast will be available by 8:00 a.m. on Seeking Alpha, iTunes, Stitcher and Spotify. Stock split maniaShares of Tesla (NASDAQ:TSLA) are up another 7.5% to $533 premarket, adding to the 12.5% rally seen yesterday after the company split its stock 5-for-1. Apple (NASDAQ:AAPL) shares are meanwhile ahead by 2.6% to $132 in early trade, following their 3.4% advance on Monday (the two stocks are up 34% and 81%, respectively, since announcing the splits just a month ago). In fact, the high trading volumes of the ""Retail Bros."" appear to be",0.5983,Positive
2020-09-01,"Zoom Video Communications reported its Q2 earnings which exceeded expectations on stronger than expected growth and a firming profit.The company is seeing impressive momentum from global user adoption and enterprise scale customers utilizing the platform.The challenge for the company will be to maintain the growth dynamics in a scenario where traditional meeting environments return to normal over the next year as the pandemic is contained.Recognizing the positive trends and company strengths, the stock's pricey valuation and extreme market enthusiasm keep us on the sidelines with much of the near-term upside likely already priced in.",0.9682,Positive
2020-09-01,Goldman Sachs analyst Heather Bellini upgrades Zoom Video Communications (NASDAQ:ZM) from Sell to Neutral and raises the price target from $187 to $402.,-0.6249,Negative
2020-09-01,Some of the stocks that may grab investor focus today are:,0.0,Neutral
2020-09-01,Zoom Growth Booms With 355% Revenue Gain in Second Quarter,0.7184,Positive
2020-08-31,"The following slide deck was published by Zoom Video Communications, Inc. in conjunction with their 2021 Q2 earnings call.",0.0,Neutral
2020-08-31,Zoom Video Communications Inc raised its annual revenue forecast by more than 30% after comfortably beating quarterly estimates on Monday as it converts more of its huge free user base to paid subscriptions.,0.6872,Positive
2020-08-31,Gainers: [[KODK]] +37.6%. [[GOGO]] +16.7%. [[ZM]] +10.1%. [[PFBI]] +7.6%. [[MYOK]] +7.3%.Losers: [[SCSC]] -10.3%. [[EYE]] -9.4%. [[WDC]] -7.8%. [[RXT]] -7.7%. [[GNMK]] -7.5%.,0.0,Neutral
2020-08-31,"The video-conferencing upstart had a breakout moment amid Covid-19 lockdowns, but that may be just the start.",0.0,Neutral
2020-08-31,"Zoom Video Communications (ZM) is up 7.2% after easily outpacing consensus with its Q2 earnings, as ongoing pandemic-driven business led to revenues that quadrupled from the prior year and sharply",0.34,Positive
2020-08-31,Zoom Video Communications Inc beat second-quarter revenue estimates on Monday as it benefited from efforts to convert more of the huge work-from-home user base it has gained in the coronavirus crisis into paying customers.,0.0164,Neutral
2020-08-31,Zoom Video Communications (ZM): Q2 Non-GAAP EPS of $0.92 beats by $0.47; GAAP EPS of $0.63 beats by $0.26.Revenue of $663.5M (+355.0% Y/Y) beats by $163.13M.988 customers contributing more than,0.0,Neutral
2020-08-31,"Last Week The VIX closed Friday at 22.96, up slightly on the week but still near the lowest levels since the spring. Last week&#39;s expected move in SPY +/- 1.2% Last week’s actual move SPY: +3.3% This Week",-0.5267,Negative
2020-08-31,"As the Dow Jones Industrial Average is set to trade with three new components, one of its original components is taking a hit from Wall Street.The Dow will trade with",0.3182,Positive
2020-08-31,"Listen on the go! A daily podcast of Wall Street Breakfast will be available by 8:00 a.m. on Seeking Alpha, iTunes, Stitcher and Spotify. High profile stock splitsExcitement is percolating around two of the market's favorite stocks as Apple (NASDAQ:AAPL) begins trading today (at $125/share) following a 4-for-1 split, while Tesla (NASDAQ:TSLA) starts trading (at $443/share) on a 5-for-1 split-adjusted basis. While the market caps of the companies will remain the same, some are saying the moves will make shares ""more accessible to a broader base of investors"" and therefore a new catalyst for the ""Retail Bros."" Others say it",0.6696,Positive
2020-08-31,Some of the stocks that may grab investor focus today are:,0.0,Neutral
2020-08-30,"[[ZM]]For Seeking Alpha's full earnings season calendar, click here.",0.0,Neutral
2020-08-30,"Zoom Video Communications (NASDAQ:ZM) is scheduled to announce Q2 earnings results on Monday, August 31st, after market close.The consensus EPS Estimate is $0.45 (+462.5% Y/Y) and the consensus Revenue Estimate",0.0,Neutral
2020-08-29,"Deep thought of the day: There's a big difference between trying to time the market versus investing using fundamental analysis. Or is there?I don't know why people keep saying that this market rally is thin.Even Ben Graham says: “Sound procedure would call for reducing the common-stock component below 50%.""",0.0,Neutral
2020-08-29,We're becoming increasingly selective as we head into the fall.Some sectors have become overpriced while others remain very opportunistic.Net lease REITs are set to richly reward investors and we are buying many of them.,0.765,Positive
2020-08-28,"TikTok has to be sold to an American company in view of data protection issues and the executive order by the US President.There are a handful of contenders interested in the acquisition, including Oracle and Microsoft.Oracle's interest makes sense in terms of the rewards being more than the risks, including financial ones.Its executives have made an offer of $20 billion to ByteDance.TikTok is a buy for Oracle in terms of the value it will bring.",0.8332,Positive
2020-08-27,"Almost every major business segment of Amazon benefited during the lockdown, be it retail, AWS, Prime video, etc., and to an extent, the same can be said for Google after the global economy opens up.Search-based advertising continues to dominate and Google can't fly without improvement in search, which is dependent upon opening up of the broader economy and high revenue contributing categories like travel in particular.If Amazon's AWS was the leader in taking backend to the Cloud, Google Cloud has the opportunity to take the front-end to the Cloud given how ubiquitous the company's product offerings are to a common user.",0.7646,Positive
2020-08-26,"(Bloomberg) -- Wall Street investors are coming around to the idea that whether the pandemic fades soon or the stay-at-home economy persists, either way Netflix Inc. is poised to gain.Shares of the video streaming company surged the most in two years Wednesday, helping lift the Invesco Dynamic Media",0.7003,Positive
2020-08-25,Apple Inc. (NASDAQ: AAPL) has quietly been working on pushing into the virtual reality and augmented space for years.,0.0,Neutral
2020-08-25,"Markets are at records despite the Covid crisis, and tech in particular is an investor darling. And those conditions may be creating a sweet spot for a slew of new",0.9061,Positive
2020-08-25,"Zoom Video Communications shares are trading higher, potentially as college and high school classes begin in the United States, with several schools opting for virtual learning and utilizing the company's platform.",0.6124,Positive
2020-08-24,"A Zoom Video Communications Inc. outage Monday ground some work meetings and online learning to a halt on the first day of class for many U.S. students, highlighting the vulnerabilities of virtual school during the coronavirus pandemic.",-0.1531,Negative
2020-08-24,Video-conferencing company Zoom Video Communications Inc said on Monday it had restored service to its U.S. users after a partial outage left many unable to log in to work meetings or attend school classes remotely.,0.34,Positive
2020-08-24,Zoom Video Communications shares are trading lower on outages in its platform and slowing US coronavirus cases as well as treatment optimism after the FDA issued Emergency Use Authorization for convalescent plasma and on reports Trump may fast track AstraZeneca's vaccine. NOTE: Zoom has been a beneficiary of the pandemic.,0.7269,Positive
2020-08-24,"Zoom Video Communications Inc is investigating reports about users facing issues while running and accessing web meetings, the company said on Monday.",0.0,Neutral
2020-08-24,"In March, the coronavirus hit the global economy like a freight train.",0.3612,Positive
2020-08-24,Zoom Shares Move Lower; Hearing Video Conferencing Platform Crashing For Users 'Worldwide',0.0,Neutral
2020-08-21,"On CNBC&#39;s &#34;Trading Nation,&#34; Todd Gordon of Ascent Wealth Partners suggested investors should consider a bullish options trade in Zoom Video Communications Inc (NASDAQ:",0.4939,Positive
2020-08-20,"Work-from-home tech and cloud computing stocks are rising, benefiting from money flowing into familiar lockdown winners with a lack of leadership in other sectors.Fastly ([[FSLY]], +11.5%) is leading cloud names. The",0.2023,Positive
2020-08-19,"Zoom Video ([[ZM]] -0.6%) touts Zoom from Home as ""a new category of software experiences"" tailored around remote work. Home is now coming to Amazon's Echo Show, Facebook's Portal, and",-0.0258,Neutral
2020-08-19,"Slack isn't just an instant messaging platform, it's a baseline collaboration tool that integrates deeply within employee workflows.Slack should be able to stand its ground despite competition from Microsoft Teams; network effects, integrations, and cross-organization channels are driving its long-term moat and pricing power.COVID-19 has led to a surge in customer growth and accelerated adoption; sales growth and retention rates are on an impressive trajectory.Investors should focus on market capture and exercise patience for FCF margin expansion; Slack is foregoing profits and heavily investing in its future.At a Fwd EV/S of 16.3x, there's significant upside potential. WORK is a Buy in my opinion.",0.9042,Positive
2020-08-18,"Zoom Video Communications shares are trading higher after RBC maintained an Outperform rating on the stock and raised its price target from $250 to $300, calling the company a 'work from home beneficiary.'",0.6486,Positive
2020-08-18,"ZM has had a large move since I discussed it at the beginning of April. With security issues no longer in the headlines, ZM may be able to build on its rocket ship trajectory of the shutdown period. The company is risky, given all the competition and uncertainties, and so is the stock, and investors should think carefully about this stock. My view remains as it was in April, that ZM's opportunity to participate in a reshaping of the economy and society at large and suggests good revenue growth ahead. Also, ZM has already shown how many eyeballs it can attract, and its potential for monetize them gradually over time may justify a higher stock price.",0.8074,Positive
2020-08-18,RBC Capital analyst Alex Zukin maintains Zoom Video Communications (NASDAQ:ZM) with a Outperform and raises the price target from $250 to $300.,0.0,Neutral
2020-08-18,"Ahead of the Q2 report on August 31, RBC raises Zoom Video's (ZM) price target from $250 to $300. Zoom shares are up 1.8% pre-market to $271.Analyst Alex Zukin says",0.296,Positive
2020-08-18,"Zoom Opens New Data Center, Plans to Add More Jobs in Singapore",0.0,Neutral
2020-08-17,"The Zacks Analyst Blog Highlights: NVIDIA, Zoom Video, Amazon, Advanced Micro Devices and Intel",0.4019,Positive
2020-08-17,"Zoom Video Communications shares are trading higher after KeyBanc issued a note saying internal data shows Zoom's billings are ""up 32% q/q in its F2Q21 vs. consensus down 15%.""",0.296,Positive
2020-08-17,"KeyBanc analyst Alex Kurtz cites internal data that shows Zoom Video's (ZM) billings are ""up 32% q/q in its F2Q21 vs. consensus down 15%.""Kurtz says the data shows a continuing",0.0,Neutral
2020-08-17,"SAN JOSE, Calif., Aug. 17, 2020 (GLOBE NEWSWIRE) -- Zoom Video Communications, Inc. (NASDAQ:ZM) today announced general availability of its Zoom Phone cloud phone service in 25 additional countries and",0.0,Neutral
2020-08-16,"On August 14th, institutional investment managers with more than $100 million AUM disclosed their positions at the end of Q2 2020.Several stocks stand out when we look at the form 13F of some of the best-performing hedge funds.Focusing on the very best ideas, I reviewed which stocks appear the most in the top five holdings of the best hedge funds at the end of June.Several common themes appear when you look at what the top portfolio managers have been buying during the second quarter of the year.",0.911,Positive
2020-08-16,"Interesting portfolio changes disclosed by Coatue Management in Q2 qtr, Fund reports total value of $11.37B.Notable buy includes Beoing (BA) 2.75M shares, DocuDign (DOCU), DexCom (DXCM) and Inovio Pharmaceuticals (INO).Huge position built includes",0.7645,Positive
2020-08-14,"Brazilian-US investment fund, 3G Capital's portfolio value stands at ~$47M as of 30th June.The filing shows notable new positions in Fastly (FSLY), Pinduoduo (PDD), Square (SQ) and Zoom (ZM), while the fund",0.34,Positive
2020-08-14,"I'm a rookie investor who stumbled fully invested into COVID-19. Portfolio consisting of growth stocks, created in December: discussing the investment ideas and returns.This overview might provide some insight, inspiration or just one example about what goes into creating a portfolio.The portfolio includes DOCU, WORK, PINS, IIPR, LK and more. I missed out on Tesla, Livongo, Zoom and Beyond Meat.Return on investment of 60% altogether (excluding LK), in just six months despite COVID-19.",0.7732,Positive
2020-08-13,Shares of several technology companies are trading higher as the sector rebounds from this week's selloff and as coronavirus uncertainty continues to boost 'stay-at-home' names.,0.3612,Positive
2020-08-12,"Shares of several technology companies are trading higher, rebounding from Tuesday's selloff. The sector has performed well amid the coronavirus pandemic and has been volatile recently due to profit taking, sector rotation and vaccine optimism.",0.8658,Positive
2020-08-11,Zoom Video Communications Inc is facing a new lawsuit claiming it misled users about the data security protections for communications on its video platform.,0.128,Positive
2020-08-11,Zoom Video Communications shares are trading lower after Salesforce sold its stake in the company. Weakness also related to overall rotation out of technology names this week.,-0.4215,Negative
2020-08-10,"Shares of several technology companies are trading lower, potentially amid profit taking following the sector's recent run. Seeing possible rotation into other sectors for the session amid market volatility after Trump signed orders extending coronavirus relief measures.",0.7184,Positive
2020-08-10,"During the last two weeks, the market danced to the tune of earnings of Big Tech and tech in general. Although, we&#39;re in for a breather this week with a light earnings schedule. Hopefully, the optimism that the previous two weeks brought will be maintained",0.7351,Positive
2020-08-10,Levi's CEO Chip Bergh weighs in on the future of denim amid the coronavirus outbreak.,0.0,Neutral
2020-08-07,Hostess CEO Andy Callahan chats with Yahoo Finance about what the Twinkie maker has been up to during the COVID-19 pandemic.,0.0,Neutral
2020-08-05,Zoom Video Communications shares are trading higher. Strength potentially related to increased usage of video communications platforms as some colleges plan on utilizing online classroom platforms in the fall.,0.7579,Positive
2020-08-03,"Zoom shares are trading higher. The company said it will no longer be selling new or upgraded products in mainland China, potentially alleviating some regulatory concerns. Strength also potentially related to increased usage of video communications platforms as some colleges plan on utilizing online classroom platforms in the fall.",0.6486,Positive
2020-08-03,"Zoom Halts Direct Sales in China, Will Rely on Local Partners",0.0,Neutral
2020-07-30,Zoom Video Communications (NASDAQ: ZM) shares are trading lower on Thursday following reports indicating two U.S.,0.0,Neutral
