date,news_headline,sentiment_score,sentiment_label
2021-10-22,"DJ Snap, Intel, Mattel, American Express: What to Watch When the Stock Market Opens Today",0.0,Neutral
2021-10-22,Bear of the Day: PagerDuty (PD),0.0,Neutral
2021-10-21,What to Expect Ahead of Microsoft (MSFT) Q1 Earnings Release?,0.0,Neutral
2021-10-21,"Thinking About Buying Stock In Zoom, Verizon Or Las Vegas Sands?",0.0,Neutral
2021-10-21,Why Planet Fitness Was a Top Performer Over the Last Five Years,0.4404,Positive
2021-10-21,2 Unstoppable Stocks to Buy and Hold for Decades,-0.2023,Negative
2021-10-21,10 Tech Stock Picks of Seth Wunder’s Black-And-White Capital,0.0,Neutral
2021-10-21,"After the Scrapped Five9 Acquisition, Zoom Is Still Going After Cloud Contact Centers",0.0,Neutral
2021-10-21,"Even in the ‘New Normal’, Zoom Video Stock Looks Like a Buy Under $275",0.3612,Positive
2021-10-21,DJ Zoom Video Communications Price Target Announced at $270.00/Share by Barclays,0.0,Neutral
2021-10-21,DJ Zoom Video Communications Initiated at Equal-Weight by Barclays,0.0,Neutral
2021-10-21,"Barclays Initiates Coverage On Zoom Video Communications with Equal-Weight Rating, Announces Price Target of $270",0.0,Neutral
2021-10-20,7 Growth Stocks to Buy Before They Come Roaring Back ,0.3818,Positive
2021-10-20,"Enterprise Software, Video Software, and More",0.0,Neutral
2021-10-20,Investing in Renewable Energy,0.2732,Positive
2021-10-19,Zoom Has Growth Ahead and Durable Advantage So Buy Up,0.5574,Positive
2021-10-19,DJ Zoom Invests in Video Conferencing System Dten,0.0,Neutral
2021-10-19,DTEN Announces Investment By Zoom,0.0,Neutral
2021-10-19,‘It’s all about improving life here on Earth’—this is astronaut Nicole Stott’s second act,0.4215,Positive
2021-10-18,Rentberry Offering Flexible Living Concept in Cities Around the World,0.2263,Positive
2021-10-18,3 Top Stocks to Buy if There Is a Market Pullback,0.2023,Positive
2021-10-18,Why Zoom Shouldn't Fear a Growth Slump,0.1139,Positive
2021-10-18,"Markets Bounce Back on S&P 500, Nasdaq",0.0,Neutral
2021-10-15,DJ Tech Earnings Will Be Dominated by Shortage Talk. Investors Beware. -- Barrons.com,-0.25,Negative
2021-10-15,"DJ LinkedIn Social Network Is Leaving China, but Microsoft Remains",0.0,Neutral
2021-10-15,Chief Executive Officer Of Zoom Video Communications Trades $25M In Company Stock,0.0,Neutral
2021-10-15,Zoom Stock Is on the Rebound on the Strength of Its Free Cash Flow,0.7579,Positive
2021-10-14,Zoom fends off RingCentral attempt at 9th Circ to block end to services,-0.4404,Negative
2021-10-14,3 Tech Stocks That Could Change The World,0.0,Neutral
2021-10-14,ARK Invest Stocks To Buy And Watch: 6 Stocks That Cathie Wood's ARK ETFs Own; Tesla Climbs,0.0,Neutral
2021-10-13,Why Zoom Video Communications Shares Are Rising,0.296,Positive
2021-10-13,Zoom Founder & CEO Eric S. Yuan and Regional Healthcare Workers to be Honored as 2021 Spirit of Silicon Valley Award Recipients at Silicon Valley Leadership Group Annual Forum,0.8402,Positive
2021-10-13,Notable Zoom Video Communications Insider Trades $1.8M In Company Stock,0.0,Neutral
2021-10-13,Ark Invest Stock Portfolio: Top 10 Picks,0.2023,Positive
2021-10-13,3 Cheap Tech Stocks to Buy Right Now,0.0,Neutral
2021-10-11,Zoom Video Communications (ZM) Stock Moves -0.42%: What You Should Know,0.0,Neutral
2021-10-11,What's Hot in the Stock Market?,0.0,Neutral
2021-10-11,DJ Zoom Still Dominates Video Meetings. But Slowing Growth Is an Issue for the Stock. -- Barrons.com,0.5423,Positive
2021-10-11,7 Short Squeeze Stocks to Buy That Could Be the Next GameStop,0.0,Neutral
2021-10-11,Zoom Named a Leader in 2021 Gartner® Magic Quadrant™ for Meeting Solutions,0.1779,Positive
2021-10-11,These Are Zoom's Big Opportunities for Growth,0.6369,Positive
2021-10-11,7 Top Stocks That Held Up Well During This Recent Market Bloodbath,0.4404,Positive
2021-10-10,The Tremendous Risk vs. Reward Equation of Zoom Apps,0.3758,Positive
2021-10-09,5 Key Ways Zoom Is Shifting From Merely a Product to a Dominant Platform,0.0,Neutral
2021-10-09,How Big Is Zoom's Churn?,0.0,Neutral
2021-10-09,"3 Heavy Hitters Zoom Is Like: PayPal, Microsoft, and Shopify",0.3612,Positive
2021-10-08,EU Questions Microsoft Peers Following Slack's Complaint,-0.296,Negative
2021-10-08,Will Growth Stocks Fall Behind Value Stocks Within the Next Decade?,0.6124,Positive
2021-10-08,1 Threat Teledoc and Amwell Investors Should at Least Consider,-0.5267,Negative
2021-10-08,Growth Driver: Zoom Rooms,0.3818,Positive
2021-10-08,Microsoft Windows 11: What Investors Need to Know,0.0,Neutral
2021-10-08,Why Disney Is Still a Buy During the Pandemic,0.0,Neutral
2021-10-08,Should Zoom Acquire Bandwidth Instead of Five9?,0.0,Neutral
2021-10-08,"Where to Invest $1,000 Right Now",0.0,Neutral
2021-10-07,What Does Zoom's Customer Breakdown Look Like?,0.3612,Positive
2021-10-07,"Zoom Video Communications, Inc.'s (NASDAQ:ZM) Stock Has Been Sliding But Fundamentals Look Strong: Is The Market Wrong?",0.0772,Positive
2021-10-07,What's the Strategy Behind the Zoom Phone?,0.0,Neutral
2021-10-06,7 Growth Stocks to Buy to Power Your Portfolio for the Rest of the Year,0.3818,Positive
2021-10-06,"Bulls, Bears Can Both Find A Way To Play Apple, Sunrun, Zoom Video Stocks",0.34,Positive
2021-10-06,What's Next for Zoom and Five9 After Their Failed Merger?,-0.5106,Negative
2021-10-06,ARK Invest Stocks To Buy And Watch: 6 Stocks That Cathie Wood's ARK ETFs Own; Tesla Falls,0.0,Neutral
2021-10-06,"Box, Fresh From Activist Win, Says Analysts Underestimate Growth",0.7579,Positive
2021-10-06,Amazon Throws Down the Gauntlet at These 5 Companies,0.1779,Positive
2021-10-05,Zoom Video Communications (ZM) Stock Sinks As Market Gains: What You Should Know,0.34,Positive
2021-10-05,How Much Further Could Zoom Stock Fall?,0.0,Neutral
2021-10-04,Why Zoom Video Communication Shares Are Falling,0.1531,Positive
2021-10-04,ARK Invest Stocks To Buy And Watch: 6 Stocks That Cathie Wood's ARK ETFs Own; Tesla Jumps On Strong Deliveries,0.5106,Positive
2021-10-04,10 Tech Stocks Chinese Billionaire Chen Tianqiao Loves,0.5719,Positive
2021-10-04,"Company News for Oct 4, 2021",0.0,Neutral
2021-10-04,Five9 (FIVN) Soars 4.7%: Is Further Upside Left in the Stock?,0.0,Neutral
2021-10-04,Here's Why Teladoc Is Here to Stay,0.0,Neutral
2021-10-04,Analysis: Zoom's abandoned Five9 deal shows hurdles to expansion,-0.4588,Negative
2021-10-03,3 Beaten-Down Stocks Investors Should Be Buying Hand Over Fist,0.4939,Positive
2021-10-03,Can Teladoc Keep Its Competitive Advantage?,0.4019,Positive
2021-10-02,"What Famous CEO Should Host ""Saturday Night Live"" Next?",0.0,Neutral
2021-10-02,Is There a New Normal for the Job Market?,0.0,Neutral
2021-10-02,"$10,000 Invested in These Growth Stocks Could Make You a Fortune Over the Next 10 Years",0.3818,Positive
2021-10-01,Why Zoom Stock Thrashed the Market Today,0.0,Neutral
2021-10-01,Zoom and Five9 may not be broken up forever,0.3724,Positive
2021-10-01,DJ The Zoom-Five9 Merger Collapsed. What's Next For Both Companies. -- Barrons.com,-0.2732,Negative
2021-10-01,"DJ The Dow Is Up, Merck Rises on Covid Pill -- and What Else Is Happening in the Stock Market Today -- Barrons.com",0.0,Neutral
2021-10-01,DJ Zoom Enters an Awkward Phase -- Heard on the Street,-0.1531,Negative
2021-10-01,"DJ Zoom, Five9 Both Have Strong Prospects After Failed Combination -- Market Insight",0.296,Positive
2021-10-01,"Dow Jones Today Rises, Nasdaq Slips After Merck Covid Antivirus Results; China EV Makers Jump, Jefferies Tops Q3 Views",0.5106,Positive
2021-10-01,Zoom Stock Rises After Five9 Merger Agreement Terminated,0.4939,Positive
2021-10-01,Cracks Start to Appear in $890 Billion Stock-Fueled M&A Boom,0.0,Neutral
2021-10-01,"Zoom (ZM), Five9 Mutually Terminate $14.7B Acquisition Deal",0.0,Neutral
2021-10-01,Five9 plays up opportunity as standalone company after Zoom merger falls apart,0.5859,Positive
2021-10-01,Analysts Laud Five9 Post Zoom Deal Termination,0.0,Neutral
2021-10-01,Here's A Less Risky Way To Play This Year's Booming IPO Market,0.2247,Positive
2021-10-01,My 5 Favorite Stocks Right Now,0.4588,Positive
2021-10-01,"Zoom's stock drop likely nixed Five9 deal, say analysts",-0.2732,Negative
2021-10-01,Zoom and Five9 drop US$14.7 billion merger amid US security review over video-conference app's operations in China,0.0772,Positive
2021-10-01,"Stocks Turn Higher, Pelosi Seeks Mulligan, Disney Cuts Deal With 'Black Widow' - 5 Things You Must Know",-0.296,Negative
2021-10-01,"5 Stocks To Watch For October 1, 2021",0.0,Neutral
2021-09-30,Zoom's $14.7B Deal To Acquire Five9 Falls Through,0.0,Neutral
2021-09-30,DJ Zoom's Nearly $15 Billion Acquisition of Five9 Rejected by Shareholders -- 2nd Update,-0.5106,Negative
2021-09-30,DJ Zoom Acquisition of Five9 Collapses After Shareholders Vote it Down -- Barrons.com,-0.296,Negative
2021-09-30,"Zoom, Five9 Scrap $14.7 Billion Deal as Investors Vote No",-0.296,Negative
2021-09-30,Five9 mutually terminates merger agreement with Zoom Video Communications,0.4939,Positive
2021-09-30,Press Release: Zoom Announces Termination of Merger Agreement with Five9,0.4939,Positive
2021-09-30,DJ Zoom's Nearly $15 Billion Acquisition of Five9 Rejected by Shareholders,-0.5106,Negative
2021-09-30,"UPDATE 2-Zoom, Five9 mutually agree to terminate nearly $15 bln all-stock deal",0.3612,Positive
2021-09-30,"Five9, Zoom mutually agree to terminate merger agreement",0.6908,Positive
2021-09-30,GRAPHIC-Markets in Q3: Bears in the China shop,0.0,Neutral
2021-09-30,Top Tech Stocks to Buy Today According to Brad Gerstner’s Altimeter Capital Management,0.2023,Positive
2021-09-29,DJ Cathie Wood's ARK Invest Sold Tesla Stock. Bulls Shouldn't Worry. -- Barrons.com,0.3412,Positive
2021-09-29,Zoom Video (ZM) Down 9.5% Since Last Earnings Report: Can It Rebound?,0.0,Neutral
2021-09-29,Here's Why Zoom Isn't Just a Pandemic Stock,0.0,Neutral
2021-09-29,DJ Why Higher Bond Yields Are Bad News for Tech Stocks Like Amazon and Zoom -- Barrons.com,-0.0772,Negative
2021-09-28,Zoom Video Communications (ZM): Hedge Funds Are Coming Back,0.0,Neutral
2021-09-28,"Hot Stocks: EV stocks fall; ASAN, MNDY suffer profit-taking; ZM hits new low; GOGO, UNFI rally on forecasts",-0.6808,Negative
2021-09-28,"Tech Stocks Roundup: Cramer on Salesforce, Amazon, Facebook, Zoom",0.1779,Positive
2021-09-27,Microsoft Steams Up Zoom Rivalry With Latest Phone Features,0.0,Neutral
2021-09-27,Will Business Travel Make a Comeback?,0.0,Neutral
2021-09-25,"Should You Let Your Winning Stocks Keep Winning, or Sell and Diversify?",0.7783,Positive
2021-09-24,Cathie Wood Knows Something About Zoom That You Don’t,0.0,Neutral
2021-09-24,"To Boost Their Communication Skills, Advisors Pose Wise Questions",0.7003,Positive
2021-09-24,What FedEx Earnings Tell Us About the Real Economy,0.0,Neutral
2021-09-23,Zoom CEO Eric Yuan details his plan to turn the killer app into a platform,-0.6486,Negative
2021-09-23,Is Zoom Stock A Buy Right Now As Five9 Acquisition Runs Into Trouble?,-0.4019,Negative
2021-09-23,Chief Executive Officer Of Zoom Video Communications Trades $26.90 Million In Company Stock,0.0,Neutral
2021-09-23,"3 Reasons to Buy Zoom Video, and 1 Reason to Sell",0.0,Neutral
2021-09-23,UK employees gain right to ask for flexible working from day one,0.6486,Positive
2021-09-22,How to Protect Your Personal Finances When the Market is Down,0.3818,Positive
2021-09-22,Does Zoom Need to Expand Its Services to Maintain Its Growth?,0.5994,Positive
2021-09-22,"Microsoft Amps Up Hardware Push With 5G Phone, Pro Laptop",0.0,Neutral
2021-09-22,My Top 7 Stocks to Buy in September's Stock Market Sell-Off,0.2023,Positive
2021-09-22,Palantir Stock Is Doing What It’s Supposed to Do,0.0,Neutral
2021-09-22,ARK Invest Stocks To Buy And Watch: 6 Stocks That Cathie Wood's ARK ETFs Own; Tesla Rallies,0.0,Neutral
2021-09-22,"Cathie Wood's ARK Invest Posts Fund Purchases For Tuesday, Sept. 21, 2021: ZM, ROKU, COIN, SGFY, TWOU, DNA, PD, PATH, DDD, KTOS, MKFG, TDOC, HOOD, GENI, VUZI, CND, BEAM, NVTA, PSNL, SLGC, ACHR, BLDE",0.0,Neutral
2021-09-22,DJ Evergrande Risks Are Receding. Now Back to the Fed's Dilemma. -- Barrons.com,-0.4215,Negative
2021-09-22,"Zoom, Five9 $15B Deal Comes Under Justice Department Scrutiny",0.5267,Positive
2021-09-22,Salesforce's Indian rival Freshworks valued at $10 billion in Wall Street IPO,0.4404,Positive
2021-09-21,DJ Zoom is a Verb -- and a Target -- Heard on the Street,0.0,Neutral
2021-09-21,DJ Zoom's Deal for Five9 Triggers Justice Dept. Review Over China Ties -- Barrons.com,0.5267,Positive
2021-09-21,UPDATE: Zoom's ~$15M Deal To Buy Five9 Is Under Government Review,0.0,Neutral
2021-09-21,BRIEF-Zoom's Nearly $15 Bln Deal For Five9 Under U.S. Govt Review Over China Ties - WSJ,0.0,Neutral
2021-09-21,Zoom's Nearly $15 Billion Deal to Buy Five9 Is Under Government Review,0.0,Neutral
2021-09-21,Zoom Says It Expects Regulatory Approvals by the First Half of Next Year,0.0,Neutral
2021-09-21,"Team Telecom Reviewing License Application Connected to the Deal, Letter to FCC Says",0.0,Neutral
2021-09-21,DJ Zoom's Nearly $15 Billion Deal for Five9 Under U.S. Government Review Over China Ties,0.0,Neutral
2021-09-21,Zoom Video's $15 Billion Purchase of Five9 Faces DOJ Scrutiny on China Ties,0.0,Neutral
2021-09-21,Apple (AAPL) Releases iOS 15: Here's What You Need to Know,0.0,Neutral
2021-09-21,3 Top Tech Stocks to Buy on Weakness,-0.25,Negative
2021-09-21,"Down 50% From Its High, Is Zoom Stock a Smart Buy?",0.4019,Positive
2021-09-21,2 Smart Growth Stocks to Buy Right Now,0.6486,Positive
2021-09-20,How Zoom Makes Money: Platform Subscriptions,0.0,Neutral
2021-09-20,Chief Revenue Officer Of Zoom Video Communications Makes $625.92 Thousand Sale,0.0,Neutral
2021-09-20,ARK Invest Stocks To Buy And Watch: 6 Stocks That Cathie Wood's ARK ETFs Own; Tesla Sells Off,0.0,Neutral
2021-09-19,Is Room for Zoom the New Office Must-Have?,0.0,Neutral
2021-09-19,What Is Freshworks All About?,0.0,Neutral
2021-09-18,"Tech Roundup: Apple speaks, and everyone listens",0.0,Neutral
2021-09-17,Trade Options Like A Pro — Check Zoom Video Communications's Big Money Trades,0.3612,Positive
2021-09-17,Why Zoom Video Shares Are Trading Higher Today,0.296,Positive
2021-09-17,Five9 upgraded at Piper on potential upside in Zoom deal offer,0.0,Neutral
2021-09-17,"As the Nasdaq Drops, Could Five9 Escape Its Deal with Zoom?",0.1779,Positive
2021-09-17,DJ Zoom's Deal for Five9 Faces Doubts After ISS Advises Against It -- Barrons.com,-0.296,Negative
2021-09-17,"5 Top Stock Gainers for Friday: Thermo Fisher, Zoom Video, Invesco",0.2023,Positive
2021-09-17,4 Dental Stocks to Buy for a Teeth-Straightening Boom,0.0,Neutral
2021-09-17,Proxy advisor ISS seeks vote against Zoom-Five9 deal on growth doubts,0.1027,Positive
2021-09-17,9 Tech and Software Stocks to Buy According to Hamilton Helmer’s Strategy Capital,0.0,Neutral
2021-09-17,ISS Tells Five9 Investors to Reject Zoom’s $14.7 Billion Offer,-0.4019,Negative
2021-09-17,"Five9 shareholders should vote against Zoom deal, says proxy advisor",0.0,Neutral
2021-09-17,ISS Recommends Vote Against Zoom's Deal To Acquire Five9,0.2263,Positive
2021-09-17,Zoom Stock Gains On Report ISS Recommends Five9 Shareholders Reject Takeover Bid,0.1531,Positive
2021-09-16,"This Restaurant Chain Has A Better 1-Year Return Than Peloton, Facebook, Disney And Zoom",0.4404,Positive
2021-09-16,Zoom (ZM) Launches Reseller Partner Program for Phone BYOC,0.0,Neutral
2021-09-16,Cisco (CSCO) Expects Software Business to Drive Revenues,0.0,Neutral
2021-09-16,Bandwidth (BAND) Joins Zoom Phone Provider Exchange Program,0.0,Neutral
2021-09-16,Is Zoom Stock A Buy Right Now? Zoomtopia Conference Focuses On Large Businesses,0.0,Neutral
2021-09-16,7 Stocks to Buy to Invest Like Jim Cramer,0.3612,Positive
2021-09-16,3 Top Growth Stocks That Are Screaming Buys Right Now,0.2023,Positive
2021-09-15,"Tim Cook, Elon Musk and Jensen Huang make Time 100 most influential list",0.4927,Positive
2021-09-15,DJ Zoom Follows Workers Back to the Office With a Video Booth,0.0,Neutral
2021-09-15,Oracle Is Aiming For The Cloud,0.0,Neutral
2021-09-15,"Microsoft (MSFT) Reveals New Repurchase Plan, Bumps Dividend",0.0,Neutral
2021-09-15,ARK Invest Stocks To Buy And Watch: 6 Stocks That Cathie Wood's ARK ETFs Own; Tesla Slides,0.0,Neutral
2021-09-15,BRIEF-Zoom Unveils Reseller Partner Program For Zoom Phone BYOC,0.0,Neutral
2021-09-15,Zoom Video Reports Reseller Partners Will Have Opportunity To Sell Zoom Phone Bring Your Own Carrier Licenses,0.4215,Positive
2021-09-15,3 Top Stocks That Just Went On Sale,0.2023,Positive
2021-09-15,3 Top Large-Cap Stocks to Buy in September,0.2023,Positive
2021-09-15,2 Potentially Explosive Stocks to Buy in September,0.0,Neutral
2021-09-14,"Cathie Wood Continues To Trim Tesla Stake, Selling Another $66M Worth Of Shares",0.4767,Positive
2021-09-14,Canva's valuation more than doubles to $40 bln in latest funding round,0.0,Neutral
2021-09-13,Zoom Steams Up Videoconferencing Rivalry,0.0,Neutral
2021-09-13,DJ Zoom Video Stock Slips As New Features Announced At Conference -- MarketWatch,0.0,Neutral
2021-09-13,Zoom Video stock slips as new features announced at conference,0.0,Neutral
2021-09-13,'Zoom is adding live translation services and coming to Facebook VR' -The Verge Report,0.0,Neutral
2021-09-13,Zoom Announces Planned Innovations To 'Ignite the Next Era of Communications',0.0,Neutral
2021-09-13,"DJ Zoom Unveils Whiteboard Software, Encrypted Calls, Live Meeting Transcriptions -- Barrons.com",0.0,Neutral
2021-09-13,"Fortinet, Linksys partner for secure work-from-home networks",0.34,Positive
2021-09-13,Is Zoom Stock A Buy Right Now? Zoomtopia Conference To Focus On Large Businesses,0.0,Neutral
2021-09-13,3 Smart Tech Stocks to Buy in September,0.4019,Positive
2021-09-12,Why Home Sales Are at a 12-Year High,0.0,Neutral
2021-09-12,"DJ Zoom, Apple, Chevron, Oracle, Roche, and Other Stocks for Investors to Watch This Week -- Barrons.com",0.0,Neutral
2021-09-11,Cathie Wood's Latest Picks: 2 Stocks She Just Bought,0.0,Neutral
2021-09-11,Zoom Is Unlikely to Lose Too Much Growth Momentum. Here's Why,-0.0258,Neutral
2021-09-10,Avoid These 2 Stocks That Were Earnings Losers,-0.6808,Negative
2021-09-10,7 Cathie Wood Stock Favorites to Keep on Your Radar,0.4215,Positive
2021-09-09,"DJ Zoom Video Communications, Inc. (ZM) Presents at Deutsche Bank 2021 Technology Conference (Transcript) >ZM",0.0,Neutral
2021-09-09,"Microsoft delays return to office, launches new hybrid work features",0.0,Neutral
2021-09-09,"Amazon launches own-branded line of smart televisions, bringing in Alexa and TikTok",0.5267,Positive
2021-09-09,Alphabet (GOOGL) & Cisco Join Forces for Interoperations,0.296,Positive
2021-09-09,"India's got the next big thing in tech, and it could be worth $1 trillion",0.2263,Positive
2021-09-09,Facebook Workrooms: Are virtual meeting rooms the answer for home-workers?,0.0,Neutral
2021-09-08,"DJ Zoom Video Communications, Inc. (ZM) Management presents at Wolfe Research Inaugural TMT Conference (Transcript) >ZM",0.0,Neutral
2021-09-08,Zoom Video Communications To Hold Financial Analyst Briefing During Zoomtopia,0.0,Neutral
2021-09-08,Google Partners With Cisco For Videoconferencing,0.0,Neutral
2021-09-08,ARK Invest Stocks To Buy And Watch: 6 Stocks That Cathie Wood's ARK ETFs Own; Tesla Skids Despite China Sales,0.0,Neutral
2021-09-08,Google Teams Up With Cisco WebEx to Make Videoconferences Easier,0.4215,Positive
2021-09-08,"Smartsheet (SMAR) Q2 Earnings Beat Estimates, Revenues Up Y/Y",0.0,Neutral
2021-09-08,3 Leading Software-as-a-Service Stocks to Buy in 2021 and Beyond,0.0,Neutral
2021-09-08,2 Top Growth Stocks That Beat Expectations and Raised Guidance,0.5267,Positive
2021-09-08,2 Software Stocks That Could Be Giving Investors a Buying Opportunity,0.6369,Positive
2021-09-07,Is the Dip in Zoom Stock a Buying Opportunity?,0.4215,Positive
2021-09-07,COVID-19 long haulers are worried about unvaccinated Americans — and mired in medical bills of over $200K,-0.296,Negative
2021-09-07,"DJ Correction to Zoom's Stock Should Stay on Mute Article Aug. 30, 2021",0.0,Neutral
2021-09-07,Apple stock is making an impressive move into the new iPhone reveal,0.5106,Positive
2021-09-07,10 Best Stocks to Buy for the Next Ten Years,0.6369,Positive
2021-09-07,25 Largest Countries in the World,0.0,Neutral
2021-09-07,"Five9 Shareholders Will Likely Reject Zoom Deal, Needham Says",-0.4019,Negative
2021-09-07,Five9 gains as Needham upgrade expects Zoom to raise acquisition price,0.34,Positive
2021-09-07,Why Cathie Wood Piled Up On Zoom Shares On Post-Earnings Slump,0.296,Positive
2021-09-07,Wall Street's hottest investor is betting big on a handful of stocks. Critics say she's playing with fire,-0.4215,Negative
2021-09-06,This High-Growth Stock Is Down More Than 40% -- Time to Buy?,0.0,Neutral
2021-09-04,This Beaten-Down Value Stock Is Worth Buying Now,0.5106,Positive
2021-09-04,DocuSign Stock: Is It a Buy?,0.0,Neutral
2021-09-04,Cathie Wood scooped up Zoom stock after it crashed — here's why,0.0,Neutral
2021-09-03,"DJ United Airlines, Procter & Gamble, Moderna: Stocks That Defined the Week",0.4215,Positive
2021-09-03,"Zoom Video Communications Inc. stock rises Friday, outperforms market",0.0,Neutral
2021-09-03,"Market Rally At Highs, Led By Apple, Growth Stocks: Weekly Review",0.3818,Positive
2021-09-03,Zooming In On Zoom's Solid But Not Good Enough Results,-0.4232,Negative
2021-09-03,265 Million Reasons Zoom Is More Than a Pandemic Stock,0.0,Neutral
2021-09-03,3 Must-See Excerpts From Zoom's Earnings Call,0.0,Neutral
2021-09-03,"DJ Moderna Keeps Soaring, Zoom Fades, as Hot Covid-19 Stocks Diverge",0.0,Neutral
2021-09-03,These 3 Companies Should Acquire Zoom For a Bargain Today,0.2023,Positive
2021-09-02,Zoom Video Communications Inc. stock outperforms market on strong trading day,0.5106,Positive
2021-09-02,The tech trade isn't done: Jeffries analyst,0.0,Neutral
2021-09-02,"Zoom Video (ZM): The Bull Case Is Cracked, Not Broken",0.3724,Positive
2021-09-02,Here's Why You Should Consider Buying Zoom Today,0.0,Neutral
2021-09-02,Seagate's (STX) Lyve Cloud Platform Deployed by Zoom Video,0.0,Neutral
2021-09-02,"This Chinese EV Maker Has A Better 1-Year Return Than Twitter, Square, Zoom And PayPal",0.4404,Positive
2021-09-02,My Thoughts on Zoom's Earnings -- Are People Overreacting?,0.0,Neutral
2021-09-02,"Down More Than 60%, This Stock Could Be a Steal",-0.4939,Negative
2021-09-01,"Software firm Monday.com's stock rallies to post-IPO high, up 162% in some three months",0.0,Neutral
2021-09-01,Chewy Stock Is Falling. It’s the Latest Stay-at-Home Casualty.,-0.6124,Negative
2021-09-01,"Zoom Video Communications Inc. stock rises Wednesday, outperforms market",0.0,Neutral
2021-09-01,PreMarket Prep Stock Of The Day: Cathie Wood Buys The Zoom Video Dip,0.0,Neutral
2021-09-01,10 Information Technology Stocks Showing Unusual Options Activity In Today's Session,0.0,Neutral
2021-09-01,Why these Cathie Wood growth stocks are set up for a September surge,0.3818,Positive
2021-09-01,Zoom Gloom: Slowing Small-Enterprise Customer Growth,-0.25,Negative
2021-09-01,"ARK Invest Stocks To Buy And Watch: 6 Stocks That Cathie Wood's ARK ETFs Own; Tesla, Zoom Rally",0.0,Neutral
2021-09-01,Ark’s Cathie Wood Buys Zoom After Earnings Spurred Selloff,0.0,Neutral
2021-09-01,"Stock Market News for Sep 1, 2021",0.0,Neutral
2021-09-01,"Star stock-picker Cathie Wood buys the Zoom dip, invests over $56 million",0.0,Neutral
2021-09-01,"UPDATE 1-Star stock-picker Cathie Wood buys the Zoom dip, invests over $56 million",0.0,Neutral
2021-09-01,"Cathie Wood buys the Zoom dip, invests over $56 million",0.0,Neutral
2021-09-01,"REFILE-Cathie Wood buys the Zoom dip, invests over $56 million",0.0,Neutral
2021-09-01,Zoom's Pandemic Bonanza Is Over,0.0,Neutral
2021-09-01,2 Beaten Down Stocks With 10X Potential,-0.4215,Negative
2021-09-01,"Corsair, GameStop, Skillz, AMC, Alibaba And More: Stocks Buzzing on WallStreetBets Today",0.0,Neutral
2021-09-01,"If You Invested $1,000 In Skillz When Cathie Wood Bought Stake In January, Here's How Much You Would Have Now",0.0,Neutral
2021-08-31,"Zoom: Post-Earnings Pullback Is an Opportunity, Says Top Analyst",0.5574,Positive
2021-08-31,Is the Cloud-Stock Boom Over?,0.0,Neutral
2021-08-31,Zoom shares record worst day in 9 months as searing growth tapers off,-0.0772,Negative
2021-08-31,"Zoom Video Communications Inc. stock falls Tuesday, underperforms market",0.0,Neutral
2021-08-31,Dow Jones Ends Slightly Lower But Closes Out August With A Gain; Walgreens Higher On Wage Hike For Hourly Workers,0.6306,Positive
2021-08-31,US STOCKS-Wall Street's subdued finish fails to detract from strong August,0.128,Positive
2021-08-31,Walgreens And IBM Lead The Dow Jones,0.0,Neutral
2021-08-31,US STOCKS-Wall St ends strong August with muted performance,0.5106,Positive
2021-08-31,5 Zoom Video Analysts Break Down Q2 Earnings: 'Growth Engine Has To Shift',0.3818,Positive
2021-08-31,"Dow Jones Slips, But Walgreens Stock Jumps 4%; Tesla Extends Gains, Stays In Buy Zone",0.5927,Positive
2021-08-31,Zoom stock plummets after earnings suggest investors may need to ‘realign their expectations’,0.0,Neutral
2021-08-31,Mid-Afternoon Market Update: Spok Holdings Surges On Takeover Offer; Sequential Brands Shares Slide,0.296,Positive
2021-08-31,Shareholders Wish This Nasdaq Stock Never Agreed to a Buyout,0.223,Positive
2021-08-31,Dow Jones Slips As Apple Stock Weighs; NetEase Soars But Zoom Video Crashes,0.0,Neutral
2021-08-31,"After Hours Watch List Scorecard: APPS, SOL, ZM",0.0,Neutral
2021-08-31,Why Shares of Five9 Tanked Nearly 15% Today,0.296,Positive
2021-08-31,"ACST, AMSC and NETE among mid-day movers",0.0,Neutral
2021-08-31,Zoom stock just crashed — here's the simplest reason why,0.0,Neutral
2021-08-31,"US STOCKS-Wall St hovers near record highs, S&P 500 set for strong August",0.5106,Positive
