,Title,Timestamp
0,MY TRADES FOR TODAY WATCH AS REQUESTED,2020-01-08 15:19:28
1,Diversification isn't working,2020-02-03 22:20:26
2,Motley Fool Tom's Best Buy Now (13 Feb 20),2020-02-15 11:57:16
3,Pre Market Watch List February 18,2020-02-18 08:43:51
4,Covid-19 stocks,2020-02-25 17:07:15
5,Invest wisely,2020-02-27 20:37:09
6,"Stocks to Watch for Feb 28, 2020 - Top 18 Ideas - Corona Virus Stocks",2020-02-28 07:23:59
7,"Pre Market Watch List February 28, 2020",2020-02-28 08:45:40
8,ZOOOOOM,2020-02-28 10:54:52
9,Bull Outpost - ZM DD,2020-02-28 11:31:44
10,"Wall Street Week Ahead for the trading week beginning March 2nd, 2020",2020-02-29 10:49:03
11,"Wall Street Week Ahead for the trading week beginning March 2nd, 2020",2020-02-29 10:51:54
12,"Wall Street Week Ahead for the trading week beginning March 2nd, 2020",2020-02-29 10:52:52
13,ZOOM Technologies is NOT Zoom Video Communications (ZM).,2020-03-02 10:52:06
14,"Today's Stock Market News [Tuesday, March 3rd, 2020]",2020-03-03 09:10:28
15,"Today's Stock Market News [Tuesday, March 3rd, 2020]",2020-03-03 09:13:36
16,"Today's Stock Market News [Tuesday, March 3rd, 2020]",2020-03-03 09:14:37
17,Zoom Right Now,2020-03-03 14:29:49
18,Simple Bear Market Strategy for Small Investors,2020-03-05 13:21:10
19,"Pre Market Watch List March 6, 2020",2020-03-06 08:28:05
20,"Stock Watch List March 6, 2020",2020-03-06 08:28:36
21,Coronoavirus Stocks,2020-03-07 21:53:14
22,"Stock Watch List March 9, 2020",2020-03-09 08:38:34
23,"Stock Watch List March 9, 2020",2020-03-09 08:46:01
24,"Stock Watch List March 10, 2020",2020-03-10 08:51:11
25,"Stock Watch List For March 10, 2020",2020-03-10 08:52:05
26,BARDA & DOD COVID-19 Test Contract | Hologic - (HOLX),2020-03-12 07:08:31
27,Companies that with long term tailwinds due to the COVID-19 (coronavirus),2020-03-14 12:34:35
28,Autists being Autists,2020-03-17 21:39:33
29,"A Comprehensive Guide to Coronavirus Stocks, Categorized via BARDA's Areas of Interest.",2020-03-19 03:15:29
30,"A Comprehensive Guide to Coronavirus Stocks, Categorized via BARDA's Areas of Interest.",2020-03-19 04:46:09
31,"What are you planning to buy ""on-sale""",2020-03-19 07:48:33
32,Zoom (ZM) stock and thoughts on working from home for the foreseeable future,2020-03-19 11:22:17
33,Why isn't anyone talking about $CSCO?,2020-03-19 11:35:46
34,Who are the autists that are buying the wrong ZOOM??!,2020-03-20 13:27:01
35,"ASPU: The next APT, APRN",2020-03-20 14:04:04
36,What are stocks that have still been in the green?,2020-03-21 11:55:50
37,"Stock Watch List March 23, 2020",2020-03-23 08:48:04
38,"Stock Watch List March 23, 2020",2020-03-23 08:48:24
39,"Stock Watch List March 23, 2020",2020-03-23 09:15:46
40,ZM stock - Zoom Video Communications - hype,2020-03-23 11:26:35
41,BLMN Value Stock?,2020-03-23 23:01:52
42,"Today's Stock Market News [Tuesday, March 24th, 2020]",2020-03-24 08:29:09
43,"Today's Stock Market News [Tuesday, March 24th, 2020]",2020-03-24 08:30:05
44,"Today's Stock Market News [Tuesday, March 24th, 2020]",2020-03-24 08:30:53
45,MTCH 7/17 90-110c,2020-03-24 21:50:48
46,"Today's Stock Market News [Wednesday, March 25th, 2020]",2020-03-25 08:17:11
47,"Today's Stock Market News [Wednesday, March 25th, 2020]",2020-03-25 08:18:10
48,"Today's Stock Market News [Wednesday, March 25th, 2020]",2020-03-25 08:18:51
49,Is it too late to get in for the mid to long term on stocks like BA?,2020-03-26 10:47:17
50,Zoom Technologies Trading Suspended After Ticker Confusion,2020-03-26 12:04:53
51,Zoom Technology Shares Suspended,2020-03-26 13:08:28
52,‘ZOOM’ stock halted after investors confuse it with Zoom Video stock,2020-03-26 19:43:20
53,"Stock watch List March 27, 2020",2020-03-27 08:50:24
54,"Stock Watch List March 27, 2020",2020-03-27 08:50:50
55,"Stock Watch List March 27, 2020",2020-03-27 08:51:15
56,Stocks that benefit from COVID-19,2020-03-30 06:21:47
57,Growth Stocks Watch-list | Swing Trade/Position Trade | GSX ZM CHWY DXCM + More,2020-03-30 08:31:49
58,"Stock Watch List March 30, 2020",2020-03-30 08:53:34
59,"Stock Watch List March 30, 2020",2020-03-30 08:54:00
60,"Stock Watch List March 30, 3020",2020-03-30 08:54:23
61,Thinking of selling ZM & AVGO and buying MSFT and AAPL. Reasoning in post. Thoughts?,2020-03-30 21:21:51
62,"Today's Pre-Market Movers & News [Tuesday, March 31st, 2020]",2020-03-31 08:29:24
63,"Today's Pre-Market Movers & News [Tuesday, March 31st, 2020]",2020-03-31 08:30:23
64,"A Guide on what to look for in ""Pennystocks"" before they run",2020-03-31 21:37:38
65,"Today's Pre-Market Movers & News [Thursday, April 2nd, 2020]",2020-04-02 08:26:53
66,"Today's Pre-Market Movers & News [Thursday, April 2nd, 2020]",2020-04-02 08:27:40
67,"Today's Pre-Market Movers & News [Thursday, April 2nd, 2020]",2020-04-02 08:28:22
68,"Stock Watch List April 2, 2020",2020-04-02 08:47:57
69,"Stock Watch List April 2, 2020",2020-04-02 08:48:52
70,Here's all plays posted in the last 24 hours,2020-04-02 16:35:42
71,This is all plays commented in the last 24 hours,2020-04-03 23:24:02
72,Question about Zoom investment. Some DD,2020-04-05 02:19:12
73,Let me try this again with more info. I apologize. You have less than two weeks to purge your account PART 2 - With proper images and stock cross-references.,2020-04-05 08:57:53
74,Big Shorts Looming?,2020-04-05 16:07:32
75,"Stock watch list April 6, 2020",2020-04-06 08:49:47
76,"Stock Watch List April 6, 2020",2020-04-06 08:50:16
77,"Stock Watch List April 6, 2020",2020-04-06 08:50:36
78,"Today's Pre-Market Movers & News [Monday, April 6th, 2020]",2020-04-06 08:51:29
79,"Today's Pre-Market Movers & News [Monday, April 6th, 2020]",2020-04-06 08:52:16
80,"Today's Pre-Market Movers & News [Monday, April 6th, 2020]",2020-04-06 08:53:07
81,My 4-6-20 Socks In Play Watchlist,2020-04-06 09:20:19
82,PTON. Peloton suspends live classes,2020-04-06 17:03:59
83,Zoom lacks security,2020-04-07 18:52:13
84,Data centers may be one of the safest defensive stocks amid a global shelter in place,2020-04-08 08:36:38
85,Institutional ownership,2020-04-08 09:49:55
86,Here are all positions posted in the last 24 hours,2020-04-08 21:06:00
87,"Today's Pre-Market Movers & News [Thursday, April 9th, 2020]",2020-04-09 08:45:10
88,"Today's Pre-Market Movers & News [Thursday, April 9th, 2020]",2020-04-09 08:46:06
89,Here are all positions posted in the last 24 hours,2020-04-09 16:38:14
90,"What Happened, and Why Markets Seem Irrational",2020-04-10 23:34:35
91,A Diamond in the Rough - Debated Welcome!,2020-04-11 13:24:04
92,Here are all positions posted in the last 24 hours,2020-04-11 17:18:18
93,"Stock watch List April 13, 2020",2020-04-13 08:46:21
94,"Stock watch List April 13, 2020",2020-04-13 08:46:23
95,"Stock Watch List April 13, 2020",2020-04-13 08:53:53
96,Does strike price matter for synthetic shorts?,2020-04-13 11:37:49
97,Here are all positions posted in the last 24 hours,2020-04-13 16:26:23
98,"Alteryx, Inc. This is some pretty Guaranteed Money (Probably)",2020-04-13 21:52:48
99,"Stock Watch List April 14, 2020",2020-04-14 08:49:32
100,"Stock watch list April 14, 2020",2020-04-14 08:49:57
101,"Stock Watch List April 14, 2020",2020-04-14 08:50:32
102,Here are all positions posted in the last 24 hours,2020-04-14 17:32:20
103,Literal free money on Zoom (ZM) puts...,2020-04-15 13:19:12
104,Here are all positions posted in the last 24 hours,2020-04-15 18:27:40
105,The right temperament,2020-04-16 21:01:44
106,STONK MARKET =/= ECONOMY,2020-04-16 22:36:05
107,How does Yahoo Finance calculate Market Cap?,2020-04-18 06:06:26
108,The market as a whole seems like it should be a lot lower right now. But which stocks specifically do you guys think are irrationally higher than they should be?,2020-04-19 18:52:57
109,Trying to understand wash sales and its driving me crazy,2020-04-19 20:59:18
110,Who is winning the videochat war? Survey inside,2020-04-20 17:19:37
111,Stock Thread 2.0,2020-04-22 20:06:45
112,Here are all positions posted in the last 24 hours,2020-04-23 16:43:56
113,For Trading April 24th,2020-04-23 21:03:13
114,In-Depth Analysis and Valuation on Zoom Video Communications (ZM),2020-04-24 02:38:20
115,"Stock watch List April 24, 2020",2020-04-24 08:40:24
116,Here are all positions posted in the last 24 hours,2020-04-24 19:13:21
117,Here are all positions posted in the last 24 hours,2020-04-25 20:17:53
118,"Stock watch List April 27, 2020",2020-04-27 08:44:33
119,The Zoom bubble is popping,2020-04-27 09:17:25
120,"Stock watch list April 29, 2020",2020-04-29 08:45:10
121,"Stock watch list April 29, 2020",2020-04-29 08:46:11
122,Morning radar 30th Apr,2020-04-30 08:02:40
123,"Stock Watch List April 30, 2020",2020-04-30 08:45:12
124,"Stock Watch List April 30, 2020",2020-04-30 08:45:17
125,Here are all positions posted in the last 24 hours,2020-04-30 12:07:49
126,Do you believe Zoom has a future or is it a fad?,2020-05-01 14:57:33
127,Does any website have accurate float and shares outstanding numbers for equities?,2020-05-04 14:53:12
128,Stop Buying Zoom Puts,2020-05-05 04:25:03
129,Wayfair/Shopify Puts,2020-05-05 09:03:45
130,Let's compile a list of Fad stocks that rose during the Coronavirus scare and only due to the Cornavirus scare (and the responses to it),2020-05-06 16:56:36
131,Turtle Beach ($HEAR) earnings today. BUY CALLS!,2020-05-07 08:43:07
132,"Stock watch list May 7, 2020",2020-05-07 08:44:20
133,ZM: why the market may be substantially underestimating the upside,2020-05-07 11:33:39
134,"AyyPce Charts - CAKE, LOGI, HD, more charts to come for 5-15 Week",2020-05-10 16:09:54
135,Day 4 5/14 : From Down to Up - The Road to $18385.37 - +9.96% ($1968.86 - $2165.08),2020-05-14 16:21:51
136,$ZM retard strength,2020-05-15 11:23:20
137,Day 5 5/15 : From Down to Up - The Road to $18385.37 -6.57% ($2665.08 - $2489.82),2020-05-15 16:28:57
138,I'm Bullish on Shopify For The Long Term But Short Term I Would Sell,2020-05-16 12:38:56
139,ZOOM is going down! And I need it to do so now!,2020-05-17 14:30:04
140,Need advice: ZM - Hold or sell?,2020-05-17 14:51:21
141,When to call it quits and seek advice from a financial advisor,2020-05-17 23:41:42
142,"Zoom (ZM) CEO/Founder Yuan, Eric S. sells out of all his stock on May 12th",2020-05-18 15:46:06
143,Criticize my plan,2020-05-18 23:36:32
144,Here are all positions posted in the last 24 hours,2020-05-19 17:52:54
145,Day 7 5/16 : From Down to Up - The Road to $18385.37 -19.40% ($2364.82 - $1904.13),2020-05-19 20:51:07
146,DD: The KEY STATISTIC ON WHY YOU SHOULD NOT SLEEP ON SLACK,2020-05-21 07:04:20
147,US MBS ETF options,2020-05-24 09:28:12
148,Meme Stonks,2020-05-26 20:02:57
149,Here are all positions posted in the last 24 hours,2020-05-27 17:00:52
150,Arbitrage tech and mainstreet,2020-05-27 18:18:26
151,"Wall Street Week Ahead for the trading week beginning June 1st, 2020",2020-05-30 08:50:41
152,"Wall Street Week Ahead for the trading week beginning June 1st, 2020",2020-05-30 08:55:42
153,"Wall Street Week Ahead for the trading week beginning June 1st, 2020",2020-05-30 08:57:08
154,"Stock Watch List June 1, 2020",2020-06-01 08:42:38
155,"Stock Watch List June 1, 2020",2020-06-01 08:43:48
156,"Zoom, Zscaler and Zynga... don't sleep on these 😴",2020-06-01 18:27:59
157,Short zoom?,2020-06-02 08:31:55
158,"Stock watch List June 2, 2020",2020-06-02 08:38:27
159,"Stock watch List June 2, 2020",2020-06-02 08:44:15
160,My 6-2-20 Stocks in Play Watchlist,2020-06-02 09:10:07
161,"Zoom Video earnings and sales blow away expectations, stock rises toward more records",2020-06-02 16:31:39
162,Technology stocks and the problem with Zoom (ZM),2020-06-02 18:12:59
163,How to trade stocks at all time highs?,2020-06-02 21:12:05
164,Your tendies at $WORK,2020-06-04 10:55:26
165,WORK (Slack Technologies) discussion and thoughts,2020-06-04 19:03:51
166,Expected moves charts for next weeks earnings and other stocks in the news,2020-06-05 14:47:32
167,Get your COCKU into $DOKU,2020-06-05 17:07:59
168,Bearish outlook on Zoom,2020-06-05 18:17:47
169,Need feedback - FD DTE earnings short options plays,2020-06-06 16:07:15
170,Selling puts on skyrocketing stocks,2020-06-08 17:04:40
171,Is this what a bubble looks like?,2020-06-08 17:08:33
172,Is this what a bubble looks like?,2020-06-08 17:09:12
173,Is this what a bubble looks like?,2020-06-08 17:09:33
174,Why are people still bullish on Zoom Video Communications (ZM)? Am I delusional..,2020-06-10 12:23:31
175,"Need some advice as a beginner, as my emotions are getting into this...",2020-06-10 12:53:19
176,How legit is this strategy? Calendar spreads before earnings reports,2020-06-13 04:05:10
177,"Stock watch List June 15, 2020",2020-06-15 08:46:06
178,"Stock watch List June 15, 2020",2020-06-15 08:46:18
179,A primer on valuing publicly traded growth-stage companies.,2020-06-15 14:34:26
180,Will we ever see the March lows again? FUNDAMENTAL DD INSIDE,2020-06-16 07:30:23
181,When to take profits?,2020-06-16 11:09:59
182,Think or Swim P/L Inaccuracy,2020-06-17 11:53:38
183,Thoughts on ZM among others in the near future,2020-06-19 00:46:11
184,"Before You ""YOLO"" LCDX Do Your Damn Research",2020-06-19 12:31:40
185,Stock tips - Trading on Breakouts,2020-06-19 15:24:17
186,Zoom (ZM) stock analysis. Put option volume increasing dramatically,2020-06-20 13:41:02
187,"Rebuttal to ""Zoom (ZM) stock analysis"" with an actual analysis",2020-06-21 03:56:21
188,"Rebuttal to ""Zoom (ZM) stock analysis"" with an actual analysis",2020-06-21 08:17:07
189,"Posting to answer some common/repeated questions to answer all who have approached me for options (day) trading after my Posts A, B and C",2020-06-21 18:19:53
190,Making the switch to ETFs... here are my potential holdings. Let’s find gold,2020-06-21 23:12:13
191,Who’s got some $ZM porn?,2020-06-22 12:19:56
192,$zm can someone who is bullish on zoom give a reason as to why they believe zoom is a good investment?,2020-06-23 06:56:00
193,"What are ""Contingent Income Auto-Callable Securities"" M.S. about to sell on $ZM ?",2020-06-23 23:23:30
194,Significant Insider Trading Activity (Last 7 Days),2020-06-25 13:42:03
195,"Stock watch List June 26, 2020",2020-06-26 08:46:21
196,My 32p DKNG might print today,2020-06-26 12:47:49
197,Help a noobie not fudge this up!,2020-06-29 22:09:44
198,2 months back at trading (update) and some new questions,2020-06-30 23:12:55
199,[Chart] Voodoo & [Options] Chains - $PLNT,2020-07-01 15:34:15
200,Stock Watch List July 2,2020-07-02 08:42:19
201,How do you know when to sell?,2020-07-02 10:20:12
202,ZM - How it Compares by Market Cap,2020-07-02 19:29:51
203,Q2 Update from the Desk of Jerome Powell,2020-07-05 16:57:32
204,Did you see the woman in the red dress two weeks later?,2020-07-08 16:44:32
205,COVID DEATHS VS THE MARKET,2020-07-08 22:29:26
206,Stock valuations compared to the past,2020-07-09 04:00:24
207,I am going to build a near real-time stock news database/API. Collecting YOUR feature requests,2020-07-09 09:12:02
208,Help me consolidate my portfolio of over 70 companies!,2020-07-12 17:42:29
209,Top Gun Of Retardation.,2020-07-14 12:20:15
210,The trick to keep Stonks going up again and again,2020-07-14 15:22:59
211,Thoughts on 50% ZM / 50% GLD,2020-07-15 01:49:45
212,"Tesla Hit a New High. No, It Was TLSA. Confused?",2020-07-16 01:02:52
213,"Stock Watch List July 16, 2020",2020-07-16 08:45:09
214,"Since fundamentals and earnings don't matter in this market, how are you identifying short term opportunities?",2020-07-17 19:08:16
215,Not Crazily priced stocks,2020-07-19 13:07:20
216,"Stock Analysis: NIO, AMD, TEAM, ZM and More! | ""I Take Requests"" for the Week of July 20th, 2020",2020-07-20 13:26:38
217,What is everyone buying today?,2020-07-24 10:56:41
218,Long DBX into earnings?,2020-07-27 09:19:43
219,What are your sticky cloud stocks?,2020-07-28 14:17:57
220,"""Strike it big stocks for the next decade"", year 1 retrospective",2020-07-30 03:25:45
221,Pre-Earnings Discussion: Dropbox (DBX),2020-08-03 02:50:38
222,TRADE OF THE DAY: Zoom ($ZM) 252.5/255 Vertical Debit Call Spread 4SEP [08/03/20],2020-08-03 09:21:58
223,No strategy but going strong?,2020-08-04 00:39:27
224,Sector Rotation and Positioning,2020-08-10 00:37:33
225,TRADE OF THE DAY: AMD ($AMD) Sell $60 Put 25SEP (Cash-Secured Put) [08/11/20],2020-08-11 09:01:11
226,Zoom Video (ZM) Stock Plunges After Salesforce Sells Stake,2020-08-11 12:34:22
227,gonna start building a Biden/Harris strategy,2020-08-12 15:41:02
228,"Interview with US Investing Champion Leif Soreide (Tips for Stock Selection, Entries/Exits, and Risk Management)",2020-08-17 18:04:21
229,Many years of browsing with the boys but like y’all getting jaded,2020-08-18 23:45:42
230,Why $WORK is the next meme stock that’s heading to the moon,2020-08-27 11:14:16
231,"How I applied Buffet's strategies to my own portfolio, +70% networth, beat SP500 by 40%",2020-08-27 21:58:08
232,"Wall Street Week Ahead for the trading week beginning August 31st, 2020",2020-08-28 17:18:45
233,"Wall Street Week Ahead for the trading week beginning August 31st, 2020",2020-08-29 08:48:38
234,"Wall Street Week Ahead for the trading week beginning August 31st, 2020",2020-08-29 08:50:06
235,Philly's Weekly Watchlist 8/30,2020-08-30 15:22:42
236,"Here is a Market Recap for today, Monday, Aug 31!",2020-08-31 16:40:52
237,Can someone explain why ZM rose so much today?,2020-08-31 23:08:19
238,Stock Market Live Updates 01/09 - ZM Stock Surges,2020-09-01 03:34:18
239,"Stock Watch List September 1, 2020",2020-09-01 08:44:41
240,ZM 5246% up,2020-09-01 12:39:29
241,"Hey! Here is a Market Recap for today, Sept 1",2020-09-01 16:32:20
242,"If This Won’t Get You Unbanned, What Will? (WSB SACIRIFICE)",2020-09-01 19:09:04
243,Find affordable calls,2020-09-01 19:52:29
244,Giving back some tendies,2020-09-02 09:20:00
245,Another 250% Option Play,2020-09-02 20:08:05
246,"Stock Watch List September 3, 2020",2020-09-03 08:45:41
247,Zoom Crushes It by All Measures... Where Does It Go From Here?,2020-09-03 11:27:32
248,Zoom Crushes It by All Measures... Where Does It Go From Here?,2020-09-03 11:28:09
249,I bought a zoom put after their earnings went through the roof.,2020-09-03 19:58:24
250,Playlist Sept 4 2020,2020-09-04 09:18:41
251,"Unusual Options Activity Summary for the week: SNAP, PTON, FB, DDOG, DISH, DD, SMAR",2020-09-06 09:16:56
252,Other (Better) ways to play earnings,2020-09-07 15:20:34
253,"Stock Watch List September 9, 2020",2020-09-09 08:40:04
254,"Stock Watch List September 10, 2020",2020-09-10 08:44:24
255,Why Do SPACs hold market dips so well?,2020-09-10 18:33:20
256,How to predict the next ten year?,2020-09-13 06:03:49
257,"Stock Watch List September 15, 2020",2020-09-15 08:44:41
258,How to be Wrong and Still Make Money: A comprehensive guide to selling credit spreads,2020-09-16 15:46:57
259,"Stock Watch List September 18, 2020",2020-09-18 08:46:18
260,9/18 Watchlist,2020-09-18 09:25:16
261,HOT STOCKS OF THE WEEK | ZM TECK TSLA INO SGMS,2020-09-20 15:04:56
262,"Stock Watch List September 22, 2020",2020-09-22 08:46:57
263,"Stock Watch List September 24, 2020",2020-09-24 08:46:02
264,Stock Competition Update: 3 months in,2020-09-24 17:26:25
265,Which stock might react to quarterly window dressing?,2020-09-27 17:49:01
266,"Stock Watch List September 28, 2020",2020-09-28 08:45:31
267,ZM and SNOW who is still buying?? ZM CEO just cashed in!,2020-09-28 18:10:07
268,Investing in ETFs,2020-09-29 11:46:06
269,"Stock Watch List September 30, 2020",2020-09-30 08:42:43
270,Inexpensive LEAPs on Cannabis Stocks,2020-09-30 12:40:51
271,"Draft for Electric truck player HYLN ""IPO"" and DD",2020-10-01 21:34:10
272,"Electric truck player HYLN ""IPO"" and DD",2020-10-02 07:30:55
273,"Electric truck player HYLN ""IPO"" and DD",2020-10-02 13:00:51
274,Disruptive companies?,2020-10-02 21:00:23
275,Day Trading Playlist Oct. 7 2020,2020-10-07 09:19:03
276,"Stock Watch List October 8, 2020",2020-10-08 08:46:58
277,"Stock Watch List October 9, 2020",2020-10-09 08:46:08
278,A question from an outsider,2020-10-10 18:40:36
279,"Stock Watch List October 12, 2020",2020-10-12 08:47:15
280,Peloton Goes Parabolic,2020-10-12 15:47:40
281,"Market Recap - Monday October 12, PLEASE ENJOY!",2020-10-12 16:29:16
282,Market Recap - Monday October 12 PLEASE ENJOY!!,2020-10-12 16:30:22
283,"Stock watch List October 14, 2020",2020-10-14 08:45:18
284,France is considering a 8pm curfew starting from tomorrow: which stocks would you invest in if more countries slowly moved towards a second lockdown?,2020-10-14 12:59:57
285,"Here is a Market Recap for today Thurs, Oct 15, 2020. Please enjoy!",2020-10-15 16:06:13
286,"Here is a Market Recap for today Thurs, Oct 15, 2020. Please enjoy!",2020-10-15 17:45:14
287,Recovery stocks are the obvious play from here.,2020-10-15 17:59:38
288,"Nearly $10,000 loss today trying to short the $PTON, $SNAP, and $ZM steamrollers. Is this the way?",2020-10-15 18:07:06
289,"Stock Watch List October 16, 2020",2020-10-16 08:45:34
290,$NOK time again!,2020-10-17 18:05:04
291,Everything Is Priced In: Let's calculate how much growth Zoom and Tesla have priced in,2020-10-18 16:41:31
292,"Stock Watch List October 19, 2020",2020-10-19 08:44:56
293,"Stock Watchlist / Idea Mon Oct 19, 2020",2020-10-19 08:45:00
294,"Stock Watchlist / Idea Mon Oct 19, 2020",2020-10-19 08:52:36
295,new highs new lows,2020-10-19 12:05:55
296,"Stock Watchlist Part 2. Tue. Oct, 20",2020-10-20 08:37:59
297,"Holding ~5% cash in my portfolio for a “rainy day” (eg, market correction). Arguments pro or con?",2020-10-20 15:03:39
298,Zoom stock(ZM),2020-10-21 16:18:07
299,"$5,000.00 Loss in a Month",2020-10-23 15:16:08
300,Advice for young environmentally & socially-conscious investors?,2020-10-25 18:40:49
301,"Stock Watch List October 28, 2020",2020-10-28 08:46:03
302,"Stock Watch List October 30, 2020",2020-10-30 08:44:20
303,Election Week Predictions,2020-11-01 01:31:16
304,"No solid foundations this week, stay flexible",2020-11-01 21:09:18
305,"Stock Watch List For November 4, 2020",2020-11-04 08:46:33
306,"Stock Watch List November 5, 2020",2020-11-05 08:35:13
307,FOMO got the better of me,2020-11-05 14:51:30
308,"At this point, if you still haven't made your first 100k yet, you might as well quit",2020-11-05 17:31:19
309,"What is a True Market Leader (TML) + And how to find them? (Ex. SHOP 2016-2020, ZM 2020, AAPL 2005-2012",2020-11-07 10:42:28
310,"What is a True Market Leader (TML) + And how to find them? (Ex. SHOP 2016-2020, ZM 2020, AAPL 2005-2012",2020-11-07 19:03:07
311,I used a web-scraper and Python to compile the average portfolio of the quarterly thread:,2020-11-08 20:19:50
312,Phillys Weekly Watchlist. Its been awhile! [Long list ],2020-11-08 22:32:34
313,"I've been selling 0.2 delta 14 DTE put spreads on ""covid proof"" stocks.",2020-11-09 08:06:30
314,"Stock Watch List November 9, 2020",2020-11-09 08:41:18
315,"After testing support at $412.29, $ZM was able to bounce and is now testing key level of $446.50. If stock breaks to upisde, levels are $461.6, $471, $483.71. Stock is 11% down",2020-11-09 11:58:02
316,"PsychoMarket Recap - Monday, November 9, 2020",2020-11-09 16:12:50
317,"Pandemic 'stay at home stocks' like Peloton, Zoom, Roku tank on Pfizer vaccine news—is it an overreaction?",2020-11-09 21:41:37
318,LexaGene ($LXXGF or $LXG) Automated Rapid Pathogen Detection System,2020-11-10 07:38:37
319,Overreaction?,2020-11-10 09:52:42
320,"Zoom Share Price | Zoom Stock Chart. ISIN: US98980L1017 | Symbol: ZM | Type: Ordinary Shares. Real-time shares price updates for Zoom, technical analysis and fundamental analysis.",2020-11-10 11:49:52
321,What stocks have the same insane premium to stock price ratio as ZM?,2020-11-12 14:04:35
322,"The Most Popular Tickers on Reddit for Today, 2020-11-14",2020-11-14 21:08:46
323,"Which one of you got put in charge of the largest U.S Pension? CALPERS buys hundreds of thousands of shares in NKLA, NIO, and ZM",2020-11-15 16:58:06
324,"Stock Watch List November 16, 2020",2020-11-16 08:40:32
325,"Here is a Market Recap for today Monday, Nov 16, 2020. Please enjoy!",2020-11-16 16:03:10
326,Stock Watch List - Nov 17 2020 ($NFLX $QDEL $SNAP $PLUG $ETSY $ZM $QCOM $AMD $RKT $AAPL $PINS $GM $TSLA),2020-11-17 01:52:05
327,Stock Watch List - Nov 18 2020 ($BABA $QDEL $NFLX $FSLY $ZM $DKNG $KSS $TWLO $QCOM $RUN $PTON $EXPE),2020-11-18 01:46:15
328,Beginners luck...,2020-11-18 13:36:56
329,Watchlist 11-19-20 👀,2020-11-18 21:53:13
330,Watchlist 11-19-20 👀,2020-11-18 21:55:25
331,Swing and daytrading mostly naked options,2020-11-20 01:46:35
332,"The Most Popular Tickers on Reddit for Today, 2020-11-20.",2020-11-20 17:30:14
333,ZM Speculation Double D's,2020-11-20 19:25:40
334,Dr. Michael Burry is gonna iLUMNate your portfolio with tendies.,2020-11-20 22:34:47
335,November 23rd | Templar Trading Daily Watchlist,2020-11-23 07:55:24
336,November 23rd | Templar Trading Daily Watchlist,2020-11-23 08:14:38
337,"Here is a Market Recap for today Monday, November 23, 2020. PLease enjoy!",2020-11-23 16:25:52
338,"Here is a Market Recap for today Tuesday, Nov 24, 2020. Please enjoy!",2020-11-24 16:55:15
339,"Stock Watch List November 25, 2020",2020-11-25 08:40:06
340,Gains from me mums ashes,2020-11-25 09:56:27
341,"Take your winnings and switch tables - NIO, BLNK, LI, XPEV, etc to BABA, GME, FSLY, OSTK",2020-11-25 11:57:35
342,"Real Institutional DD for you losers, how to play this market",2020-11-25 13:40:36
343,"Stock Watch List November 27, 2020",2020-11-27 08:45:21
344,"Wall Street Week Ahead for the trading week beginning November 30th, 2020",2020-11-28 10:24:47
345,"Wall Street Week Ahead for the trading week beginning November 30th, 2020",2020-11-28 10:29:20
346,"Wall Street Week Ahead for the trading week beginning November 30th, 2020",2020-11-28 10:30:39
347,"Stock Watch List November 30, 2020",2020-11-30 08:43:31
348,"Stock Watch List December 1, 2020",2020-12-01 08:44:08
349,"Here is a Market Recap for today Tuesday, December 1, 2020",2020-12-01 16:00:00
350,"TOP 3 OVERSOLD STOCKS IM BUYING! | BABA,NIO,ZM 📈",2020-12-01 20:20:13
351,"$157K to $757K (and $50K loss today): ZM, PRPL, FMCI .... and now two YOLOs to $1MM+ ... IPOB and OAC",2020-12-01 21:16:03
352,Coming Back to Electric Truck Player Hyliion (HYLN) - and DD,2020-12-07 21:39:08
353,Bubble??,2020-12-09 13:33:33
354,I just got in on the ABNB IPO via the Directed Shares for Hosts. How would you handle it?,2020-12-09 21:05:59
355,LUMN - getting ready for breakout,2020-12-09 23:57:51
356,What are your favorite sources for tracking the market?,2020-12-15 18:43:56
357,My dad actually subscribed to Motley Fool ~2 years ago. And has a 62% return so far.,2020-12-18 20:48:53
358,"Stock Watch List For December 21, 2020",2020-12-21 08:45:23
359,Portfolio of 19 stocks. What should be my 20th?,2020-12-21 19:52:45
360,"Tips/suggestiosn for my portfolio? 30 years old, started investing 1 year ago",2020-12-22 08:02:17
361,How to spot an explosive breakout,2020-12-22 14:46:00
362,Any hope for Zoom?,2020-12-22 20:05:37
363,Help in Understanding Gamma Exposure (GEX),2020-12-27 00:04:43
364,Bear case on ARK etfs?,2020-12-27 13:23:49
365,Investing Untangled - My new YouTube channel focussed on value investing,2020-12-28 15:39:32
366,Right exit strategy,2020-12-28 16:17:54
367,What is over diverstified portfolio?,2020-12-29 15:45:29
368,"Down 19% on $140,000 investment in $ZM (Zoom) stock. What is your investor sentiment on its mid-long term trajectory?",2021-01-01 17:49:24
369,"How did you find these stocks, decided entry/exit points, investment amount in 2020 and what is on your buy and hold list for 2021 for growth?",2021-01-02 02:48:01
370,"Market went down today due to virus fears, but these stock rose up.",2021-01-05 02:00:18
371,Cant you use leaps expiring next week to your advantage?,2021-01-07 21:51:33
372,Inflation + Stimulus = Buy Shipping (Discussion),2021-01-08 21:49:29
373,Small Cap opportunities for 2021,2021-01-09 13:02:01
374,My first attempt to analyze chart and maybe I found anomaly!,2021-01-10 14:02:54
375,Why I think Motley Fool is a legitimate resource for stock picking,2021-01-11 13:25:29
376,$TAUG Tauriga Sciences Inc. Renews its Status as an Affiliate Vendor to the National Association of College Stores,2021-01-12 15:28:32
377,"Zoom Puts are Free Money, DD Inside",2021-01-13 21:06:57
378,"Stock Watch List For January 15, 2021",2021-01-15 08:45:26
379,Premium Sellers 🥳,2021-01-18 18:00:34
380,AAPL is planning a new ad-free podcasting subscription service to increase podcaster revenue. This could force SPOT’s hand to follow suit,2021-01-20 15:20:48
381,Cloud Based Stocks - Some thoughts on Moovly Media (TSXV: MVY),2021-01-24 12:12:17
382,Blackberry (BB) Strategic Analysis using Options,2021-01-24 15:00:01
383,Since everyone seems to be an expert on gamma squeezes...,2021-01-24 19:58:44
384,QSAM Biosciences Closes Series B Preferred Private Placement; $2.5 Million in New Capital to Fund Upcoming Clinical Trials,2021-01-28 15:11:56
385,Is ZM the next big thing??,2021-01-31 07:55:59
386,$SPCE potentially an interesting sideshow 👀👀,2021-02-01 17:39:52
387,DDDD - Is GME being Illegally Naked Short Sold?,2021-02-02 03:59:55
388,"Emotional investing, lack of research & shilling",2021-02-02 05:37:15
389,Understanding Debit Spreads,2021-02-06 17:51:50
390,Fidelity Investments Sold Its Entire Stake in GameStop. Time to realize it’s not WSB vs Wall St and move on with your life,2021-02-10 14:25:15
391,$GMEV: Hydroponics + Vertical Farming = Investment to Mars!,2021-02-11 19:14:24
392,Should I be looking at ETF’s for long term? Any advice would be awesome. Thanks,2021-02-14 01:58:09
393,Does anyone else think a catastrophic market crash is NOT coming anytime soon?,2021-02-14 09:01:42
394,ZM play,2021-02-18 15:33:05
395,Ray Dalio's hedge fund unloaded its stake in Tesla and poured millions into Goldman Sachs and JPMorgan in the 4th-quarter.... Blackberry,2021-02-19 09:20:46
396,NEW TRADERS: The internet is loaded with bad advice on buying individual stocks—your core portfolio should be built on old principles,2021-02-19 13:08:19
397,"Daily Play, Yesterday it was better to go with the defensive play, today I will also have 2 picks in case market goes red, we must rotate sectors if there is correction",2021-02-23 07:03:07
398,"Ideas and plays in case we have a correction, a good thesis on why the correction as well. Good luck!",2021-02-23 07:11:17
399,Has this really happened,2021-02-26 02:44:09
400,$IMII – Inception Mining Inc. – A Profitable Gold-Mining Penny Stock??,2021-02-26 12:47:40
401,"ZM, NVAX, OKTA, SE, LMND, FUBO, NIO Stock Earnings & More This Week!",2021-02-28 14:28:41
402,"Expected moves for the week, SPY, Zoom, NIO, Snowflake, Slack and more.",2021-02-28 17:36:03
403,(3/2) Tuesday's Pre-Market Stock Movers & News,2021-03-02 08:40:43
404,(3/2) Tuesday's Pre-Market Stock Movers & News,2021-03-02 08:42:04
405,"Game Plan for March 2, 2021",2021-03-02 08:46:44
406,"Here is a Market Recap for today Tuesday, March 2, 2021. Please enjoy!",2021-03-02 16:44:51
407,"Here is a Market Recap for today, Tuesday, March 2, 2021. Please enjoy!",2021-03-02 16:45:20
408,"Here is a Market Recap for today Tuesday, March 2, 2021. Please enjoy!",2021-03-02 16:46:00
409,Cathie Wood ArkInvest 03/02 | ARK ETFs Briefing | Buy Buy Buy,2021-03-03 03:22:25
410,Interesting summary from the NYT Dealbook on SPAC structures evolving,2021-03-03 08:50:09
411,CCL will sink in 2021 like their aging ships,2021-03-04 12:17:56
412,Where is SNOW heading?,2021-03-04 18:23:22
413,"Cathie's most bought / sold stocks this week (as % of ETF). Top buys: ZM, TSLA, TDOC. Top sells: TSM, PYPL, FB. (PLTR 11th most bought stock this week!)",2021-03-06 05:21:07
414,"Here is a Market Recap for today Monday, March 8, 2021.",2021-03-08 16:37:09
415,"Here is a Market Recap for today Monday, March 8, 2021.",2021-03-08 16:39:09
416,Buy the dip growth candidates,2021-03-08 23:57:34
417,Pandemic-proof stocks?,2021-03-09 15:05:24
418,Pandemic proof stocks?,2021-03-09 16:14:06
419,Great presentation by Innoviz ($CGRO),2021-03-10 02:06:23
420,Me looking back at all the stocks that I have owned a year ago,2021-03-10 20:11:06
421,Short interest: Enough for GME?,2021-03-11 05:39:14
422,"IlLUMNated? Who Wins and Loses When Autists, Christian Bale and Tendies Collide?",2021-03-11 23:13:36
423,$ZOM sells first Truforma unit,2021-03-16 08:28:01
424,Will Mid-Summer Be Prime for Covid Plays Again,2021-03-17 00:55:13
425,Applying Occum's razor to the stock market,2021-03-17 07:18:32
426,"Game Plan for March 17, 2021",2021-03-17 09:12:32
427,"$MITC First Public Cultured Meat Company, Meatech 3D",2021-03-18 11:37:35
428,BNGO Earnings Likely Outcomes (could b wrong),2021-03-21 19:27:56
429,Handling of Vertical Put Spread (Debit),2021-03-22 20:23:50
430,"Your Mom's Game Plan for March 24, 2021",2021-03-24 09:06:20
431,(3/26) Friday's Pre-Market Stock Movers & News,2021-03-26 08:27:56
432,(3/26) Friday's Pre-Market Stock Movers & News,2021-03-26 08:29:09
433,"Dissecting the SPACrash: Growth, Rising Yields, and the Rotation to Value (long post)",2021-04-01 17:09:49
434,"MCI-MCIC, The TuSimple IPO, and how to profit off retards",2021-04-13 17:47:05
435,"Diversification, Questions about ETFs: STOCKS (VTI/IVOG/VONG)",2021-04-21 22:10:56
436,My $ZM DD was on point and you can still profit from it!,2021-04-28 18:50:28
437,2021 Stock Draft,2021-04-29 21:02:36
438,Why the stock market is falling now.,2021-05-13 09:33:21
439,"Pension Fund Trims GME Holdings, But Not By Much! How About An AMA With Pension Funds Managers?",2021-05-22 17:54:11
440,Buy Zoom (ZM) Stock Down 40% Before Q1 Earnings?,2021-05-27 20:02:31
441,$Z will disrupt most aspects of the industry that has one of the biggest addressable markets (TAM),2021-05-31 17:02:59
442,"Larry Cheung, CFA - Zoom (ZM) Stock Analysis 2021",2021-05-31 18:45:32
443,"Larry Cheung, CFA - Zoom (ZM) Stock Analysis 2021",2021-05-31 18:46:23
444,"Cleanest Options Flow from Last Week - Setups going into Next Week - QQQ, CRWD, ARKK, PAGS, ZM, ABNB",2021-05-31 22:36:46
445,"Here is a Market Recap for today Wednesday, June 2, 2021",2021-06-02 16:41:23
446,Post earnings insight shows possible upside for $ZM,2021-06-03 10:16:46
447,Twilio still down from the end of April?,2021-06-04 13:27:04
448,"Cleanest + Repeated Options Flow Plays Series # 3 - AMC, CLNE, FUBO, ARKK. FB, FUTU, JMIA",2021-06-06 19:52:30
449,Don't Look Now But ZM About To Zoom.,2021-06-10 13:13:29
450,"The OG Stock Watch List June 11, 2021",2021-06-11 08:48:27
451,Recap of today's trading - 6/16,2021-06-16 18:38:41
452,How To Find The Best Stocks to Invest In (A Beginner's Guide),2021-06-18 19:21:23
453,Day Trading Options,2021-06-20 17:16:12
454,"Preparation for trading day - June 22, 2021",2021-06-22 07:57:02
455,Prediction Stocks movement for this week,2021-06-22 23:56:59
456,CLOV detailed DD,2021-06-23 02:18:49
457,"My prediction results . AMD, PLTR , NIO who are the winners?",2021-06-23 10:41:38
458,Day Trading Options,2021-06-23 21:31:26
459,"As a trader/investor there are bad days, weeks, months, even quarters.. We rarely have bad years, so please do not get down on yourself and remember we must live to see another day! Earnings season is coming in full swing and it will be judgement day!",2021-07-11 22:25:48
460,"As a trader/investor there are bad days, weeks, months, even quarters.. We rarely have bad years, so please do not get down on yourself",2021-07-11 22:27:03
461,Todays most active stock options $AMD $TSLA $F $ZM $TLRY,2021-07-29 12:18:33
462,Important dates from my watch list.,2021-07-29 20:21:14
463,"Wall Street Week Ahead for the trading week beginning August 9th, 2021",2021-08-06 19:03:30
464,"Wall Street Week Ahead for the trading week beginning August 9th, 2021",2021-08-06 19:04:19
465,Strategy Upon Market Correction,2021-08-22 14:59:58
466,"Stock Watch List August 26, 2021",2021-08-26 08:46:24
467,Here's Your Daily Market Brief For August 26th,2021-08-26 08:51:56
468,Reflection of 749 options trades in 2 years,2021-08-27 02:57:44
469,"Wall Street Week Ahead for the trading week beginning August 30th, 2021",2021-08-28 08:25:41
470,"Wall Street Week Ahead for the trading week beginning August 30th, 2021",2021-08-28 08:29:09
471,"Wall Street Week Ahead for the trading week beginning August 30th, 2021",2021-08-28 08:30:17
472,"Expected Moves SPY, USO. Earnings from ZM, CHWY, CRWD, DOCU.",2021-08-29 16:45:33
473,"Analyst’s Positive On Zoom (ZM) Stock Ahead of Earnings, Despite Concerns",2021-08-30 09:56:29
474,🚨 ZOOM STOCK (ZM) JUST CRASHED AFTER EARNINGS,2021-08-30 19:10:03
475,"Stock Watch List August 31, 2021",2021-08-31 08:47:40
476,"Morning Update for Tuesday, 08/31/21",2021-08-31 08:47:54
477,"Morning Update for Tuesday, 08/31/21",2021-08-31 08:49:03
478,Zoom (ZM) Stock Falls 11% As Guidance Comes In Below Forecasts,2021-08-31 08:56:58
479,Here's Your Daily Market Brief For August 31st,2021-08-31 09:12:24
480,Here's Your Daily Market Brief For August 31st,2021-08-31 09:12:29
481,Options Stock Ranker for Aug-31-2021,2021-08-31 16:21:08
482,"PsychoMarket Recap - Tuesday, August 31, 2021",2021-08-31 16:36:58
483,"PsychoMarket Recap - Tuesday, August 31, 2021",2021-08-31 16:37:58
484,"@Reuters: ByteDance says it will downsize fintech business, plans to sell stock broker ops https://t.co/zmDVsmyLR8 https://t.co/gmu43i7qlJ",2021-09-02 04:07:37
485,"POLY, At a recent $32, the stock now trades for about 0.7 times anticipated revenue for the March 2023 fiscal year, and just under eight times projected profits for the same period. In comparison, Logitech International (LOGI), 22 times.",2021-09-02 10:59:40
486,"Zen Graphene with 'Paradigm Changing Applications' in Healthcare, Green Energy, and Materials Science",2021-09-02 13:13:12
487,"Zen Graphene with 'Paradigm Changing Applications' in Healthcare, Green Energy, and Materials Science",2021-09-02 13:18:11
488,Is this the end of ZOOM (ZM) Stock?,2021-09-04 22:31:33
489,What do you feel have been your 5 most profitable tickers this year? Whether it be from trades or long term hold and you still have not sold. This is a good way to brain storm and see if there is a way to broaden your watch list and get an idea of others' Winners.,2021-09-05 09:15:10
490,What do you feel have been your 5 most profitable tickers this year? Whether it be from trades or long term hold? Let us help each other,2021-09-05 09:19:06
491,Most expensive calls and most expensive puts (ATM premium/underlying price) for 145 tickers.,2021-09-07 07:15:09
492,Oil Producers and why I like $OXY,2021-09-14 11:29:00
493,Oil producers and my favorite from this sector,2021-09-14 11:33:47
494,ZM DD (STFU Slim Jim Cramerrrr),2021-09-15 15:27:09
495,Imagine you bought a crypto coin and wait for a rebound.This is a coin miner company.This may surprise you in the future.,2021-09-17 13:20:02
496,How to Play the Current Market Drop,2021-09-19 14:51:59
497,Current Market Providing Great Opportunities for both Small and Large Accounts,2021-09-19 14:54:21
498,"$ZM - Needham sees #Genesys and $KLTR as 'Plan B options' if $FIVN deal is derailed, remains cautious on stock",2021-09-21 11:26:03
499,"Morning Update for Friday, 10/01/21",2021-10-01 08:43:06
500,"Morning Update for Friday, 10/01/21",2021-10-01 08:45:03
501,"Stock Watch List October 1, 2021",2021-10-01 08:48:21
502,Requesting Historical Data for Multiple Symbols with ib insync,2021-10-09 02:51:02
503,"Stock Watch List October 14, 2021",2021-10-14 08:48:31
504,"Morning Update for Friday, 10/22/21",2021-10-22 08:37:29
505,"Morning Update for Friday, 10/22/21",2021-10-22 08:38:45
506,"Stock Watch List October 22, 2021",2021-10-22 08:45:34
507,"Thomas1774Paine: Isn't announcing you're shorting Trumps new stock -- isn't that market manipulation? Oh, just a 'little' ... https://t.co/X3L50YraZM",2021-10-25 23:19:28
508,"Will there be some pain in $ARKK into year end? (I know, I know)",2021-11-07 06:03:43
509,"I scraped r/options for the top ticker mentions in the last 24H. Here are the results (Thursday November 11, 2021)",2021-11-11 03:35:02
510,$ZM PUTS is the next easy play,2021-11-11 12:09:22
511,Splunk Stock Slumps and Cathie Wood’s ARK Buys the Drop,2021-11-16 05:02:26
512,Rivian - Is this the right time to buy?,2021-11-16 08:56:33
513,Rivian - Is this the right time to buy?,2021-11-16 09:01:39
514,$MVES is the counterintuitive Metaverse play (A fat-fingered phenomenon!!),2021-11-16 09:23:58
515,Rivian - Is this the right time to buy?,2021-11-17 09:07:09
516,"Morning Update for Friday, 11/19/21",2021-11-19 08:46:12
517,"ZM Earnings: ZM will plummet, but by how much?",2021-11-19 13:14:32
518,"Wall Street Week Ahead for the trading week beginning November 22nd, 2021",2021-11-19 19:49:22
519,"I scraped r/options for the top ticker mentions in the last 24H. Here are the results (Sunday November 21, 2021)",2021-11-21 03:35:01
520,"The week ahead in options. Tesla, Rivian, Lucid, NIO, Zoom, and more.",2021-11-21 15:10:28
521,"Historical Post Earnings Moves MEGA Compilation AND Analysis (Q3 Week 7) - $ZM, $BBY, $DKS, $DLTR, $PDD, $XPEV, $DE, and More",2021-11-21 16:46:23
522,"Historical Post Earnings Moves MEGA Compilation AND Analysis (Q3 Week 7) - $ZM, $BBY, $DKS, $DLTR, $PDD, $XPEV, $DE, and More",2021-11-21 18:14:59
523,ZM iron condor that expires 11/26,2021-11-21 22:02:30
524,"I scraped r/options for the top ticker mentions in the last 24H. Here are the results (Monday November 22, 2021)",2021-11-22 03:35:02
525,Options Stock Ranker for Nov-22-2021,2021-11-22 16:15:11
526,"HoT StOCkS -- ISPC, ZM, SAND.X, AADI, XPEV, LGVN, AMP.X, BBY, MDT, ARKK, DLTR, GENI, ADI, J, UDMY, DKS, MU, AEO, BURL, SJM, DY, CRO.X, MOV, LORL, MRVL, AIRS, TITN, ANF, BYSI, BOIL",2021-11-23 07:56:18
527,Todays most active stock options $AAPL $TSLA $NIO $ZM $PAGS $DKNG $LCID $F,2021-11-23 12:47:13
528,Options Stock Ranker for Nov-23-2021,2021-11-23 16:15:09
529,"Wish Price target $25. If it can last that long, sure. I have seen beaten down stocks which can figure out a turn around strategy can go at least 700% from their lowest price. In this case 3.57 x 7 = 24.99 I Examples: ETSY, FB, NIO, ZM, TWLO, TSLA, ROKU, SQ, PINS, TLRY, M",2021-11-24 11:23:53
530,"Morning Update for Friday, 11/26/21",2021-11-26 08:17:08
531,A look at the week ahead using options flow data: Covid Stocks edition $PFE $MRK $PTON $ZM $WMT etc,2021-11-28 13:29:46
532,"Technical analysis of Zoom Stock | ISIN: US98980L1017 | Symbol: ZM dated November 28, 2021. 14 technical indicators on the daily timeframe show a signal: SELL. Details on the official website:",2021-11-28 15:35:17
533,(11/29) Monday's Pre-Market Stock Movers & News,2021-11-29 08:24:04
534,(11/29) Monday's Pre-Market Stock Movers & News,2021-11-29 08:28:43
535,"Morning Update for Monday, 11/29/21",2021-11-29 08:44:41
536,(12/1) Wednesday's Pre-Market Stock Movers & News,2021-12-01 08:59:47
537,(12/1) Wednesday's Pre-Market Stock Movers & News,2021-12-01 09:02:01
538,(12/1) Wednesday's Pre-Market Stock Movers & News,2021-12-01 09:02:56
539,Zoom’s Microsoft Problem Comes to Light,2021-12-02 08:36:19
540,Zoom’s Microsoft Problem Comes to Light,2021-12-02 08:36:38
541,Zoom’s Microsoft Problem Comes to Light,2021-12-02 08:37:10
542,"TDOC holder, trying to calm myself...",2021-12-02 09:26:51
543,"TDOC holders, will we overcome???",2021-12-02 09:29:08
544,"Morning Update for Friday, 12/3/21",2021-12-03 08:36:33
545,"Here is a Market Recap for today Friday, December 3, 2021. Please enjoy!",2021-12-03 17:33:54
546,"Here is a Market Recap for today Friday, December 3, 2021. Please enjoy!",2021-12-03 17:34:23
547,Pandemic stocks Valuation after the recent selloff,2021-12-04 15:19:11
548,Pandemic hype stocks are returning to May 2020 levels. What's next?,2021-12-06 20:27:49
549,Valuation doesn't matter until it does,2021-12-06 20:45:36
550,ZM is Looking Good,2021-12-07 10:49:58
551,ARRK Position,2021-12-07 23:13:54
552,Microvision (MVIS)- SIMON SAYS it's the PERFECT SHORT,2021-12-12 18:20:15
553,Could Square's deal to buy Afterpay face the same fate as Zoom's deal to buy Five9?,2021-12-13 08:30:28
554,Is it just me or has this sub been quiet recently for everyones portfolio who is actively investing is either in the red or got burnt?,2021-12-14 21:03:01
555,$ZM a great day a great play. Lest see correction/continuation Monday. #JointheWinningTeamDTC #StocksToBuy #stockstowatch #StockMarket #stocks https://t.co/bRYTgHV4Jn,2021-12-17 20:29:44
556,$ZM a great day a great play. Lest see correction/continuation Monday. #JointheWinningTeamDTC #StocksToBuy #stockstowatch #StockMarket #stocks https://t.co/bRYTgHV4Jn,2021-12-17 20:30:38
557,"Morning Update for Monday, 12/20/21",2021-12-20 09:20:52
558,"$ZM, $PTON, $ROKU you welcome #stocks #stockmarkets #StocksToBuy #stockstowatch https://t.co/dtFSe1QTCr",2021-12-30 11:00:16
559,"$ZM, $PTON, $ROKU you welcome #stocks #stockmarkets #StocksToBuy #stockstowatch https://t.co/dtFSe1QTCr",2021-12-30 11:04:19
560,Growth vs Value,2022-01-04 16:19:13
561,Stocks that will dip 50% or more in 2022?,2022-01-11 07:20:28
562,"Morning Update for Friday, 1/14/22",2022-01-14 09:21:11
563,Is this a good buy opportunity for growth stocks?,2022-01-14 12:16:15
564,"Stock Pattern Head-and-Shoulders Top ZM on December 30, 2021",2022-01-14 13:14:30
565,"Stock Pattern Broadening Bottom ZM on January 06, 2022",2022-01-22 15:23:42
566,Zoom (ZM) is now trading below the price it was at almost 2 years ago when it was announced that it would join the Nasdaq-100 index,2022-01-23 03:53:42
567,Top stock option open interest changes $DT $DKNG $INTC $LVS $VST $F $CCL $NLY $GM $ZM,2022-01-24 07:38:19
568,Looking for large-cap (10B+ market cap) ARK-like stocks to short,2022-01-30 03:53:34
569,Advice on Stock Picks Appreciated,2022-02-06 14:00:22
570,Are we prepared for Facebook (Meta) free cash flow to drop 46% in 2022!!?? Nonetheless it is still a buy,2022-02-06 18:25:06
571,FATH low float bull thesis no longer holds,2022-02-09 05:54:17
572,I compared ~20 ETFs to create an income portion of my portfolio,2022-02-14 11:09:53
573,"“Stock market faces the most ‘massive misallocation’ of ‘capital in the history of mankind,’ ARK’s Cathie Wood” — 2/17 MarketWatch Article",2022-02-18 00:42:00
574,Notable Tech/Software Companies with High FCF Yield %,2022-02-18 18:34:45
575,Tech/Software Stocks with Attractive FCF Yield %,2022-02-18 18:37:58
576,I have my eye on select stocks which I think will have a good run in the future $WIMI $AAL $ZM,2022-02-18 21:33:02
577,We're back to where we started in 2020,2022-02-18 22:36:47
578,You're top 3 stops as of today,2022-02-23 19:02:27
579,"Wall Street Week Ahead for the trading week beginning February 28th, 2022",2022-02-26 08:02:23
580,"Wall Street Week Ahead for the trading week beginning February 28th, 2022",2022-02-26 08:48:28
581,"Options expected moves this week. SPY, TSLA, CRM, ZM and more.",2022-02-27 16:48:39
582,How do I buy deep OTM calls on RuPaul?,2022-02-28 13:07:47
583,My current plays for tomorrows- thoughts,2022-02-28 17:14:25
584,"hot 🔥🔥🔥🔥🔥📉📉🔥📈 stocks LCID, BTC.X, RSX, ETH.X, TGT, MARA, LUKOY, ZM, LUNA.X, SOFI, LHX, VRM, DPZ, SE, RUSL, TGTX, UMA.X, VFF, WDAY, LTC.X, DDD, BIDU, USO, EMN, ALBO, CME, MLCO, ET, CPE, EHTH",2022-03-01 09:10:51
585,Zoom's Pandemic Growth Stops,2022-03-01 10:11:13
586,Zoom's Pandemic Growth Stops,2022-03-01 10:11:29
587,Zoom's Pandemic Growth Stops,2022-03-01 10:11:38
588,Here's Your Daily Market Brief For March 2nd,2022-03-02 08:09:23
589,Here's Your Daily Market Brief For March 2nd,2022-03-02 08:09:29
590,Is #ZM Stock a Buy Right Now? 3 Analysts Weigh In on #Zoom Price Predictions. - Read more on PipPost,2022-03-02 08:30:22
591,Buying tech is literally the best thing you can do atm,2022-03-02 12:41:23
592,Is #ZM Stock a Buy Right Now? 3 Analysts Weigh In on #Zoom Price Predictions. - Read more on PipPost,2022-03-02 19:05:10
593,"Stock Pattern Three Falling Peaks ZM on February 15, 2022",2022-03-02 19:35:56
594,"Stock Pattern Triangle Symmetrical Top ZM on February 15, 2022",2022-03-04 19:02:45
595,"Stock Pattern Triangle Descending ZM on February 16, 2022",2022-03-06 23:47:04
596,ZM Stock Is the Metaverse Investment Everyone's Missing,2022-03-09 01:22:12
597,"Stock Pattern Triangle Symmetrical Bottom ZM on February 11, 2022",2022-03-10 20:17:45
598,"Stock Pattern Triangle Symmetrical Top ZM on February 10, 2022",2022-03-15 12:31:23
599,Is there a way to know WHEN an analyst is going to review a stock?,2022-03-17 07:20:56
600,Todays top stock option open interest changes $XOM $AMC $HTZ $VRM $ZM $MCHP $GOLD $JD $XRX,2022-03-24 07:41:42
601,Largest decreases in stock option open interest so far this week - $T $F $ZM $PDD $AAPL $KGC $CAN $BABA $TSLA $JD $NIO $NVDA,2022-03-25 08:04:30
602,Largest decreases in stock option open interest $T $AAPL $F $ZM $PDD $KGC $CAN $TNET $UBER $AMC $JD $FLEX,2022-03-26 08:50:14
603,ZM Double Bottom Thoughts?,2022-04-03 17:03:32
604,DKNG (DraftKings) Compared to other Growth Stocks,2022-04-11 15:13:23
605,Why Is Zoom (ZM) Stock Up Today? - Read more on PipPost,2022-04-14 10:45:11
606,Why Is Zoom (ZM) Stock Up Today? - Read more on PipPost,2022-04-14 21:30:09
607,"Are ""Retail"" Stocks Oversold due to Taxes?",2022-04-18 12:25:27
608,"Jim Cramer's, 04/14 Mad Money Stock Recommendations",2022-04-18 17:37:48
609,"Jim Cramer's, 04/14 Mad Money Stock Recommendations",2022-04-18 18:42:59
610,"Here is a Market Recap for today Friday, April 22, 2022",2022-04-22 17:11:44
611,What are your favorite ARKK holdings on fire sale?,2022-05-01 11:28:05
612,POWcycle: The Endgame,2022-05-07 04:11:27
613,"Zoom (NASDAQ:ZM) stock fell 3.6% after Piper Sandler downgraded its stance on the video conferencing company to ‘neutral’ from ‘overweight’, saying the company’s other products have “limited upside”.",2022-05-12 13:59:46
614,Zoom is fucked.,2022-05-14 23:25:51
615,"Zoom - #ZM Stock Review - April 2, 2022",2022-05-19 13:26:51
616,Stocks reporting next week ordered by PE and trade above 1 billion market cap with options available,2022-05-20 15:47:18
617,"The question now is what, if any, stocks to buy that are down 60+%?",2022-05-20 21:49:44
618,"Wall Street Week Ahead for the trading week beginning May 23rd, 2022",2022-05-21 08:24:40
619,"Expected moves. Zoom, Nvidia, Shopify, Alibaba, Costco and more.",2022-05-22 15:27:48
620,Stock futures gain as Wall Street looks to snap 8-week losing streak,2022-05-23 00:59:40
621,"$TSLA Tesla sold for $32.06B today. No more words but BTW, if I were you, I will pay more attention to the following growth stocks $TWTR $WIMI $PLUG $ZM",2022-05-23 03:38:33
622,"Zoom earnings beat expectations, stock soars 18% after hours - is this the start of the tech rebound?",2022-05-23 17:11:44
623,ZM earnings are half of last year. Misses forecast. Stock shoots up and gains 10%,2022-05-23 17:18:10
624,Why I am bullish on ZM stock after earnings | Utradea,2022-05-23 17:41:29
625,Why I am bullish on ZM stock after earnings | Utradea,2022-05-23 19:17:32
626,"🔥🔥🔥🔥🔥🔥 Hot stocks -- LKNCY, SNAP, BBY, ZM, ANF, RL, DOCN, CSIQ, WOOF, AZO, SOTK, FSR, INFA, QURE, HON, INMB, SPNS, JWN, J, ALPN, BRKL, UTHR, PEGA, OPRT, CUTR, DSX, DIA, NTRA, PRU, BDN",2022-05-24 08:42:47
627,(5/24) Tuesday's Pre-Market Stock Movers & News,2022-05-24 09:13:20
628,(5/24) Tuesday's Pre-Market Stock Movers & News,2022-05-24 09:14:42
629,"Hot stocks 00 SNAP, CCL, PINS, ETC.X, ROKU, ZM, BBY, SMG, CSIQ, ANF, WOOF, MQ, GOOG, LKNCY, DKS, CLBK, WSBC, AZO, URBN, RL, DSX, BANR, PHAT, JWN, DXCM, TTD, UHAL, MU, LSCC, FIL.X",2022-05-24 13:11:42
630,"GFAI, SNAP, ZM, AAPL, FB, FUV. Stock Market Crash 2022. Has The Market B...",2022-05-24 17:54:07
631,"GFAI, SNAP, ZM, AAPL, FB, FUV. Stock Market Crash 2022. Has The Market B...",2022-05-24 17:54:24
632,"GFAI, SNAP, ZM, AAPL, FB, FUV. Stock Market Crash 2022.",2022-05-24 18:14:01
633,Todays top stock option open interest changes $PBR $CCL $LAZR $SNAP $DVN $ZM $INTC $GM $PINS $RIVN,2022-05-25 08:02:35
634,(5/25) Wednesday's Pre-Market Stock Movers & News,2022-05-25 08:16:35
635,#Zoom (ZM) Stock Climbs on Q1 Earnings Beat - Read more on PipPost,2022-05-25 11:00:12
636,Zoom (ZM) Stock Climbs on Q1 Earnings Beat - Read more on PipPost,2022-05-25 21:20:09
637,(5/26) Thursday's Pre-Market Stock Movers & News,2022-05-26 08:53:07
638,Largest increases in stock option open interest this week $CCL $CHPT $NCLH $HTH $PBR $SOFI $SBUX $LAZR $AMD $AAL $ZM,2022-05-27 08:24:16
639,Spotlight on a 2x Leveraged ETF FNGG-Holdings are Worth Taking a Look At,2022-06-03 19:22:55
640,"Stock Pattern Broadening Wedge Descending ZM on May 11, 2022",2022-06-08 20:15:00
641,"Cathie Wood sees 13x surge in Zoom ($ZM) by 2026, targets $1,500 stock price, panning mandates to end remote working as ‘trial-and-error’",2022-06-10 01:35:41
642,skyrocket,2022-06-13 14:33:30
643,Why there is a chance of Thermonuclear war and how to profit from it,2022-06-21 21:27:30
644,"While the overall markets continue to be weak, $RGC ’s share price has performed well since April.",2022-06-22 11:36:46
645,"Here is a Market Recap for today Wednesday, July 6, 2022",2022-07-06 16:19:37
646,"5 GROWTH STOCKS down 75% - ABNB, ZM, SPOT, NFLX, PYPL - Any Value There Now?",2022-07-10 08:36:53
647,There are 3 major signs inflation may have peaked — but they don't mean things are going to get cheaper right away By Ben Winck,2022-07-12 14:28:17
648,RGC: CEO Figuratively Putting His Money Where His Mouth Is,2022-07-13 09:12:37
649,"Here is a Market Recap for today Wednesday, July 13, 2022",2022-07-13 18:38:08
650,The DD on Monkeypox and how you can profit off it. The bull case for Siga Technologies and Bavarian Nordic,2022-07-21 10:22:33
651,(8/2) Tuesday's Pre-Market Stock Movers & News,2022-08-02 08:24:14
652,(8/2) Tuesday's Pre-Market Stock Movers & News,2022-08-02 08:25:36
653,$ZM vs. $OKTA: what is the best stock to add to your portfolio?,2022-08-09 12:34:36
654,Todays top stock option open interest changes $CHPT $F $NKLA $LCID $INTC $GOOGL $CCJ $ZM,2022-08-10 07:57:44
655,What stocks might make more money? Compare $ZM vs. $OKTA.,2022-08-10 11:27:44
656,$ZM vs. $OKTA: which stock is the best to buy?,2022-08-12 13:41:15
657,Which stock is the best to invest? Compare $ZM vs. $OKTA.,2022-08-14 16:12:12
658,$ZM vs. $OKTA: what is the best stock to add to your portfolio?,2022-08-16 15:54:41
659,"Evidence of 2022's coming stock market crash, and 2023's 'Greatest Depression'",2022-08-18 15:18:24
660,A Story,2022-08-18 22:42:16
661,"Wall Street Week Ahead for the trading week beginning August 22nd, 2022",2022-08-19 18:30:36
662,(8/22) Monday's Pre-Market Stock Movers & News,2022-08-22 08:17:21
663,"ZOOM (ZM) has earnings tonight, puts are going to print massively.",2022-08-22 14:02:07
664,"Zoom is struggling to convince consumers to pay, and the stock is sliding",2022-08-22 21:48:45
665,(8/23) Tuesday's Pre-Market Stock Movers & News,2022-08-23 08:30:17
666,(8/23) Tuesday's Pre-Market Stock Movers & News,2022-08-23 08:31:27
667,$ZM vs. $OKTA: what is the best stock to add to your portfolio?,2022-08-23 12:10:19
668,Back to UCaaS stock discussions (RingCentral),2022-08-23 23:10:42
669,Todays top stock option open interest changes $UMC $MMM $NKLA $CHPRT $CCL $AMC $ZM $SOFI,2022-08-24 08:07:33
670,(8/24) Wednesday's Pre-Market Stock Movers & News,2022-08-24 08:35:33
671,"Stock Pattern Head-and-Shoulders Top ZM on July 06, 2022",2022-08-25 06:39:01
672,Todays top stock option open interest changes $SIRI $MMM $ET $CHPT $JD $NU $ZM $NKLA $TSM $FLEX $SQ,2022-08-25 07:58:50
673,(8/25) Thursday's Pre-Market Stock Movers & News,2022-08-25 08:18:55
674,When did you first come across WallStreetBets? What was your first influenced stock/bet?,2022-08-25 11:00:11
675,$ZM vs. $OKTA: which stock is the best to buy?,2022-08-26 11:40:12
676,I Tried 4 Paid Services for Stock Selection: Here are The Results for 2021 and 2022,2022-08-30 06:31:20
677,$ZM vs. $OKTA: what is the best stock to add to your portfolio?,2022-08-30 14:16:34
678,What stocks might make more money? Compare $ZM vs. $OKTA.,2022-08-31 13:07:05
679,$ZM vs. $OKTA: which stock is the best to buy?,2022-09-02 11:15:21
680,"Adobe Stock Slumps On $20B Figma Purchase, Soft Q4 Sales Forecast",2022-09-15 12:02:55
681,The one-year shareholder returns and company earnings persist lower as Zoom Video Communications (NASDAQ:ZM) stock falls a further ...,2022-09-17 17:43:53
682,When is it time to just take the loss?,2022-09-19 11:21:48
683,"Wall Street Week Ahead for the trading week beginning September 26th, 2022",2022-09-23 20:09:36
684,"Wall Street Week Ahead for the trading week beginning September 26th, 2022",2022-09-23 20:12:20
685,Todays largest stock option open interest changes $PBR $AAPL $CCL $AMZN $PYPL $AMD $AAL $GOOGL $ZM $META,2022-09-27 07:57:46
686,Don’t Like Jim Cramer’s Stock Calls? This ETF Bets Against ‘Mad Money’ Host.,2022-10-06 12:45:20
687,$ZM Bearish technical pattern building based off 14 signals on the 15-min chart. See chart at https://blog.ultraalgo.com/algorithmic-trading-stock-zm-nasdaq #tradingideas #stocks #ultraalgo #tradingview,2022-10-12 13:40:11
688,@Reuters: U.S. stocks ended a choppy session slightly lower after minutes from the last Federal Reserve meeting showed policymakers agreed they needed to maintain a more restrictive policy stance https://t.co/zZmO0pXqNj https://t.co/KI2kR77inL,2022-10-12 21:07:55
689,@Reuters: U.S. stocks ended a choppy session slightly lower after Fed minutes showed policymakers agreed they needed to maintain a more restrictive policy stance. Investors also anticipated a consumer price inflation report due on Thursday https://t.co/zZmO0qf2bT https://t.co/tCEGq9LyoA,2022-10-13 01:08:35
690,@Reuters: U.S. stocks ended slightly lower after Fed minutes showed policymakers agreed they needed to maintain a more restrictive policy stance https://t.co/zZmO0pXqNj https://t.co/tqu7D6YmkK,2022-10-13 03:07:35
691,$ZM Day Trading | Awaiting Buy Signal based off 9 signals on the 15-min chart. >> Find more Stock Trading Ideas at UltraAlgo.com,2022-10-17 12:28:19
692,"Stock Pattern Triple Bottoms ZM on October 10, 2022",2022-10-21 16:28:51
693,$ZM Algo Trading | Awaiting Short Signal based off 15 signals on the 15-min chart. >> Start your free trial for more stock chart ideas at UltraAlgo.com,2022-10-22 08:52:38
694,Trading Ideas $ZM | Sell rating based off 16 signals on the 15-min chart. #trading #stockZM🚀 blog.ultraalgo.com/algorithmic-trading-stock-zm-nasdaq,2022-10-23 15:45:35
695,"@Reuters: European stocks rise on hopes of Fed pause, Prosus slides on China woes https://t.co/HI12WOpajr https://t.co/sCeZmYulDc",2022-10-24 08:08:46
696,"Stock Pattern Three Rising Valleys ZM on October 10, 2022",2022-10-27 11:21:08
697,Trading Ideas ZM | $ZM Awaiting Short Signal based off 13 signals on the 15-min chart. #trading #stocks #NASDAQ 🚀 Learn more at UltraAlgo.com/Videos,2022-10-28 16:22:09
698,"What causes stock charts to show a stocks value temporarily drop to $0 before returning to ""normal""?",2022-11-01 15:45:50
699,"Comcast (CMCSA) - Short-term pain, long-term gain",2022-11-05 09:41:00
700,"$ZM Rating upgraded to Buy based off 13 signals, 15-min chart. #tradingZM #NASDAQ blog.ultraalgo.com/algorithmic-trading-stock-zm-nasdaq/",2022-11-08 21:28:31
701,Nasdaq $RGC CEO Figuratively Putting His Money Where His Mouth Is,2022-11-09 11:51:31
702,Learning how to calculate intrinsic value,2022-11-12 04:45:37
703,"$ZM Awaiting Buy Signal based off 12 trades $2,183 net profit 6.90 profit factor 91% win rate on a 15-min chart. #trading #stocks 🚀 UltraAlgo.com",2022-11-14 11:33:07
704,$PTON Awaiting Short Signal based off 30 trades on the 15-min chart. #trading #stocks 🚀 https://t.co/OX1Gfgcqq2 https://t.co/dD0ovDxqZM,2022-11-14 11:39:17
705,"Wall Street Week Ahead for the trading week beginning November 21st, 2022",2022-11-18 19:38:15
706,"Expected Moves - SPY, Zoom, Baidu, Best Buy, Autodesk and more.",2022-11-20 11:23:23
707,"My Full Plan for this Week 11/21 + Challenge Update (3 Earnings Plays, 1 MAJOR Economic Event , 4 Stocks)",2022-11-20 19:11:50
708,The Billionaires in this Timeline Suck!!!,2022-11-21 17:40:26
709,$ZM Awaiting Short Signal based off 12 trades on the 15-min chart. #nyse #nasdaq #stockZM #trading #markets 💸 Learn more UltraAlgo.com,2022-11-22 07:33:19
710,(11/22) Tuesday's Pre-Market Stock Movers & News,2022-11-22 08:28:46
711,(11/22) Tuesday's Pre-Market Stock Movers & News,2022-11-22 08:29:47
712,Zoom Can't Keep Up Past Growth,2022-11-22 10:14:41
713,From Inflation to Recession: Part 2 - puts on industrials for generational wealth,2022-11-22 19:07:02
714,Is $ZM a fading company?,2022-11-23 05:21:57
715,(11/23) Wednesday's Pre-Market Stock Movers & News,2022-11-23 08:02:53
716,Is $ZM a fading company?,2022-11-23 08:49:02
717,"My Full Plan for this Week 11/28 + Challenge Update (4 Earnings Plays, 3 MAJOR Economic Event , 3 Stocks + 10x Lotto)",2022-11-28 07:06:51
718,$ZM Awaiting Buy Signal based off 14 trades on the 15-min chart. #trading #stocks #ZM 🚀 Free trial at UltraAlgo.com/platform,2022-11-28 07:42:10
719,$MLAB Trading Ideas | Awaiting Short signal. 80% Profitability based on 5 trades. Profit factor is 14.17. Learn more at https://t.co/54bj3mKa5j. #MLABSTOCK #stocks https://t.co/ZmLt7313Yc,2022-11-29 08:07:20
720,Top Stock Option open interest changes $FINV $CHPT $VALE $LUMN $AMD $VALE $PLUG $AMC $BABA $ZM,2022-11-29 08:29:13
721,$ZM Awaiting Buy Signal based off 14 trades on the 15-min chart. #trading #stocks #nyse #nasdaq Free trial at UltraAlgo.com,2022-11-30 12:50:03
722,$ZM Awaiting Buy Signal based off 14 signals on the 15-min chart. #trading #stocks #ZM 🚀 Trial at UltraAlgo.com,2022-12-02 08:37:04
723,$ZM vs. $OKTA: which stock is the best to buy?,2022-12-02 12:06:48
724,These stocks has more upside: GOOGL AAPL ZM WIMI SNAP,2022-12-05 04:21:47
725,Trading plan Day 2,2022-12-13 04:09:39
726,"Cathie Wood of ARK Invest bought 74,862 shares of Tesla today worth around around $11.7 million",2022-12-15 13:13:44
727,"Cathie Wood of ARK Invest bought 74,862 shares of Tesla today worth around around $11.7 million",2022-12-15 13:14:13
728,$LNSTY Trading Ideas | Awaiting Buy signal. 100% Profitability based on 8 trades. Profit factor is 100. Learn more at https://t.co/uNaBDyBhvH. #LNSTYSTOCK #stocks https://t.co/0e51PxHsZM,2022-12-18 03:32:23
729,$ZM Trading Ideas | Awaiting Buy signal. 83.33% Profitability based on 6 trades. Profit factor is 6.97. Learn more at https://t.co/uNaBDyBhvH. #ZMSTOCK #stocks https://t.co/4iMg4SPG0L,2022-12-18 19:29:32
730,$CHY Trading Ideas | Awaiting Buy signal. 68.42% Profitability based on 21 trades. Profit factor is 3.6. Learn more at https://t.co/GvIkfXJuj9. #CHYSTOCK #stocks https://t.co/KHoX4nmlZm,2022-12-19 01:34:35
731,$GABC Trading Ideas | Awaiting Short signal. 85.71% Profitability based on 8 trades. Profit factor is 4.81. Learn more at https://t.co/GvIkfXJuj9. #GABCSTOCK #stocks https://t.co/xo0vAR7iZm,2022-12-22 06:18:03
732,$ZM Trading Ideas | Awaiting Buy signal. 75% Profitability based on 4 trades. Profit factor is 7.09. Learn more at https://t.co/uNaBDyBhvH. #ZMSTOCK #stocks https://t.co/BhR1tdthNQ,2022-12-22 06:20:24
733,Todays top stock option open interest changes $WBD $T $BABA $GOOG $CCL $ZM $AAPL $TSLA $DKNG $BA,2022-12-22 07:36:18
734,$SLGC Trading Ideas | Awaiting Short signal. 100% Profitability based on 7 trades. Profit factor is 100. Learn more at https://t.co/GvIkfXJuj9. #SLGCSTOCK #stocks https://t.co/iZmBHTGms5,2022-12-23 05:16:11
735,$ENGIY Day Trading | Awaiting Buy signal. 71.43% win rate based on 7 trades. Profit factor is 8.74. #trading #investing #stocks 🚀 Free trial at https://t.co/Dj3UOYpEUH https://t.co/1CkZmGHD6M,2022-12-28 16:06:03
