,Title,Timestamp
0,Barren streets but bustling stock markets in virus-stricken China,2020-02-11 07:21:38
1,$AMC either has an insane amount of value or is circling around the drain...what does /r/securityanalysis think?,2020-03-08 21:17:48
2,What do you guys think about AMC stock?,2020-03-16 09:08:03
3,AMC theaters closing for up to 12 weeks is this a good stock daddy?,2020-03-17 12:43:45
4,Testing Stock AMC/Jeep 4.0 Cylinder Heads (Ported and Unported) against Edelbrock's 4.0 Jeep Head on the Dyno,2020-03-19 13:14:08
5,Bought AMC stock @ $2.3. What do you guys think?,2020-04-04 21:34:17
6,AMC Stock,2020-04-12 21:05:24
7,The top ten selling products of the Great Depression converted to modern stocks.,2020-04-13 03:49:55
8,Have any major corporations declared bankruptcy yet (or seem like they’re close to declaring) due to the impacts of COVID-19?,2020-04-15 05:54:56
9,Why AMC Entertainment Stock Jumped Today,2020-04-15 17:56:11
10,"Stocks To Watch Today, Apr 17 2020 - Top 5 Stocks To Short",2020-04-17 08:19:15
11,Daily Watchlist for Friday 04/17/20,2020-04-17 08:31:42
12,"Stock Watch list April 17, 2020",2020-04-17 08:50:40
13,I missed the AMC stock :(,2020-04-17 14:09:24
14,Daily Watchlist for Monday 04/20/20,2020-04-20 08:36:37
15,What happens if you buy put options on a company that goes bankrupt?,2020-04-20 09:00:12
16,I personally love taking the family out to theater. I recently got some stocks at 3.20 with AMC and plan to hold out until they plan to open in July. Has anyone else recently bought into AMC? What are yours thoughts and opinions?,2020-04-24 13:00:43
17,Daily Watchlist for Tuesday 04/28/20,2020-04-28 09:12:10
18,AMC bans Universal,2020-04-29 01:27:09
19,Daily Watchlist for Wednesday 04/29/20,2020-04-29 08:29:11
20,Decided to Try Options Trading.,2020-04-29 09:41:36
21,Daily Watchlist for Thursday 04/30/20,2020-04-30 09:00:50
22,"$AMC, interesting stock to take a look at...",2020-05-01 09:45:55
23,Daily Watchlist for Monday 05/11/20,2020-05-11 08:40:40
24,What do you do when out of day trades?,2020-05-11 11:37:59
25,AMC SOARING AMAZON MERGER,2020-05-11 11:47:20
26,Daily Watchlist for Tuesday 05/12/20,2020-05-12 08:56:04
27,AMC’s stock soars after report Amazon held merger talks,2020-05-12 09:57:41
28,Daily Watchlist for Wednesday 05/13/20,2020-05-13 08:48:32
29,Wrong AMC: AMZN rumored to buy AMC Networks,2020-05-13 09:49:45
30,Wrong AMC: AMZN rumored to buy AMC Networks,2020-05-13 10:02:57
31,Wrong AMC: AMZN rumored to buy AMC Networks,2020-05-13 10:03:50
32,"Ok, Hornet experts; got a parts related question for you...",2020-05-18 23:06:38
33,AMC likely to close down,2020-06-04 12:27:21
34,Do you think AMC Theatres can survive the pandemic without going bankrupt?,2020-06-09 18:04:16
35,My 6-10-20 Stocks in Play Watchlist,2020-06-10 09:15:26
36,AMC is doomed.,2020-06-17 14:38:33
37,Cineplex stock?,2020-06-18 23:14:04
38,AMC stock predictions,2020-06-25 13:59:45
39,HELP! Call Option Trading,2020-06-26 15:46:25
40,Thoughts on AMC STOCK?,2020-06-28 15:51:25
41,Next Week's Earning Plays,2020-07-19 10:08:38
42,"New Investor, I need some clarity.",2020-07-25 13:16:00
43,"Over 21 months later, here's how /r/investing performed on the underrated stock survey. Inspired by Mr_Suzan and galloog1.",2020-08-02 19:59:56
44,ALERT ON $INPX!!!!!!!! Tell us if you know anything!,2020-08-09 00:41:32
45,Holding AMC until Tenet comes out,2020-08-14 08:54:32
46,"Watchlist: 9/3 Making Money, Jobs and Gambling",2020-09-03 08:51:12
47,Note Worthy News This Morning 8 October 2020 (Note: Just The Headlines),2020-10-08 08:47:30
48,Contrarian Investment Ideas: Energy and Movie Theatres,2020-10-11 23:52:50
49,"""Buy when there is blood on the streets"" | Cinemark Holdings (CNK)",2020-10-13 15:47:50
50,"Stock watch List October 14, 2020",2020-10-14 08:45:18
51,AMC in contract talks with AMZN for bezos-themed butter sauce,2020-10-14 10:48:19
52,AMC possible bankruptcy! Entertainment stocks or Airlines?,2020-10-15 12:11:46
53,AMC Entertainment (NYSE: AMC) vs. Cinemark (NYSE: CNK) - An upside comparison and the future for traditional Movie Theaters,2020-10-17 11:44:40
54,Stock advice,2020-10-17 12:47:37
55,AMC stock has had its lowest dip since the COVID-19 crash after a denied rumor of bankruptcy. Only one way to go from here.,2020-10-18 09:03:00
56,News (Just The Headlines) This Pre-Market and Watch List for 19 October 2020 (Will Update Until 9:20am EST),2020-10-19 07:18:41
57,"Here is a Market Recap for today Mon, Oct 19, 2020. Please enjoy!",2020-10-19 16:08:18
58,Companies and their suppliers directly impacted by covid closures,2020-10-20 00:49:40
59,"Penny Stock Pre-Market News (Just The Headlines), Pre-Market Watch List and Opening Watch List for 27 October 2020 (Will Update to 9:20 a.m EST)",2020-10-27 07:10:17
60,Most anticipated earnings releases for the week beginning November 2nd 2020,2020-10-31 09:26:10
61,Penny Stock Earnings and Pre-Market Watch List for 2 November 2020,2020-11-01 20:09:31
62,"Penny Stock Pre-Market News (Just The Headlines), Pre-Market Watch List and Opening Watch List for 02 November 2020 (Will Update to 9:20 a.m EST)",2020-11-02 07:18:56
63,"After Hours News (2 November 2020, Just The Headlines), Penny Stock Earnings, Near Future Potential Catalysts and Pre-Market Opening Watch List for 3 November 2020",2020-11-02 20:10:03
64,November 9th | Templar Trading Daily Watchlist,2020-11-09 07:41:36
65,AMC Entertainment Stock 2021,2020-11-12 16:39:56
66,Buy AMC to save America,2020-11-16 13:09:31
67,"What's on your next ""pandemic lock down"" list?",2020-11-19 10:57:04
68,Are there any rules behind stock offerings? It seems like a company could really take advantage of public investors by constantly diluting their ownership,2020-11-22 16:46:37
69,Cinemark ($CNK) is Good and So Can You!,2020-12-04 14:09:21
70,AT&T (NYSE: T) - A stock Guide/Review,2020-12-05 20:46:06
71,Watchlist 12-8-20 👀,2020-12-07 21:38:46
72,Watchlist 12-8-20 👀,2020-12-07 21:39:21
73,AMC outlook,2020-12-11 13:56:28
74,Watchlist 12-17-20 👀,2020-12-16 21:41:06
75,What happen to AMC stock of it goes bankrupt?,2020-12-16 23:37:36
76,It Can't Be This Easy...,2020-12-19 12:38:32
77,Watchlist 12-22-20 👀,2020-12-21 22:12:41
78,Watchlist 12-22-20 👀,2020-12-21 22:13:14
79,Watchlist 12-23-20 👀,2020-12-22 21:45:20
80,Watchlist 12-23-20 👀,2020-12-22 21:47:33
81,Watchlist 12-24-20 👀,2020-12-23 22:03:18
82,Watchlist 12-24-20 👀,2020-12-23 22:04:13
83,A Beginners question,2020-12-29 04:22:30
84,AMC Stock,2020-12-30 07:34:35
85,AMC will be back.,2020-12-31 20:08:50
86,1971 Javelin VIN Decode Question,2021-01-02 15:24:56
87,Bubble protection,2021-01-08 15:44:12
88,Watchlist 1-13-21 👀,2021-01-12 22:53:51
89,Watchlist 1-13-21 👀,2021-01-12 22:54:13
90,Question about SEC filings?,2021-01-15 18:56:36
91,What is the likelihood of AMC going bankrupt vs its stock rebounding?,2021-01-16 15:20:55
92,What is the likelihood of AMC going bankrupt vs its Stock rebounding?,2021-01-16 15:23:31
93,AMC Entertainment CEO is shockingly close to staving off bankruptcy,2021-01-18 14:46:07
94,AMC,2021-01-18 15:01:57
95,Watchlist 1-19-21 👀,2021-01-18 21:46:33
96,Watchlist 1-19-21 👀,2021-01-18 21:47:07
97,January 19th | Templar Trading Daily Watchlist,2021-01-19 07:42:39
98,LIVE Penny Stock Summary for Jan-19-2021,2021-01-19 10:58:37
99,Looks like AMC is going to survive pandemic,2021-01-19 12:40:40
100,Watchlist 1-21-21 👀,2021-01-20 23:07:25
101,Watchlist 1-21-21 👀,2021-01-20 23:08:10
102,Stocks to buy now... AMC and ZNGA Stock analysis,2021-01-20 23:25:22
103,EPR Properties,2021-01-21 07:01:09
104,Azu's Best Dividend Pennies,2021-01-21 14:09:09
105,Watchlist 1-22-21 👀,2021-01-21 22:52:34
106,Watchlist 1-22-21 👀,2021-01-21 22:52:56
107,AMC 📈 or 📉?,2021-01-23 05:59:01
108,I created an algo that tracks the most hyped stocks on Reddit. Here are the results for this week,2021-01-24 08:09:56
109,I need some clarification on Options.,2021-01-24 11:01:01
110,AMC stock looks great in two ways ...,2021-01-24 15:48:13
111,Hedging Long Term Calls with Short Term Puts??,2021-01-24 16:34:12
112,My Watchlist for the week - Jan 25th 2021,2021-01-24 17:27:34
113,“Watchlist 1-25-21 👀,2021-01-24 21:59:04
114,CBD stocks are the new EV stocks in 2021🚀,2021-01-25 03:58:50
115,Good news from AMC,2021-01-25 10:01:02
116,How do I find the groups that are picking their next stock to short squeeze like GME and AMC?,2021-01-25 11:55:23
117,Is it possible hedge funds could be pumping NOK after hours and then dumping it tomorrow?,2021-01-25 16:52:53
118,AMC CC Weeklies,2021-01-25 17:27:47
119,Nokia pump (by hedgefunds I think),2021-01-25 20:30:52
120,Today's posts about NOK and AMC on this sub quickly got lots of awards. Someone is spending money to promote these stocks.,2021-01-25 20:49:20
121,SPCE,2021-01-25 21:27:29
122,Unusual options opportunity in AMC,2021-01-25 22:43:06
123,“Watchlist 1-26-21 👀Futures are RED as of 10:45 ET,2021-01-25 22:51:21
124,"For everyone holding calls who is in the In the money , check your expiration date",2021-01-26 19:06:55
125,"You Provide the Ticker, I'll Provide the Analysis!",2021-01-26 20:01:00
126,"r/Daytrading - discuss day trading only, not buy & hold",2021-01-26 21:00:17
127,Watchlist 1-27-21 👀,2021-01-26 23:09:03
128,AMC Short Squeeze?,2021-01-27 00:52:59
129,AMC und NOK kaufen,2021-01-27 03:57:48
130,"PSA/""THE NEXT GME"" - PLEASE READ: This time period is a great chance to vastly improve the content on this sub",2021-01-27 06:45:42
131,January 27th | Templar Trading Daily Watchlist,2021-01-27 07:15:26
132,Is AMC a go?,2021-01-27 07:51:12
133,BE WEARY OF AMC!!,2021-01-27 08:37:00
134,"Momentum Stocks Catch Fire as Market Boils (AMC, FCEL, CMGR, MMEDF)",2021-01-27 08:44:41
135,"Stock Watch List For January 27, 2021",2021-01-27 08:45:34
136,"Momentum Stocks Catch Fire as Market Boils (AMC, FCEL, CMGR, MMEDF)",2021-01-27 08:50:27
137,Stocks to Watch 27/01/2021,2021-01-27 09:02:51
138,Stocks to Watch 27/01/2021,2021-01-27 09:03:03
139,#save_amc Save our Theaters,2021-01-27 09:07:28
140,"AMC stock has skyrocketed to almost $20 a share, good time to buy or wait for a price drop?",2021-01-27 09:08:04
141,Red means GO!!!,2021-01-27 09:33:42
142,AMC options aren't updating/moving,2021-01-27 09:42:48
143,So did I just get fucked over?,2021-01-27 09:43:50
144,they need to fill my AMC STOCKS SMFHHHHH,2021-01-27 09:46:07
145,AMC,2021-01-27 09:57:45
146,HOLD AMC MEN!!!,2021-01-27 10:01:09
147,DO NOT WORRY,2021-01-27 10:08:46
148,RED DAY = FIRESALE,2021-01-27 10:11:37
149,"Anyone else think that the sell off in the market is caused by GME, AMC, BB pump?",2021-01-27 10:13:58
150,Nok is next! On your mark get set goooo!!!! 🏁,2021-01-27 10:15:51
151,"Bitcoin Live Stocks DUMP, AMC Moon?",2021-01-27 10:29:28
152,Long term stocks,2021-01-27 10:41:15
153,Explain I’m a dumbsh*t,2021-01-27 10:48:48
154,$AMC $GME $BB ALL HAVE COMMON WITH THIS STOCK... $SNDL,2021-01-27 10:53:55
155,ON ROBIN HOOD AMC STOCK DOESNT WANNA BE GIVEN WHAT HAPPENS IF I CANCEL ORDER?,2021-01-27 11:03:32
156,AMC?,2021-01-27 11:06:48
157,Can I get some words of encouragement?,2021-01-27 11:11:41
158,Identifying Volatility Halts and then Running Analysis - the Meme Identifier!,2021-01-27 11:34:03
159,What is going on with $EXPR?,2021-01-27 11:36:02
160,AMC hedges,2021-01-27 11:47:09
161,AMC? Should I buy AMC stocks?,2021-01-27 11:58:22
162,AMC stock - Just bought 69 shares @ $15.40,2021-01-27 12:00:14
163,AMC STOCK THREAD,2021-01-27 12:10:33
164,Explain. it to me like I'm 5,2021-01-27 12:17:22
165,What happened to NOK today?,2021-01-27 12:17:35
166,Give me a reason not to sell,2021-01-27 12:24:16
167,I’ve never looked at the stock market even once. This is my third time on this subreddit. Should I buy amc stock? Or maybe a few shares in GameStop at 320?,2021-01-27 12:26:00
168,AMC Stock?,2021-01-27 12:28:55
169,Wealthsimple Trade not proceeding with my AMC buy order,2021-01-27 12:30:49
170,Will #AMC hit $40-$50?,2021-01-27 12:31:51
171,"Just bought AMC stock - totally blue about stock market - hope i wont’ regret it-want to join the people’s revolution- we, the people",2021-01-27 12:31:56
172,AMC is the new (and better) GME,2021-01-27 12:32:54
173,Stop flooding the market,2021-01-27 12:38:01
174,AMC STOCK IS HOLDING! BUY BUY,2021-01-27 12:39:07
175,Looking to get into US Stocks; best bet to save on fees?,2021-01-27 12:42:19
176,AMC will rise to $300. nok will not.,2021-01-27 12:43:34
177,AMC Stock,2021-01-27 12:46:09
178,Where to Buy AMC stock in the uk?,2021-01-27 12:49:05
179,What stock brokers are willing to sell short on stocks (e.g. GME)?,2021-01-27 12:51:10
180,What is happening with AMC? is it going down?,2021-01-27 12:53:11
181,AMC - The Poor Retards GME,2021-01-27 12:54:25
182,Do not divide. AMC and NOK are the 2 main stoinks to buy and hold. If you were late on AMC buy into NOK. The more and more people post and support the other stocks delude what we are trying to accomplish. UNITY = MONEY ............ MONEY = PIZZA.,2021-01-27 12:56:36
183,Finally started making money off the AMC stocks I bought today. When do I start snorting coke of a stripper’s ass?,2021-01-27 13:26:33
184,My thoughts on some good future stocks - give me your opinions,2021-01-27 13:26:54
185,AMC STOCK,2021-01-27 13:27:25
186,AMC stock,2021-01-27 13:32:05
187,STOCK IN AMC,2021-01-27 13:35:29
188,Major brokerage firms restricting $GME and $AMC stocks - this is what I see on TDA. Are you still able to buy ?,2021-01-27 13:58:55
189,Trading Inquiries,2021-01-27 14:24:35
190,Not laughing,2021-01-27 15:45:55
191,"Dropped a total of $750 on the AMC stocks. I am hoping for a strong finish to the day, and another Skyrocket for after-hours marketing. Does anyone else have any thoughts on AMC at the moment?",2021-01-27 15:54:06
192,"Dropped a total of $750 today on the AMC stocks. I am hoping for a strong finish to the day, and another Skyrocket for after-hours marketing. Does anyone else have any thoughts on AMC at the moment?",2021-01-27 15:54:30
193,Just bought my first stock because of you retards AMC 💎✋🚀🚀🚀🚀🚀🚀🚀 straight to the FUCKING moon! I fucking love this place and how awesome it is.,2021-01-27 15:57:46
194,Improvise and Adapt #2,2021-01-27 16:18:44
195,NOK After Hours,2021-01-27 16:23:44
196,NOK After Hours,2021-01-27 16:24:00
197,"AMC is the new GME: cousins, not competitors, AMC is the next big short squeeze, and outperformed GME today by 165% with a price still under $20",2021-01-27 16:35:03
198,Nasdaq's Adena Friedman Suggests Trading Halt to Combat Reddit,2021-01-27 17:01:49
199,"Hey YALL. I’m looking for opinions and advice. I’m hearing many things about AMC stock. Would it be safe to pull out of it a few dollars up or let it potentially go up next day, since after market is dropping.",2021-01-27 17:07:53
200,$AMC $GME $BB ALL HAVE COMMON WITH THIS STOCK... $SNDL,2021-01-27 17:13:15
201,"GNUS ran up 81% today, volume exceeding 200M for the day.",2021-01-27 17:18:57
202,Friendly advice from a idiot on cash app.,2021-01-27 18:15:59
203,Stock market is on crack ATM. WSB influence engulfing the whole market?,2021-01-27 18:19:19
204,Finding Value Stocks,2021-01-27 19:00:33
205,Stocks rise up!!,2021-01-27 19:02:10
206,Quit? Or Hold?,2021-01-27 19:22:22
207,AMC stock sell or hold?,2021-01-27 19:49:18
208,AMC n NOK,2021-01-27 21:04:50
209,"Journey to $1 Million - A Bloody Day of January the 27, 2021",2021-01-27 21:06:06
210,"I have $120,000 sitting in my savings account and curious how to get my financial life back on track after divorce",2021-01-27 21:50:00
211,What is happening with the rest of the market?,2021-01-27 22:49:37
212,"Anomalous Stocks, Wednesday, January 27, 2021",2021-01-27 22:51:43
213,I LOVE THE MOVIES: Part 1,2021-01-27 22:55:10
214,Why GameStop & AMC Are Down After Hours,2021-01-27 23:18:09
215,"A word of CAUTION about HOT Stocks (GME, AMC, BB< NOK et all)",2021-01-27 23:47:44
216,The Great Migration,2021-01-28 00:55:55
217,Notice the pattern,2021-01-28 02:23:48
218,AMC borrowing fees,2021-01-28 05:32:30
219,GME and AMC ceased trading,2021-01-28 06:37:46
220,"AMC Stock news, what does this do to the stock?",2021-01-28 06:46:54
221,Very high short interest on $SENS,2021-01-28 07:13:36
222,Reddit effect hit more than just GME. Wallstreetbets drives AMC stock over 800% since Jan 1! More gainers with this 1 month surge include BBBY up 197% & NOK up 67%. GameStop stock takes the lead at a whopping 1915% surge,2021-01-28 07:36:47
223,Amc Stock to the moon,2021-01-28 08:10:19
224,Should I Sell My Nokia to Put More Stock in AMC,2021-01-28 08:11:30
225,AMC stocks no longer supported on Robinhood?,2021-01-28 08:28:38
226,Where Can I buy GameStop and amc stock?,2021-01-28 08:57:32
227,WATCH OUT 🤞,2021-01-28 09:05:14
228,"HEDGE FUNDS ARE TAGETTING GME , BB and AMC at 20min BEFORE STOCK OPENING! AGAIN!!! DONT BE FOOLED!! HOLD GME // BUY BB!!!🚀🚀🚀🚀🚀🌕💎💎💎💎🙌🏼🙌🏼",2021-01-28 09:08:03
229,Stocks to Watch 28/01/2021,2021-01-28 09:11:10
230,"Robinhood, TD Ameritrade, Charles Schwab, Trading 212 has paused trading on hot stocks such as GME, AMC, NOK, etc! They're doing it to ""protect their valued customers from the volitive market."" Forget them, find a new trading app, and make them wish they never fucked over the little people.",2021-01-28 09:13:44
231,"You can still purchase AMC stock via Cash App, Despite robinhood and others removing it.",2021-01-28 09:17:48
232,"Robinhood and other platform are not letting people buy GME, AMC Stock",2021-01-28 09:19:41
233,NOK and AMC stocks on RH,2021-01-28 09:22:23
234,"PSA: Please be extremely careful with your holdings, especially meme stocks. There’s a lot of stuff going on that can go south any moment.",2021-01-28 09:32:10
235,Revolut is just as bad as robinhood,2021-01-28 09:43:47
236,Got my AMC stocks this morning on Charles Schwab. Unfortunately I don’t have enough for GME. 🚀 🚀 🚀,2021-01-28 09:52:23
237,Fuck Robinhood - Use Cashapp,2021-01-28 09:57:55
238,AMC Stock on the dip...BUY BUY. And dont forget GME!!......buy both and HOLD,2021-01-28 09:58:58
239,I REALLY ENJOY THE AMC STOCK,2021-01-28 10:06:37
240,Do not sell your amc or nok stock,2021-01-28 10:23:02
241,Question from a Newbie,2021-01-28 10:23:48
242,My brother just got an email from Robinhood that they submit a limit order for 18 of his AMC stocks without his consent,2021-01-28 10:28:10
243,AMC Stock is going really deep in the shit hole almost a %50 Loss,2021-01-28 10:33:02
244,I can’t log into E*TRADE. Anyone else have this problem?,2021-01-28 10:33:19
245,"GME, BB, AMC stock",2021-01-28 10:38:45
246,HELP YOUR BROTHERS ON AMC!!!,2021-01-28 10:44:11
247,Just a quick message.,2021-01-28 10:46:12
248,Any stocks that I can buy on Robin that are going to boom? Besides GameStop Amc ect.,2021-01-28 10:49:30
249,USE CASHAPP,2021-01-28 10:50:50
250,AMC,2021-01-28 11:09:46
251,Robinhood - Mass Exodus Required,2021-01-28 11:14:52
252,Never invested before,2021-01-28 11:20:35
253,"Stop giving in, this movement is still very strong and still going. Do not sell, hold and buy more!",2021-01-28 11:28:53
254,You can use the chase banking app,2021-01-28 11:32:14
255,“Bulls get fed. Bears get fed. Pigs get slaughtered.”,2021-01-28 11:35:14
256,Buy stocks on Cashapp,2021-01-28 11:35:49
257,AMC STOCK? LONG TIME LISTENER FIRST TIME CALLER,2021-01-28 11:51:53
258,New to stock but iv got nok.and amc now,2021-01-28 11:55:21
259,NEWBIE: WHATS THE DEAL WITH AMC,2021-01-28 12:12:22
260,Hold the line,2021-01-28 12:30:37
261,The brokers take over,2021-01-28 13:31:59
262,CashApp!,2021-01-28 13:49:20
263,AMC put option,2021-01-28 13:55:10
264,CASHAPP STOCK FYI AMC KEEP INVESTING,2021-01-28 14:01:15
265,Stocks,2021-01-28 14:15:41
266,AMC and NOK trade halts on cashapp,2021-01-28 15:11:58
267,"Potential buy/hold GME, AMC, BB, etc. during the dip?",2021-01-28 15:24:33
268,Stock trading,2021-01-28 15:25:24
269,"Robinhood will allow limited buying of restricted securities Friday, GameStop jumps after hours",2021-01-28 16:36:21
270,These crashed... what's next? GME AMC Stocks,2021-01-28 17:13:22
271,1/29 GME (and others) Gamma Squeeze,2021-01-28 17:21:08
272,"Does anyone think it’s weird that robinhood is allowing “limited buys” Into today’s restricted stocks? Could it be a price limit? GME, BB, AMC ...",2021-01-28 18:03:32
273,Some of you are Idiots 🤑,2021-01-28 19:11:38
274,"TD Ameritrade allowing long calls and puts on certain stocks, but restricting covered positions and spreads",2021-01-28 20:07:03
275,"Billionaire Hedge Fund Bailouts - January 28, 2021",2021-01-28 20:47:58
276,The bullish case for Tanger Outlets (SKT),2021-01-28 20:57:49
277,Watchlist 1-29-21 👀,2021-01-28 21:08:55
278,"Actual Reason You can't buy GME, AMC and etc.",2021-01-28 22:18:58
279,These were all the stocks that Robinhood blocked: $GME $KOSS $AMC $NOK $BB $BBBY $VIR $GNUS $AAL $NAKD,2021-01-28 22:32:42
280,Help me understand this $GME $AMC gamma squeeze. Haven’t the hedge funds all covered their shorts and switched to the bull side to recoup their losses? Isn’t making the stock go up giving them the money we took back va leaving them with a huge $GME bag,2021-01-28 22:57:44
281,IM URGING YOU TO READ IF YOU OWN AMC,2021-01-28 23:37:46
282,$UMC Semiconductor: Bargain Compared to Peer Group,2021-01-28 23:41:03
283,Incase you haven’t heard..,2021-01-28 23:46:10
284,"They released the hold on GME, AMC, and NOK stock",2021-01-28 23:49:06
285,"WealthSimple not processing orders until February 1, 2021?",2021-01-29 00:55:07
286,"Anomalous Stocks, Thursday, January 28, 2021",2021-01-29 02:43:33
287,ShortSqueeze XPSA,2021-01-29 04:43:48
288,Gamestop Big Picture: The Short Singularity Pt 3 - WTF edition,2021-01-29 06:46:07
289,"Can't ""the rich"" just buy GME or AMC?",2021-01-29 08:53:09
290,DAILY SQUEEZE THREAD - 2021-01-29: Please put all GME/AMC/other squeeze stock discussion in here to help clean up our wonderful sub!,2021-01-29 09:53:59
291,"Are there any stocks other than GME, AMC, NOK, and BB that people want to talk about?",2021-01-29 09:58:20
292,Why BDRBF could be ready to explode (DD on Bombardier),2021-01-29 11:16:25
293,CIBC Rejecting GME/AMC Sell Limit Orders,2021-01-29 13:05:47
294,I believe there are no holds on GameStop and AMC stock on this app but I just found it and I think they don't do cryptocurrency yet so you may want to get a second app for that,2021-01-29 13:42:45
295,New to stocks,2021-01-29 14:22:32
296,Some stocks you should check out! 2 long term and 1 short term holding ( post and if you want youtube video),2021-01-29 16:31:07
297,Need help picking a new trading platform,2021-01-29 16:33:35
298,RH is limiting these stocks by the way https://www.google.com/amp/s/investorplace.com/2021/01/robinhood-bans-reddit-stocks-wallstreetbets-gme-cciv-sndl-jagx-amc-nok-bb/amp/,2021-01-29 17:07:11
299,New Investor on a shoestring budget for stocks here. What should I be keeping an eye on on Monday?,2021-01-29 17:11:16
300,"Buying into AMC, still worth it?",2021-01-29 18:27:08
301,"Anomalous Stocks, Friday, January 29, 2021",2021-01-29 19:18:26
302,"Theory: Citadel is shorting all 50 stocks RH restricted, and therefore the market, and will try to hold on for one last stand",2021-01-29 19:34:57
303,What’s the general consensus on BlackBerry?,2021-01-29 21:24:19
304,DAILY SQUEEZE THREAD: Please put all current happenings regarding GME/AMC/other squeeze stocks in here to help keep our community awesome!,2021-01-30 00:00:16
305,Why buying AMC helps save a beloved American company on top of unleashing a devastating squeeze on hedge funds.,2021-01-30 00:06:52
306,Can't Stop Won't Stop Game Stonk,2021-01-30 01:36:37
307,What stocks you guys buying this week?,2021-01-30 02:31:18
308,My prediciton on what will happen,2021-01-30 07:50:05
309,Should I get into dividends as an 18 year old?,2021-01-30 08:15:09
310,Any good stocks to invest in for beginners?,2021-01-30 10:43:44
311,"Don’t put money you can’t risk in $GME or $AMC but even a few shares makes a difference. Join the revolution. Long the shorts, this is the way!",2021-01-30 11:16:59
312,Me after investing 20 bucks into AMC stock.,2021-01-30 11:38:02
313,Weekend GME Thread + Homework for all: Let's stop using brokerages that halted trading,2021-01-30 13:03:28
314,What's the overall feeling on NAKD?,2021-01-30 13:05:06
315,The situation with Gamestop affects everyone in the stock market,2021-01-30 13:50:15
316,Is questrade also limiting quantity of stocks like GME and AMC?,2021-01-30 13:58:11
317,Does it make sense to move TSP funds out of CSI and into G fund?,2021-01-30 14:12:17
318,Robinhood Limitations,2021-01-30 15:06:33
319,You can get a ticket on a 🚀 to the 🌑 for the same price as a ticket to the movies! $AMC breakout coming.,2021-01-30 16:03:33
320,"Concern/questions about the economy if GME, AMC, etc. reach endgame (posted in r/economy too)",2021-01-30 16:42:19
321,European Investing platform with english?,2021-01-30 16:42:48
322,Penny Stocks to Invest in on RH,2021-01-30 17:22:19
323,"Why Triggering the GameStop ""Infinite Gamma Squeeze"" is a terrible idea.",2021-01-30 18:26:22
324,AMC next phase:,2021-01-30 20:32:25
325,$AMC. WSB Mascot saying. We Like The Stock. Actively shopping.,2021-01-30 22:44:43
326,Yo! Check out her videos about stocks ! GME + AMC + ???,2021-01-30 22:59:29
327,What are your next moves?,2021-01-30 23:42:52
328,Does AMC actually have legitimate potential to grow as high as people claim?,2021-01-30 23:43:55
329,DAILY SQUEEZE THREAD: Please put all current happenings regarding GME/AMC/other squeeze stocks in here to help keep our community awesome!,2021-01-31 00:00:21
330,need help on options play?,2021-01-31 00:36:46
331,Questions: Why is AMC not rising as much as GME,2021-01-31 03:09:33
332,I created an algo that tracks the most hyped stocks on Reddit. Here are the results for this week,2021-01-31 07:32:17
333,Here are current trading restrictions for TD Ameritrade -- seem fairly reasonable,2021-01-31 07:54:40
334,"AMC Short Interest is Often Overstated, and Actually 10-15% Based on My Calculations Below",2021-01-31 08:44:48
335,Kinepolis DD (EBR:KIN),2021-01-31 11:00:51
336,Short term investing next week in the volatile meme stocks,2021-01-31 11:04:36
337,How it Ends. AMC and others to issue stock,2021-01-31 11:07:46
338,AMC now 147 million shares short with a 21% borrow rate. Lots of naked calls In the Money too.,2021-01-31 11:51:50
339,IPOE SoFi DD updates amid Meme Stock Mania,2021-01-31 12:40:28
340,"Interactive Brokers lifts all restrictions on stock and option trading, increased margin requirements to remain in place",2021-01-31 12:54:42
341,Looking for good stock that could explode this year,2021-01-31 12:55:01
342,Tired of the meme stocks,2021-01-31 12:56:10
343,"Options for this week, GME, GOOGL, SNAP and more",2021-01-31 14:41:50
344,HOLD!! To The Moon!!,2021-01-31 14:43:24
345,Breaking News: AMC GME stock winner,2021-01-31 15:46:24
346,AMC Leaps- Any ideas on fundamentals?,2021-01-31 18:07:41
347,"Alright, I have a bunch of questions.",2021-01-31 18:51:52
348,Markets Look Like They’re in a Bubble. What Do Investors Do Now?,2021-01-31 20:40:45
349,Another thread about next week,2021-01-31 21:10:01
350,Watchlist 2-1-21 👀,2021-01-31 21:47:46
351,What to do for tomorrow with 1.5k sold in stocks on friday and RH saying i dont have sufficient buying power?,2021-01-31 22:40:00
352,DAILY SQUEEZE THREAD: Please put all current happenings regarding GME/AMC/other squeeze stocks in here to help keep our community awesome!,2021-02-01 00:00:14
353,Purchased $AMC stock when the market is closed,2021-02-01 03:03:27
354,WSJ: GameStop Day Traders Are Moving Into SPACs,2021-02-01 07:28:07
355,"Emotional involvement has never been this high, please understand the risk involved.",2021-02-01 08:42:51
356,Now is a good time to baseline your resources for news on stocks/investments,2021-02-01 09:02:33
357,AMC: A Different Kind of Investing,2021-02-01 10:05:31
358,Don’t get scared at AMC stock,2021-02-01 10:51:55
359,"AMC, GME, BB and some others - It’s NO COINCIDENCE that the stock that were trending since GME explosion are being manipulated since last week. DO NOT FEAR! HOLD AND BUY!",2021-02-01 11:02:08
360,Did I miss out?,2021-02-01 12:13:06
361,"Serious question, did the GME squeeze already happen?",2021-02-01 13:39:18
362,WALLSTREET DIRTY TACTICS- Price of a stock goes up or down based on supply and demand. READ to see why AMC and GME have not yet 🚀🚀🚀🚀🚀🌕 because of the illegal fraud Wallstreet and brokers like RH are doing,2021-02-01 15:38:24
363,Long Thesis on Hostess Brands (TWNK) (Owner of Twinkies),2021-02-01 17:07:15
364,"TD ""news"" alert on AMC stock Ticker (clear misinformation tactics)",2021-02-01 17:29:25
365,Long Thesis on Hostess Brands (TWNK) (Owner of Twinkies),2021-02-01 17:34:19
366,Lost €100 because Trading212 go brr,2021-02-01 18:31:17
367,"Wealthsimple trade vs Questrade for purchasing stocks, particularly blackberry gme and amc?",2021-02-01 18:36:54
368,15 U.S.C.A. § 78i - the Illegality of Short Ladder Attacks (Legal insight),2021-02-01 18:57:46
369,Fubo stock on track to hit $200,2021-02-01 19:21:44
370,15 U.S.C.A. § 78i - the Illegality of Short Ladder Attacks,2021-02-01 19:41:13
371,"Stock goes lower, puts go down",2021-02-01 19:57:43
372,"AMC Entertainment Holdings, Inc (AMC) Stock Price, News, Quote & History - Yahoo Finance",2021-02-01 20:32:31
373,Have We Reached The Moon? THEN IT'S NOT OVER! AMC Stock News GameStop Short Squeeze Is Still On! WSB,2021-02-01 20:40:04
374,"Canadian regulators eye Reddit rally, vow to act if manipulation identified",2021-02-01 20:56:44
375,My first post! Options trades initiated TODAY 2/1/21,2021-02-01 21:01:09
376,Thoughts on investing in (F) Ford Motor now at $10.99,2021-02-01 21:48:51
377,GME Short Squeeze What Comes Next,2021-02-01 21:52:09
378,TEAM WE NEED TO MAKE THIS VIDEO GO VIRAL!!! 🚀🌙THIS IS WHY AMC DIDN'T SQUEEZE TODAY! (Naked Short & Short Ladder) // AMC Stock Update 💰💰💰,2021-02-01 23:12:20
379,I’m completely sick of seeing GME and AMC posts,2021-02-01 23:25:51
380,What is better for buying the blackberry gme and amc stocks? Wealthsimple trade or questrade?,2021-02-01 23:34:36
381,Stock Market Data Downloader - Python,2021-02-01 23:43:31
382,DAILY SQUEEZE THREAD: Please put all current happenings regarding GME/AMC/other squeeze stocks in here to help keep our community awesome!,2021-02-02 00:00:20
383,DD - Funko Toys (+$15 per share / +$600m Market Cap),2021-02-02 05:28:33
384,Just bought yesterday my first AMC stocks and bought today another 20! Germany stays strong! To the moon 💎 🙌 🚀,2021-02-02 06:14:05
385,Current situation with AMC?,2021-02-02 08:11:27
386,AMC stock probably would have been worth it even if all of this wasn't happening,2021-02-02 08:35:48
387,"A Must-Read for New Traders/Investors - BlackBerry, AMC, and others",2021-02-02 08:54:30
388,Has anyone else seen this?!?,2021-02-02 09:17:20
389,Revolut only allowing users to SELL GME and AMC stocks,2021-02-02 09:22:04
390,Revolut just set GME and AMC stocks to sell only!,2021-02-02 09:35:19
391,"Bought some AMC stock, hold fast my fellow retards!",2021-02-02 09:35:39
392,I can’t buy anymore AMC stock on CashApp. These MF’Ed are trying to manipulate the market by suppressing our ability to buy more stock.,2021-02-02 09:39:35
393,$GME $AMC UK Platform Revolut suspends purchases of $GME and $AMC stocks,2021-02-02 09:40:48
394,SEC really needs to step in on these HF!!!!,2021-02-02 09:42:22
395,r/Stocks - GME megathread!,2021-02-02 10:33:50
396,Holding to my AMC stock and buying the dips. Bolder!!,2021-02-02 10:41:18
397,Revolut (DriveWealth) is restricting buying of GME and AMC from 02/02/21. Read the email i just received below. They are essentially doing what Robinhood did last week.,2021-02-02 10:42:36
398,Revolut in UK not letting me buy,2021-02-02 10:45:22
399,Revolut set to Sell only the GME and AMC Stocks!,2021-02-02 10:45:51
400,Revolut restricting $GME and $AMC trading,2021-02-02 10:46:05
401,Sold my AMC stocks for £9 and proud.,2021-02-02 11:02:24
402,Revolut also uses Drivewealth. Buying GME and AMC stocks no longer possible in the Revolut app.,2021-02-02 11:04:33
403,AMC holder/ thoughts on another trade while holding,2021-02-02 11:29:36
404,AMC Profit Opportunity - Comparing CSP vs PCS,2021-02-02 12:54:43
405,CGX.TO for the long,2021-02-02 13:09:29
406,1 GME Gang,2021-02-02 16:20:59
407,Great day today boys and girls!!! ***Update***,2021-02-02 16:27:34
408,Apps that haven’t banned stocks,2021-02-02 16:32:58
409,"AMC Stock Will Boom, Here's Why. (Explained)",2021-02-02 16:38:38
410,Are the short ladder attacks the same for AMC?,2021-02-02 16:42:20
411,Are the short ladder attacks the same for AMC?,2021-02-02 16:42:53
412,Are the short ladder attacks the same for AMC?,2021-02-02 16:43:09
413,AMC Straddle Play - March 5th,2021-02-02 18:06:22
414,"if you lost a ton of money playing the meme stocks, consider it as tuition",2021-02-02 19:22:38
415,Story on how you made a fund 113 million dollars richer,2021-02-02 19:31:59
416,Why You Should Get Into Long Positions of Cannabis,2021-02-02 21:01:03
417,"SNDL, ZOM + others, Complete Technical Analyses for Rest of Week Feb 3rd, 2021",2021-02-02 21:53:37
418,Finding my investment compass again after being sucked into WSB,2021-02-02 23:54:53
419,DAILY SQUEEZE THREAD: Please put all current happenings regarding GME/AMC/other squeeze stocks in here to help keep our community awesome!,2021-02-03 00:00:15
420,Does it make sense to move my position in GME into AMC instead?,2021-02-03 03:08:17
421,Someone Always Ends Up Holding the “Doo Bag”,2021-02-03 05:09:05
422,REZZF/GBML Lithium mine play with extremely low market cap ($14.59M),2021-02-03 07:35:04
423,Twitter news claims interest for GME/AMC in the subreddit is fizzling out (it’s all we fucking talk about). And they can’t even list the correct stock for AMC Entertainment.,2021-02-03 08:45:01
424,Suggestions for investing.,2021-02-03 09:38:35
425,Need some insight on rebuilding my portfolio,2021-02-03 13:36:59
426,Churchill Capital IV - a meme stock,2021-02-03 14:28:33
427,Old fart advice for young investors,2021-02-03 15:05:46
428,Clarifying the SEC's Investigation of Social Media GME Hype for Fraud [Bloomberg Article],2021-02-03 16:31:00
429,Reminder - Whether you own GME or not - CHANGE YOUR GODDAMN BROKER,2021-02-03 17:00:35
430,In need of some advice,2021-02-03 18:22:46
431,My first few days in the crusade: a current reflection,2021-02-03 22:36:57
432,Batman looking out over Wall Street in the $AMC stock chart today. 💎 🙌💎 for Batman = 🚀🌕,2021-02-03 23:13:00
433,DAILY SQUEEZE THREAD: Please put all current happenings regarding GME/AMC/other squeeze stocks in here to help keep our community awesome!,2021-02-04 00:00:15
434,Holding AMC with diamond hands... but what's the situation for the squeeze?,2021-02-04 04:52:15
435,"I have no clue how stocks work, and no idea what I am doing.",2021-02-04 08:55:56
436,Im deleting the top post. r/StockMaket does not advocate holding shit when its in a death spiral!,2021-02-04 11:41:24
437,"rWSB is losing direction and becoming fractured. Remember Apes: alone weak, together strong (AMC proposal)",2021-02-04 12:57:27
438,"Learned my Lesson with Buying into the Hype, but Will Still Hold Long Term",2021-02-04 13:38:24
439,Never going to sell my AMC stock. My strategy has always been to kiss any money I invest goodbye as soon as I hit the trade button.,2021-02-04 14:03:54
440,DeepFuckingValue Goes to Capital Hill,2021-02-04 14:21:35
441,NAKD is the next big stock.,2021-02-04 14:26:29
442,Capital Gains Tax,2021-02-04 15:18:58
443,"BB is the only one that broke its correlation with the other ""BANG"" stocks (AMC, Nokia, Gamestop) and traded upward today.",2021-02-04 16:15:24
444,GME and meme stock an expensive lesson to learn.,2021-02-04 17:11:58
445,GME Likely to Rebound,2021-02-04 17:37:40
446,I can’t believe how many people are more retarted than me!,2021-02-04 18:24:46
447,Seeing large after hours spikes in price and volume-- what does that indicate about the next day's opening price?,2021-02-04 18:42:39
448,BC couple uses AMC stock gains to support My Pleasant school library,2021-02-04 19:16:04
449,Wall Street won the war?,2021-02-04 19:40:26
450,DAILY SQUEEZE THREAD: Please put all current happenings regarding GME/AMC/other squeeze stocks in here to help keep our community awesome!,2021-02-05 00:00:16
451,If AMC's Stock hits $300 I will send Valentines Gorilla Shit to my ex!!!,2021-02-05 00:21:26
452,Yellen vows to protect us,2021-02-05 00:30:25
453,"Robinhood lifts trading restrictions on GameStop, AMC stock",2021-02-05 00:30:37
454,YOLO trade strategy for Investors who kept getting FCKed this week.,2021-02-05 01:00:02
455,I believe this wave of stock market interest could be great in the long term,2021-02-05 07:43:05
456,Robinhood took off all restrictions,2021-02-05 08:53:09
457,Covered Call Strategy Using AMC Bags,2021-02-05 08:58:56
458,Two Year Study Shows Owning AMC Stock Can Drive 5 More Trips to the Movies a Year,2021-02-05 09:38:04
459,Robinhood lifted GME and AMC restrictions,2021-02-05 09:38:48
460,If you own AMC please read this,2021-02-05 12:10:23
461,I’m tired of seeing meme stocks here,2021-02-05 12:11:25
462,Are XGRO and XEQT the best ETFs my best choices?,2021-02-05 13:20:18
463,Just spent my spending bidget on AMC stock. Lets go tards!!! AMC TO THE MOON 🚀🚀 💎🤲,2021-02-05 15:32:25
464,Why AMC Stock Jumped Again Friday | The Motley Fool,2021-02-05 17:27:43
465,What does this mean for AMC stock? Form 8-K filed Feb 1 2021,2021-02-05 19:44:21
466,Who's Ready for the ETH Squeeze? 10k Possible in 2021,2021-02-05 20:02:42
467,"AMC: An imploding time bomb, and put spreads to capitalize",2021-02-05 20:44:36
468,BB Stock,2021-02-05 23:05:31
469,Can someone explain to me a few things about AMC stock?,2021-02-06 01:21:49
470,WSB helped Silver Lake Group make 113 million in profit. Nice!,2021-02-06 06:42:29
471,I built a tool that shows the number of total mentions on reddit and short interest for each ticker,2021-02-06 10:22:53
472,My First-Ever Stock Purchase - AMC,2021-02-06 10:24:14
473,$AMC buy and hold till launch,2021-02-06 12:49:49
474,Is AMC a good long term investment?,2021-02-06 14:33:30
475,AMC Stock: A Retard's Short DD,2021-02-06 20:09:25
476,What I've learned from investing so far,2021-02-07 03:10:49
477,"140k in savings, is my plan good?",2021-02-07 05:03:50
478,Gamestop Big Picture: The Bigger Picture,2021-02-07 05:10:12
479,Biotech Longterm Play,2021-02-07 09:17:53
480,DD - Electrovaya - EFLVF - $1.55 - TL:DR,2021-02-07 15:17:39
481,What happens to shares of AMC if Netflix buys the company?,2021-02-07 20:49:18
482,Save $AMC Billboard in Kzoo goes viral,2021-02-07 23:56:06
483,AMC Major Stakeholder Wanda Converts Stock To Allow For Sale,2021-02-08 03:00:02
484,"Thank you to all the kind, seasoned veterans taking the time to educate new traders like myself.",2021-02-08 03:30:40
485,"Tired of hearing about GME, AMC, & NOK? I handpicked the most popular posts, tickers, and DD from the last week. Here are the results!",2021-02-08 08:34:55
486,(2/8) Monday's Pre-Market Stock Movers & News,2021-02-08 08:45:30
487,A non-meme 'macro' analysis on AMC (DD),2021-02-08 08:50:20
488,I bought AMC stocks and now I'm scared.,2021-02-08 10:48:44
489,What do you guys think about this portfolio for a young first time investor?,2021-02-08 11:48:06
490,At what point should we come to terms that AMC won’t see $15.00 for a long while?,2021-02-08 12:16:42
491,Weekly SPAC Rundown 2/1 – 2/7,2021-02-08 16:03:18
492,BB is not a phone company. Here’s some DD.,2021-02-08 23:35:42
493,Learning the hard way,2021-02-09 07:36:40
494,$AMC.... Not looking at the meme stock but a pivot for $AMC could change the game.,2021-02-09 09:30:34
495,AMC $8 Put option,2021-02-09 16:07:12
496,PSA: Call options can & are being used to create un-squeezable short positions,2021-02-09 16:54:10
497,"AMC Entertainment's stock drops toward a 4-day losing streak, in which it has shed nearly 39%",2021-02-09 21:38:32
498,Why Reddit’s WallStreetBets Will Stop Buying AMC Stock,2021-02-09 21:42:43
499,MASSIVE AMC STOCK ANALYSIS-WILL AMC STOCK GO BACK TO $20? Buy AMC Stock At $5?,2021-02-09 22:01:37
500,"Nothing to do with stocks, just my AMC in an asparagus field",2021-02-10 09:00:08
501,"Based on reports and current news, what are the predictions for SGMD? I lost a ridiculous amount of money to AMC (still holding by the way but in deficit) and I’m just worried about the next investment. Any insights? How many stocks did you purchase?",2021-02-10 12:56:38
502,What is going on with Helios and Matheson ($HMNY)?,2021-02-10 13:30:30
503,Heres why the squeeze HASNT happened yet on AMC GME,2021-02-10 16:35:38
504,Is it ok to talk about AMC,2021-02-10 21:31:55
505,Deep DD on Soligenix (SNGX) - READ it first,2021-02-11 08:46:15
506,A historical survey of the systemic problem of shorting non-existing stock (naked shorting) in relation to recent events,2021-02-11 15:02:55
507,Sell amc and cut loses or hold for long term ?,2021-02-11 19:35:34
508,Buy AMC and sell long term Calls?,2021-02-12 01:03:56
509,Another low day?,2021-02-12 09:46:46
510,$NSTB / Apex Clearing,2021-02-13 08:10:02
511,"What to do if you lost money on GameStop, AMC, or other ‘meme stocks’",2021-02-13 13:37:46
512,"Tired of hearing about all these meme stocks? I handpicked the most popular posts, tickers, and DD from the last week. Here are the results!",2021-02-14 07:52:40
513,AMC - Is it a company in decline?,2021-02-15 02:40:06
514,Too afraid to ask,2021-02-15 03:25:15
515,AMC Blockbuster DD: The Sequel,2021-02-15 17:53:17
516,Winning SPAC DD #2: Mudrick Capital Acquisition (MUDSW) and merger speculation,2021-02-15 18:46:45
517,"Morning Update for Tuesday, 02/16/21",2021-02-16 08:32:58
518,BDRBF going to DaMoon,2021-02-16 10:19:22
519,"AMC Entertainment Holdings, Inc (AMC) Stock Price, News, Quote & History - Yahoo Finance",2021-02-16 11:59:37
520,I just need someone to tell me I’m doing alright.,2021-02-17 03:03:12
521,Are meme stocks basically any IV over 150%,2021-02-17 21:25:57
522,Blackberry: Bear Case,2021-02-17 22:43:59
523,SEC confirms $GME price kept artificially low via fractional reserve,2021-02-18 07:34:26
524,"Yesterday's play was absolutely amazing, while others lost, I hope you took advantage and made money! Lets go with momentum! 9 plays in 9 days and all profitable!",2021-02-19 07:35:56
525,I'm trying to understand Robinhood's excuse/exposure risk,2021-02-19 14:05:13
526,"Why am I not satisfied, why is greed a thing.",2021-02-19 17:34:29
527,The 99.2% AMC stock being held statement is FALSE. Here's why,2021-02-20 12:19:37
528,The whole GME/AMC trend completely derailed my plans and strategy.,2021-02-22 15:36:06
529,ITS TIME #AMC - STOCK IS GOING TO THE MOON 🚀🚀🚀,2021-02-22 16:56:53
530,"Journey to $1 Million - February 22nd, 2021",2021-02-22 20:29:43
531,"Daily Play, Yesterday it was better to go with the defensive play, today I will also have 2 picks in case market goes red, we must rotate sectors if there is correction",2021-02-23 07:03:07
532,Options strategies to take advantage of a market downturn,2021-02-23 10:08:04
533,"Watch $GME, $AMC and other ""meme stock"" prices rise",2021-02-23 11:35:00
534,AMC Calls 4/16 and 6/18 (insanity or viable play?),2021-02-23 22:19:03
535,Low float on stock. Institutions that bought into AMC /GME now investing into UAMY this last week?,2021-02-24 03:42:26
536,Is AMC blowing up or am I tripping? Goddamn I like this stock 💎💎💎,2021-02-24 15:52:05
537,Can someone explain to me why halting trading of a stock is not market manipulation?,2021-02-24 18:12:51
538,Bloomberg stock forecast for AMC is Bullish!,2021-02-24 22:15:45
539,GME Saga continues and my analysis,2021-02-25 05:22:41
540,AMC GME difference – Not the short or Gamma Squeeze candidate you think it is – real short interest a lot lower due to massive share count increase and dilution.,2021-02-25 07:36:52
541,"Game Plan for February 25, 2021",2021-02-25 08:45:35
542,"Morning Update for Thursday, 02/25/21",2021-02-25 09:01:14
543,Why is AMD doing dropping like a stone?,2021-02-25 11:23:28
544,"BUYING THE DIP, HOLDING STONG - $AMC (Let's Go to the Movies!)",2021-02-25 14:39:28
545,I need help with risk management,2021-02-25 19:37:14
546,First straddle!!!,2021-02-25 21:00:39
547,Update on AMC,2021-02-26 00:26:40
548,"Anomalous Stocks, Thursday, February 25, 2021",2021-02-26 02:23:20
549,"I recruited an astronaut to help get us to the moon. He’s also an actor, scientist, doctor, and lawyer, and seriously knows his stuff! He loves the movies and we love the stock! Long live AMC!",2021-02-26 07:57:37
550,Tdameritrade option question,2021-02-26 22:44:46
551,Robinhood to plan confidential IPO filing as soon as March,2021-02-27 00:19:41
552,"If you only have $100 to invest, what stock would you invest it in?",2021-02-27 13:56:05
553,"Am I doing this right? Am I doing good, bad, great? What can I expect to make? Can I quit my job and be a trader? Realistic expectations",2021-02-27 18:31:00
554,Why I love the AMC Stock,2021-02-28 20:04:03
555,AMC and dilution,2021-03-01 14:49:13
556,AMC options..,2021-03-02 11:11:57
557,AMC Prediction: March 5-March 11 Huge Gains,2021-03-02 19:49:41
558,"🔥 Market Open: Live Stock Updates on $GME & $AMC 🔥 Ask a Data Scientist *Not an adviser, not a dead cat*",2021-03-02 23:43:00
559,AMC Call Now No Positive Profit,2021-03-03 10:16:47
560,Retail investors care more for the success of American businesses than Wall Street,2021-03-03 11:44:44
561,Stocks to Sell Put Options,2021-03-03 15:16:33
562,"Uranium - fuel of the future, opportunity of the lifetime",2021-03-05 06:17:06
563,"Level 2: $GME, $RKT, $AMC, $PLTR, $SKT, $TSLA, $BB- Top Stock Streams",2021-03-05 09:43:24
564,Question about Puts in regards to the GME and AMC situation,2021-03-05 19:39:23
565,Question about Puts in regards to the GME/AMC situation,2021-03-06 00:04:26
566,"AMC FILED w/SEC TODAY to INCREASE COMMON STOCK SHARES by 500,000,000 to 1,024,173,073 - Shareholders Vote MAY 4 - Effective Immediately if Approved. Please READ",2021-03-06 02:27:36
567,"Most anticipated earnings releases for the week beginning March 08, 2021",2021-03-06 06:49:55
568,"Most Anticipated Earnings Releases for the week beginning March 8th, 2021",2021-03-06 07:10:36
569,"Wall Street Week Ahead for the trading week beginning March 8th, 2021",2021-03-06 07:25:53
570,"Laid off and daytrading. 28k in, PDT, and margin. My apprenticeship, if you will.",2021-03-06 13:51:59
571,Vanguard and Blackrock,2021-03-06 16:40:35
572,"Most anticipated earnings releases for the week beginning March 08, 2021",2021-03-06 22:13:14
573,Meme Stock or Future Potential? AMC Entertainment,2021-03-07 17:25:22
574,"Expected moves for the week. SPY, Tesla, Docu, AMC, Oracle and more",2021-03-07 17:46:40
575,Help with my call options on AMC,2021-03-07 21:00:05
576,"Morning Update for Monday, 03/08/21",2021-03-08 08:55:34
577,"Here is a Market Recap for today Monday, March 8, 2021.",2021-03-08 16:39:09
578,Potential big winners for investing,2021-03-09 10:59:02
579,Should I cut my losses?,2021-03-09 13:34:35
580,Be Careful Trading This Week,2021-03-10 02:46:03
581,OPTIONS: Straddle Prices for Stocks Expected to Report Quarterly Results This Week. NYSE: $AMC,2021-03-10 06:44:57
582,"Morning Update for Wednesday, 03/10/21",2021-03-10 08:53:23
583,AMC earnings play?,2021-03-10 10:50:06
584,AMC options 🚀,2021-03-10 16:59:00
585,NASDAQ Cools Off as the Russell Soars...,2021-03-10 17:56:11
586,"GME and AMC charts today during that mass drop. Identical? One could say tactical. Human emotion plays a lot into market buys and sells, and these hedges are looking to trigger you to sell with these coordinated attacks. Stay 💎🙌🏼 and remember why you bought the stock and stay retarded.",2021-03-10 18:02:48
587,ETF Account for Son,2021-03-10 23:07:10
588,"Anomalous Stocks, Wednesday, March 10, 2021",2021-03-10 23:30:05
589,💩 List: Know Your Enemies,2021-03-11 01:29:17
590,A Trade Idea – Sorry about GOCO Yesterday Morgan Stanley is absolutely wrong,2021-03-11 06:47:27
591,A Trade Idea – Sorry about GOCO Yesterday Morgan Stanley is absolutely wrong,2021-03-11 06:48:20
592,"Morning Update for Thursday, 03/11/21",2021-03-11 08:31:47
593,Anyone here trading the AMC options? I feel like they are too expensive to take on.,2021-03-11 14:26:37
594,AMC vertical spread,2021-03-11 21:19:14
595,I feel like I’m literally burning my money.,2021-03-12 04:35:10
596,Most discussed stocks of the week and their sentiment,2021-03-13 12:56:22
597,I've created an algorithm that scans social media sites to identify stocks that have had the biggest increase in chatter. I wanted to share the results of this week with you.,2021-03-13 13:02:41
598,DD - FNKO Launching NFTs in 2021,2021-03-13 16:00:24
599,Advice for young investors with little or no bills to pay!,2021-03-14 20:31:03
600,"Morning Update for Monday, 03/15/21",2021-03-15 08:52:56
601,"Game Plan for March 15, 2021",2021-03-15 09:06:31
602,$BB 3/15/2021 - Healthy Retracement,2021-03-15 16:11:53
603,"Here is a Market Recap for today Monday, March 15, 2021. Please enjoy!",2021-03-15 16:45:03
604,NASDAQ Leads Indexes Higher...,2021-03-15 20:05:07
605,The effect of options on stock price $TRVG $AMC $GME,2021-03-15 21:10:09
606,"r/Stocks Daily Thread on Meme Stocks Tuesday - Mar 16, 2021",2021-03-16 05:20:15
607,"Morning Update for Tuesday, 03/16/21",2021-03-16 08:49:22
608,AMC Apedate (Update),2021-03-16 13:21:01
609,"Here is a Market Recap for today Tuesday, March 16, 2021. Please enjoy!",2021-03-16 16:08:23
610,"NYSE Chairman Says GameStop Surge Highlights U.S. Market Flaws...""Retail stock pickers have been openly coordinating share purchases and sales on Reddit forums, sending the price of GameStop, AMC Entertainment Holdings Inc. and others on a wild series of ups and downs.""",2021-03-16 16:13:16
611,HELL NO I WILL NOT LEND MY HTB STOCKS!!!,2021-03-16 19:12:47
612,DD With the Gamestonk Terminal,2021-03-17 16:47:32
613,"Morning Update for Thursday, 03/18/21",2021-03-18 08:56:21
614,"DEEP $AMC ITM 19 MAR 21 CALLS Sell?, Roll over?, exercise?",2021-03-18 14:32:16
615,First time poster. Hey guys! If you’re in any of the FB AMC groups you probably know this car. Found this Reddit page in the midst of the AMC stock market ordeal. But I’m glad to be here! 73 Javelin with a 366,2021-03-18 15:16:28
616,2 reasons to buy Rolls-Royce at $1.70✈️,2021-03-19 08:17:01
617,Lets talk about AMC today,2021-03-19 20:40:47
618,"The AMC Stock vote will be a resounding YES on the part of the Majority, and how it affects you. Read more inside.",2021-03-20 15:04:37
619,"r/Stocks Daily Thread on Meme Stocks Sunday - Mar 21, 2021",2021-03-21 05:20:20
620,AMC why it's all good from friday's Quadruple witching hour.,2021-03-21 13:18:19
621,AMC; Fundamentals and the Long Term play,2021-03-22 04:43:21
622,"Morning Update for Monday, 03/22/21",2021-03-22 08:55:36
623,The Telehealth Underdog: AMWL Announcing Q4 Earnings This Week,2021-03-22 11:37:26
624,"ASO earnings, decent short interest",2021-03-22 15:06:58
625,A Trade Idea and yesterdays NLS,2021-03-23 07:55:11
626,A Trade Idea - And yesterday's NLS,2021-03-23 07:55:56
627,"Morning Update for Tuesday, 03/23/21",2021-03-23 09:01:57
628,69 contracts = AMC stock price at 420 ?,2021-03-23 15:53:43
629,THE QQQ continues to trade in the same range for the past 10 out of 11 sessions ... sell premium,2021-03-23 16:25:49
630,(3/24) Wednesday's Pre-Market Stock Movers & News,2021-03-24 08:47:31
631,2021 - The greatest year of Investing,2021-03-24 22:29:02
632,Double leg 150% gain on volatile stock theory,2021-03-25 10:47:05
633,Covered calls on AMC,2021-03-25 12:27:56
634,"Here is a Market Recap for today Thursday, March 25, 2021",2021-03-25 16:49:31
635,"I wanted to make sure WealthSimple didn't lend out my shares. Their response: Wealthsimple Trade doesn't offer options trading such as shorts, calls, puts, etc. So you can rest assured that your shares aren't available for lending!",2021-03-25 17:29:46
636,StockPulse PulseBrief - Etruscus Resources - CSE:ETR / OTC: ETRUF,2021-03-26 22:47:27
637,Complete list of this week's trending tickers and top posts from Reddit,2021-03-28 11:41:36
638,"Stocks On The Move-GME, AMC, KOSS, HPR, BRPA, HGEN, CAN, AABB, EEIQ, KZI...",2021-03-29 07:27:12
639,"So I don't have much to invest, and I don't understand the tricks of the trade, but is this an ok strategy for someone in my boat?",2021-03-29 21:22:51
640,Help with Cash Secured Put.,2021-03-30 01:21:29
641,Stocks becoming very stable? No Volatility?,2021-03-30 11:52:55
642,"AMC & GME Stock Low Volume Explanation - Someone Purchased $33,000,000 in Deep ITM Options for 4/16",2021-04-01 01:54:40
643,We Win and They Lose. There Is No Middle Ground In The Battle For AMC Stock and GameStop!🚀🚀🚀🚀🚀,2021-04-01 06:20:14
644,I want your opinion on casual trading,2021-04-02 09:49:20
645,Trade Analysis,2021-04-02 10:50:39
646,Find out total holdings of portfolio based on different ETFs,2021-04-02 22:50:00
647,I don’t even care what’s they say bad thing about GME or AMC I just like to buy those stocks and I like the stocks,2021-04-03 11:15:12
648,AMC AND GME SHORT INTEREST IS MUCH HIGHER THAN WE THINK! - (AMC and GME Stock Analysis),2021-04-04 06:39:17
649,Buying more ASO Calls,2021-04-04 09:33:18
650,DD on fundamentals and growth of Super League Gaming $SLGG,2021-04-06 08:15:03
651,Why CIDM is a steal at $1.40,2021-04-07 10:39:08
652,New Position: Atlas Air Worldwide,2021-04-07 23:20:05
653,$MUDS TOPPS DD,2021-04-10 16:44:48
654,$MUDS TOPPS DD,2021-04-10 17:05:37
655,$MUDS TOPPS Another Take,2021-04-10 17:07:12
656,Any stocks $13 and under you like for selling put options on right now?,2021-04-13 00:46:03
657,"Trying to move away from a ""swing for the fences""/day trading mentality",2021-04-13 18:50:54
658,"Morning Update for Thursday, 04/15/21",2021-04-15 08:45:54
659,"Gary Gensler confirmed by Senate to lead the SEC, Wall Street’s top regulator",2021-04-15 10:00:58
660,"The market is perfectly healthy, and not about to drop, or have a large correction like everyone suspects (Hear me out)",2021-04-16 13:11:06
661,Being Defensive in the Mining Space,2021-04-18 11:58:50
662,"LOOKING FOR ADVICE ( APPLE, TESLA AND AMAZON STOCKS) ‼️‼️‼️",2021-04-20 13:50:34
663,Options Stock Ranker for Apr-21-2021,2021-04-21 10:04:02
664,Newbie Investor!,2021-04-21 16:59:53
665,Any Next Steps???,2021-04-23 13:05:39
666,List of Stock-Specific Investment Related Subreddits,2021-04-24 13:44:59
667,How meme stocks like Gamestop and AMC changed Wall Street,2021-04-25 19:41:26
668,"Morning Update for Monday, 04/26/21",2021-04-26 08:41:16
669,Your favorite underlyings to sell puts for/wheel,2021-04-29 21:44:24
670,"Most anticipated earnings releases for the week beginning May 3, 2021",2021-05-01 08:38:22
671,Why hasn't Robinhood still not received any form of punishment/fine when they restricted the buying on 50 different stocks back in January?,2021-05-01 09:36:51
672,AMC Symmetrical Triangle Pattern Analysis,2021-05-01 12:33:04
673,I do not think it means what you think it means,2021-05-01 17:46:24
674,"Expected moves this week. Roku, DraftKings, Uber, Cronos Peloton and more",2021-05-02 15:38:06
675,"$AMC Stock, How To Buy 50% Off 🤑 Simple Option Strategy! 🎫 Any Stock! Example in Robinhood",2021-05-02 19:34:19
676,Advice for young investors with little or no bills to pay!,2021-05-05 09:57:40
677,Vista Outdoor ($VSTO) pre-earnings DD,2021-05-05 21:31:43
678,Options Stock Ranker for May-06-2021,2021-05-06 16:15:03
679,"According to Morningstar, only 42% of the top 5,000 US stocks finished positive in the previous decade (plus what I've learned over my 12+ years investing)",2021-05-06 19:17:44
680,"$AMC YOLO update : 4648 shares across 4 accounts, 19 call options. I still like the stock 🦍💪",2021-05-06 19:44:25
681,Just wanted to point this out about youtube stock entertainers.,2021-05-06 23:08:19
682,"Hot Stocks Level 2 ( $GME $RKT $SPY $VIAC $TSLA $VIX & $AMC #DOGE​) May 07, 2021",2021-05-07 07:55:22
683,Anybody else easy for the AMC explosion?,2021-05-09 14:51:22
684,$AMC stock,2021-05-10 08:39:58
685,"How to make ""free"" money by lending out your AMC shares",2021-05-12 14:14:32
686,"I am Officially going defensive tomorrow! I was preparing for this for several weeks, but I too was buying the dip! Bad strategy as you see the Red deepens!",2021-05-12 22:56:17
687,"If price rises exponentially, are there still buyers interested in purchasing deeply ITM contracts (selling to close without exercising)?",2021-05-13 01:06:21
688,"The Only Watch List You Need May 13, 2021",2021-05-13 09:03:47
689,AMC soars and this time GameStop follows as meme stocks get squeezed hard,2021-05-13 14:45:56
690,"Here is a Market Recap for today Thursday, May 13, 2021",2021-05-13 16:24:43
691,31 year old investor advice,2021-05-13 17:46:44
692,CCL / Carnival Cruise Line,2021-05-13 18:22:01
693,Express ($EXPR) Stock: Over 10% Increase Explanation,2021-05-13 21:11:01
694,OCGN might be a good bullish daytrade today 14th May,2021-05-14 02:37:28
695,Got a hole burning in my pocket.,2021-05-14 03:07:17
696,"The Only Watch List You Need May 14, 2021",2021-05-14 09:08:20
697,"After 24% Pop, Why Redditors Could Keep AMC Stock Rising",2021-05-14 10:38:44
698,"Here is a Market Recap for today Friday, May 14, 2021",2021-05-14 16:42:47
699,Why I Think AMC Will Result In Bagholders,2021-05-14 18:50:15
700,Can we please talk about YOLO BSC Token?,2021-05-14 23:25:21
701,"So, how was your trading week?",2021-05-15 16:38:04
702,Are strangles a good way to play AMC?,2021-05-16 03:02:28
703,I built a program that tracks mentions and sentiment of stocks across Reddit and Twitter! This week's most discussed and top growing stocks!,2021-05-16 10:34:52
704,"The Only Watch List You Need May 17, 2021",2021-05-17 09:11:36
705,AMC Strong Move,2021-05-17 23:04:43
706,GameStop and AMC short-sellers have lost almost $1 billion in just 5 days of trading amid a meme-stock rally,2021-05-18 12:11:37
707,AMC brings new drama to the stock market,2021-05-18 12:28:52
708,Catalyst for market taking a nose dive?,2021-05-18 14:47:01
709,Options Stock Ranker for May-19-2021,2021-05-19 16:15:09
710,Anyone have insight on GPOR - just got put on NYSE 2 days ago profile page points to amctheaters page,2021-05-19 16:56:22
711,READ READ READ,2021-05-20 12:19:52
712,Options Stock Ranker for May-24-2021,2021-05-24 16:15:04
713,First major experience in the stock market with AMC and meme stocks,2021-05-25 14:46:29
714,"Here is a Market Recap for today Tuesday, May 25, 2021",2021-05-25 16:42:26
715,Trying to understand options,2021-05-26 06:19:50
716,amc covered call,2021-05-26 10:22:39
717,What happens to the general stock market if the $GME and $AMC squeezes work?,2021-05-26 16:06:57
718,Halp with exit strategy,2021-05-27 10:29:31
719,SpotGamma Analysis - AMC RKT Gamma Squeeze: “Escape Vol-ocity!”,2021-05-27 16:14:14
720,"Here is a Market Recap for today Thursday, May 27, 2021",2021-05-27 16:26:35
721,Looking for info on the 258 engine,2021-05-27 20:35:55
722,Using stock options to capitalize on the vol spike in $AMC,2021-05-27 21:14:09
723,$AMC tomorrow: Pre Holiday and Max Pain Effect,2021-05-27 21:33:39
724,Asking as a novice: what is happening with AMC now?,2021-05-27 21:45:34
725,Best way to profit from AMC FOMO?,2021-05-27 21:51:15
726,AMC!!!!!!! What is going to be decided on June 2?,2021-05-27 22:23:48
727,Selling AMC puts June 4,2021-05-27 22:36:42
728,"AMC Stock Is Soaring, Leaving GameStop in the Dust",2021-05-28 04:56:24
729,AMC bearish plays,2021-05-28 07:03:20
730,"The Ultimate Gap Watch List May 28, 2021",2021-05-28 08:49:34
731,AMC’s Four-Day Surge Slaps Short Sellers With $1.3 Billion Loss,2021-05-28 12:00:46
732,"Here is a Market Recap for today Friday, May 28, 2021",2021-05-28 16:54:54
733,$AMC +$270K. Not selling cos I like the stock!,2021-05-28 18:20:14
734,"AMC Entertainment’s 130% spike this week isn’t done yet, analyst speculates",2021-05-28 18:59:06
735,Geographic asset allocation,2021-05-29 05:08:45
736,"Wall Street Week Ahead for the trading week beginning May 31st, 2021",2021-05-29 07:02:24
737,$AMC earnings analysis by Quant Data,2021-05-29 16:36:24
738,"Plays on high IV, Memes & AMC",2021-05-29 18:23:27
739,Made 2k off amc,2021-05-29 23:24:43
740,"Please help, math on selling or exercising the option!! (5x)10$ calls at 3.75 exp jan 2022",2021-05-30 04:44:50
741,I built a program that tracks mentions and sentiment of stocks across Reddit and Twitter! This week's most discussed and top growing stocks!,2021-05-30 10:20:57
742,A backtested algorithm for trading meme stocks – 366% on AMC in just under 2 months and 16 trades,2021-05-30 13:55:13
743,AMC headed for bankruptcy because retail investors?,2021-05-30 21:26:21
744,"r/DayTrading's Weekly Questions Thread - Monday - May 31, 2021",2021-05-31 05:00:22
745,"Expected moves this week. Zoom, Crowdstrike, Lululemon and meme stocks.",2021-05-31 14:11:16
746,Tune out the FUD AMC stock,2021-05-31 16:38:45
747,HOW TO PLAY AMC FOR DIRT CHEAP,2021-06-01 04:51:12
748,AMC Continues to Pop (+20% today)- Best 3 Reddit Stocks To Watch,2021-06-01 12:56:06
749,Ever notice how they rob you blind on put trades?,2021-06-01 13:06:52
750,"Here is a Market Recap for today Tuesday, June 1, 2021",2021-06-01 16:18:59
751,Any advice for minimizing losses as this point on a short... and hear me out for those who would rather ridicule for having done so! AMC,2021-06-01 19:02:30
752,Big Cap vs small Cap oil,2021-06-01 20:23:23
753,AMC up 40% as Reddit bulls drown out hedge fund share dump,2021-06-02 07:34:36
754,AMC to Offer Free Popcorn and Exclusive Screenings for Investors,2021-06-02 08:03:20
755,Question on call option,2021-06-02 12:00:19
756,Get out the popcorn! AMC Entertainment is having the best year of any stock with a market cap of at least $3 billion.,2021-06-02 14:52:56
757,Advice please,2021-06-02 15:47:11
758,"Here is a Market Recap for today Wednesday, June 2, 2021",2021-06-02 16:41:23
759,Meme stocks and post-sale regrets,2021-06-02 17:39:53
760,Best Cash Secured Puts for Long Term Investing,2021-06-02 19:58:15
761,I bought subscriptions to social media/sentiment stock data platforms to see which one was the best for algotraders,2021-06-02 20:10:04
762,Beware of what AMC shorts are holding!,2021-06-02 21:12:52
763,"Alert: Mudrick Capital Buys AMC Stock, Cashes Out Swiftly",2021-06-03 01:40:26
764,"Alert: Mudrick Capital Buys AMC Stock, Cashes Out Swiftly",2021-06-03 01:45:32
765,Am I understanding this correctly?,2021-06-03 02:14:52
766,We like the stock $AMC $GME,2021-06-03 02:26:54
767,BB on a Ride,2021-06-03 04:41:14
768,What is going on with AMC stock? Break out the popcorn🍿,2021-06-03 09:58:15
769,Updated DAILY short volume data in AMC (as of Wednesday's close). Another 266 million+ shares shorted yeterday,2021-06-03 11:00:49
770,They totally rob you blind if you try to scalp ootm puts on AMC,2021-06-03 11:04:38
771,"AMC was presumably near bankruptcy with covid but the meme stock raised $230m from Mudrick Capital in part thanks to its massive runup this year. After the news, AMC nearly doubled in a day, up 3000% YTD!",2021-06-03 11:21:16
772,AMC: EVERY ONE SHOULD READ THIS MORNING’S 8-K FILING,2021-06-03 12:03:43
773,AMC 25k stocks YOLO - To the moon and beyond!,2021-06-03 13:45:21
774,Rolling Deep ITM Calls on AMC,2021-06-03 13:49:13
775,"Here is a Market Recap for today Thursday, June 3, 2021",2021-06-03 16:46:13
776,My analysis of AMC 11m share sale news,2021-06-03 17:25:23
777,What is a gamma squeeze and how did it drive up AMC's stock price?,2021-06-04 03:56:19
778,Amc is on early rise stage,2021-06-04 08:21:51
779,"Most notable stock upgrades and downgrades June 4, 2021",2021-06-04 09:02:51
780,Watchlist - 2021-06-04,2021-06-04 09:19:49
781,That AMC dip yesterday kicked my portfolio and took its lunch money,2021-06-04 10:33:40
782,Should I sell my AMC stocks and go naked with the September 16c I sold?,2021-06-04 10:37:54
783,"Retail Traders in India, South Korea Join Meme Craze for AMC - The Short Squeeze is coming!!",2021-06-04 14:21:59
784,AMC Covered Call,2021-06-04 16:11:20
785,Options Stock Ranker for Jun-04-2021,2021-06-04 16:15:03
786,A lesson to act. Take profits.,2021-06-04 18:50:46
787,"Wall Street Week Ahead for the trading week beginning June 7th, 2021",2021-06-05 00:42:29
788,WKHS Recent Downtrend Breakout - Important Levels,2021-06-05 15:21:12
789,Synthetic Short on AMC strategy,2021-06-05 21:28:00
790,Has this sub become a meme-shilling machine?,2021-06-06 12:29:50
791,"Expected moves for this week: Meme stocks, SPY, Earnings in COUP, CHWY, FCEL, MRVL and more",2021-06-06 13:53:12
792,AMC Stock Holders - Pitch for AMC Subscription Service - Cable and Streaming - Your Thoughts.,2021-06-06 16:43:28
793,$AMC retail vs Wallstreet,2021-06-06 18:38:55
794,"Cleanest + Repeated Options Flow Plays Series # 3 - AMC, CLNE, FUBO, ARKK. FB, FUTU, JMIA",2021-06-06 19:52:30
795,The question isn't if AMC will crash it's when will it crash.,2021-06-07 02:33:20
796,Breaking 100 USD dividend payout this month,2021-06-07 04:40:36
797,The short-squeeze thesis isn't gonna end well for a lot of you,2021-06-07 07:55:32
798,AMC Strangle: How idiotic am I?,2021-06-07 10:22:55
799,AMC technical analysis 6/7,2021-06-07 11:19:00
800,"‘Resist the temptation’ to short AMC Entertainment, other meme stocks ‘because these prices can go to unimaginable highs,’ says Interactive Brokers founder",2021-06-07 13:25:11
801,eating dirt on $CLOV,2021-06-07 16:26:30
802,On Memes & Investing,2021-06-08 05:55:39
803,"The OG Stock Watch List June 8, 2021",2021-06-08 08:48:42
804,Options Stock Ranker for Jun-08-2021,2021-06-08 16:15:04
805,"‘Resist the temptation’ to short AMC Entertainment, other meme stocks ‘because these prices can go to unimaginable highs,’ says Interactive Brokers founder",2021-06-08 17:34:04
806,"MEME YOLO aka ""Moon"" Trap !!!",2021-06-08 18:41:26
807,Covered call on AMC?,2021-06-08 21:16:57
808,Hostess Twinkies ($TWNK) DD,2021-06-08 22:48:33
809,The Geo Group is undervalued with price to free cash flow ration of less than 2.,2021-06-09 03:44:59
810,Will AMC Stock Squeeze Again? Find Out Why.,2021-06-09 14:34:32
811,Options Stock Ranker for Jun-09-2021,2021-06-09 16:15:04
812,Question Plz my first option call I started very small to learn this,2021-06-09 20:38:20
813,"With meme stocks becoming the new trend, I’m wondering if anyone has found a good strategy to detecting the next “it” stock?",2021-06-10 01:07:48
814,"Different Sub, Same Problems. Flooded by shitty Memes/DD of shitty Stocks",2021-06-10 09:18:01
815,$WWE - Can I get a hell yeah,2021-06-10 09:24:03
816,Top 10 Reddit Stocks As Frenzy Hints At Life Beyond WallStreetBets,2021-06-10 13:40:31
817,Why Would Price Go Down if Inflow is Consistently Higher Than Outflow?,2021-06-10 13:42:31
818,My new strategy - Advice Appreciated!,2021-06-10 18:18:30
819,"Question for all the apps out there! Is it at all possible in any way whatsoever that the hedgies are pushing all these new “meme stocks” and turning us onto them, as a way to distract us from GME and AMC and spread our power out between too many other stocks.??",2021-06-10 20:53:49
820,AMC Just Got a Credit Upgrade. Being a Meme Stock Is Paying Off.,2021-06-10 20:59:47
821,Investments exceed RRSP contribution limit,2021-06-11 05:57:13
822,💎$AMCToken 📷NEW TOKEN🔥 10000X potential🚀 Get on & tighten the belt! Now!,2021-06-11 09:02:25
823,"I made an algo that tracks sentiment on Reddit (and trades those stocks). Here's the source code and the sentiment results for this week. I rebalance weekly, but can set rebalance speed to as fast as a couple ticks (although that would be a bit silly)",2021-06-11 11:31:36
824,Can't buy AMC options on TD today,2021-06-11 14:01:11
825,Hopefully 3 months from now I get a whole lot of FUCK you's 🤝,2021-06-11 16:15:09
826,I like the stock 😼🍺 #amcstrong💪🏾,2021-06-11 17:09:48
827,Risks of selling optiond,2021-06-11 17:54:56
828,"After weeks of profiting from the stock and debt of AMC Entertainment Holdings Inc., hedge fund Mudrick Capital Management ended up with a 5.4% loss after a derivatives bet went haywire",2021-06-11 19:16:44
829,"A hedge fund lost 10% in just a few days after a sudden spike in AMC stock derailed an options trade, new report says",2021-06-12 09:45:38
830,My experience with the Moomoo app/brokerage firm and why I wouldn't use it and left.,2021-06-12 16:18:32
831,💎$AMCToken 📷NEW TOKEN🔥 10000X potential🚀 Get on & tighten the belt! Now!,2021-06-12 17:07:15
832,"I made an algo that tracks sentiment on Reddit (and trades those stocks). Here's the source code and the sentiment results for this week. I rebalance weekly, but can set rebalance speed to as fast as a couple ticks (although that would be a bit silly)",2021-06-12 18:21:51
833,In the money and out of the money in highly volatile stocks,2021-06-13 12:54:38
834,"How do we capitalize off of ""Meme Stock Mania?""",2021-06-13 13:30:01
835,"Expected Moves this week. SPY, Meme vol crush, Oracle and Adobe earnings",2021-06-13 16:52:36
836,Buying Options Call on AMC,2021-06-13 23:42:13
837,"The OG Stock Watch List June 14, 2021",2021-06-14 08:50:44
838,Beginner Dividend Investor looking for advice,2021-06-14 13:57:29
839,AMC stock ripping/trey,2021-06-14 15:51:13
840,Options Stock Ranker for Jun-14-2021,2021-06-14 16:15:04
841,Selling amc calls,2021-06-15 01:07:45
842,"The OG Stock Watch List June 15, 2021",2021-06-15 08:48:02
843,AMC is a cult,2021-06-15 09:43:42
844,The only meme stock that keeps going up 🚀🚀🚀🚀 $AMC,2021-06-15 10:18:38
845,Options Stock Ranker for Jun-15-2021,2021-06-15 16:15:05
846,Buying High IV Underlying to Sell CCs,2021-06-15 16:58:24
847,THE NEXT BIG SQUEEZE IS COMING. HORSES ARE ABOUT TO RUN.,2021-06-15 21:39:09
848,"I bought an AMC 45c 6/18 for $820, it’s currently worth $1,500. Would you sell the contract or exercise it? *not asking for financial advice",2021-06-15 23:39:47
849,Due Diligence of a stock where all criterias for an SS are met but only needs volume,2021-06-16 06:06:14
850,Top Stocks on /r/PennyStocks in last 24 hours,2021-06-16 14:29:30
851,Best way to get your feet wet in options?,2021-06-16 16:08:39
852,Options Stock Ranker for Jun-16-2021,2021-06-16 16:15:05
853,"$XERS - You'll Have Xero Worries With This One, Literally",2021-06-16 22:07:10
854,Recommend reading / resources for all levels,2021-06-17 11:32:04
855,The next move coming for AMC stock,2021-06-17 12:23:19
856,My DD on RKT and the Options data,2021-06-18 00:03:38
857,AMC stock key levels here!,2021-06-18 12:51:36
858,EGLX - leading eSports company is way over shorted,2021-06-18 13:24:47
859,$AMC We need all APES buy buy buy hold hold hold the squeeze is coming soon the shorts are throwing everything they can to drop the price.,2021-06-18 15:04:58
860,Options Stock Ranker for Jun-18-2021,2021-06-18 16:15:06
861,Uneducated traders fuel HF,2021-06-19 13:48:23
862,$CLOV- Serious Discussion: Is this stock the actual dark horse.. AMC & GME prepared us for???,2021-06-19 16:12:38
863,Options play for meme stocks?,2021-06-20 12:48:08
864,"The OG Stock Watch List June 21, 2021",2021-06-21 08:47:31
865,"GameStop Is Joining the Russell 1000, but AMC Isn’t. How It Affects the Stocks.",2021-06-21 09:32:42
866,Left My Career To Learn to Become a Full Time Trader - Week 11,2021-06-21 17:28:34
867,“Too good to be true” options trade… Need help.,2021-06-22 05:29:43
868,AMC July 30 $60 Call [$17.50],2021-06-23 11:56:10
869,CLNE - A very promising long term stock,2021-06-23 12:08:35
870,Someone's coming knocking...,2021-06-23 16:47:16
871,"AMC $50 sell put, 8/20 calls",2021-06-23 17:06:19
872,"[SUGGESTION] As a beginner, if you were given $1,000, where would you want to invest?",2021-06-24 00:41:37
873,Buying back a covered call deep ITM,2021-06-24 11:10:55
874,Mitigating Risks and Maximizing Returns using Collateral Plays - In Depth Trade Thesis,2021-06-24 18:40:10
875,$WKHS climbing in popularity among retail investors and wsb. Highest short interest and borrow rate. What do you guys think about this potential EV play? I think HUGE! $WKHS 💎🐎🦍,2021-06-24 19:23:31
876,tradezero htb fee (stocks with high volume?),2021-06-25 02:42:21
877,Seemingly nonsense buying power requirement (cash secured account) (iron condor VS CCS + CSP),2021-06-25 05:37:51
878,Hedge funds rethink tactics after $12bn hit from meme stock army,2021-06-25 07:00:50
879,"Daily option statistics for stocks such as SPCE, AMC, WISH, CLOV, BB, GME, TSLA, WKHS, NOK and others.",2021-06-25 16:54:35
880,I invest based on quantitative sentiment score on Reddit - I'm beating SPY YTD and BUZZ since inception. Last week's numbers and positions:,2021-06-25 18:53:45
881,"I invest based on quantitative sentiment score on Reddit - I'm beating SPY YTD and BUZZ since inception, and 2.18% return last week compared to a 0.39% loss for SPY and 0.66% loss for BUZZ. More of last week's numbers and positions:",2021-06-25 18:55:16
882,I invest based on quantitative sentiment score on Reddit - I'm beating SPY YTD and BUZZ since inception. Last week's numbers and positions:,2021-06-25 19:00:59
883,"Let's try a new ""market sentiment"" hot take, called Trade, Invest, Short",2021-06-25 22:29:54
884,Is market manipulation real? Do we see it on the regular? Do we individual investors have a chance?,2021-06-26 16:02:24
885,Value Investing Guide,2021-06-27 18:05:38
886,Charles Schwab Raises Margin Requirements For AMC & GME Stock,2021-06-27 18:11:35
887,"Expected moves this week. SPY, QQQ, Meme Stocks, Earnings",2021-06-27 18:25:36
888,The most discussed stocks across Reddit and Twitter Now. $WISH $AMC $GME $CLOV $SPY $CLNE $BB $TSLA $WKHS $PLTR,2021-06-28 13:40:29
889,Left My Career to Learn to Become a Full Time Day Trader - Week 12,2021-06-28 15:21:38
890,"Stock Watch List June 29, 2021",2021-06-29 08:46:14
891,Exercise my Option?,2021-06-29 09:19:38
892,What’s your opinion on social media accounts manipulating the ‘meme’ stocks?,2021-06-29 09:57:23
893,Maximizing profit from selling AMC calls,2021-06-29 16:05:16
894,UPDATE: I invest based on quantitative sentiment score on Reddit - I'm beating SPY YTD and BUZZ since inception (but lost this past week). Last week's numbers and positions (and what I'm rebalancing into tomorrow morning),2021-06-29 17:59:30
895,I'm another lucky meme trader that got burned and is now trying to develop more sustainable habits.,2021-06-29 18:25:58
896,new stock!,2021-06-29 23:19:38
897,"Allied Energy Corporation (AGYP) Sees Major Short Volume, Squeeze Next?",2021-06-30 12:18:04
898,Is AMC the new Tesla stock of 2021? - Rising Candle post,2021-06-30 19:25:08
899,What the most popular Meme stocks GME and AMC have in common that many others don’t.,2021-07-01 09:30:09
900,AMC bull put spread?,2021-07-01 11:25:05
901,Long range Put options for AMC or Meme Stocks,2021-07-01 15:10:16
902,A different kind of post - Classic narrative,2021-07-01 15:15:09
903,A different kind of post - Classic narrative,2021-07-01 15:17:06
904,Need opinions on my new investing strategy,2021-07-01 17:34:26
905,CLMT…the reusable energy stock ready for take off. Stock/company is crazy undervalued with cutting edge tech assets.,2021-07-01 21:15:47
906,"Here is a Market Recap for today Friday, July 2, 2021. Please enjoy!",2021-07-02 16:22:38
907,AMC STOCK ALL THE GOOD THATS COME FROM THE MOVEMENT SO FAR,2021-07-04 20:30:47
908,"Expected moves this week, SPY, SPCE, WKHS and more",2021-07-05 13:46:50
909,Left My Career to Learn to Become a Full Time Day Trader - Week 13 Update,2021-07-05 19:09:40
910,AMC Withdraws 25M Share Increase Proposal From Shareholder Vote,2021-07-06 08:57:35
911,"Stock Watch List July 7, 2021",2021-07-07 08:48:37
912,"Stock Watch List July 8, 2021",2021-07-08 08:48:27
913,Hey everybody what’s your opinion on AMC? What’s your overall view of the company and the stock?pic for attention,2021-07-08 09:48:32
914,How do I hit undo,2021-07-08 12:47:36
915,Cool visual of today's (7/8) total option premium over the course of the day.,2021-07-08 16:55:02
916,SPCE IV Crash,2021-07-08 19:32:29
917,AMC STOCK - (THEY ARE SCARED) A MESSAGE FOR ALL APES. OFFICIAL AMC STOCK HYPE VIDEO 🔥🔥🔥,2021-07-09 00:10:21
918,Friday Beers Options Breakdown (July 9th),2021-07-09 16:59:07
919,Betting against meme stocks with puts,2021-07-09 19:40:53
920,Good morning!,2021-07-10 08:28:37
921,New to investing any recommendation on how to get started?,2021-07-10 15:29:18
922,"Stock Watch List July 12, 2021",2021-07-12 08:44:17
923,Beachbody ($BODY) DD,2021-07-12 09:59:09
924,Top 30 short squeezes as ranked by Fintel. Enjoy little grasshoppers!!!,2021-07-12 16:13:00
925,"I have $4,000 invested into some random-ish picks. What do you guys think I should add / sell from this portfolio?",2021-07-13 03:10:01
926,"Stock Watch List July 14, 2021",2021-07-14 08:48:31
927,Options trading in Germany?,2021-07-14 09:10:44
928,Rolling out of my losing position,2021-07-14 13:48:57
929,GameStop Investors Speculate on Meme Stock’s NFT Launch,2021-07-15 08:23:43
930,"Day Trading Stock Watch List July 15, 2021",2021-07-15 08:50:01
931,"Reddit Traders Are Upending the World of Credit Investing, Too",2021-07-15 08:59:25
932,Closing vertical spreads,2021-07-15 10:27:58
933,Anyone else tired of this market?,2021-07-15 11:47:17
934,Position Sizing - New Trader,2021-07-15 16:28:33
935,New to options trading and want to make I understand before I buy,2021-07-15 17:48:26
936,AMC Stock: Beware Of These Risks,2021-07-16 06:24:36
937,What do you guys think $AMC will do today?,2021-07-16 07:48:22
938,"Stock Watch List July 16, 2021",2021-07-16 08:47:07
939,"Underlying goes up, value of contract...does whatever the hell it wants?",2021-07-16 11:36:34
940,AMC Stock To The Moon: Could This Be The Week?,2021-07-17 07:46:03
941,Calculating market-makers' GEX (Gamma exposure) for meme stocks,2021-07-17 17:49:24
942,"Stock Watch List July 19, 2021",2021-07-19 08:49:31
943,AMC stock soaring once again,2021-07-20 15:59:02
944,Meme Stocks GameStop and AMC Bounce Back. Short Sellers Got Burned Again.,2021-07-20 19:12:55
945,"Stock Watch List July 22, 2021",2021-07-22 08:49:25
946,Is there a great stock to day trade?,2021-07-22 20:34:51
947,"Stock Watch List July 23, 2021",2021-07-23 08:44:40
948,"AMC’s CEO, Who Embraced Meme Stock Crowd, Gets Another Title",2021-07-23 12:56:58
949,AMC Quantitative Stock Analysis - Bearish (7/23),2021-07-23 22:14:01
950,"AMC, GME Stock This Is Why I'm Holding, Must See...",2021-07-23 23:20:30
951,Rules I always tell myself to Follow - and never do (please feel free to add on or call out a bad rule),2021-07-24 21:34:55
952,NDVA Question,2021-07-25 20:56:12
953,Adjusting Margin Calls with Naked Shorting,2021-07-25 22:00:02
954,Valuee - Launch of new tool for value investing,2021-07-27 14:41:39
955,Part 1: Risk management for the Aggressive Retail Trader: Buying options,2021-07-27 20:08:30
956,AMC Stock Float History,2021-07-28 12:50:57
957,"Robinhood & Me: or How I Got Screwed ... recording with ""Highest Level Of Escalation""",2021-07-31 20:45:04
958,"Security Analysis: Chapter I: The Scope and Limitations of Security Analysis. The Concept of Intrinsic Value Pt. 3: The Examples, Continued",2021-07-31 23:30:35
959,How Stocks Are Valued Part 2: Relative Value,2021-08-01 11:52:03
960,"Virtu Financial DD: Earnings Aug 4th, 2021",2021-08-03 14:52:32
961,$AMC Entertainment stock,2021-08-03 19:22:15
962,Ninja Trading Simulator setup help,2021-08-06 07:56:35
963,"Cinemark reported its Q2 revenue today, beat estimates by 10% | Indicates, the return of theatre business",2021-08-06 10:25:12
964,"Most anticipated earnings releases for the week beginning August 9, 2021",2021-08-07 07:03:16
965,"Expected moves this week, SPY, Robinhood., Coinbase, NIO, Palantir, Disney and more.",2021-08-08 11:27:37
966,AMC Entertainment Q2 earnings – What to expect,2021-08-09 04:18:30
967,AMC Margin maintenance,2021-08-09 08:39:18
968,Bullish (coinbase competitor). Key supporters include Peter Thiel and former NYSE president,2021-08-09 13:36:43
969,AMC smashes Q2 earnings; reports revenue $444.7M,2021-08-09 16:38:01
970,Pre-market news- August 10th 2021,2021-08-10 06:41:10
971,"Stock Watch List August 10, 2021",2021-08-10 08:48:13
972,THIS IS HUGE FOR AMC| These Stocks will Double 🔥🔥🔥 |Technical Analysis,2021-08-10 09:48:33
973,THIS IS HUGE FOR AMC| These Stocks will Double 🔥🔥🔥 |Technical Analysis,2021-08-10 10:44:31
974,THIS IS HUGE FOR AMC| These Stocks will Double 🔥🔥🔥 |Technical Analysis,2021-08-10 10:45:47
975,"Here is a Market Recap for today Tuesday, August 10, 2021",2021-08-10 17:01:39
976,For People new to Crypto - an invitation to tonight's event {$PYE} {DEVTEAM6} {DMoney},2021-08-11 16:19:31
977,Where can I find…,2021-08-12 14:37:33
978,"Historical Post Earnings Moves MEGA Compilation and Analysis (Q2 Week 6) - $RBLX, $NVDA, $WMT, $HD, $CSCO, $TGT, $LOW and More",2021-08-15 14:23:43
979,Options Stock Ranker for Aug-16-2021,2021-08-16 16:15:33
980,"Here is a Market Recap for today Monday, August 16, 2021",2021-08-16 16:20:59
981,"Here is a Market Recap for today Monday, August 16, 2021",2021-08-16 16:21:19
982,Hot Stocks!!!! Year 2000,2021-08-17 05:33:37
983,My dividend stock portfolio,2021-08-17 13:23:39
984,Options Stock Ranker for Aug-17-2021,2021-08-17 16:15:09
985,Markets: Hedge Fund RenTech Loads Up On AMC Stock,2021-08-18 09:33:58
986,Markets: Hedge Fund RenTech Loads Up On AMC Stock,2021-08-18 09:34:44
987,So I'm gradually becoming a boomer investor.,2021-08-19 14:49:54
988,"I have 8 months to become a full-time trader, how do I do it?",2021-08-22 22:18:09
989,"Stock Watch List August 23, 2021",2021-08-23 08:47:34
990,"Why is Chipotle blowing up? In 5 years they've climbed $1400 a share, almost half of that has happened in the last year, with the majority of the spike in the last 3 months",2021-08-23 11:37:18
991,"AMC, GME Stocks Call Broker Download This App, Or Could Loss All Your $$$$",2021-08-23 18:00:09
992,"Stock Watch List August 24, 2021",2021-08-24 08:46:44
993,"Here is a Market Recap for today Tuesday, August 24, 2021",2021-08-24 16:50:42
994,"Stock Watch List August 25, 2021",2021-08-25 08:47:30
995,Here's Your Daily Market Brief For August 25th,2021-08-25 08:55:45
996,My portfolio,2021-08-25 20:36:41
997,Reflection of a short options career.,2021-08-26 19:15:08
998,"How many stocks do you keep in your watchlist at any given time? Do you like to have a lot, or just a few, how do you manage your list, etc?",2021-08-27 00:34:39
999,$BBIG Small Cap Squeeze Play Opportunity,2021-08-27 11:19:16
1000,"Anyone here a fan of SPHD as part of a part income part growth account? And what do you think of my ""strategy""? Thoughts on my holdings?",2021-08-28 16:44:12
1001,The recent surge in “Meme” stocks like AMC and Gamestop as the “retail trader sticks it to Wall Street” is not new.,2021-08-28 17:22:30
1002,"AMC, GME, Stock Squeeze Simulator",2021-08-29 14:39:46
1003,"Stock Watch List August 30, 2021",2021-08-30 08:47:55
1004,I sold some AMC today but why is the price at 3k? I only got 40 for each share,2021-08-30 12:28:09
1005,Get Ready for the Next Crash,2021-08-31 10:21:37
1006,why don't hedge fund close their short position?,2021-08-31 14:18:14
1007,TFSA and Meme Stocks,2021-08-31 20:22:04
1008,"Macquarie downgrades AMC on poor box office, predicts 80% stock decline",2021-09-01 08:20:49
1009,Some good high interest higher risk dividend stocks vs low interest lower risk interest stocks?,2021-09-01 16:58:48
1010,Is the FED forcing/encouraging speculation (in people's hopes of preserving value in their savings),2021-09-02 20:54:38
1011,Best websites for beginner investor,2021-09-04 18:55:46
1012,"I don’t vent much and I never post on this app, please read and give feedback!",2021-09-05 01:56:29
1013,Buy the dip...,2021-09-05 15:55:28
1014,Options Stock Ranker for Sep-07-2021,2021-09-07 16:28:25
1015,Here's Your Daily Market Brief For September 8th,2021-09-08 08:51:04
1016,Options Stock Ranker for Sep-08-2021,2021-09-08 16:15:39
1017,IRNT likely isn't done and tomorrow might be it's 06/02 (AMC),2021-09-08 19:36:53
1018,Here's Your Daily Market Brief For September 9th,2021-09-09 09:04:53
1019,"Live @ 6:25 Am PST Stock Pre-Market Every Day Come Join Us.. AMC, GME, M...",2021-09-09 09:29:16
1020,Yet another SPAC Market Update,2021-09-10 12:23:05
1021,"Wall Street Week Ahead for the trading week beginning September 13th, 2021",2021-09-10 20:34:42
1022,Vega-Positive swing trading. Is there a right and wrong way?,2021-09-11 10:14:23
1023,"$43k to a quarter million (almost) challenge. YOLO'd my 401k and individual accounts into AMC, GME, and speculative stocks in January. Don't do options yet. How am I doing?",2021-09-14 00:13:49
1024,"Forex Newbie, paper trading",2021-09-14 06:53:53
1025,HOLD DEEP OTM CALL OPTIONS AT NO COST,2021-09-14 15:37:20
1026,Options Stock Ranker for Sep-15-2021,2021-09-15 16:16:21
1027,Thinking About YOLOing Into AMC Stock,2021-09-17 00:14:21
1028,My crossroads,2021-09-17 01:11:10
1029,"AMC, GME All Stocks I Cracked The Algorithm💯 I Just Make A Trading Bot M...",2021-09-18 11:41:25
1030,John Oliver episode I watched tonight(july ep),2021-09-19 06:02:29
1031,"Algorithm Stock Market Cracked Works On AMC, GME, Ect. Live Monday Marke...",2021-09-19 12:05:58
1032,"Stock Watch List September 20, 2021",2021-09-20 08:50:03
1033,"Live Market Open.. AMC, GME Algorithms Cracked Stock Trades Live AMC, GME. We Did It... 💯🚀🚀",2021-09-20 09:14:43
1034,"AMC, GME All Stock Don't Believe This, Its Not True... 🚀🚀💯",2021-09-20 20:22:42
1035,"Wednesday RUNDOWN:$ATER, $NURO, $TMC, $IRNT $CARA, $AMC Stock (MAJOR BUY ALERT) 1k to 100k 2ND PICK $CEI",2021-09-23 01:29:16
1036,"Stock Watch List September 23, 2021",2021-09-23 08:46:46
1037,Bubble is bursting,2021-09-24 01:24:20
1038,Portfolio of big companies,2021-09-24 18:34:01
1039,MONDAY RUNDOWN: $CEI Cool Down Near ($ATER don't Panic) $NAKD Rally/$OCGN/$RKER/$AMC Stock,2021-09-27 22:53:53
1040,"2 Stocks That Will See Massive Buying Pressure Today ($FAMI, $CEI) $AMC Stock Update",2021-09-30 14:46:16
1041,Rising bond yields: what they mean and how to play this,2021-10-01 19:45:43
1042,MAJOR BUY ALERT UPDATE $PROG ($AMC IS FOLLOWING THE MARKET PULLBACK) $CEI STOCK,2021-10-04 15:06:36
1043,Options Stock Ranker for Oct-05-2021,2021-10-05 16:15:09
1044,"When 90% of a $2.8 mil portfolio is powered by WSB meme stocks, who says WSB is full of dumb money? TSLA, GME, AMC, PLTR. I'm not fucking leaving!",2021-10-07 09:46:16
1045,FRIDAY RUNDOWN ($DATS MAJOR BUY ALERT UPDATE) $CCXI SELL OF INCOMING/$CEI NEWS/$AMC STOCK,2021-10-08 23:58:01
1046,Will Robinhood be finally held accountable for market manipulation?,2021-10-09 00:31:33
1047,Options Stock Ranker for Oct-11-2021,2021-10-11 16:15:35
1048,SEC Form 13H - Large Trader - My Experience,2021-10-11 18:05:04
1049,ULTIMATE Guide to Selling Options Profitably PART 5 - Diving Deep into Volatility (Important),2021-10-12 12:15:31
1050,Options Stock Ranker for Oct-12-2021,2021-10-12 16:15:12
1051,"WEDNESDAY RUNDOWN: $ANY, $OCGN, $CEI, $NAOV, $DATS, $AMC, $KOSS, $WTRH Stock",2021-10-14 00:25:43
1052,"THURSDAY RUNDOWN: $OCGN, $BBIG, $ATER, $ANY, $NRXP, $AMC, $OPAD STOCK",2021-10-15 00:10:58
1053,Is it ok to hold multiple ETF's? (I am a noob),2021-10-17 16:54:46
1054,who are here the holder of $KPLT ? some thoughts about $KPLT,2021-10-18 01:56:22
1055,Top 5 Trending Stocks on Reddit,2021-10-18 10:16:46
1056,"Geo Group (NYSE-GEO) – Stock trades at $8.20, but is worth $27, $37 and $42 based on various valuation metrics. And the reasons why this deep undervaluation won’t last.",2021-10-19 10:07:32
1057,"The frenzied trading in shares of GameStop, AMC and other so-called meme stocks in January led to big losses for some hedge funds, retail investors who were abruptly shut out from trading and calls concluded that the markets operated largely as intended, debunking conspiracy theories.",2021-10-19 12:14:58
1058,Ultimate Guide to Selling Options Profitably PART 9 - Understanding and Trading Skew,2021-10-19 15:03:31
1059,Options Stock Ranker for Oct-19-2021,2021-10-19 16:16:17
1060,"How to find ""rabbit"" or identify potential MEME-stocks.",2021-10-21 12:32:27
1061,"Stock Watch List October 22, 2021",2021-10-22 08:45:34
1062,"$RDBX: A strong value play with a forward P/E of 2.3, float of 2M, huge brand awareness with a promising pivot to digital",2021-10-25 04:05:04
1063,The power of cult: Why I think DWAC is primed to move higher and so will other similar cult stocks,2021-10-25 11:10:37
1064,"$PALI Okay, this is it. The FULL COMBINED DD for PALI. The full workings of it's manipulation. Staddann did the numbers. I did speculative",2021-10-26 11:34:37
1065,AMC STOCK - I'VE SEEN ENOUGH (Technical Analysis),2021-10-26 21:27:03
1066,The ULTIMATE $PALI DD COMPENDIUM. Maxim just announced PALI conference call Nov 4th PT $7. Picture proof. Data proof. This DD is getting bigger every day PALI'S. DD in comments,2021-10-27 14:13:18
1067,"WEDNESDAY'S RUNDOWN: $IRNT Stock, $OCGN Stock, $CARA Stock, $PROG Stock, $AMC Stock, $PHUN Stock, $OPAD Stock",2021-10-28 02:54:17
1068,"I scraped r/options for the top ticker mentions in the last 24H. Here are the results (Friday October 29, 2021)",2021-10-29 10:46:41
1069,"I scraped r/stockmarket for the top ticker mentions in the last 24H. Here are the results (Friday October 29, 2021)",2021-10-29 10:46:41
1070,Best European Brokers,2021-10-30 08:12:20
1071,"Expected Moves this Week, AMC, Roku, Moderna, DraftKings, Peloton, Square and more.",2021-10-31 15:34:09
1072,"Historical Post Earnings Moves MEGA Compilation AND Analysis (Q3 Week 4) - $AMC, $CRSR, $ROKU, $PINS, $SQ, $RKT, $FSLY and More",2021-10-31 17:10:49
1073,"FRIDAY RUNDOWN: $OCGN Stock, $CARA Stock, $REKR Stock, $BTBT Stock, $PROG Stock, $BKTT Stock, $AMC Stock, $AVIR Stock, $NIO Stock, $WTRH Stock",2021-10-31 18:36:18
1074,"This week's hot stocks, high IV list, top & worst performers of the week.",2021-10-31 22:27:07
1075,"I scraped r/stockmarket for the top ticker mentions in the last 24H. Here are the results (Monday November 01, 2021)",2021-11-01 04:35:02
1076,Options Stock Ranker for Nov-01-2021,2021-11-01 16:15:15
1077,AMC Stock Price Surges Again Ahead of Earnings Call,2021-11-02 00:47:00
1078,AMC Stock Price Surges Again Ahead of Earnings Call,2021-11-02 00:47:47
1079,"I scraped r/options for the top ticker mentions in the last 24H. Here are the results (Tuesday November 02, 2021)",2021-11-02 04:35:01
1080,Can Wallstreetbets beat the market? - I analyzed 20MM+ comments in 2021 to see if you should pay attention to the stock picks made in wsb. Here are the results.,2021-11-02 08:49:34
1081,$AMC Entertainment stock,2021-11-02 09:21:42
1082,"Come join our group , Stock Market Open Live Stream $TSLA $BROS $AMC $SESN #options #investing...",2021-11-02 10:16:37
1083,Options Stock Ranker for Nov-02-2021,2021-11-02 16:15:18
1084,Anyone invested in this stock? Shares of Avis double in single day as huge earnings beat sends hedge fund shorts running,2021-11-03 02:31:41
1085,"I scraped r/options for the top ticker mentions in the last 24H. Here are the results (Wednesday November 03, 2021)",2021-11-03 04:35:01
1086,Can Wallstreetbets beat the market? - I analyzed 20MM+ comments made on WSB in 2021 to see if you should pay attention to their stock picks. Here are the results.,2021-11-03 07:22:41
1087,"Stock Watch List November 3, 2021",2021-11-03 08:51:21
1088,Options Stock Ranker for Nov-03-2021,2021-11-03 16:15:55
1089,"I scraped r/options for the top ticker mentions in the last 24H. Here are the results (Thursday November 04, 2021)",2021-11-04 04:35:02
1090,Here's Your Daily Market Brief For November 4th,2021-11-04 08:56:51
1091,"I scraped r/options for the top ticker mentions in the last 24H. Here are the results (Friday November 05, 2021)",2021-11-05 04:35:02
1092,Holy shit I'm finally in the green!!! So this is what it feels like..,2021-11-05 09:54:00
1093,"I scraped r/options for the top ticker mentions in the last 24H. Here are the results (Saturday November 06, 2021)",2021-11-06 04:35:02
1094,Will Macy's $M become a meme stock?,2021-11-06 12:15:34
1095,"I scraped r/options for the top ticker mentions in the last 24H. Here are the results (Sunday November 07, 2021)",2021-11-07 03:35:01
1096,AMC & TSLA Breakouts?,2021-11-07 11:33:00
1097,AMC & TSLA Breakouts?,2021-11-07 11:37:23
1098,"Expected Moves this Week, TSLA, DIS, AMC, COIN, NIO, PLTR and more.",2021-11-07 15:28:06
1099,"I scraped r/stockmarket for the top ticker mentions in the last 24H. Here are the results (Monday November 08, 2021)",2021-11-08 03:35:01
1100,"I scraped r/options for the top ticker mentions in the last 24H. Here are the results (Monday November 08, 2021)",2021-11-08 03:35:01
1101,"Stock Watch List November 8, 2021",2021-11-08 08:49:41
1102,Eternals gross $77m as AMC is all set to report its Q3 results on Monday,2021-11-08 09:23:10
1103,Options Stock Ranker for Nov-08-2021,2021-11-08 16:17:09
1104,"Could ""meme stocks"" like GME and AMC cause a market crash?",2021-11-08 20:08:13
1105,"I scraped r/options for the top ticker mentions in the last 24H. Here are the results (Tuesday November 09, 2021)",2021-11-09 03:35:02
1106,Sec under 25k day trade limits,2021-11-09 14:35:00
1107,AMC Stock: Now We Know What Tickles Investors,2021-11-10 06:34:30
1108,"I scraped r/options for the top ticker mentions in the last 24H. Here are the results (Thursday November 11, 2021)",2021-11-11 03:35:02
1109,"I scraped r/stockmarket for the top ticker mentions in the last 24H. Here are the results (Thursday November 11, 2021)",2021-11-11 03:35:02
1110,Looking for whale hunters.,2021-11-11 16:10:27
1111,Covered calls and covered puts strike right on the money?,2021-11-12 16:29:49
1112,Can/should I sue my brokerage for missed profits of 15k during the GME/NOK/AMC/BB fiasco of January?,2021-11-12 16:52:54
1113,How to backtest?,2021-11-12 19:33:38
1114,"I scraped r/options for the top ticker mentions in the last 24H. Here are the results (Saturday November 13, 2021)",2021-11-13 03:35:02
1115,Understanding and Attacking Trader Anxiety: (A Long Read For Serious Traders who Have Issues with Trader Anxiety),2021-11-13 16:31:55
1116,$CANO's Clash: Hedge Funds shorting vs CEO buying ATM shares on margin,2021-11-15 07:57:10
1117,Options Stock Ranker for Nov-15-2021,2021-11-15 16:15:11
1118,"MONDAY RUNDOWN: $KZR Stock Major News, $BIMI Stock Aftermarket Bull Run, $BTB, $AMC Squeeze Coming",2021-11-15 23:23:53
1119,Options Stock Ranker for Nov-16-2021,2021-11-16 16:16:18
1120,"$UBER recommended to me by my Uber, apparently it's a great stock to own?",2021-11-17 01:11:35
1121,"$UBER recommended to me by my Uber, apparently its a great stock to own?",2021-11-17 01:24:05
1122,"I scraped r/options for the top ticker mentions in the last 24H. Here are the results (Thursday November 18, 2021)",2021-11-18 03:35:02
1123,Industry incumbents influence on the Social Media Community and Stock Price Movement for the leaders in the industry,2021-11-18 21:20:36
1124,"I scraped r/options for the top ticker mentions in the last 24H. Here are the results (Friday November 19, 2021)",2021-11-19 03:35:02
1125,"I scraped r/options for the top ticker mentions in the last 24H. Here are the results (Saturday November 20, 2021)",2021-11-20 03:35:01
1126,Merrill Edge Level 4 (write option credit spread) requirements,2021-11-20 19:29:26
1127,"With the current market condition, do i sell my beloved AMC to fund other stocks?! Or do I just diamond hand this like the ape that I am and just buy stocks later?",2021-11-21 00:47:49
1128,Is this a Bubble?,2021-11-21 01:05:12
1129,Implied volatility & open interest?,2021-11-21 02:30:00
1130,"I scraped r/options for the top ticker mentions in the last 24H. Here are the results (Sunday November 21, 2021)",2021-11-21 03:35:01
1131,"I scraped r/options for the top ticker mentions in the last 24H. Here are the results (Monday November 22, 2021)",2021-11-22 03:35:02
1132,List of large cap stocks that are up over 100% in the last 6 months. We like any of these to run further?,2021-11-23 18:44:21
1133,Options Stock Ranker for Nov-24-2021,2021-11-24 16:15:09
1134,Highest IV you've ever seen?,2021-11-24 17:11:51
1135,"I scraped r/options for the top ticker mentions in the last 24H. Here are the results (Monday November 29, 2021)",2021-11-29 06:35:01
1136,"Giant U.S. Pension Bought AMC, Snowflake, and Tilray Stock",2021-11-30 06:11:45
1137,"TUESDAY RUNDOWN: $AERC Stock, $IMGN Stock, $AQST Stock, $AMC Stock, $NUZE Stock",2021-11-30 23:34:57
1138,"I scraped r/options for the top ticker mentions in the last 24H. Here are the results (Wednesday December 01, 2021)",2021-12-01 06:35:02
1139,"WEDNESDAY RUNDOWN: $AMC Stock, $AHI Stock, $IMGN Stock, $PHUN Stock, $AERC Stock, $ADGI Stock",2021-12-01 22:20:19
1140,Read at your own risk. Advice needed. Forgotten Account that has been tanking over the last month.,2021-12-02 00:35:43
1141,"I scraped r/options for the top ticker mentions in the last 24H. Here are the results (Thursday December 02, 2021)",2021-12-02 06:35:02
1142,(12/2) Thursday's Pre-Market Stock Movers & News,2021-12-02 08:20:56
1143,"$AMC.v ($AZMCF us)- Arizona Metals will make me a Millionaire....Under followed, undervalued, early and misunderstood copper/gold story in a safe jurisdiction",2021-12-02 10:11:42
1144,Need for a new PLAYBOOK on stock market analysis,2021-12-02 14:26:38
1145,"I scraped Reddit for the top ticker mentions in the last 24H. Here are the results (Saturday December 04, 2021)",2021-12-04 06:35:01
1146,"I scraped Reddit for the top ticker mentions in the last 24H. Here are the results (Sunday December 05, 2021)",2021-12-05 06:35:02
1147,"I scraped Reddit for the top ticker mentions in the last 24H. Here are the results (Monday December 06, 2021)",2021-12-06 06:35:01
1148,Super-Bearish Catalysts of Market Losses!,2021-12-06 11:36:48
1149,"I scraped Reddit for the top ticker mentions in the last 24H. Here are the results (Tuesday December 07, 2021)",2021-12-07 06:35:03
1150,"I scraped Reddit for the top ticker mentions in the last 24H. Here are the results (Wednesday December 08, 2021)",2021-12-08 06:35:02
1151,"I scraped Reddit for the top ticker mentions in the last 24H. Here are the results (Thursday December 09, 2021)",2021-12-09 06:35:03
1152,"AMC Stock: More Popular Than Tesla, Apple, Amazon, and Google",2021-12-09 07:09:38
1153,Psycho Market Recap for Thur Dec 9 2021,2021-12-09 16:11:52
1154,Psycho Market Recap for Thur Dec 9 2021,2021-12-09 16:12:50
1155,"I scraped Reddit for the top ticker mentions in the last 24H. Here are the results (Friday December 10, 2021)",2021-12-10 06:35:03
1156,(12/10) Friday's Pre-Market Stock Movers & News,2021-12-10 08:02:56
1157,(12/10) Friday's Pre-Market Stock Movers & News,2021-12-10 08:04:45
1158,"I scraped Reddit for the top ticker mentions in the last 24H. Here are the results (Saturday December 11, 2021)",2021-12-11 06:35:04
1159,"I scraped Reddit for the top ticker mentions in the last 24H. Here are the results (Sunday December 12, 2021)",2021-12-12 06:35:01
1160,"I scraped Reddit for the top ticker mentions in the last 24H. Here are the results (Monday December 13, 2021)",2021-12-13 06:35:03
1161,Why did 2021 turn out to be a bad year for new investors,2021-12-13 09:53:16
1162,Arizona Metals announces inclusion in GDXJ index effective Dec 17th- 10 bagger trade,2021-12-13 10:07:00
1163,Meme stocks AMC and GameStop tumble to lowest levels in months as investors d**p risky positions,2021-12-13 14:45:09
1164,AMC Sinks: Is Insider Selling Killing The Stock?,2021-12-13 15:01:20
1165,"I scraped Reddit for the top ticker mentions in the last 24H. Here are the results (Tuesday December 14, 2021)",2021-12-14 06:35:01
1166,(12/14) Tuesday's Pre-Market Stock Movers & News,2021-12-14 08:15:43
