Unnamed: 0,Title,Timestamp,clean_title
0,Barren streets but bustling stock markets in virus-stricken China,2020-02-11 07:21:38,barren street bustling stock market virus stricken china 
1,$AMC either has an insane amount of value or is circling around the drain...what does /r/securityanalysis think?,2020-03-08 21:17:48,amc either insane amount value circling around drain securityanalysis think 
2,What do you guys think about AMC stock?,2020-03-16 09:08:03,guy think amc stock 
3,AMC theaters closing for up to 12 weeks is this a good stock daddy?,2020-03-17 12:43:45,amc theater closing 12 week good stock daddy 
4,Testing Stock AMC/Jeep 4.0 Cylinder Heads (Ported and Unported) against Edelbrock's 4.0 Jeep Head on the Dyno,2020-03-19 13:14:08,testing stock amc jeep cylinder head ported unported edelbrock jeep head dyno 
5,Bought AMC stock @ $2.3. What do you guys think?,2020-04-04 21:34:17,bought amc stock guy think 
6,AMC Stock,2020-04-12 21:05:24,amc stock 
7,The top ten selling products of the Great Depression converted to modern stocks.,2020-04-13 03:49:55,top ten selling product great depression converted modern stock 
8,Have any major corporations declared bankruptcy yet (or seem like they’re close to declaring) due to the impacts of COVID-19?,2020-04-15 05:54:56,major corporation declared bankruptcy yet seem like close declaring due impact covid 19 
9,Why AMC Entertainment Stock Jumped Today,2020-04-15 17:56:11,amc entertainment stock jumped today 
10,"Stocks To Watch Today, Apr 17 2020 - Top 5 Stocks To Short",2020-04-17 08:19:15,stock watch today apr 17 2020 top stock short 
11,Daily Watchlist for Friday 04/17/20,2020-04-17 08:31:42,daily watchlist friday 04 17 20 
12,"Stock Watch list April 17, 2020",2020-04-17 08:50:40,stock watch list april 17 2020 
13,I missed the AMC stock :(,2020-04-17 14:09:24,missed amc stock EMOJIsad 
14,Daily Watchlist for Monday 04/20/20,2020-04-20 08:36:37,daily watchlist monday 04 20 20 
15,What happens if you buy put options on a company that goes bankrupt?,2020-04-20 09:00:12,happens buy put option company go bankrupt 
16,I personally love taking the family out to theater. I recently got some stocks at 3.20 with AMC and plan to hold out until they plan to open in July. Has anyone else recently bought into AMC? What are yours thoughts and opinions?,2020-04-24 13:00:43,personally love taking family theater recently got stock 20 amc plan hold plan open july anyone else recently bought amc thought opinion 
17,Daily Watchlist for Tuesday 04/28/20,2020-04-28 09:12:10,daily watchlist tuesday 04 28 20 
18,AMC bans Universal,2020-04-29 01:27:09,amc ban universal 
19,Daily Watchlist for Wednesday 04/29/20,2020-04-29 08:29:11,daily watchlist wednesday 04 29 20 
20,Decided to Try Options Trading.,2020-04-29 09:41:36,decided try option trading 
21,Daily Watchlist for Thursday 04/30/20,2020-04-30 09:00:50,daily watchlist thursday 04 30 20 
22,"$AMC, interesting stock to take a look at...",2020-05-01 09:45:55,amc interesting stock take look 
23,Daily Watchlist for Monday 05/11/20,2020-05-11 08:40:40,daily watchlist monday 05 11 20 
24,What do you do when out of day trades?,2020-05-11 11:37:59,day trade 
25,AMC SOARING AMAZON MERGER,2020-05-11 11:47:20,amc soaring amazon merger 
26,Daily Watchlist for Tuesday 05/12/20,2020-05-12 08:56:04,daily watchlist tuesday 05 12 20 
27,AMC’s stock soars after report Amazon held merger talks,2020-05-12 09:57:41,amc stock soar report amazon held merger talk 
28,Daily Watchlist for Wednesday 05/13/20,2020-05-13 08:48:32,daily watchlist wednesday 05 13 20 
29,Wrong AMC: AMZN rumored to buy AMC Networks,2020-05-13 09:49:45,wrong amc amzn rumored buy amc network 
30,Wrong AMC: AMZN rumored to buy AMC Networks,2020-05-13 10:02:57,wrong amc amzn rumored buy amc network 
31,Wrong AMC: AMZN rumored to buy AMC Networks,2020-05-13 10:03:50,wrong amc amzn rumored buy amc network 
32,"Ok, Hornet experts; got a parts related question for you...",2020-05-18 23:06:38,ok hornet expert got part related question 
33,AMC likely to close down,2020-06-04 12:27:21,amc likely close 
34,Do you think AMC Theatres can survive the pandemic without going bankrupt?,2020-06-09 18:04:16,think amc theatre survive pandemic without going bankrupt 
35,My 6-10-20 Stocks in Play Watchlist,2020-06-10 09:15:26,10 20 stock play watchlist 
36,AMC is doomed.,2020-06-17 14:38:33,amc doomed 
37,Cineplex stock?,2020-06-18 23:14:04,cineplex stock 
38,AMC stock predictions,2020-06-25 13:59:45,amc stock prediction 
39,HELP! Call Option Trading,2020-06-26 15:46:25,help call option trading 
40,Thoughts on AMC STOCK?,2020-06-28 15:51:25,thought amc stock 
41,Next Week's Earning Plays,2020-07-19 10:08:38,next week earning play 
42,"New Investor, I need some clarity.",2020-07-25 13:16:00,new investor need clarity 
43,"Over 21 months later, here's how /r/investing performed on the underrated stock survey. Inspired by Mr_Suzan and galloog1.",2020-08-02 19:59:56,21 month later investing performed underrated stock survey inspired mr suzan galloog1 
44,ALERT ON $INPX!!!!!!!! Tell us if you know anything!,2020-08-09 00:41:32,alert inpx tell u know anything 
45,Holding AMC until Tenet comes out,2020-08-14 08:54:32,holding amc tenet come 
46,"Watchlist: 9/3 Making Money, Jobs and Gambling",2020-09-03 08:51:12,watchlist making money job gambling 
47,Note Worthy News This Morning 8 October 2020 (Note: Just The Headlines),2020-10-08 08:47:30,note worthy news morning october 2020 note headline 
48,Contrarian Investment Ideas: Energy and Movie Theatres,2020-10-11 23:52:50,contrarian investment idea energy movie theatre 
49,"""Buy when there is blood on the streets"" | Cinemark Holdings (CNK)",2020-10-13 15:47:50,buy blood street cinemark holding cnk 
50,"Stock watch List October 14, 2020",2020-10-14 08:45:18,stock watch list october 14 2020 
51,AMC in contract talks with AMZN for bezos-themed butter sauce,2020-10-14 10:48:19,amc contract talk amzn bezos themed butter sauce 
52,AMC possible bankruptcy! Entertainment stocks or Airlines?,2020-10-15 12:11:46,amc possible bankruptcy entertainment stock airline 
53,AMC Entertainment (NYSE: AMC) vs. Cinemark (NYSE: CNK) - An upside comparison and the future for traditional Movie Theaters,2020-10-17 11:44:40,amc entertainment nyse amc v cinemark nyse cnk upside comparison future traditional movie theater 
54,Stock advice,2020-10-17 12:47:37,stock advice 
55,AMC stock has had its lowest dip since the COVID-19 crash after a denied rumor of bankruptcy. Only one way to go from here.,2020-10-18 09:03:00,amc stock lowest dip since covid 19 crash denied rumor bankruptcy one way go 
56,News (Just The Headlines) This Pre-Market and Watch List for 19 October 2020 (Will Update Until 9:20am EST),2020-10-19 07:18:41,news headline pre market watch list 19 october 2020 update 20am est 
57,"Here is a Market Recap for today Mon, Oct 19, 2020. Please enjoy!",2020-10-19 16:08:18,market recap today mon oct 19 2020 please enjoy 
58,Companies and their suppliers directly impacted by covid closures,2020-10-20 00:49:40,company supplier directly impacted covid closure 
59,"Penny Stock Pre-Market News (Just The Headlines), Pre-Market Watch List and Opening Watch List for 27 October 2020 (Will Update to 9:20 a.m EST)",2020-10-27 07:10:17,penny stock pre market news headline pre market watch list opening watch list 27 october 2020 update 20 est 
60,Most anticipated earnings releases for the week beginning November 2nd 2020,2020-10-31 09:26:10,anticipated earnings release week beginning november 2nd 2020 
61,Penny Stock Earnings and Pre-Market Watch List for 2 November 2020,2020-11-01 20:09:31,penny stock earnings pre market watch list november 2020 
62,"Penny Stock Pre-Market News (Just The Headlines), Pre-Market Watch List and Opening Watch List for 02 November 2020 (Will Update to 9:20 a.m EST)",2020-11-02 07:18:56,penny stock pre market news headline pre market watch list opening watch list 02 november 2020 update 20 est 
63,"After Hours News (2 November 2020, Just The Headlines), Penny Stock Earnings, Near Future Potential Catalysts and Pre-Market Opening Watch List for 3 November 2020",2020-11-02 20:10:03,hour news november 2020 headline penny stock earnings near future potential catalyst pre market opening watch list november 2020 
64,November 9th | Templar Trading Daily Watchlist,2020-11-09 07:41:36,november 9th templar trading daily watchlist 
65,AMC Entertainment Stock 2021,2020-11-12 16:39:56,amc entertainment stock 2021 
66,Buy AMC to save America,2020-11-16 13:09:31,buy amc save america 
67,"What's on your next ""pandemic lock down"" list?",2020-11-19 10:57:04,next pandemic lock list 
68,Are there any rules behind stock offerings? It seems like a company could really take advantage of public investors by constantly diluting their ownership,2020-11-22 16:46:37,rule behind stock offering seems like company could really take advantage public investor constantly diluting ownership 
69,Cinemark ($CNK) is Good and So Can You!,2020-12-04 14:09:21,cinemark cnk good 
70,AT&T (NYSE: T) - A stock Guide/Review,2020-12-05 20:46:06,nyse stock guide review 
71,Watchlist 12-8-20 👀,2020-12-07 21:38:46,watchlist 12 20 
72,Watchlist 12-8-20 👀,2020-12-07 21:39:21,watchlist 12 20 
73,AMC outlook,2020-12-11 13:56:28,amc outlook 
74,Watchlist 12-17-20 👀,2020-12-16 21:41:06,watchlist 12 17 20 
75,What happen to AMC stock of it goes bankrupt?,2020-12-16 23:37:36,happen amc stock go bankrupt 
76,It Can't Be This Easy...,2020-12-19 12:38:32,easy 
77,Watchlist 12-22-20 👀,2020-12-21 22:12:41,watchlist 12 22 20 
78,Watchlist 12-22-20 👀,2020-12-21 22:13:14,watchlist 12 22 20 
79,Watchlist 12-23-20 👀,2020-12-22 21:45:20,watchlist 12 23 20 
80,Watchlist 12-23-20 👀,2020-12-22 21:47:33,watchlist 12 23 20 
81,Watchlist 12-24-20 👀,2020-12-23 22:03:18,watchlist 12 24 20 
82,Watchlist 12-24-20 👀,2020-12-23 22:04:13,watchlist 12 24 20 
83,A Beginners question,2020-12-29 04:22:30,beginner question 
84,AMC Stock,2020-12-30 07:34:35,amc stock 
85,AMC will be back.,2020-12-31 20:08:50,amc back 
86,1971 Javelin VIN Decode Question,2021-01-02 15:24:56,1971 javelin vin decode question 
87,Bubble protection,2021-01-08 15:44:12,bubble protection 
88,Watchlist 1-13-21 👀,2021-01-12 22:53:51,watchlist 13 21 
89,Watchlist 1-13-21 👀,2021-01-12 22:54:13,watchlist 13 21 
90,Question about SEC filings?,2021-01-15 18:56:36,question sec filing 
91,What is the likelihood of AMC going bankrupt vs its stock rebounding?,2021-01-16 15:20:55,likelihood amc going bankrupt v stock rebounding 
92,What is the likelihood of AMC going bankrupt vs its Stock rebounding?,2021-01-16 15:23:31,likelihood amc going bankrupt v stock rebounding 
93,AMC Entertainment CEO is shockingly close to staving off bankruptcy,2021-01-18 14:46:07,amc entertainment ceo shockingly close staving bankruptcy 
94,AMC,2021-01-18 15:01:57,amc 
95,Watchlist 1-19-21 👀,2021-01-18 21:46:33,watchlist 19 21 
96,Watchlist 1-19-21 👀,2021-01-18 21:47:07,watchlist 19 21 
97,January 19th | Templar Trading Daily Watchlist,2021-01-19 07:42:39,january 19th templar trading daily watchlist 
98,LIVE Penny Stock Summary for Jan-19-2021,2021-01-19 10:58:37,live penny stock summary jan 19 2021 
99,Looks like AMC is going to survive pandemic,2021-01-19 12:40:40,look like amc going survive pandemic 
100,Watchlist 1-21-21 👀,2021-01-20 23:07:25,watchlist 21 21 
101,Watchlist 1-21-21 👀,2021-01-20 23:08:10,watchlist 21 21 
102,Stocks to buy now... AMC and ZNGA Stock analysis,2021-01-20 23:25:22,stock buy amc znga stock analysis 
103,EPR Properties,2021-01-21 07:01:09,epr property 
104,Azu's Best Dividend Pennies,2021-01-21 14:09:09,azu best dividend penny 
105,Watchlist 1-22-21 👀,2021-01-21 22:52:34,watchlist 22 21 
106,Watchlist 1-22-21 👀,2021-01-21 22:52:56,watchlist 22 21 
107,AMC 📈 or 📉?,2021-01-23 05:59:01,amc 
108,I created an algo that tracks the most hyped stocks on Reddit. Here are the results for this week,2021-01-24 08:09:56,created algo track hyped stock reddit result week 
109,I need some clarification on Options.,2021-01-24 11:01:01,need clarification option 
110,AMC stock looks great in two ways ...,2021-01-24 15:48:13,amc stock look great two way 
111,Hedging Long Term Calls with Short Term Puts??,2021-01-24 16:34:12,hedging long term call short term put 
112,My Watchlist for the week - Jan 25th 2021,2021-01-24 17:27:34,watchlist week jan 25th 2021 
113,“Watchlist 1-25-21 👀,2021-01-24 21:59:04,watchlist 25 21 
114,CBD stocks are the new EV stocks in 2021🚀,2021-01-25 03:58:50,cbd stock new ev stock 2021 
115,Good news from AMC,2021-01-25 10:01:02,good news amc 
116,How do I find the groups that are picking their next stock to short squeeze like GME and AMC?,2021-01-25 11:55:23,find group picking next stock short squeeze like gme amc 
117,Is it possible hedge funds could be pumping NOK after hours and then dumping it tomorrow?,2021-01-25 16:52:53,possible hedge fund could pumping nok hour dumping tomorrow 
118,AMC CC Weeklies,2021-01-25 17:27:47,amc cc weekly 
119,Nokia pump (by hedgefunds I think),2021-01-25 20:30:52,nokia pump hedgefund think 
120,Today's posts about NOK and AMC on this sub quickly got lots of awards. Someone is spending money to promote these stocks.,2021-01-25 20:49:20,today post nok amc sub quickly got lot award someone spending money promote stock 
121,SPCE,2021-01-25 21:27:29,spce 
122,Unusual options opportunity in AMC,2021-01-25 22:43:06,unusual option opportunity amc 
123,“Watchlist 1-26-21 👀Futures are RED as of 10:45 ET,2021-01-25 22:51:21,watchlist 26 21 future red 10 45 et 
124,"For everyone holding calls who is in the In the money , check your expiration date",2021-01-26 19:06:55,everyone holding call money check expiration date 
125,"You Provide the Ticker, I'll Provide the Analysis!",2021-01-26 20:01:00,provide ticker provide analysis 
126,"r/Daytrading - discuss day trading only, not buy & hold",2021-01-26 21:00:17,daytrading discus day trading buy hold 
127,Watchlist 1-27-21 👀,2021-01-26 23:09:03,watchlist 27 21 
128,AMC Short Squeeze?,2021-01-27 00:52:59,amc short squeeze 
129,AMC und NOK kaufen,2021-01-27 03:57:48,amc und nok kaufen 
130,"PSA/""THE NEXT GME"" - PLEASE READ: This time period is a great chance to vastly improve the content on this sub",2021-01-27 06:45:42,psa next gme please read time period great chance vastly improve content sub 
131,January 27th | Templar Trading Daily Watchlist,2021-01-27 07:15:26,january 27th templar trading daily watchlist 
132,Is AMC a go?,2021-01-27 07:51:12,amc go 
133,BE WEARY OF AMC!!,2021-01-27 08:37:00,weary amc 
134,"Momentum Stocks Catch Fire as Market Boils (AMC, FCEL, CMGR, MMEDF)",2021-01-27 08:44:41,momentum stock catch fire market boil amc fcel cmgr mmedf 
135,"Stock Watch List For January 27, 2021",2021-01-27 08:45:34,stock watch list january 27 2021 
136,"Momentum Stocks Catch Fire as Market Boils (AMC, FCEL, CMGR, MMEDF)",2021-01-27 08:50:27,momentum stock catch fire market boil amc fcel cmgr mmedf 
137,Stocks to Watch 27/01/2021,2021-01-27 09:02:51,stock watch 27 01 2021 
138,Stocks to Watch 27/01/2021,2021-01-27 09:03:03,stock watch 27 01 2021 
139,#save_amc Save our Theaters,2021-01-27 09:07:28,save amc save theater 
140,"AMC stock has skyrocketed to almost $20 a share, good time to buy or wait for a price drop?",2021-01-27 09:08:04,amc stock skyrocketed almost 20 share good time buy wait price drop 
141,Red means GO!!!,2021-01-27 09:33:42,red mean go 
142,AMC options aren't updating/moving,2021-01-27 09:42:48,amc option updating moving 
143,So did I just get fucked over?,2021-01-27 09:43:50,get fucked 
144,they need to fill my AMC STOCKS SMFHHHHH,2021-01-27 09:46:07,need fill amc stock smfhh 
145,AMC,2021-01-27 09:57:45,amc 
146,HOLD AMC MEN!!!,2021-01-27 10:01:09,hold amc men 
147,DO NOT WORRY,2021-01-27 10:08:46,worry 
148,RED DAY = FIRESALE,2021-01-27 10:11:37,red day firesale 
149,"Anyone else think that the sell off in the market is caused by GME, AMC, BB pump?",2021-01-27 10:13:58,anyone else think sell market caused gme amc bb pump 
150,Nok is next! On your mark get set goooo!!!! 🏁,2021-01-27 10:15:51,nok next mark get set goo 
151,"Bitcoin Live Stocks DUMP, AMC Moon?",2021-01-27 10:29:28,bitcoin live stock dump amc moon 
152,Long term stocks,2021-01-27 10:41:15,long term stock 
153,Explain I’m a dumbsh*t,2021-01-27 10:48:48,explain dumbsh 
154,$AMC $GME $BB ALL HAVE COMMON WITH THIS STOCK... $SNDL,2021-01-27 10:53:55,amc gme bb common stock sndl 
155,ON ROBIN HOOD AMC STOCK DOESNT WANNA BE GIVEN WHAT HAPPENS IF I CANCEL ORDER?,2021-01-27 11:03:32,robin hood amc stock doesnt wan na given happens cancel order 
156,AMC?,2021-01-27 11:06:48,amc 
157,Can I get some words of encouragement?,2021-01-27 11:11:41,get word encouragement 
158,Identifying Volatility Halts and then Running Analysis - the Meme Identifier!,2021-01-27 11:34:03,identifying volatility halt running analysis meme identifier 
159,What is going on with $EXPR?,2021-01-27 11:36:02,going expr 
160,AMC hedges,2021-01-27 11:47:09,amc hedge 
161,AMC? Should I buy AMC stocks?,2021-01-27 11:58:22,amc buy amc stock 
162,AMC stock - Just bought 69 shares @ $15.40,2021-01-27 12:00:14,amc stock bought 69 share 15 40 
163,AMC STOCK THREAD,2021-01-27 12:10:33,amc stock thread 
164,Explain. it to me like I'm 5,2021-01-27 12:17:22,explain like 
165,What happened to NOK today?,2021-01-27 12:17:35,happened nok today 
166,Give me a reason not to sell,2021-01-27 12:24:16,give reason sell 
167,I’ve never looked at the stock market even once. This is my third time on this subreddit. Should I buy amc stock? Or maybe a few shares in GameStop at 320?,2021-01-27 12:26:00,never looked stock market even third time subreddit buy amc stock maybe share gamestop 320 
168,AMC Stock?,2021-01-27 12:28:55,amc stock 
169,Wealthsimple Trade not proceeding with my AMC buy order,2021-01-27 12:30:49,wealthsimple trade proceeding amc buy order 
170,Will #AMC hit $40-$50?,2021-01-27 12:31:51,amc hit 40 50 
171,"Just bought AMC stock - totally blue about stock market - hope i wont’ regret it-want to join the people’s revolution- we, the people",2021-01-27 12:31:56,bought amc stock totally blue stock market hope wont regret want join people revolution people 
172,AMC is the new (and better) GME,2021-01-27 12:32:54,amc new better gme 
173,Stop flooding the market,2021-01-27 12:38:01,stop flooding market 
174,AMC STOCK IS HOLDING! BUY BUY,2021-01-27 12:39:07,amc stock holding buy buy 
175,Looking to get into US Stocks; best bet to save on fees?,2021-01-27 12:42:19,looking get u stock best bet save fee 
176,AMC will rise to $300. nok will not.,2021-01-27 12:43:34,amc rise 300 nok 
177,AMC Stock,2021-01-27 12:46:09,amc stock 
178,Where to Buy AMC stock in the uk?,2021-01-27 12:49:05,buy amc stock uk 
179,What stock brokers are willing to sell short on stocks (e.g. GME)?,2021-01-27 12:51:10,stock broker willing sell short stock gme 
180,What is happening with AMC? is it going down?,2021-01-27 12:53:11,happening amc going 
181,AMC - The Poor Retards GME,2021-01-27 12:54:25,amc poor retard gme 
182,Do not divide. AMC and NOK are the 2 main stoinks to buy and hold. If you were late on AMC buy into NOK. The more and more people post and support the other stocks delude what we are trying to accomplish. UNITY = MONEY ............ MONEY = PIZZA.,2021-01-27 12:56:36,divide amc nok main stoinks buy hold late amc buy nok people post support stock delude trying accomplish unity money money pizza 
183,Finally started making money off the AMC stocks I bought today. When do I start snorting coke of a stripper’s ass?,2021-01-27 13:26:33,finally started making money amc stock bought today start snorting coke stripper as 
184,My thoughts on some good future stocks - give me your opinions,2021-01-27 13:26:54,thought good future stock give opinion 
185,AMC STOCK,2021-01-27 13:27:25,amc stock 
186,AMC stock,2021-01-27 13:32:05,amc stock 
187,STOCK IN AMC,2021-01-27 13:35:29,stock amc 
188,Major brokerage firms restricting $GME and $AMC stocks - this is what I see on TDA. Are you still able to buy ?,2021-01-27 13:58:55,major brokerage firm restricting gme amc stock see tda still able buy 
189,Trading Inquiries,2021-01-27 14:24:35,trading inquiry 
190,Not laughing,2021-01-27 15:45:55,laughing 
191,"Dropped a total of $750 on the AMC stocks. I am hoping for a strong finish to the day, and another Skyrocket for after-hours marketing. Does anyone else have any thoughts on AMC at the moment?",2021-01-27 15:54:06,dropped total 750 amc stock hoping strong finish day another skyrocket hour marketing anyone else thought amc moment 
192,"Dropped a total of $750 today on the AMC stocks. I am hoping for a strong finish to the day, and another Skyrocket for after-hours marketing. Does anyone else have any thoughts on AMC at the moment?",2021-01-27 15:54:30,dropped total 750 today amc stock hoping strong finish day another skyrocket hour marketing anyone else thought amc moment 
193,Just bought my first stock because of you retards AMC 💎✋🚀🚀🚀🚀🚀🚀🚀 straight to the FUCKING moon! I fucking love this place and how awesome it is.,2021-01-27 15:57:46,bought first stock retard amc straight fucking moon fucking love place awesome 
194,Improvise and Adapt #2,2021-01-27 16:18:44,improvise adapt 
195,NOK After Hours,2021-01-27 16:23:44,nok hour 
196,NOK After Hours,2021-01-27 16:24:00,nok hour 
197,"AMC is the new GME: cousins, not competitors, AMC is the next big short squeeze, and outperformed GME today by 165% with a price still under $20",2021-01-27 16:35:03,amc new gme cousin competitor amc next big short squeeze outperformed gme today 165 price still 20 
198,Nasdaq's Adena Friedman Suggests Trading Halt to Combat Reddit,2021-01-27 17:01:49,nasdaq adena friedman suggests trading halt combat reddit 
199,"Hey YALL. I’m looking for opinions and advice. I’m hearing many things about AMC stock. Would it be safe to pull out of it a few dollars up or let it potentially go up next day, since after market is dropping.",2021-01-27 17:07:53,hey yall looking opinion advice hearing many thing amc stock would safe pull dollar let potentially go next day since market dropping 
200,$AMC $GME $BB ALL HAVE COMMON WITH THIS STOCK... $SNDL,2021-01-27 17:13:15,amc gme bb common stock sndl 
201,"GNUS ran up 81% today, volume exceeding 200M for the day.",2021-01-27 17:18:57,gnu ran 81 today volume exceeding 200m day 
202,Friendly advice from a idiot on cash app.,2021-01-27 18:15:59,friendly advice idiot cash app 
203,Stock market is on crack ATM. WSB influence engulfing the whole market?,2021-01-27 18:19:19,stock market crack atm wsb influence engulfing whole market 
204,Finding Value Stocks,2021-01-27 19:00:33,finding value stock 
205,Stocks rise up!!,2021-01-27 19:02:10,stock rise 
206,Quit? Or Hold?,2021-01-27 19:22:22,quit hold 
207,AMC stock sell or hold?,2021-01-27 19:49:18,amc stock sell hold 
208,AMC n NOK,2021-01-27 21:04:50,amc nok 
209,"Journey to $1 Million - A Bloody Day of January the 27, 2021",2021-01-27 21:06:06,journey million bloody day january 27 2021 
210,"I have $120,000 sitting in my savings account and curious how to get my financial life back on track after divorce",2021-01-27 21:50:00,120 00 sitting saving account curious get financial life back track divorce 
211,What is happening with the rest of the market?,2021-01-27 22:49:37,happening rest market 
212,"Anomalous Stocks, Wednesday, January 27, 2021",2021-01-27 22:51:43,anomalous stock wednesday january 27 2021 
213,I LOVE THE MOVIES: Part 1,2021-01-27 22:55:10,love movie part 
214,Why GameStop & AMC Are Down After Hours,2021-01-27 23:18:09,gamestop amc hour 
215,"A word of CAUTION about HOT Stocks (GME, AMC, BB< NOK et all)",2021-01-27 23:47:44,word caution hot stock gme amc bb nok et 
216,The Great Migration,2021-01-28 00:55:55,great migration 
217,Notice the pattern,2021-01-28 02:23:48,notice pattern 
218,AMC borrowing fees,2021-01-28 05:32:30,amc borrowing fee 
219,GME and AMC ceased trading,2021-01-28 06:37:46,gme amc ceased trading 
220,"AMC Stock news, what does this do to the stock?",2021-01-28 06:46:54,amc stock news stock 
221,Very high short interest on $SENS,2021-01-28 07:13:36,high short interest sen 
222,Reddit effect hit more than just GME. Wallstreetbets drives AMC stock over 800% since Jan 1! More gainers with this 1 month surge include BBBY up 197% & NOK up 67%. GameStop stock takes the lead at a whopping 1915% surge,2021-01-28 07:36:47,reddit effect hit gme wallstreetbets drive amc stock 800 since jan gainer month surge include bby 197 nok 67 gamestop stock take lead whopping 1915 surge 
223,Amc Stock to the moon,2021-01-28 08:10:19,amc stock moon 
224,Should I Sell My Nokia to Put More Stock in AMC,2021-01-28 08:11:30,sell nokia put stock amc 
225,AMC stocks no longer supported on Robinhood?,2021-01-28 08:28:38,amc stock longer supported robinhood 
226,Where Can I buy GameStop and amc stock?,2021-01-28 08:57:32,buy gamestop amc stock 
227,WATCH OUT 🤞,2021-01-28 09:05:14,watch 
228,"HEDGE FUNDS ARE TAGETTING GME , BB and AMC at 20min BEFORE STOCK OPENING! AGAIN!!! DONT BE FOOLED!! HOLD GME // BUY BB!!!🚀🚀🚀🚀🚀🌕💎💎💎💎🙌🏼🙌🏼",2021-01-28 09:08:03,hedge fund tagetting gme bb amc 20min stock opening dont fooled hold gme buy bb 
229,Stocks to Watch 28/01/2021,2021-01-28 09:11:10,stock watch 28 01 2021 
230,"Robinhood, TD Ameritrade, Charles Schwab, Trading 212 has paused trading on hot stocks such as GME, AMC, NOK, etc! They're doing it to ""protect their valued customers from the volitive market."" Forget them, find a new trading app, and make them wish they never fucked over the little people.",2021-01-28 09:13:44,robinhood td ameritrade charles schwab trading 212 paused trading hot stock gme amc nok etc protect valued customer volitive market forget find new trading app make wish never fucked little people 
231,"You can still purchase AMC stock via Cash App, Despite robinhood and others removing it.",2021-01-28 09:17:48,still purchase amc stock via cash app despite robinhood others removing 
232,"Robinhood and other platform are not letting people buy GME, AMC Stock",2021-01-28 09:19:41,robinhood platform letting people buy gme amc stock 
233,NOK and AMC stocks on RH,2021-01-28 09:22:23,nok amc stock rh 
234,"PSA: Please be extremely careful with your holdings, especially meme stocks. There’s a lot of stuff going on that can go south any moment.",2021-01-28 09:32:10,psa please extremely careful holding especially meme stock lot stuff going go south moment 
235,Revolut is just as bad as robinhood,2021-01-28 09:43:47,revolut bad robinhood 
236,Got my AMC stocks this morning on Charles Schwab. Unfortunately I don’t have enough for GME. 🚀 🚀 🚀,2021-01-28 09:52:23,got amc stock morning charles schwab unfortunately enough gme 
237,Fuck Robinhood - Use Cashapp,2021-01-28 09:57:55,fuck robinhood use cashapp 
238,AMC Stock on the dip...BUY BUY. And dont forget GME!!......buy both and HOLD,2021-01-28 09:58:58,amc stock dip buy buy dont forget gme buy hold 
239,I REALLY ENJOY THE AMC STOCK,2021-01-28 10:06:37,really enjoy amc stock 
240,Do not sell your amc or nok stock,2021-01-28 10:23:02,sell amc nok stock 
241,Question from a Newbie,2021-01-28 10:23:48,question newbie 
242,My brother just got an email from Robinhood that they submit a limit order for 18 of his AMC stocks without his consent,2021-01-28 10:28:10,brother got email robinhood submit limit order 18 amc stock without consent 
243,AMC Stock is going really deep in the shit hole almost a %50 Loss,2021-01-28 10:33:02,amc stock going really deep shit hole almost 50 loss 
244,I can’t log into E*TRADE. Anyone else have this problem?,2021-01-28 10:33:19,log trade anyone else problem 
245,"GME, BB, AMC stock",2021-01-28 10:38:45,gme bb amc stock 
246,HELP YOUR BROTHERS ON AMC!!!,2021-01-28 10:44:11,help brother amc 
247,Just a quick message.,2021-01-28 10:46:12,quick message 
248,Any stocks that I can buy on Robin that are going to boom? Besides GameStop Amc ect.,2021-01-28 10:49:30,stock buy robin going boom besides gamestop amc ect 
249,USE CASHAPP,2021-01-28 10:50:50,use cashapp 
250,AMC,2021-01-28 11:09:46,amc 
251,Robinhood - Mass Exodus Required,2021-01-28 11:14:52,robinhood mass exodus required 
252,Never invested before,2021-01-28 11:20:35,never invested 
253,"Stop giving in, this movement is still very strong and still going. Do not sell, hold and buy more!",2021-01-28 11:28:53,stop giving movement still strong still going sell hold buy 
254,You can use the chase banking app,2021-01-28 11:32:14,use chase banking app 
255,“Bulls get fed. Bears get fed. Pigs get slaughtered.”,2021-01-28 11:35:14,bull get fed bear get fed pig get slaughtered 
256,Buy stocks on Cashapp,2021-01-28 11:35:49,buy stock cashapp 
257,AMC STOCK? LONG TIME LISTENER FIRST TIME CALLER,2021-01-28 11:51:53,amc stock long time listener first time caller 
258,New to stock but iv got nok.and amc now,2021-01-28 11:55:21,new stock iv got nok amc 
259,NEWBIE: WHATS THE DEAL WITH AMC,2021-01-28 12:12:22,newbie whats deal amc 
260,Hold the line,2021-01-28 12:30:37,hold line 
261,The brokers take over,2021-01-28 13:31:59,broker take 
262,CashApp!,2021-01-28 13:49:20,cashapp 
263,AMC put option,2021-01-28 13:55:10,amc put option 
264,CASHAPP STOCK FYI AMC KEEP INVESTING,2021-01-28 14:01:15,cashapp stock fyi amc keep investing 
265,Stocks,2021-01-28 14:15:41,stock 
266,AMC and NOK trade halts on cashapp,2021-01-28 15:11:58,amc nok trade halt cashapp 
267,"Potential buy/hold GME, AMC, BB, etc. during the dip?",2021-01-28 15:24:33,potential buy hold gme amc bb etc dip 
268,Stock trading,2021-01-28 15:25:24,stock trading 
269,"Robinhood will allow limited buying of restricted securities Friday, GameStop jumps after hours",2021-01-28 16:36:21,robinhood allow limited buying restricted security friday gamestop jump hour 
270,These crashed... what's next? GME AMC Stocks,2021-01-28 17:13:22,crashed next gme amc stock 
271,1/29 GME (and others) Gamma Squeeze,2021-01-28 17:21:08,29 gme others gamma squeeze 
272,"Does anyone think it’s weird that robinhood is allowing “limited buys” Into today’s restricted stocks? Could it be a price limit? GME, BB, AMC ...",2021-01-28 18:03:32,anyone think weird robinhood allowing limited buy today restricted stock could price limit gme bb amc 
273,Some of you are Idiots 🤑,2021-01-28 19:11:38,idiot 
274,"TD Ameritrade allowing long calls and puts on certain stocks, but restricting covered positions and spreads",2021-01-28 20:07:03,td ameritrade allowing long call put certain stock restricting covered position spread 
275,"Billionaire Hedge Fund Bailouts - January 28, 2021",2021-01-28 20:47:58,billionaire hedge fund bailouts january 28 2021 
276,The bullish case for Tanger Outlets (SKT),2021-01-28 20:57:49,bullish case tanger outlet skt 
277,Watchlist 1-29-21 👀,2021-01-28 21:08:55,watchlist 29 21 
278,"Actual Reason You can't buy GME, AMC and etc.",2021-01-28 22:18:58,actual reason buy gme amc etc 
279,These were all the stocks that Robinhood blocked: $GME $KOSS $AMC $NOK $BB $BBBY $VIR $GNUS $AAL $NAKD,2021-01-28 22:32:42,stock robinhood blocked gme kos amc nok bb bby vir gnu aal nakd 
280,Help me understand this $GME $AMC gamma squeeze. Haven’t the hedge funds all covered their shorts and switched to the bull side to recoup their losses? Isn’t making the stock go up giving them the money we took back va leaving them with a huge $GME bag,2021-01-28 22:57:44,help understand gme amc gamma squeeze hedge fund covered short switched bull side recoup loss making stock go giving money took back va leaving huge gme bag 
281,IM URGING YOU TO READ IF YOU OWN AMC,2021-01-28 23:37:46,im urging read amc 
282,$UMC Semiconductor: Bargain Compared to Peer Group,2021-01-28 23:41:03,umc semiconductor bargain compared peer group 
283,Incase you haven’t heard..,2021-01-28 23:46:10,incase heard 
284,"They released the hold on GME, AMC, and NOK stock",2021-01-28 23:49:06,released hold gme amc nok stock 
285,"WealthSimple not processing orders until February 1, 2021?",2021-01-29 00:55:07,wealthsimple processing order february 2021 
286,"Anomalous Stocks, Thursday, January 28, 2021",2021-01-29 02:43:33,anomalous stock thursday january 28 2021 
287,ShortSqueeze XPSA,2021-01-29 04:43:48,shortsqueeze xpsa 
288,Gamestop Big Picture: The Short Singularity Pt 3 - WTF edition,2021-01-29 06:46:07,gamestop big picture short singularity pt wtf edition 
289,"Can't ""the rich"" just buy GME or AMC?",2021-01-29 08:53:09,rich buy gme amc 
290,DAILY SQUEEZE THREAD - 2021-01-29: Please put all GME/AMC/other squeeze stock discussion in here to help clean up our wonderful sub!,2021-01-29 09:53:59,daily squeeze thread 2021 01 29 please put gme amc squeeze stock discussion help clean wonderful sub 
291,"Are there any stocks other than GME, AMC, NOK, and BB that people want to talk about?",2021-01-29 09:58:20,stock gme amc nok bb people want talk 
292,Why BDRBF could be ready to explode (DD on Bombardier),2021-01-29 11:16:25,bdrbf could ready explode dd bombardier 
293,CIBC Rejecting GME/AMC Sell Limit Orders,2021-01-29 13:05:47,cibc rejecting gme amc sell limit order 
294,I believe there are no holds on GameStop and AMC stock on this app but I just found it and I think they don't do cryptocurrency yet so you may want to get a second app for that,2021-01-29 13:42:45,believe hold gamestop amc stock app found think cryptocurrency yet may want get second app 
295,New to stocks,2021-01-29 14:22:32,new stock 
296,Some stocks you should check out! 2 long term and 1 short term holding ( post and if you want youtube video),2021-01-29 16:31:07,stock check long term short term holding post want youtube video 
297,Need help picking a new trading platform,2021-01-29 16:33:35,need help picking new trading platform 
298,RH is limiting these stocks by the way https://www.google.com/amp/s/investorplace.com/2021/01/robinhood-bans-reddit-stocks-wallstreetbets-gme-cciv-sndl-jagx-amc-nok-bb/amp/,2021-01-29 17:07:11,rh limiting stock way URL 
299,New Investor on a shoestring budget for stocks here. What should I be keeping an eye on on Monday?,2021-01-29 17:11:16,new investor shoestring budget stock keeping eye monday 
300,"Buying into AMC, still worth it?",2021-01-29 18:27:08,buying amc still worth 
301,"Anomalous Stocks, Friday, January 29, 2021",2021-01-29 19:18:26,anomalous stock friday january 29 2021 
302,"Theory: Citadel is shorting all 50 stocks RH restricted, and therefore the market, and will try to hold on for one last stand",2021-01-29 19:34:57,theory citadel shorting 50 stock rh restricted therefore market try hold one last stand 
303,What’s the general consensus on BlackBerry?,2021-01-29 21:24:19,general consensus blackberry 
304,DAILY SQUEEZE THREAD: Please put all current happenings regarding GME/AMC/other squeeze stocks in here to help keep our community awesome!,2021-01-30 00:00:16,daily squeeze thread please put current happening regarding gme amc squeeze stock help keep community awesome 
305,Why buying AMC helps save a beloved American company on top of unleashing a devastating squeeze on hedge funds.,2021-01-30 00:06:52,buying amc help save beloved american company top unleashing devastating squeeze hedge fund 
306,Can't Stop Won't Stop Game Stonk,2021-01-30 01:36:37,stop stop game stonk 
307,What stocks you guys buying this week?,2021-01-30 02:31:18,stock guy buying week 
308,My prediciton on what will happen,2021-01-30 07:50:05,prediciton happen 
309,Should I get into dividends as an 18 year old?,2021-01-30 08:15:09,get dividend 18 year old 
310,Any good stocks to invest in for beginners?,2021-01-30 10:43:44,good stock invest beginner 
311,"Don’t put money you can’t risk in $GME or $AMC but even a few shares makes a difference. Join the revolution. Long the shorts, this is the way!",2021-01-30 11:16:59,put money risk gme amc even share make difference join revolution long short way 
312,Me after investing 20 bucks into AMC stock.,2021-01-30 11:38:02,investing 20 buck amc stock 
313,Weekend GME Thread + Homework for all: Let's stop using brokerages that halted trading,2021-01-30 13:03:28,weekend gme thread homework let stop using brokerage halted trading 
314,What's the overall feeling on NAKD?,2021-01-30 13:05:06,overall feeling nakd 
315,The situation with Gamestop affects everyone in the stock market,2021-01-30 13:50:15,situation gamestop affect everyone stock market 
316,Is questrade also limiting quantity of stocks like GME and AMC?,2021-01-30 13:58:11,questrade also limiting quantity stock like gme amc 
317,Does it make sense to move TSP funds out of CSI and into G fund?,2021-01-30 14:12:17,make sense move tsp fund csi fund 
318,Robinhood Limitations,2021-01-30 15:06:33,robinhood limitation 
319,You can get a ticket on a 🚀 to the 🌑 for the same price as a ticket to the movies! $AMC breakout coming.,2021-01-30 16:03:33,get ticket price ticket movie amc breakout coming 
320,"Concern/questions about the economy if GME, AMC, etc. reach endgame (posted in r/economy too)",2021-01-30 16:42:19,concern question economy gme amc etc reach endgame posted economy 
321,European Investing platform with english?,2021-01-30 16:42:48,european investing platform english 
322,Penny Stocks to Invest in on RH,2021-01-30 17:22:19,penny stock invest rh 
323,"Why Triggering the GameStop ""Infinite Gamma Squeeze"" is a terrible idea.",2021-01-30 18:26:22,triggering gamestop infinite gamma squeeze terrible idea 
324,AMC next phase:,2021-01-30 20:32:25,amc next phase 
325,$AMC. WSB Mascot saying. We Like The Stock. Actively shopping.,2021-01-30 22:44:43,amc wsb mascot saying like stock actively shopping 
326,Yo! Check out her videos about stocks ! GME + AMC + ???,2021-01-30 22:59:29,yo check video stock gme amc 
327,What are your next moves?,2021-01-30 23:42:52,next move 
328,Does AMC actually have legitimate potential to grow as high as people claim?,2021-01-30 23:43:55,amc actually legitimate potential grow high people claim 
329,DAILY SQUEEZE THREAD: Please put all current happenings regarding GME/AMC/other squeeze stocks in here to help keep our community awesome!,2021-01-31 00:00:21,daily squeeze thread please put current happening regarding gme amc squeeze stock help keep community awesome 
330,need help on options play?,2021-01-31 00:36:46,need help option play 
331,Questions: Why is AMC not rising as much as GME,2021-01-31 03:09:33,question amc rising much gme 
332,I created an algo that tracks the most hyped stocks on Reddit. Here are the results for this week,2021-01-31 07:32:17,created algo track hyped stock reddit result week 
333,Here are current trading restrictions for TD Ameritrade -- seem fairly reasonable,2021-01-31 07:54:40,current trading restriction td ameritrade seem fairly reasonable 
334,"AMC Short Interest is Often Overstated, and Actually 10-15% Based on My Calculations Below",2021-01-31 08:44:48,amc short interest often overstated actually 10 15 based calculation 
335,Kinepolis DD (EBR:KIN),2021-01-31 11:00:51,kinepolis dd ebr kin 
336,Short term investing next week in the volatile meme stocks,2021-01-31 11:04:36,short term investing next week volatile meme stock 
337,How it Ends. AMC and others to issue stock,2021-01-31 11:07:46,end amc others issue stock 
338,AMC now 147 million shares short with a 21% borrow rate. Lots of naked calls In the Money too.,2021-01-31 11:51:50,amc 147 million share short 21 borrow rate lot naked call money 
339,IPOE SoFi DD updates amid Meme Stock Mania,2021-01-31 12:40:28,ipoe sofi dd update amid meme stock mania 
340,"Interactive Brokers lifts all restrictions on stock and option trading, increased margin requirements to remain in place",2021-01-31 12:54:42,interactive broker lift restriction stock option trading increased margin requirement remain place 
341,Looking for good stock that could explode this year,2021-01-31 12:55:01,looking good stock could explode year 
342,Tired of the meme stocks,2021-01-31 12:56:10,tired meme stock 
343,"Options for this week, GME, GOOGL, SNAP and more",2021-01-31 14:41:50,option week gme googl snap 
344,HOLD!! To The Moon!!,2021-01-31 14:43:24,hold moon 
345,Breaking News: AMC GME stock winner,2021-01-31 15:46:24,breaking news amc gme stock winner 
346,AMC Leaps- Any ideas on fundamentals?,2021-01-31 18:07:41,amc leap idea fundamental 
347,"Alright, I have a bunch of questions.",2021-01-31 18:51:52,alright bunch question 
348,Markets Look Like They’re in a Bubble. What Do Investors Do Now?,2021-01-31 20:40:45,market look like bubble investor 
349,Another thread about next week,2021-01-31 21:10:01,another thread next week 
350,Watchlist 2-1-21 👀,2021-01-31 21:47:46,watchlist 21 
351,What to do for tomorrow with 1.5k sold in stocks on friday and RH saying i dont have sufficient buying power?,2021-01-31 22:40:00,tomorrow 5k sold stock friday rh saying dont sufficient buying power 
352,DAILY SQUEEZE THREAD: Please put all current happenings regarding GME/AMC/other squeeze stocks in here to help keep our community awesome!,2021-02-01 00:00:14,daily squeeze thread please put current happening regarding gme amc squeeze stock help keep community awesome 
353,Purchased $AMC stock when the market is closed,2021-02-01 03:03:27,purchased amc stock market closed 
354,WSJ: GameStop Day Traders Are Moving Into SPACs,2021-02-01 07:28:07,wsj gamestop day trader moving spacs 
355,"Emotional involvement has never been this high, please understand the risk involved.",2021-02-01 08:42:51,emotional involvement never high please understand risk involved 
356,Now is a good time to baseline your resources for news on stocks/investments,2021-02-01 09:02:33,good time baseline resource news stock investment 
357,AMC: A Different Kind of Investing,2021-02-01 10:05:31,amc different kind investing 
358,Don’t get scared at AMC stock,2021-02-01 10:51:55,get scared amc stock 
359,"AMC, GME, BB and some others - It’s NO COINCIDENCE that the stock that were trending since GME explosion are being manipulated since last week. DO NOT FEAR! HOLD AND BUY!",2021-02-01 11:02:08,amc gme bb others coincidence stock trending since gme explosion manipulated since last week fear hold buy 
360,Did I miss out?,2021-02-01 12:13:06,miss 
361,"Serious question, did the GME squeeze already happen?",2021-02-01 13:39:18,serious question gme squeeze already happen 
362,WALLSTREET DIRTY TACTICS- Price of a stock goes up or down based on supply and demand. READ to see why AMC and GME have not yet 🚀🚀🚀🚀🚀🌕 because of the illegal fraud Wallstreet and brokers like RH are doing,2021-02-01 15:38:24,wallstreet dirty tactic price stock go based supply demand read see amc gme yet illegal fraud wallstreet broker like rh 
363,Long Thesis on Hostess Brands (TWNK) (Owner of Twinkies),2021-02-01 17:07:15,long thesis hostess brand twnk owner twinkie 
364,"TD ""news"" alert on AMC stock Ticker (clear misinformation tactics)",2021-02-01 17:29:25,td news alert amc stock ticker clear misinformation tactic 
365,Long Thesis on Hostess Brands (TWNK) (Owner of Twinkies),2021-02-01 17:34:19,long thesis hostess brand twnk owner twinkie 
366,Lost €100 because Trading212 go brr,2021-02-01 18:31:17,lost 100 trading212 go brr 
367,"Wealthsimple trade vs Questrade for purchasing stocks, particularly blackberry gme and amc?",2021-02-01 18:36:54,wealthsimple trade v questrade purchasing stock particularly blackberry gme amc 
368,15 U.S.C.A. § 78i - the Illegality of Short Ladder Attacks (Legal insight),2021-02-01 18:57:46,15 78i illegality short ladder attack legal insight 
369,Fubo stock on track to hit $200,2021-02-01 19:21:44,fubo stock track hit 200 
370,15 U.S.C.A. § 78i - the Illegality of Short Ladder Attacks,2021-02-01 19:41:13,15 78i illegality short ladder attack 
371,"Stock goes lower, puts go down",2021-02-01 19:57:43,stock go lower put go 
372,"AMC Entertainment Holdings, Inc (AMC) Stock Price, News, Quote & History - Yahoo Finance",2021-02-01 20:32:31,amc entertainment holding inc amc stock price news quote history yahoo finance 
373,Have We Reached The Moon? THEN IT'S NOT OVER! AMC Stock News GameStop Short Squeeze Is Still On! WSB,2021-02-01 20:40:04,reached moon amc stock news gamestop short squeeze still wsb 
374,"Canadian regulators eye Reddit rally, vow to act if manipulation identified",2021-02-01 20:56:44,canadian regulator eye reddit rally vow act manipulation identified 
375,My first post! Options trades initiated TODAY 2/1/21,2021-02-01 21:01:09,first post option trade initiated today 21 
376,Thoughts on investing in (F) Ford Motor now at $10.99,2021-02-01 21:48:51,thought investing ford motor 10 99 
377,GME Short Squeeze What Comes Next,2021-02-01 21:52:09,gme short squeeze come next 
378,TEAM WE NEED TO MAKE THIS VIDEO GO VIRAL!!! 🚀🌙THIS IS WHY AMC DIDN'T SQUEEZE TODAY! (Naked Short & Short Ladder) // AMC Stock Update 💰💰💰,2021-02-01 23:12:20,team need make video go viral amc squeeze today naked short short ladder amc stock update 
379,I’m completely sick of seeing GME and AMC posts,2021-02-01 23:25:51,completely sick seeing gme amc post 
380,What is better for buying the blackberry gme and amc stocks? Wealthsimple trade or questrade?,2021-02-01 23:34:36,better buying blackberry gme amc stock wealthsimple trade questrade 
381,Stock Market Data Downloader - Python,2021-02-01 23:43:31,stock market data downloader python 
382,DAILY SQUEEZE THREAD: Please put all current happenings regarding GME/AMC/other squeeze stocks in here to help keep our community awesome!,2021-02-02 00:00:20,daily squeeze thread please put current happening regarding gme amc squeeze stock help keep community awesome 
383,DD - Funko Toys (+$15 per share / +$600m Market Cap),2021-02-02 05:28:33,dd funko toy 15 per share 600m market cap 
384,Just bought yesterday my first AMC stocks and bought today another 20! Germany stays strong! To the moon 💎 🙌 🚀,2021-02-02 06:14:05,bought yesterday first amc stock bought today another 20 germany stay strong moon 
385,Current situation with AMC?,2021-02-02 08:11:27,current situation amc 
386,AMC stock probably would have been worth it even if all of this wasn't happening,2021-02-02 08:35:48,amc stock probably would worth even happening 
387,"A Must-Read for New Traders/Investors - BlackBerry, AMC, and others",2021-02-02 08:54:30,must read new trader investor blackberry amc others 
388,Has anyone else seen this?!?,2021-02-02 09:17:20,anyone else seen 
389,Revolut only allowing users to SELL GME and AMC stocks,2021-02-02 09:22:04,revolut allowing user sell gme amc stock 
390,Revolut just set GME and AMC stocks to sell only!,2021-02-02 09:35:19,revolut set gme amc stock sell 
391,"Bought some AMC stock, hold fast my fellow retards!",2021-02-02 09:35:39,bought amc stock hold fast fellow retard 
392,I can’t buy anymore AMC stock on CashApp. These MF’Ed are trying to manipulate the market by suppressing our ability to buy more stock.,2021-02-02 09:39:35,buy anymore amc stock cashapp mf ed trying manipulate market suppressing ability buy stock 
393,$GME $AMC UK Platform Revolut suspends purchases of $GME and $AMC stocks,2021-02-02 09:40:48,gme amc uk platform revolut suspends purchase gme amc stock 
394,SEC really needs to step in on these HF!!!!,2021-02-02 09:42:22,sec really need step hf 
395,r/Stocks - GME megathread!,2021-02-02 10:33:50,stock gme megathread 
396,Holding to my AMC stock and buying the dips. Bolder!!,2021-02-02 10:41:18,holding amc stock buying dip bolder 
397,Revolut (DriveWealth) is restricting buying of GME and AMC from 02/02/21. Read the email i just received below. They are essentially doing what Robinhood did last week.,2021-02-02 10:42:36,revolut drivewealth restricting buying gme amc 02 02 21 read email received essentially robinhood last week 
398,Revolut in UK not letting me buy,2021-02-02 10:45:22,revolut uk letting buy 
399,Revolut set to Sell only the GME and AMC Stocks!,2021-02-02 10:45:51,revolut set sell gme amc stock 
400,Revolut restricting $GME and $AMC trading,2021-02-02 10:46:05,revolut restricting gme amc trading 
401,Sold my AMC stocks for £9 and proud.,2021-02-02 11:02:24,sold amc stock proud 
402,Revolut also uses Drivewealth. Buying GME and AMC stocks no longer possible in the Revolut app.,2021-02-02 11:04:33,revolut also us drivewealth buying gme amc stock longer possible revolut app 
403,AMC holder/ thoughts on another trade while holding,2021-02-02 11:29:36,amc holder thought another trade holding 
404,AMC Profit Opportunity - Comparing CSP vs PCS,2021-02-02 12:54:43,amc profit opportunity comparing csp v pc 
405,CGX.TO for the long,2021-02-02 13:09:29,cgx long 
406,1 GME Gang,2021-02-02 16:20:59,gme gang 
407,Great day today boys and girls!!! ***Update***,2021-02-02 16:27:34,great day today boy girl update 
408,Apps that haven’t banned stocks,2021-02-02 16:32:58,apps banned stock 
409,"AMC Stock Will Boom, Here's Why. (Explained)",2021-02-02 16:38:38,amc stock boom explained 
410,Are the short ladder attacks the same for AMC?,2021-02-02 16:42:20,short ladder attack amc 
411,Are the short ladder attacks the same for AMC?,2021-02-02 16:42:53,short ladder attack amc 
412,Are the short ladder attacks the same for AMC?,2021-02-02 16:43:09,short ladder attack amc 
413,AMC Straddle Play - March 5th,2021-02-02 18:06:22,amc straddle play march 5th 
414,"if you lost a ton of money playing the meme stocks, consider it as tuition",2021-02-02 19:22:38,lost ton money playing meme stock consider tuition 
415,Story on how you made a fund 113 million dollars richer,2021-02-02 19:31:59,story made fund 113 million dollar richer 
416,Why You Should Get Into Long Positions of Cannabis,2021-02-02 21:01:03,get long position cannabis 
417,"SNDL, ZOM + others, Complete Technical Analyses for Rest of Week Feb 3rd, 2021",2021-02-02 21:53:37,sndl zom others complete technical analysis rest week feb 3rd 2021 
418,Finding my investment compass again after being sucked into WSB,2021-02-02 23:54:53,finding investment compass sucked wsb 
419,DAILY SQUEEZE THREAD: Please put all current happenings regarding GME/AMC/other squeeze stocks in here to help keep our community awesome!,2021-02-03 00:00:15,daily squeeze thread please put current happening regarding gme amc squeeze stock help keep community awesome 
420,Does it make sense to move my position in GME into AMC instead?,2021-02-03 03:08:17,make sense move position gme amc instead 
421,Someone Always Ends Up Holding the “Doo Bag”,2021-02-03 05:09:05,someone always end holding doo bag 
422,REZZF/GBML Lithium mine play with extremely low market cap ($14.59M),2021-02-03 07:35:04,rezzf gbml lithium mine play extremely low market cap 14 59m 
423,Twitter news claims interest for GME/AMC in the subreddit is fizzling out (it’s all we fucking talk about). And they can’t even list the correct stock for AMC Entertainment.,2021-02-03 08:45:01,twitter news claim interest gme amc subreddit fizzling fucking talk even list correct stock amc entertainment 
424,Suggestions for investing.,2021-02-03 09:38:35,suggestion investing 
425,Need some insight on rebuilding my portfolio,2021-02-03 13:36:59,need insight rebuilding portfolio 
426,Churchill Capital IV - a meme stock,2021-02-03 14:28:33,churchill capital iv meme stock 
427,Old fart advice for young investors,2021-02-03 15:05:46,old fart advice young investor 
428,Clarifying the SEC's Investigation of Social Media GME Hype for Fraud [Bloomberg Article],2021-02-03 16:31:00,clarifying sec investigation social medium gme hype fraud bloomberg article 
429,Reminder - Whether you own GME or not - CHANGE YOUR GODDAMN BROKER,2021-02-03 17:00:35,reminder whether gme change goddamn broker 
430,In need of some advice,2021-02-03 18:22:46,need advice 
431,My first few days in the crusade: a current reflection,2021-02-03 22:36:57,first day crusade current reflection 
432,Batman looking out over Wall Street in the $AMC stock chart today. 💎 🙌💎 for Batman = 🚀🌕,2021-02-03 23:13:00,batman looking wall street amc stock chart today batman 
433,DAILY SQUEEZE THREAD: Please put all current happenings regarding GME/AMC/other squeeze stocks in here to help keep our community awesome!,2021-02-04 00:00:15,daily squeeze thread please put current happening regarding gme amc squeeze stock help keep community awesome 
434,Holding AMC with diamond hands... but what's the situation for the squeeze?,2021-02-04 04:52:15,holding amc diamond hand situation squeeze 
435,"I have no clue how stocks work, and no idea what I am doing.",2021-02-04 08:55:56,clue stock work idea 
436,Im deleting the top post. r/StockMaket does not advocate holding shit when its in a death spiral!,2021-02-04 11:41:24,im deleting top post stockmaket advocate holding shit death spiral 
437,"rWSB is losing direction and becoming fractured. Remember Apes: alone weak, together strong (AMC proposal)",2021-02-04 12:57:27,rwsb losing direction becoming fractured remember ape alone weak together strong amc proposal 
438,"Learned my Lesson with Buying into the Hype, but Will Still Hold Long Term",2021-02-04 13:38:24,learned lesson buying hype still hold long term 
439,Never going to sell my AMC stock. My strategy has always been to kiss any money I invest goodbye as soon as I hit the trade button.,2021-02-04 14:03:54,never going sell amc stock strategy always kiss money invest goodbye soon hit trade button 
440,DeepFuckingValue Goes to Capital Hill,2021-02-04 14:21:35,deepfuckingvalue go capital hill 
441,NAKD is the next big stock.,2021-02-04 14:26:29,nakd next big stock 
442,Capital Gains Tax,2021-02-04 15:18:58,capital gain tax 
443,"BB is the only one that broke its correlation with the other ""BANG"" stocks (AMC, Nokia, Gamestop) and traded upward today.",2021-02-04 16:15:24,bb one broke correlation bang stock amc nokia gamestop traded upward today 
444,GME and meme stock an expensive lesson to learn.,2021-02-04 17:11:58,gme meme stock expensive lesson learn 
445,GME Likely to Rebound,2021-02-04 17:37:40,gme likely rebound 
446,I can’t believe how many people are more retarted than me!,2021-02-04 18:24:46,believe many people retarted 
447,Seeing large after hours spikes in price and volume-- what does that indicate about the next day's opening price?,2021-02-04 18:42:39,seeing large hour spike price volume indicate next day opening price 
448,BC couple uses AMC stock gains to support My Pleasant school library,2021-02-04 19:16:04,bc couple us amc stock gain support pleasant school library 
449,Wall Street won the war?,2021-02-04 19:40:26,wall street war 
450,DAILY SQUEEZE THREAD: Please put all current happenings regarding GME/AMC/other squeeze stocks in here to help keep our community awesome!,2021-02-05 00:00:16,daily squeeze thread please put current happening regarding gme amc squeeze stock help keep community awesome 
451,If AMC's Stock hits $300 I will send Valentines Gorilla Shit to my ex!!!,2021-02-05 00:21:26,amc stock hit 300 send valentine gorilla shit ex 
452,Yellen vows to protect us,2021-02-05 00:30:25,yellen vow protect u 
453,"Robinhood lifts trading restrictions on GameStop, AMC stock",2021-02-05 00:30:37,robinhood lift trading restriction gamestop amc stock 
454,YOLO trade strategy for Investors who kept getting FCKed this week.,2021-02-05 01:00:02,yolo trade strategy investor kept getting fcked week 
455,I believe this wave of stock market interest could be great in the long term,2021-02-05 07:43:05,believe wave stock market interest could great long term 
456,Robinhood took off all restrictions,2021-02-05 08:53:09,robinhood took restriction 
457,Covered Call Strategy Using AMC Bags,2021-02-05 08:58:56,covered call strategy using amc bag 
458,Two Year Study Shows Owning AMC Stock Can Drive 5 More Trips to the Movies a Year,2021-02-05 09:38:04,two year study show owning amc stock drive trip movie year 
459,Robinhood lifted GME and AMC restrictions,2021-02-05 09:38:48,robinhood lifted gme amc restriction 
460,If you own AMC please read this,2021-02-05 12:10:23,amc please read 
461,I’m tired of seeing meme stocks here,2021-02-05 12:11:25,tired seeing meme stock 
462,Are XGRO and XEQT the best ETFs my best choices?,2021-02-05 13:20:18,xgro xeqt best etf best choice 
463,Just spent my spending bidget on AMC stock. Lets go tards!!! AMC TO THE MOON 🚀🚀 💎🤲,2021-02-05 15:32:25,spent spending bidget amc stock let go tards amc moon 
464,Why AMC Stock Jumped Again Friday | The Motley Fool,2021-02-05 17:27:43,amc stock jumped friday motley fool 
465,What does this mean for AMC stock? Form 8-K filed Feb 1 2021,2021-02-05 19:44:21,mean amc stock form filed feb 2021 
466,Who's Ready for the ETH Squeeze? 10k Possible in 2021,2021-02-05 20:02:42,ready eth squeeze 10k possible 2021 
467,"AMC: An imploding time bomb, and put spreads to capitalize",2021-02-05 20:44:36,amc imploding time bomb put spread capitalize 
468,BB Stock,2021-02-05 23:05:31,bb stock 
469,Can someone explain to me a few things about AMC stock?,2021-02-06 01:21:49,someone explain thing amc stock 
470,WSB helped Silver Lake Group make 113 million in profit. Nice!,2021-02-06 06:42:29,wsb helped silver lake group make 113 million profit nice 
471,I built a tool that shows the number of total mentions on reddit and short interest for each ticker,2021-02-06 10:22:53,built tool show number total mention reddit short interest ticker 
472,My First-Ever Stock Purchase - AMC,2021-02-06 10:24:14,first ever stock purchase amc 
473,$AMC buy and hold till launch,2021-02-06 12:49:49,amc buy hold till launch 
474,Is AMC a good long term investment?,2021-02-06 14:33:30,amc good long term investment 
475,AMC Stock: A Retard's Short DD,2021-02-06 20:09:25,amc stock retard short dd 
476,What I've learned from investing so far,2021-02-07 03:10:49,learned investing far 
477,"140k in savings, is my plan good?",2021-02-07 05:03:50,140k saving plan good 
478,Gamestop Big Picture: The Bigger Picture,2021-02-07 05:10:12,gamestop big picture bigger picture 
479,Biotech Longterm Play,2021-02-07 09:17:53,biotech longterm play 
480,DD - Electrovaya - EFLVF - $1.55 - TL:DR,2021-02-07 15:17:39,dd electrovaya eflvf 55 tl dr 
481,What happens to shares of AMC if Netflix buys the company?,2021-02-07 20:49:18,happens share amc netflix buy company 
482,Save $AMC Billboard in Kzoo goes viral,2021-02-07 23:56:06,save amc billboard kzoo go viral 
483,AMC Major Stakeholder Wanda Converts Stock To Allow For Sale,2021-02-08 03:00:02,amc major stakeholder wanda convert stock allow sale 
484,"Thank you to all the kind, seasoned veterans taking the time to educate new traders like myself.",2021-02-08 03:30:40,thank kind seasoned veteran taking time educate new trader like 
485,"Tired of hearing about GME, AMC, & NOK? I handpicked the most popular posts, tickers, and DD from the last week. Here are the results!",2021-02-08 08:34:55,tired hearing gme amc nok handpicked popular post ticker dd last week result 
486,(2/8) Monday's Pre-Market Stock Movers & News,2021-02-08 08:45:30,monday pre market stock mover news 
487,A non-meme 'macro' analysis on AMC (DD),2021-02-08 08:50:20,non meme macro analysis amc dd 
488,I bought AMC stocks and now I'm scared.,2021-02-08 10:48:44,bought amc stock scared 
489,What do you guys think about this portfolio for a young first time investor?,2021-02-08 11:48:06,guy think portfolio young first time investor 
490,At what point should we come to terms that AMC won’t see $15.00 for a long while?,2021-02-08 12:16:42,point come term amc see 15 00 long 
491,Weekly SPAC Rundown 2/1 – 2/7,2021-02-08 16:03:18,weekly spac rundown 
492,BB is not a phone company. Here’s some DD.,2021-02-08 23:35:42,bb phone company dd 
493,Learning the hard way,2021-02-09 07:36:40,learning hard way 
494,$AMC.... Not looking at the meme stock but a pivot for $AMC could change the game.,2021-02-09 09:30:34,amc looking meme stock pivot amc could change game 
495,AMC $8 Put option,2021-02-09 16:07:12,amc put option 
496,PSA: Call options can & are being used to create un-squeezable short positions,2021-02-09 16:54:10,psa call option used create un squeezable short position 
497,"AMC Entertainment's stock drops toward a 4-day losing streak, in which it has shed nearly 39%",2021-02-09 21:38:32,amc entertainment stock drop toward day losing streak shed nearly 39 
498,Why Reddit’s WallStreetBets Will Stop Buying AMC Stock,2021-02-09 21:42:43,reddit wallstreetbets stop buying amc stock 
499,MASSIVE AMC STOCK ANALYSIS-WILL AMC STOCK GO BACK TO $20? Buy AMC Stock At $5?,2021-02-09 22:01:37,massive amc stock analysis amc stock go back 20 buy amc stock 
500,"Nothing to do with stocks, just my AMC in an asparagus field",2021-02-10 09:00:08,nothing stock amc asparagus field 
501,"Based on reports and current news, what are the predictions for SGMD? I lost a ridiculous amount of money to AMC (still holding by the way but in deficit) and I’m just worried about the next investment. Any insights? How many stocks did you purchase?",2021-02-10 12:56:38,based report current news prediction sgmd lost ridiculous amount money amc still holding way deficit worried next investment insight many stock purchase 
502,What is going on with Helios and Matheson ($HMNY)?,2021-02-10 13:30:30,going helios matheson hmny 
503,Heres why the squeeze HASNT happened yet on AMC GME,2021-02-10 16:35:38,here squeeze hasnt happened yet amc gme 
504,Is it ok to talk about AMC,2021-02-10 21:31:55,ok talk amc 
505,Deep DD on Soligenix (SNGX) - READ it first,2021-02-11 08:46:15,deep dd soligenix sngx read first 
506,A historical survey of the systemic problem of shorting non-existing stock (naked shorting) in relation to recent events,2021-02-11 15:02:55,historical survey systemic problem shorting non existing stock naked shorting relation recent event 
507,Sell amc and cut loses or hold for long term ?,2021-02-11 19:35:34,sell amc cut loses hold long term 
508,Buy AMC and sell long term Calls?,2021-02-12 01:03:56,buy amc sell long term call 
509,Another low day?,2021-02-12 09:46:46,another low day 
510,$NSTB / Apex Clearing,2021-02-13 08:10:02,nstb apex clearing 
511,"What to do if you lost money on GameStop, AMC, or other ‘meme stocks’",2021-02-13 13:37:46,lost money gamestop amc meme stock 
512,"Tired of hearing about all these meme stocks? I handpicked the most popular posts, tickers, and DD from the last week. Here are the results!",2021-02-14 07:52:40,tired hearing meme stock handpicked popular post ticker dd last week result 
513,AMC - Is it a company in decline?,2021-02-15 02:40:06,amc company decline 
514,Too afraid to ask,2021-02-15 03:25:15,afraid ask 
515,AMC Blockbuster DD: The Sequel,2021-02-15 17:53:17,amc blockbuster dd sequel 
516,Winning SPAC DD #2: Mudrick Capital Acquisition (MUDSW) and merger speculation,2021-02-15 18:46:45,winning spac dd mudrick capital acquisition mudsw merger speculation 
517,"Morning Update for Tuesday, 02/16/21",2021-02-16 08:32:58,morning update tuesday 02 16 21 
518,BDRBF going to DaMoon,2021-02-16 10:19:22,bdrbf going damoon 
519,"AMC Entertainment Holdings, Inc (AMC) Stock Price, News, Quote & History - Yahoo Finance",2021-02-16 11:59:37,amc entertainment holding inc amc stock price news quote history yahoo finance 
520,I just need someone to tell me I’m doing alright.,2021-02-17 03:03:12,need someone tell alright 
521,Are meme stocks basically any IV over 150%,2021-02-17 21:25:57,meme stock basically iv 150 
522,Blackberry: Bear Case,2021-02-17 22:43:59,blackberry bear case 
523,SEC confirms $GME price kept artificially low via fractional reserve,2021-02-18 07:34:26,sec confirms gme price kept artificially low via fractional reserve 
524,"Yesterday's play was absolutely amazing, while others lost, I hope you took advantage and made money! Lets go with momentum! 9 plays in 9 days and all profitable!",2021-02-19 07:35:56,yesterday play absolutely amazing others lost hope took advantage made money let go momentum play day profitable 
525,I'm trying to understand Robinhood's excuse/exposure risk,2021-02-19 14:05:13,trying understand robinhood excuse exposure risk 
526,"Why am I not satisfied, why is greed a thing.",2021-02-19 17:34:29,satisfied greed thing 
527,The 99.2% AMC stock being held statement is FALSE. Here's why,2021-02-20 12:19:37,99 amc stock held statement false 
528,The whole GME/AMC trend completely derailed my plans and strategy.,2021-02-22 15:36:06,whole gme amc trend completely derailed plan strategy 
529,ITS TIME #AMC - STOCK IS GOING TO THE MOON 🚀🚀🚀,2021-02-22 16:56:53,time amc stock going moon 
530,"Journey to $1 Million - February 22nd, 2021",2021-02-22 20:29:43,journey million february 22nd 2021 
531,"Daily Play, Yesterday it was better to go with the defensive play, today I will also have 2 picks in case market goes red, we must rotate sectors if there is correction",2021-02-23 07:03:07,daily play yesterday better go defensive play today also pick case market go red must rotate sector correction 
532,Options strategies to take advantage of a market downturn,2021-02-23 10:08:04,option strategy take advantage market downturn 
533,"Watch $GME, $AMC and other ""meme stock"" prices rise",2021-02-23 11:35:00,watch gme amc meme stock price rise 
534,AMC Calls 4/16 and 6/18 (insanity or viable play?),2021-02-23 22:19:03,amc call 16 18 insanity viable play 
535,Low float on stock. Institutions that bought into AMC /GME now investing into UAMY this last week?,2021-02-24 03:42:26,low float stock institution bought amc gme investing uamy last week 
536,Is AMC blowing up or am I tripping? Goddamn I like this stock 💎💎💎,2021-02-24 15:52:05,amc blowing tripping goddamn like stock 
537,Can someone explain to me why halting trading of a stock is not market manipulation?,2021-02-24 18:12:51,someone explain halting trading stock market manipulation 
538,Bloomberg stock forecast for AMC is Bullish!,2021-02-24 22:15:45,bloomberg stock forecast amc bullish 
539,GME Saga continues and my analysis,2021-02-25 05:22:41,gme saga continues analysis 
540,AMC GME difference – Not the short or Gamma Squeeze candidate you think it is – real short interest a lot lower due to massive share count increase and dilution.,2021-02-25 07:36:52,amc gme difference short gamma squeeze candidate think real short interest lot lower due massive share count increase dilution 
541,"Game Plan for February 25, 2021",2021-02-25 08:45:35,game plan february 25 2021 
542,"Morning Update for Thursday, 02/25/21",2021-02-25 09:01:14,morning update thursday 02 25 21 
543,Why is AMD doing dropping like a stone?,2021-02-25 11:23:28,amd dropping like stone 
544,"BUYING THE DIP, HOLDING STONG - $AMC (Let's Go to the Movies!)",2021-02-25 14:39:28,buying dip holding stong amc let go movie 
545,I need help with risk management,2021-02-25 19:37:14,need help risk management 
546,First straddle!!!,2021-02-25 21:00:39,first straddle 
547,Update on AMC,2021-02-26 00:26:40,update amc 
548,"Anomalous Stocks, Thursday, February 25, 2021",2021-02-26 02:23:20,anomalous stock thursday february 25 2021 
549,"I recruited an astronaut to help get us to the moon. He’s also an actor, scientist, doctor, and lawyer, and seriously knows his stuff! He loves the movies and we love the stock! Long live AMC!",2021-02-26 07:57:37,recruited astronaut help get u moon also actor scientist doctor lawyer seriously know stuff love movie love stock long live amc 
550,Tdameritrade option question,2021-02-26 22:44:46,tdameritrade option question 
551,Robinhood to plan confidential IPO filing as soon as March,2021-02-27 00:19:41,robinhood plan confidential ipo filing soon march 
552,"If you only have $100 to invest, what stock would you invest it in?",2021-02-27 13:56:05,100 invest stock would invest 
553,"Am I doing this right? Am I doing good, bad, great? What can I expect to make? Can I quit my job and be a trader? Realistic expectations",2021-02-27 18:31:00,right good bad great expect make quit job trader realistic expectation 
554,Why I love the AMC Stock,2021-02-28 20:04:03,love amc stock 
555,AMC and dilution,2021-03-01 14:49:13,amc dilution 
556,AMC options..,2021-03-02 11:11:57,amc option 
557,AMC Prediction: March 5-March 11 Huge Gains,2021-03-02 19:49:41,amc prediction march march 11 huge gain 
558,"🔥 Market Open: Live Stock Updates on $GME & $AMC 🔥 Ask a Data Scientist *Not an adviser, not a dead cat*",2021-03-02 23:43:00,market open live stock update gme amc ask data scientist adviser dead cat 
559,AMC Call Now No Positive Profit,2021-03-03 10:16:47,amc call positive profit 
560,Retail investors care more for the success of American businesses than Wall Street,2021-03-03 11:44:44,retail investor care success american business wall street 
561,Stocks to Sell Put Options,2021-03-03 15:16:33,stock sell put option 
562,"Uranium - fuel of the future, opportunity of the lifetime",2021-03-05 06:17:06,uranium fuel future opportunity lifetime 
563,"Level 2: $GME, $RKT, $AMC, $PLTR, $SKT, $TSLA, $BB- Top Stock Streams",2021-03-05 09:43:24,level gme rkt amc pltr skt tsla bb top stock stream 
564,Question about Puts in regards to the GME and AMC situation,2021-03-05 19:39:23,question put regard gme amc situation 
565,Question about Puts in regards to the GME/AMC situation,2021-03-06 00:04:26,question put regard gme amc situation 
566,"AMC FILED w/SEC TODAY to INCREASE COMMON STOCK SHARES by 500,000,000 to 1,024,173,073 - Shareholders Vote MAY 4 - Effective Immediately if Approved. Please READ",2021-03-06 02:27:36,amc filed sec today increase common stock share 500 00 00 024 173 073 shareholder vote may effective immediately approved please read 
567,"Most anticipated earnings releases for the week beginning March 08, 2021",2021-03-06 06:49:55,anticipated earnings release week beginning march 08 2021 
568,"Most Anticipated Earnings Releases for the week beginning March 8th, 2021",2021-03-06 07:10:36,anticipated earnings release week beginning march 8th 2021 
569,"Wall Street Week Ahead for the trading week beginning March 8th, 2021",2021-03-06 07:25:53,wall street week ahead trading week beginning march 8th 2021 
570,"Laid off and daytrading. 28k in, PDT, and margin. My apprenticeship, if you will.",2021-03-06 13:51:59,laid daytrading 28k pdt margin apprenticeship 
571,Vanguard and Blackrock,2021-03-06 16:40:35,vanguard blackrock 
572,"Most anticipated earnings releases for the week beginning March 08, 2021",2021-03-06 22:13:14,anticipated earnings release week beginning march 08 2021 
573,Meme Stock or Future Potential? AMC Entertainment,2021-03-07 17:25:22,meme stock future potential amc entertainment 
574,"Expected moves for the week. SPY, Tesla, Docu, AMC, Oracle and more",2021-03-07 17:46:40,expected move week spy tesla docu amc oracle 
575,Help with my call options on AMC,2021-03-07 21:00:05,help call option amc 
576,"Morning Update for Monday, 03/08/21",2021-03-08 08:55:34,morning update monday 03 08 21 
577,"Here is a Market Recap for today Monday, March 8, 2021.",2021-03-08 16:39:09,market recap today monday march 2021 
578,Potential big winners for investing,2021-03-09 10:59:02,potential big winner investing 
579,Should I cut my losses?,2021-03-09 13:34:35,cut loss 
580,Be Careful Trading This Week,2021-03-10 02:46:03,careful trading week 
581,OPTIONS: Straddle Prices for Stocks Expected to Report Quarterly Results This Week. NYSE: $AMC,2021-03-10 06:44:57,option straddle price stock expected report quarterly result week nyse amc 
582,"Morning Update for Wednesday, 03/10/21",2021-03-10 08:53:23,morning update wednesday 03 10 21 
583,AMC earnings play?,2021-03-10 10:50:06,amc earnings play 
584,AMC options 🚀,2021-03-10 16:59:00,amc option 
585,NASDAQ Cools Off as the Russell Soars...,2021-03-10 17:56:11,nasdaq cool russell soar 
586,"GME and AMC charts today during that mass drop. Identical? One could say tactical. Human emotion plays a lot into market buys and sells, and these hedges are looking to trigger you to sell with these coordinated attacks. Stay 💎🙌🏼 and remember why you bought the stock and stay retarded.",2021-03-10 18:02:48,gme amc chart today mass drop identical one could say tactical human emotion play lot market buy sell hedge looking trigger sell coordinated attack stay remember bought stock stay retarded 
587,ETF Account for Son,2021-03-10 23:07:10,etf account son 
588,"Anomalous Stocks, Wednesday, March 10, 2021",2021-03-10 23:30:05,anomalous stock wednesday march 10 2021 
589,💩 List: Know Your Enemies,2021-03-11 01:29:17,list know enemy 
590,A Trade Idea – Sorry about GOCO Yesterday Morgan Stanley is absolutely wrong,2021-03-11 06:47:27,trade idea sorry goco yesterday morgan stanley absolutely wrong 
591,A Trade Idea – Sorry about GOCO Yesterday Morgan Stanley is absolutely wrong,2021-03-11 06:48:20,trade idea sorry goco yesterday morgan stanley absolutely wrong 
592,"Morning Update for Thursday, 03/11/21",2021-03-11 08:31:47,morning update thursday 03 11 21 
593,Anyone here trading the AMC options? I feel like they are too expensive to take on.,2021-03-11 14:26:37,anyone trading amc option feel like expensive take 
594,AMC vertical spread,2021-03-11 21:19:14,amc vertical spread 
595,I feel like I’m literally burning my money.,2021-03-12 04:35:10,feel like literally burning money 
596,Most discussed stocks of the week and their sentiment,2021-03-13 12:56:22,discussed stock week sentiment 
597,I've created an algorithm that scans social media sites to identify stocks that have had the biggest increase in chatter. I wanted to share the results of this week with you.,2021-03-13 13:02:41,created algorithm scan social medium site identify stock biggest increase chatter wanted share result week 
598,DD - FNKO Launching NFTs in 2021,2021-03-13 16:00:24,dd fnko launching nfts 2021 
599,Advice for young investors with little or no bills to pay!,2021-03-14 20:31:03,advice young investor little bill pay 
600,"Morning Update for Monday, 03/15/21",2021-03-15 08:52:56,morning update monday 03 15 21 
601,"Game Plan for March 15, 2021",2021-03-15 09:06:31,game plan march 15 2021 
602,$BB 3/15/2021 - Healthy Retracement,2021-03-15 16:11:53,bb 15 2021 healthy retracement 
603,"Here is a Market Recap for today Monday, March 15, 2021. Please enjoy!",2021-03-15 16:45:03,market recap today monday march 15 2021 please enjoy 
604,NASDAQ Leads Indexes Higher...,2021-03-15 20:05:07,nasdaq lead index higher 
605,The effect of options on stock price $TRVG $AMC $GME,2021-03-15 21:10:09,effect option stock price trvg amc gme 
606,"r/Stocks Daily Thread on Meme Stocks Tuesday - Mar 16, 2021",2021-03-16 05:20:15,stock daily thread meme stock tuesday mar 16 2021 
607,"Morning Update for Tuesday, 03/16/21",2021-03-16 08:49:22,morning update tuesday 03 16 21 
608,AMC Apedate (Update),2021-03-16 13:21:01,amc apedate update 
609,"Here is a Market Recap for today Tuesday, March 16, 2021. Please enjoy!",2021-03-16 16:08:23,market recap today tuesday march 16 2021 please enjoy 
610,"NYSE Chairman Says GameStop Surge Highlights U.S. Market Flaws...""Retail stock pickers have been openly coordinating share purchases and sales on Reddit forums, sending the price of GameStop, AMC Entertainment Holdings Inc. and others on a wild series of ups and downs.""",2021-03-16 16:13:16,nyse chairman say gamestop surge highlight market flaw retail stock picker openly coordinating share purchase sale reddit forum sending price gamestop amc entertainment holding inc others wild series ups down 
611,HELL NO I WILL NOT LEND MY HTB STOCKS!!!,2021-03-16 19:12:47,hell lend htb stock 
612,DD With the Gamestonk Terminal,2021-03-17 16:47:32,dd gamestonk terminal 
613,"Morning Update for Thursday, 03/18/21",2021-03-18 08:56:21,morning update thursday 03 18 21 
614,"DEEP $AMC ITM 19 MAR 21 CALLS Sell?, Roll over?, exercise?",2021-03-18 14:32:16,deep amc itm 19 mar 21 call sell roll exercise 
615,First time poster. Hey guys! If you’re in any of the FB AMC groups you probably know this car. Found this Reddit page in the midst of the AMC stock market ordeal. But I’m glad to be here! 73 Javelin with a 366,2021-03-18 15:16:28,first time poster hey guy fb amc group probably know car found reddit page midst amc stock market ordeal glad 73 javelin 366 
616,2 reasons to buy Rolls-Royce at $1.70✈️,2021-03-19 08:17:01,reason buy roll royce 70 
617,Lets talk about AMC today,2021-03-19 20:40:47,let talk amc today 
618,"The AMC Stock vote will be a resounding YES on the part of the Majority, and how it affects you. Read more inside.",2021-03-20 15:04:37,amc stock vote resounding yes part majority affect read inside 
619,"r/Stocks Daily Thread on Meme Stocks Sunday - Mar 21, 2021",2021-03-21 05:20:20,stock daily thread meme stock sunday mar 21 2021 
620,AMC why it's all good from friday's Quadruple witching hour.,2021-03-21 13:18:19,amc good friday quadruple witching hour 
621,AMC; Fundamentals and the Long Term play,2021-03-22 04:43:21,amc fundamental long term play 
622,"Morning Update for Monday, 03/22/21",2021-03-22 08:55:36,morning update monday 03 22 21 
623,The Telehealth Underdog: AMWL Announcing Q4 Earnings This Week,2021-03-22 11:37:26,telehealth underdog amwl announcing q4 earnings week 
624,"ASO earnings, decent short interest",2021-03-22 15:06:58,aso earnings decent short interest 
625,A Trade Idea and yesterdays NLS,2021-03-23 07:55:11,trade idea yesterday nls 
626,A Trade Idea - And yesterday's NLS,2021-03-23 07:55:56,trade idea yesterday nls 
627,"Morning Update for Tuesday, 03/23/21",2021-03-23 09:01:57,morning update tuesday 03 23 21 
628,69 contracts = AMC stock price at 420 ?,2021-03-23 15:53:43,69 contract amc stock price 420 
629,THE QQQ continues to trade in the same range for the past 10 out of 11 sessions ... sell premium,2021-03-23 16:25:49,qq continues trade range past 10 11 session sell premium 
630,(3/24) Wednesday's Pre-Market Stock Movers & News,2021-03-24 08:47:31,24 wednesday pre market stock mover news 
631,2021 - The greatest year of Investing,2021-03-24 22:29:02,2021 greatest year investing 
632,Double leg 150% gain on volatile stock theory,2021-03-25 10:47:05,double leg 150 gain volatile stock theory 
633,Covered calls on AMC,2021-03-25 12:27:56,covered call amc 
634,"Here is a Market Recap for today Thursday, March 25, 2021",2021-03-25 16:49:31,market recap today thursday march 25 2021 
635,"I wanted to make sure WealthSimple didn't lend out my shares. Their response: Wealthsimple Trade doesn't offer options trading such as shorts, calls, puts, etc. So you can rest assured that your shares aren't available for lending!",2021-03-25 17:29:46,wanted make sure wealthsimple lend share response wealthsimple trade offer option trading short call put etc rest assured share available lending 
636,StockPulse PulseBrief - Etruscus Resources - CSE:ETR / OTC: ETRUF,2021-03-26 22:47:27,stockpulse pulsebrief etruscus resource cse etr otc etruf 
637,Complete list of this week's trending tickers and top posts from Reddit,2021-03-28 11:41:36,complete list week trending ticker top post reddit 
638,"Stocks On The Move-GME, AMC, KOSS, HPR, BRPA, HGEN, CAN, AABB, EEIQ, KZI...",2021-03-29 07:27:12,stock move gme amc kos hpr brpa hgen aabb eeiq kzi 
639,"So I don't have much to invest, and I don't understand the tricks of the trade, but is this an ok strategy for someone in my boat?",2021-03-29 21:22:51,much invest understand trick trade ok strategy someone boat 
640,Help with Cash Secured Put.,2021-03-30 01:21:29,help cash secured put 
641,Stocks becoming very stable? No Volatility?,2021-03-30 11:52:55,stock becoming stable volatility 
642,"AMC & GME Stock Low Volume Explanation - Someone Purchased $33,000,000 in Deep ITM Options for 4/16",2021-04-01 01:54:40,amc gme stock low volume explanation someone purchased 33 00 00 deep itm option 16 
643,We Win and They Lose. There Is No Middle Ground In The Battle For AMC Stock and GameStop!🚀🚀🚀🚀🚀,2021-04-01 06:20:14,win lose middle ground battle amc stock gamestop 
644,I want your opinion on casual trading,2021-04-02 09:49:20,want opinion casual trading 
645,Trade Analysis,2021-04-02 10:50:39,trade analysis 
646,Find out total holdings of portfolio based on different ETFs,2021-04-02 22:50:00,find total holding portfolio based different etf 
647,I don’t even care what’s they say bad thing about GME or AMC I just like to buy those stocks and I like the stocks,2021-04-03 11:15:12,even care say bad thing gme amc like buy stock like stock 
648,AMC AND GME SHORT INTEREST IS MUCH HIGHER THAN WE THINK! - (AMC and GME Stock Analysis),2021-04-04 06:39:17,amc gme short interest much higher think amc gme stock analysis 
649,Buying more ASO Calls,2021-04-04 09:33:18,buying aso call 
650,DD on fundamentals and growth of Super League Gaming $SLGG,2021-04-06 08:15:03,dd fundamental growth super league gaming slgg 
651,Why CIDM is a steal at $1.40,2021-04-07 10:39:08,cidm steal 40 
652,New Position: Atlas Air Worldwide,2021-04-07 23:20:05,new position atlas air worldwide 
653,$MUDS TOPPS DD,2021-04-10 16:44:48,mud topps dd 
654,$MUDS TOPPS DD,2021-04-10 17:05:37,mud topps dd 
655,$MUDS TOPPS Another Take,2021-04-10 17:07:12,mud topps another take 
656,Any stocks $13 and under you like for selling put options on right now?,2021-04-13 00:46:03,stock 13 like selling put option right 
657,"Trying to move away from a ""swing for the fences""/day trading mentality",2021-04-13 18:50:54,trying move away swing fence day trading mentality 
658,"Morning Update for Thursday, 04/15/21",2021-04-15 08:45:54,morning update thursday 04 15 21 
659,"Gary Gensler confirmed by Senate to lead the SEC, Wall Street’s top regulator",2021-04-15 10:00:58,gary gensler confirmed senate lead sec wall street top regulator 
660,"The market is perfectly healthy, and not about to drop, or have a large correction like everyone suspects (Hear me out)",2021-04-16 13:11:06,market perfectly healthy drop large correction like everyone suspect hear 
661,Being Defensive in the Mining Space,2021-04-18 11:58:50,defensive mining space 
662,"LOOKING FOR ADVICE ( APPLE, TESLA AND AMAZON STOCKS) ‼️‼️‼️",2021-04-20 13:50:34,looking advice apple tesla amazon stock 
663,Options Stock Ranker for Apr-21-2021,2021-04-21 10:04:02,option stock ranker apr 21 2021 
664,Newbie Investor!,2021-04-21 16:59:53,newbie investor 
665,Any Next Steps???,2021-04-23 13:05:39,next step 
666,List of Stock-Specific Investment Related Subreddits,2021-04-24 13:44:59,list stock specific investment related subreddits 
667,How meme stocks like Gamestop and AMC changed Wall Street,2021-04-25 19:41:26,meme stock like gamestop amc changed wall street 
668,"Morning Update for Monday, 04/26/21",2021-04-26 08:41:16,morning update monday 04 26 21 
669,Your favorite underlyings to sell puts for/wheel,2021-04-29 21:44:24,favorite underlyings sell put wheel 
670,"Most anticipated earnings releases for the week beginning May 3, 2021",2021-05-01 08:38:22,anticipated earnings release week beginning may 2021 
671,Why hasn't Robinhood still not received any form of punishment/fine when they restricted the buying on 50 different stocks back in January?,2021-05-01 09:36:51,robinhood still received form punishment fine restricted buying 50 different stock back january 
672,AMC Symmetrical Triangle Pattern Analysis,2021-05-01 12:33:04,amc symmetrical triangle pattern analysis 
673,I do not think it means what you think it means,2021-05-01 17:46:24,think mean think mean 
674,"Expected moves this week. Roku, DraftKings, Uber, Cronos Peloton and more",2021-05-02 15:38:06,expected move week roku draftkings uber cronos peloton 
675,"$AMC Stock, How To Buy 50% Off 🤑 Simple Option Strategy! 🎫 Any Stock! Example in Robinhood",2021-05-02 19:34:19,amc stock buy 50 simple option strategy stock example robinhood 
676,Advice for young investors with little or no bills to pay!,2021-05-05 09:57:40,advice young investor little bill pay 
677,Vista Outdoor ($VSTO) pre-earnings DD,2021-05-05 21:31:43,vista outdoor vsto pre earnings dd 
678,Options Stock Ranker for May-06-2021,2021-05-06 16:15:03,option stock ranker may 06 2021 
679,"According to Morningstar, only 42% of the top 5,000 US stocks finished positive in the previous decade (plus what I've learned over my 12+ years investing)",2021-05-06 19:17:44,according morningstar 42 top 00 u stock finished positive previous decade plus learned 12 year investing 
680,"$AMC YOLO update : 4648 shares across 4 accounts, 19 call options. I still like the stock 🦍💪",2021-05-06 19:44:25,amc yolo update 4648 share across account 19 call option still like stock 
681,Just wanted to point this out about youtube stock entertainers.,2021-05-06 23:08:19,wanted point youtube stock entertainer 
682,"Hot Stocks Level 2 ( $GME $RKT $SPY $VIAC $TSLA $VIX & $AMC #DOGE​) May 07, 2021",2021-05-07 07:55:22,hot stock level gme rkt spy viac tsla vix amc doge may 07 2021 
683,Anybody else easy for the AMC explosion?,2021-05-09 14:51:22,anybody else easy amc explosion 
684,$AMC stock,2021-05-10 08:39:58,amc stock 
685,"How to make ""free"" money by lending out your AMC shares",2021-05-12 14:14:32,make free money lending amc share 
686,"I am Officially going defensive tomorrow! I was preparing for this for several weeks, but I too was buying the dip! Bad strategy as you see the Red deepens!",2021-05-12 22:56:17,officially going defensive tomorrow preparing several week buying dip bad strategy see red deepens 
687,"If price rises exponentially, are there still buyers interested in purchasing deeply ITM contracts (selling to close without exercising)?",2021-05-13 01:06:21,price rise exponentially still buyer interested purchasing deeply itm contract selling close without exercising 
688,"The Only Watch List You Need May 13, 2021",2021-05-13 09:03:47,watch list need may 13 2021 
689,AMC soars and this time GameStop follows as meme stocks get squeezed hard,2021-05-13 14:45:56,amc soar time gamestop follows meme stock get squeezed hard 
690,"Here is a Market Recap for today Thursday, May 13, 2021",2021-05-13 16:24:43,market recap today thursday may 13 2021 
691,31 year old investor advice,2021-05-13 17:46:44,31 year old investor advice 
692,CCL / Carnival Cruise Line,2021-05-13 18:22:01,ccl carnival cruise line 
693,Express ($EXPR) Stock: Over 10% Increase Explanation,2021-05-13 21:11:01,express expr stock 10 increase explanation 
694,OCGN might be a good bullish daytrade today 14th May,2021-05-14 02:37:28,ocgn might good bullish daytrade today 14th may 
695,Got a hole burning in my pocket.,2021-05-14 03:07:17,got hole burning pocket 
696,"The Only Watch List You Need May 14, 2021",2021-05-14 09:08:20,watch list need may 14 2021 
697,"After 24% Pop, Why Redditors Could Keep AMC Stock Rising",2021-05-14 10:38:44,24 pop redditors could keep amc stock rising 
698,"Here is a Market Recap for today Friday, May 14, 2021",2021-05-14 16:42:47,market recap today friday may 14 2021 
699,Why I Think AMC Will Result In Bagholders,2021-05-14 18:50:15,think amc result bagholders 
700,Can we please talk about YOLO BSC Token?,2021-05-14 23:25:21,please talk yolo bsc token 
701,"So, how was your trading week?",2021-05-15 16:38:04,trading week 
702,Are strangles a good way to play AMC?,2021-05-16 03:02:28,strangles good way play amc 
703,I built a program that tracks mentions and sentiment of stocks across Reddit and Twitter! This week's most discussed and top growing stocks!,2021-05-16 10:34:52,built program track mention sentiment stock across reddit twitter week discussed top growing stock 
704,"The Only Watch List You Need May 17, 2021",2021-05-17 09:11:36,watch list need may 17 2021 
705,AMC Strong Move,2021-05-17 23:04:43,amc strong move 
706,GameStop and AMC short-sellers have lost almost $1 billion in just 5 days of trading amid a meme-stock rally,2021-05-18 12:11:37,gamestop amc short seller lost almost billion day trading amid meme stock rally 
707,AMC brings new drama to the stock market,2021-05-18 12:28:52,amc brings new drama stock market 
708,Catalyst for market taking a nose dive?,2021-05-18 14:47:01,catalyst market taking nose dive 
709,Options Stock Ranker for May-19-2021,2021-05-19 16:15:09,option stock ranker may 19 2021 
710,Anyone have insight on GPOR - just got put on NYSE 2 days ago profile page points to amctheaters page,2021-05-19 16:56:22,anyone insight gpor got put nyse day ago profile page point amctheaters page 
711,READ READ READ,2021-05-20 12:19:52,read read read 
712,Options Stock Ranker for May-24-2021,2021-05-24 16:15:04,option stock ranker may 24 2021 
713,First major experience in the stock market with AMC and meme stocks,2021-05-25 14:46:29,first major experience stock market amc meme stock 
714,"Here is a Market Recap for today Tuesday, May 25, 2021",2021-05-25 16:42:26,market recap today tuesday may 25 2021 
715,Trying to understand options,2021-05-26 06:19:50,trying understand option 
716,amc covered call,2021-05-26 10:22:39,amc covered call 
717,What happens to the general stock market if the $GME and $AMC squeezes work?,2021-05-26 16:06:57,happens general stock market gme amc squeeze work 
718,Halp with exit strategy,2021-05-27 10:29:31,halp exit strategy 
719,SpotGamma Analysis - AMC RKT Gamma Squeeze: “Escape Vol-ocity!”,2021-05-27 16:14:14,spotgamma analysis amc rkt gamma squeeze escape vol ocity 
720,"Here is a Market Recap for today Thursday, May 27, 2021",2021-05-27 16:26:35,market recap today thursday may 27 2021 
721,Looking for info on the 258 engine,2021-05-27 20:35:55,looking info 258 engine 
722,Using stock options to capitalize on the vol spike in $AMC,2021-05-27 21:14:09,using stock option capitalize vol spike amc 
723,$AMC tomorrow: Pre Holiday and Max Pain Effect,2021-05-27 21:33:39,amc tomorrow pre holiday max pain effect 
724,Asking as a novice: what is happening with AMC now?,2021-05-27 21:45:34,asking novice happening amc 
725,Best way to profit from AMC FOMO?,2021-05-27 21:51:15,best way profit amc fomo 
726,AMC!!!!!!! What is going to be decided on June 2?,2021-05-27 22:23:48,amc going decided june 
727,Selling AMC puts June 4,2021-05-27 22:36:42,selling amc put june 
728,"AMC Stock Is Soaring, Leaving GameStop in the Dust",2021-05-28 04:56:24,amc stock soaring leaving gamestop dust 
729,AMC bearish plays,2021-05-28 07:03:20,amc bearish play 
730,"The Ultimate Gap Watch List May 28, 2021",2021-05-28 08:49:34,ultimate gap watch list may 28 2021 
731,AMC’s Four-Day Surge Slaps Short Sellers With $1.3 Billion Loss,2021-05-28 12:00:46,amc four day surge slap short seller billion loss 
732,"Here is a Market Recap for today Friday, May 28, 2021",2021-05-28 16:54:54,market recap today friday may 28 2021 
733,$AMC +$270K. Not selling cos I like the stock!,2021-05-28 18:20:14,amc 270k selling co like stock 
734,"AMC Entertainment’s 130% spike this week isn’t done yet, analyst speculates",2021-05-28 18:59:06,amc entertainment 130 spike week done yet analyst speculates 
735,Geographic asset allocation,2021-05-29 05:08:45,geographic asset allocation 
736,"Wall Street Week Ahead for the trading week beginning May 31st, 2021",2021-05-29 07:02:24,wall street week ahead trading week beginning may 31st 2021 
737,$AMC earnings analysis by Quant Data,2021-05-29 16:36:24,amc earnings analysis quant data 
738,"Plays on high IV, Memes & AMC",2021-05-29 18:23:27,play high iv meme amc 
739,Made 2k off amc,2021-05-29 23:24:43,made 2k amc 
740,"Please help, math on selling or exercising the option!! (5x)10$ calls at 3.75 exp jan 2022",2021-05-30 04:44:50,please help math selling exercising option 5x 10 call 75 exp jan 2022 
741,I built a program that tracks mentions and sentiment of stocks across Reddit and Twitter! This week's most discussed and top growing stocks!,2021-05-30 10:20:57,built program track mention sentiment stock across reddit twitter week discussed top growing stock 
742,A backtested algorithm for trading meme stocks – 366% on AMC in just under 2 months and 16 trades,2021-05-30 13:55:13,backtested algorithm trading meme stock 366 amc month 16 trade 
743,AMC headed for bankruptcy because retail investors?,2021-05-30 21:26:21,amc headed bankruptcy retail investor 
744,"r/DayTrading's Weekly Questions Thread - Monday - May 31, 2021",2021-05-31 05:00:22,daytrading weekly question thread monday may 31 2021 
745,"Expected moves this week. Zoom, Crowdstrike, Lululemon and meme stocks.",2021-05-31 14:11:16,expected move week zoom crowdstrike lululemon meme stock 
746,Tune out the FUD AMC stock,2021-05-31 16:38:45,tune fud amc stock 
747,HOW TO PLAY AMC FOR DIRT CHEAP,2021-06-01 04:51:12,play amc dirt cheap 
748,AMC Continues to Pop (+20% today)- Best 3 Reddit Stocks To Watch,2021-06-01 12:56:06,amc continues pop 20 today best reddit stock watch 
749,Ever notice how they rob you blind on put trades?,2021-06-01 13:06:52,ever notice rob blind put trade 
750,"Here is a Market Recap for today Tuesday, June 1, 2021",2021-06-01 16:18:59,market recap today tuesday june 2021 
751,Any advice for minimizing losses as this point on a short... and hear me out for those who would rather ridicule for having done so! AMC,2021-06-01 19:02:30,advice minimizing loss point short hear would rather ridicule done amc 
752,Big Cap vs small Cap oil,2021-06-01 20:23:23,big cap v small cap oil 
753,AMC up 40% as Reddit bulls drown out hedge fund share dump,2021-06-02 07:34:36,amc 40 reddit bull drown hedge fund share dump 
754,AMC to Offer Free Popcorn and Exclusive Screenings for Investors,2021-06-02 08:03:20,amc offer free popcorn exclusive screening investor 
755,Question on call option,2021-06-02 12:00:19,question call option 
756,Get out the popcorn! AMC Entertainment is having the best year of any stock with a market cap of at least $3 billion.,2021-06-02 14:52:56,get popcorn amc entertainment best year stock market cap least billion 
757,Advice please,2021-06-02 15:47:11,advice please 
758,"Here is a Market Recap for today Wednesday, June 2, 2021",2021-06-02 16:41:23,market recap today wednesday june 2021 
759,Meme stocks and post-sale regrets,2021-06-02 17:39:53,meme stock post sale regret 
760,Best Cash Secured Puts for Long Term Investing,2021-06-02 19:58:15,best cash secured put long term investing 
761,I bought subscriptions to social media/sentiment stock data platforms to see which one was the best for algotraders,2021-06-02 20:10:04,bought subscription social medium sentiment stock data platform see one best algotraders 
762,Beware of what AMC shorts are holding!,2021-06-02 21:12:52,beware amc short holding 
763,"Alert: Mudrick Capital Buys AMC Stock, Cashes Out Swiftly",2021-06-03 01:40:26,alert mudrick capital buy amc stock cash swiftly 
764,"Alert: Mudrick Capital Buys AMC Stock, Cashes Out Swiftly",2021-06-03 01:45:32,alert mudrick capital buy amc stock cash swiftly 
765,Am I understanding this correctly?,2021-06-03 02:14:52,understanding correctly 
766,We like the stock $AMC $GME,2021-06-03 02:26:54,like stock amc gme 
767,BB on a Ride,2021-06-03 04:41:14,bb ride 
768,What is going on with AMC stock? Break out the popcorn🍿,2021-06-03 09:58:15,going amc stock break popcorn 
769,Updated DAILY short volume data in AMC (as of Wednesday's close). Another 266 million+ shares shorted yeterday,2021-06-03 11:00:49,updated daily short volume data amc wednesday close another 266 million share shorted yeterday 
770,They totally rob you blind if you try to scalp ootm puts on AMC,2021-06-03 11:04:38,totally rob blind try scalp ootm put amc 
771,"AMC was presumably near bankruptcy with covid but the meme stock raised $230m from Mudrick Capital in part thanks to its massive runup this year. After the news, AMC nearly doubled in a day, up 3000% YTD!",2021-06-03 11:21:16,amc presumably near bankruptcy covid meme stock raised 230m mudrick capital part thanks massive runup year news amc nearly doubled day 300 ytd 
772,AMC: EVERY ONE SHOULD READ THIS MORNING’S 8-K FILING,2021-06-03 12:03:43,amc every one read morning filing 
773,AMC 25k stocks YOLO - To the moon and beyond!,2021-06-03 13:45:21,amc 25k stock yolo moon beyond 
774,Rolling Deep ITM Calls on AMC,2021-06-03 13:49:13,rolling deep itm call amc 
775,"Here is a Market Recap for today Thursday, June 3, 2021",2021-06-03 16:46:13,market recap today thursday june 2021 
776,My analysis of AMC 11m share sale news,2021-06-03 17:25:23,analysis amc 11m share sale news 
777,What is a gamma squeeze and how did it drive up AMC's stock price?,2021-06-04 03:56:19,gamma squeeze drive amc stock price 
778,Amc is on early rise stage,2021-06-04 08:21:51,amc early rise stage 
779,"Most notable stock upgrades and downgrades June 4, 2021",2021-06-04 09:02:51,notable stock upgrade downgrade june 2021 
780,Watchlist - 2021-06-04,2021-06-04 09:19:49,watchlist 2021 06 04 
781,That AMC dip yesterday kicked my portfolio and took its lunch money,2021-06-04 10:33:40,amc dip yesterday kicked portfolio took lunch money 
782,Should I sell my AMC stocks and go naked with the September 16c I sold?,2021-06-04 10:37:54,sell amc stock go naked september 16c sold 
783,"Retail Traders in India, South Korea Join Meme Craze for AMC - The Short Squeeze is coming!!",2021-06-04 14:21:59,retail trader india south korea join meme craze amc short squeeze coming 
784,AMC Covered Call,2021-06-04 16:11:20,amc covered call 
785,Options Stock Ranker for Jun-04-2021,2021-06-04 16:15:03,option stock ranker jun 04 2021 
786,A lesson to act. Take profits.,2021-06-04 18:50:46,lesson act take profit 
787,"Wall Street Week Ahead for the trading week beginning June 7th, 2021",2021-06-05 00:42:29,wall street week ahead trading week beginning june 7th 2021 
788,WKHS Recent Downtrend Breakout - Important Levels,2021-06-05 15:21:12,wkhs recent downtrend breakout important level 
789,Synthetic Short on AMC strategy,2021-06-05 21:28:00,synthetic short amc strategy 
790,Has this sub become a meme-shilling machine?,2021-06-06 12:29:50,sub become meme shilling machine 
791,"Expected moves for this week: Meme stocks, SPY, Earnings in COUP, CHWY, FCEL, MRVL and more",2021-06-06 13:53:12,expected move week meme stock spy earnings coup chwy fcel mrvl 
792,AMC Stock Holders - Pitch for AMC Subscription Service - Cable and Streaming - Your Thoughts.,2021-06-06 16:43:28,amc stock holder pitch amc subscription service cable streaming thought 
793,$AMC retail vs Wallstreet,2021-06-06 18:38:55,amc retail v wallstreet 
794,"Cleanest + Repeated Options Flow Plays Series # 3 - AMC, CLNE, FUBO, ARKK. FB, FUTU, JMIA",2021-06-06 19:52:30,cleanest repeated option flow play series amc clne fubo arkk fb futu jmia 
795,The question isn't if AMC will crash it's when will it crash.,2021-06-07 02:33:20,question amc crash crash 
796,Breaking 100 USD dividend payout this month,2021-06-07 04:40:36,breaking 100 usd dividend payout month 
797,The short-squeeze thesis isn't gonna end well for a lot of you,2021-06-07 07:55:32,short squeeze thesis gon na end well lot 
798,AMC Strangle: How idiotic am I?,2021-06-07 10:22:55,amc strangle idiotic 
799,AMC technical analysis 6/7,2021-06-07 11:19:00,amc technical analysis 
800,"‘Resist the temptation’ to short AMC Entertainment, other meme stocks ‘because these prices can go to unimaginable highs,’ says Interactive Brokers founder",2021-06-07 13:25:11,resist temptation short amc entertainment meme stock price go unimaginable high say interactive broker founder 
801,eating dirt on $CLOV,2021-06-07 16:26:30,eating dirt clov 
802,On Memes & Investing,2021-06-08 05:55:39,meme investing 
803,"The OG Stock Watch List June 8, 2021",2021-06-08 08:48:42,og stock watch list june 2021 
804,Options Stock Ranker for Jun-08-2021,2021-06-08 16:15:04,option stock ranker jun 08 2021 
805,"‘Resist the temptation’ to short AMC Entertainment, other meme stocks ‘because these prices can go to unimaginable highs,’ says Interactive Brokers founder",2021-06-08 17:34:04,resist temptation short amc entertainment meme stock price go unimaginable high say interactive broker founder 
806,"MEME YOLO aka ""Moon"" Trap !!!",2021-06-08 18:41:26,meme yolo aka moon trap 
807,Covered call on AMC?,2021-06-08 21:16:57,covered call amc 
